geoid,name,universe,urban area
26038,"Eau Claire, WI Urbanized Area (2010)",953.0,26038
26065,"Ebensburg, PA Urban Cluster (2010)",0.0,26065
26092,"Eden, NC Urban Cluster (2010)",266.0,26092
26119,"Edenton, NC Urban Cluster (2010)",50.0,26119
26146,"Edgefield, SC Urban Cluster (2010)",94.0,26146
26173,"Edgerton, WI Urban Cluster (2010)",13.0,26173
26200,"Edgewood, NM Urban Cluster (2010)",83.0,26200
26227,"Edinboro, PA Urban Cluster (2010)",14.0,26227
26254,"Edna, TX Urban Cluster (2010)",4.0,26254
26275,"Edwards, CO Urban Cluster (2010)",158.0,26275
26308,"Effingham, IL Urban Cluster (2010)",25.0,26308
26345,"Eielson AFB, AK Urban Cluster (2010)",104.0,26345
26362,"Elberton, GA Urban Cluster (2010)",20.0,26362
26389,"El Campo, TX Urban Cluster (2010)",21.0,26389
26416,"El Centro--Calexico, CA Urbanized Area (2010)",1397.0,26416
26443,"Eldon, MO Urban Cluster (2010)",275.0,26443
26470,"El Dorado, AR Urban Cluster (2010)",153.0,26470
26497,"Eldorado, IL Urban Cluster (2010)",113.0,26497
26524,"El Dorado, KS Urban Cluster (2010)",262.0,26524
26551,"Eldorado at Santa Fe, NM Urban Cluster (2010)",88.0,26551
26578,"El Dorado Springs, MO Urban Cluster (2010)",19.0,26578
26632,"Electra, TX Urban Cluster (2010)",134.0,26632
26659,"Elgin, TX Urban Cluster (2010)",33.0,26659
26686,"Elizabeth City, NC Urban Cluster (2010)",19.0,26686
26713,"Elizabethtown, NC Urban Cluster (2010)",64.0,26713
26750,"Elizabethtown--Radcliff, KY Urbanized Area (2010)",1139.0,26750
26767,"Elk City, OK Urban Cluster (2010)",866.0,26767
26794,"Elkhart, IN--MI Urbanized Area (2010)",1849.0,26794
26821,"Elkhorn, WI Urban Cluster (2010)",72.0,26821
26848,"Elkin, NC Urban Cluster (2010)",159.0,26848
26875,"Elkins, WV Urban Cluster (2010)",81.0,26875
26902,"Elko, NV Urban Cluster (2010)",1219.0,26902
26912,"Elko New Market, MN Urban Cluster (2010)",12.0,26912
26956,"Elkton, VA Urban Cluster (2010)",129.0,26956
26983,"Ellensburg, WA Urban Cluster (2010)",316.0,26983
27010,"Ellenville, NY Urban Cluster (2010)",161.0,27010
27037,"Ellijay, GA Urban Cluster (2010)",37.0,27037
27064,"Ellsworth, KS Urban Cluster (2010)",45.0,27064
27070,"Ellsworth, ME Urban Cluster (2010)",61.0,27070
27076,"Ellsworth, WI Urban Cluster (2010)",5.0,27076
27085,"Ellwood City, PA Urban Cluster (2010)",13.0,27085
27118,"Elmira, NY Urbanized Area (2010)",670.0,27118
27172,"Elmwood, IL Urban Cluster (2010)",12.0,27172
27199,"Eloy, AZ Urban Cluster (2010)",179.0,27199
27226,"El Paso, IL Urban Cluster (2010)",33.0,27226
27253,"El Paso, TX--NM Urbanized Area (2010)",9086.0,27253
27261,"El Paso de Robles (Paso Robles)--Atascadero, CA Urbanized Area (2010)",945.0,27261
27280,"El Reno, OK Urban Cluster (2010)",2504.0,27280
27290,"Elroy, TX Urban Cluster (2010)",240.0,27290
27300,"Elverson, PA Urban Cluster (2010)",0.0,27300
27307,"Elwood, IN Urban Cluster (2010)",37.0,27307
27334,"Ely, MN Urban Cluster (2010)",15.0,27334
27361,"Ely, NV Urban Cluster (2010)",489.0,27361
27372,"Emajagua, PR Urban Cluster (2010)",33.0,27372
27380,"Emerald Bay, TX Urban Cluster (2010)",18.0,27380
27442,"Emmetsburg, IA Urban Cluster (2010)",8.0,27442
27469,"Emmett, ID Urban Cluster (2010)",165.0,27469
27496,"Emmitsburg, MD--PA Urban Cluster (2010)",58.0,27496
27523,"Emporia, KS Urban Cluster (2010)",570.0,27523
27550,"Emporia, VA Urban Cluster (2010)",134.0,27550
27577,"Emporium, PA Urban Cluster (2010)",9.0,27577
27592,"Enfield, NC Urban Cluster (2010)",28.0,27592
27604,"England, AR Urban Cluster (2010)",8.0,27604
27631,"Enid, OK Urban Cluster (2010)",2213.0,27631
27658,"Ennis, TX Urban Cluster (2010)",1170.0,27658
27685,"Enterprise, AL Urban Cluster (2010)",726.0,27685
27712,"Ephraim, UT Urban Cluster (2010)",73.0,27712
27739,"Ephrata, WA Urban Cluster (2010)",57.0,27739
27750,"Epping, NH Urban Cluster (2010)",95.0,27750
27766,"Erie, PA Urbanized Area (2010)",1198.0,27766
27793,"Erwin, TN Urban Cluster (2010)",33.0,27793
27820,"Escalon, CA Urban Cluster (2010)",121.0,27820
27847,"Escanaba, MI Urban Cluster (2010)",825.0,27847
27874,"Espanola, NM Urban Cluster (2010)",2837.0,27874
27885,"Esparto, CA Urban Cluster (2010)",28.0,27885
27901,"Estacada, OR Urban Cluster (2010)",120.0,27901
27928,"Estes Park, CO Urban Cluster (2010)",0.0,27928
27955,"Estherville, IA Urban Cluster (2010)",14.0,27955
27991,"Estrella, AZ Urban Cluster (2010)",136.0,27991
28009,"Etowah, TN Urban Cluster (2010)",0.0,28009
28063,"Eudora, KS Urban Cluster (2010)",259.0,28063
28090,"Eufaula, AL--GA Urban Cluster (2010)",11.0,28090
28117,"Eugene, OR Urbanized Area (2010)",8773.0,28117
28144,"Eunice, LA Urban Cluster (2010)",48.0,28144
28171,"Eunice, NM Urban Cluster (2010)",5.0,28171
28198,"Eureka, CA Urban Cluster (2010)",2798.0,28198
28225,"Eureka, IL Urban Cluster (2010)",0.0,28225
28252,"Eureka, KS Urban Cluster (2010)",79.0,28252
28262,"Eureka, MO Urban Cluster (2010)",59.0,28262
28306,"Evanston, WY Urban Cluster (2010)",521.0,28306
28333,"Evansville, IN--KY Urbanized Area (2010)",1323.0,28333
28360,"Evansville, WI Urban Cluster (2010)",8.0,28360
28387,"Evarts, KY Urban Cluster (2010)",27.0,28387
28414,"Everett, PA Urban Cluster (2010)",10.0,28414
28431,"Evergreen, AL Urban Cluster (2010)",86.0,28431
28441,"Evergreen, CO Urban Cluster (2010)",9.0,28441
28468,"Everson, WA Urban Cluster (2010)",657.0,28468
28495,"Excelsior Springs, MO Urban Cluster (2010)",83.0,28495
28522,"Fabens, TX Urban Cluster (2010)",18.0,28522
28549,"Fairbanks, AK Urbanized Area (2010)",8378.0,28549
28576,"Fairbury, IL Urban Cluster (2010)",0.0,28576
28603,"Fairbury, NE Urban Cluster (2010)",79.0,28603
28624,"Fairdale, PA Urban Cluster (2010)",13.0,28624
28657,"Fairfield, CA Urbanized Area (2010)",2927.0,28657
28684,"Fairfield, IL Urban Cluster (2010)",12.0,28684
28711,"Fairfield, IA Urban Cluster (2010)",315.0,28711
28738,"Fairfield, TX Urban Cluster (2010)",71.0,28738
28765,"Fairfield Glade, TN Urban Cluster (2010)",75.0,28765
28782,"Fairfield Harbour, NC Urban Cluster (2010)",7.0,28782
28819,"Fair Haven, VT Urban Cluster (2010)",18.0,28819
28846,"Fairmont, MN Urban Cluster (2010)",13.0,28846
28860,"Fairmont, NC Urban Cluster (2010)",192.0,28860
28873,"Fairmont, WV Urban Cluster (2010)",404.0,28873
28900,"Fairmount, IN Urban Cluster (2010)",10.0,28900
28954,"Fairview, TN Urban Cluster (2010)",58.0,28954
28981,"Fajardo, PR Urbanized Area (2010)",294.0,28981
29008,"Falfurrias, TX Urban Cluster (2010)",167.0,29008
29035,"Fallon, NV Urban Cluster (2010)",593.0,29035
29062,"Falls City, NE Urban Cluster (2010)",371.0,29062
29089,"Fargo, ND--MN Urbanized Area (2010)",4267.0,29089
29116,"Faribault, MN Urban Cluster (2010)",450.0,29116
29143,"Farmersville, TX Urban Cluster (2010)",6.0,29143
29170,"Farmerville, LA Urban Cluster (2010)",54.0,29170
29224,"Farmington, ME Urban Cluster (2010)",5.0,29224
29251,"Farmington, MO Urban Cluster (2010)",560.0,29251
29265,"Farmington, NH Urban Cluster (2010)",12.0,29265
29278,"Farmington, NM Urbanized Area (2010)",14643.0,29278
29305,"Farmville, NC Urban Cluster (2010)",7.0,29305
29332,"Farmville, VA Urban Cluster (2010)",206.0,29332
29359,"Fayette, AL Urban Cluster (2010)",8.0,29359
29413,"Fayette, MO Urban Cluster (2010)",40.0,29413
29440,"Fayetteville, NC Urbanized Area (2010)",10515.0,29440
29467,"Fayetteville, TN Urban Cluster (2010)",183.0,29467
29494,"Fayetteville--Springdale--Rogers, AR--MO Urbanized Area (2010)",7516.0,29494
29510,"Fearrington Village, NC Urban Cluster (2010)",0.0,29510
29521,"Federalsburg, MD Urban Cluster (2010)",78.0,29521
29548,"Fellsmere, FL Urban Cluster (2010)",11.0,29548
29575,"Fergus Falls, MN Urban Cluster (2010)",88.0,29575
29602,"Fernandina Beach, FL Urban Cluster (2010)",165.0,29602
29656,"Fernley, NV Urban Cluster (2010)",821.0,29656
29683,"Ferriday, LA Urban Cluster (2010)",0.0,29683
29698,"Filer, ID Urban Cluster (2010)",28.0,29698
29710,"Fillmore, CA Urban Cluster (2010)",235.0,29710
29737,"Findlay, OH Urban Cluster (2010)",579.0,29737
29764,"Firebaugh, CA Urban Cluster (2010)",32.0,29764
29775,"Firestone--Frederick, CO Urban Cluster (2010)",413.0,29775
29791,"Fitzgerald, GA Urban Cluster (2010)",48.0,29791
29818,"Flagstaff, AZ Urbanized Area (2010)",8434.0,29818
29845,"Flemingsburg, KY Urban Cluster (2010)",4.0,29845
29872,"Flint, MI Urbanized Area (2010)",5594.0,29872
29899,"Flora, IL Urban Cluster (2010)",51.0,29899
29953,"Florence, AL Urbanized Area (2010)",952.0,29953
29980,"Florence, AZ Urban Cluster (2010)",793.0,29980
30007,"Florence, CO Urban Cluster (2010)",419.0,30007
30034,"Florence, OR Urban Cluster (2010)",307.0,30034
30061,"Florence, SC Urbanized Area (2010)",537.0,30061
30088,"Floresville, TX Urban Cluster (2010)",105.0,30088
30115,"Florida--Imbéry--Barceloneta, PR Urbanized Area (2010)",266.0,30115
30142,"Floydada, TX Urban Cluster (2010)",3.0,30142
30171,"Foley, AL Urban Cluster (2010)",107.0,30171
30196,"Folkston, GA Urban Cluster (2010)",107.0,30196
30223,"Fond du Lac, WI Urbanized Area (2010)",709.0,30223
30250,"Fordyce, AR Urban Cluster (2010)",8.0,30250
30277,"Forest, MS Urban Cluster (2010)",0.0,30277
30304,"Forest City, IA Urban Cluster (2010)",46.0,30304
30331,"Forest City, NC Urban Cluster (2010)",198.0,30331
30358,"Forest Lake, MN Urban Cluster (2010)",399.0,30358
30385,"Forestville, CA Urban Cluster (2010)",169.0,30385
30412,"Forks, WA Urban Cluster (2010)",235.0,30412
30439,"Forney, TX Urban Cluster (2010)",304.0,30439
30466,"Forrest City, AR Urban Cluster (2010)",57.0,30466
30493,"Forsyth, GA Urban Cluster (2010)",71.0,30493
30520,"Forsyth, MO Urban Cluster (2010)",215.0,30520
30547,"Fort Atkinson, WI Urban Cluster (2010)",281.0,30547
30574,"Fort Bragg, CA Urban Cluster (2010)",402.0,30574
30601,"Fort Branch, IN Urban Cluster (2010)",109.0,30601
30628,"Fort Collins, CO Urbanized Area (2010)",4960.0,30628
30655,"Fort Defiance, AZ--NM Urban Cluster (2010)",3765.0,30655
30682,"Fort Dodge, IA Urban Cluster (2010)",157.0,30682
30736,"Fort Irwin, CA Urban Cluster (2010)",158.0,30736
30748,"Fort Leonard Wood, MO Urban Cluster (2010)",869.0,30748
30755,"Fort Lupton, CO Urban Cluster (2010)",212.0,30755
30763,"Fort Madison, IA--IL Urban Cluster (2010)",124.0,30763
30790,"Fort Meade, FL Urban Cluster (2010)",66.0,30790
30817,"Fort Morgan, CO Urban Cluster (2010)",171.0,30817
30844,"Fort Payne, AL Urban Cluster (2010)",117.0,30844
30858,"Fort Plain, NY Urban Cluster (2010)",22.0,30858
30871,"Fort Polk, LA Urban Cluster (2010)",184.0,30871
30898,"Fort Scott, KS Urban Cluster (2010)",120.0,30898
30925,"Fort Smith, AR--OK Urbanized Area (2010)",5107.0,30925
30952,"Fort Stockton, TX Urban Cluster (2010)",51.0,30952
30979,"Fortuna, CA Urban Cluster (2010)",841.0,30979
31033,"Fort Valley, GA Urban Cluster (2010)",19.0,31033
31060,"Fort Walton Beach--Navarre--Wright, FL Urbanized Area (2010)",2408.0,31060
31087,"Fort Wayne, IN Urbanized Area (2010)",3310.0,31087
31114,"Fostoria, OH Urban Cluster (2010)",108.0,31114
31150,"Four Corners, FL Urban Cluster (2010)",517.0,31150
31158,"Four Corners, MT Urban Cluster (2010)",13.0,31158
31168,"Fowlerville, MI Urban Cluster (2010)",77.0,31168
31195,"Frankenmuth, MI Urban Cluster (2010)",0.0,31195
31222,"Frankfort, IN Urban Cluster (2010)",47.0,31222
31249,"Frankfort, KY Urban Cluster (2010)",227.0,31249
31276,"Franklin, KY Urban Cluster (2010)",110.0,31276
31303,"Franklin, LA Urban Cluster (2010)",584.0,31303
31330,"Franklin, NH Urban Cluster (2010)",57.0,31330
31384,"Franklin, NC Urban Cluster (2010)",190.0,31384
31411,"Franklin (Venango County), PA Urban Cluster (2010)",39.0,31411
31438,"Franklin, VA Urban Cluster (2010)",93.0,31438
31450,"Franklin--Highland Lake, NJ Urban Cluster (2010)",119.0,31450
31465,"Franklinton, LA Urban Cluster (2010)",35.0,31465
31478,"Fraser, CO Urban Cluster (2010)",0.0,31478
31492,"Frazier Park, CA Urban Cluster (2010)",58.0,31492
31519,"Frederick, MD Urbanized Area (2010)",1804.0,31519
31546,"Frederick, OK Urban Cluster (2010)",224.0,31546
31573,"Fredericksburg, TX Urban Cluster (2010)",833.0,31573
31600,"Fredericksburg, VA Urbanized Area (2010)",1911.0,31600
31627,"Fredericktown, MO Urban Cluster (2010)",1.0,31627
31681,"Freeport, IL Urban Cluster (2010)",340.0,31681
31735,"Fremont, MI Urban Cluster (2010)",230.0,31735
31762,"Fremont, NE Urban Cluster (2010)",496.0,31762
31789,"Fremont, OH Urban Cluster (2010)",85.0,31789
31843,"Fresno, CA Urbanized Area (2010)",15953.0,31843
31870,"Friona, TX Urban Cluster (2010)",130.0,31870
31897,"Fritch, TX Urban Cluster (2010)",170.0,31897
31924,"Front Royal, VA Urban Cluster (2010)",405.0,31924
31978,"Frostproof, FL Urban Cluster (2010)",127.0,31978
32032,"Fulton, KY--TN Urban Cluster (2010)",196.0,32032
32059,"Fulton, MS Urban Cluster (2010)",0.0,32059
32086,"Fulton, MO Urban Cluster (2010)",191.0,32086
32113,"Gadsden, AL Urbanized Area (2010)",860.0,32113
32140,"Gaffney, SC Urban Cluster (2010)",336.0,32140
32167,"Gainesville, FL Urbanized Area (2010)",1868.0,32167
32194,"Gainesville, GA Urbanized Area (2010)",1443.0,32194
32221,"Gainesville, TX Urban Cluster (2010)",290.0,32221
32248,"Galax, VA Urban Cluster (2010)",31.0,32248
32275,"Galena, IL Urban Cluster (2010)",0.0,32275
32302,"Galena, KS--MO Urban Cluster (2010)",114.0,32302
32329,"Galesburg, IL Urban Cluster (2010)",296.0,32329
32356,"Galion, OH Urban Cluster (2010)",142.0,32356
32383,"Galliano--Larose--Cut Off, LA Urban Cluster (2010)",1448.0,32383
32437,"Gallup, NM Urban Cluster (2010)",11125.0,32437
32451,"Galt, CA Urban Cluster (2010)",507.0,32451
32491,"Galveston, TX Urban Cluster (2010)",727.0,32491
32518,"Garden City, KS Urban Cluster (2010)",663.0,32518
32572,"Gardnerville Ranchos, NV Urban Cluster (2010)",814.0,32572
32599,"Garner, IA Urban Cluster (2010)",0.0,32599
32626,"Garnett, KS Urban Cluster (2010)",221.0,32626
32637,"Garrettsville, OH Urban Cluster (2010)",54.0,32637
32653,"Gastonia, NC--SC Urbanized Area (2010)",1613.0,32653
32707,"Gatesville, TX Urban Cluster (2010)",1592.0,32707
32720,"Gautier, MS Urban Cluster (2010)",0.0,32720
32734,"Gaylord, MI Urban Cluster (2010)",254.0,32734
32761,"Geneseo, IL Urban Cluster (2010)",118.0,32761
32788,"Geneseo, NY Urban Cluster (2010)",59.0,32788
32815,"Geneva, AL Urban Cluster (2010)",0.0,32815
32842,"Geneva, NY Urban Cluster (2010)",301.0,32842
32850,"Geneva, OH Urban Cluster (2010)",56.0,32850
32869,"Genoa, IL Urban Cluster (2010)",161.0,32869
32896,"Genoa, OH Urban Cluster (2010)",68.0,32896
32950,"Georgetown, DE Urban Cluster (2010)",75.0,32950
32977,"Georgetown, KY Urban Cluster (2010)",95.0,32977
33004,"Georgetown, OH Urban Cluster (2010)",13.0,33004
33031,"Georgetown, SC Urban Cluster (2010)",11.0,33031
33166,"Gibson City, IL Urban Cluster (2010)",17.0,33166
33193,"Giddings, TX Urban Cluster (2010)",16.0,33193
33220,"Gillespie, IL Urban Cluster (2010)",20.0,33220
33247,"Gillette, WY Urban Cluster (2010)",688.0,33247
33274,"Gilman, IL Urban Cluster (2010)",21.0,33274
33301,"Gilmer, TX Urban Cluster (2010)",64.0,33301
33328,"Gilroy--Morgan Hill, CA Urbanized Area (2010)",1854.0,33328
33355,"Girard, KS Urban Cluster (2010)",30.0,33355
33409,"Gladwin, MI Urban Cluster (2010)",15.0,33409
33436,"Glasgow, KY Urban Cluster (2010)",143.0,33436
33463,"Glasgow, MT Urban Cluster (2010)",306.0,33463
33490,"Glencoe, MN Urban Cluster (2010)",161.0,33490
33517,"Glendive, MT Urban Cluster (2010)",253.0,33517
33544,"Glennville, GA Urban Cluster (2010)",0.0,33544
33598,"Glens Falls, NY Urbanized Area (2010)",359.0,33598
33612,"Glenville, WV Urban Cluster (2010)",44.0,33612
33625,"Glenwood, IA Urban Cluster (2010)",95.0,33625
33635,"Glenwood, MD Urban Cluster (2010)",71.0,33635
33652,"Glenwood Springs, CO Urban Cluster (2010)",267.0,33652
33679,"Globe, AZ Urban Cluster (2010)",641.0,33679
33695,"Gloucester Courthouse, VA Urban Cluster (2010)",2.0,33695
33706,"Glouster, OH Urban Cluster (2010)",96.0,33706
33733,"Gloversville, NY Urban Cluster (2010)",167.0,33733
33749,"Gold Beach, OR Urban Cluster (2010)",60.0,33749
33760,"Golden Beach, MD Urban Cluster (2010)",0.0,33760
33787,"Goldendale, WA Urban Cluster (2010)",117.0,33787
33798,"Golden Gate Estates, FL Urban Cluster (2010)",0.0,33798
33814,"Goldsboro, NC Urbanized Area (2010)",626.0,33814
33841,"Gonzales, CA Urban Cluster (2010)",42.0,33841
33868,"Gonzales, TX Urban Cluster (2010)",59.0,33868
33895,"Gooding, ID Urban Cluster (2010)",36.0,33895
33922,"Goodland, KS Urban Cluster (2010)",10.0,33922
33938,"Goodrich, MI Urban Cluster (2010)",12.0,33938
34003,"Gothenburg, NE Urban Cluster (2010)",10.0,34003
34030,"Gouverneur, NY Urban Cluster (2010)",17.0,34030
34057,"Gowanda, NY Urban Cluster (2010)",317.0,34057
34072,"Graceville, FL Urban Cluster (2010)",62.0,34072
34084,"Grafton, ND Urban Cluster (2010)",243.0,34084
34111,"Grafton, WV Urban Cluster (2010)",39.0,34111
34138,"Graham, TX Urban Cluster (2010)",45.0,34138
34151,"Gramercy--Lutcher, LA Urban Cluster (2010)",0.0,34151
34165,"Granbury, TX Urban Cluster (2010)",315.0,34165
34192,"Grand Bay, AL Urban Cluster (2010)",13.0,34192
34219,"Grand Forks, ND--MN Urbanized Area (2010)",2605.0,34219
34229,"Grand Forks AFB, ND Urban Cluster (2010)",72.0,34229
34246,"Grand Island, NE Urbanized Area (2010)",498.0,34246
34273,"Grand Junction, CO Urbanized Area (2010)",2297.0,34273
34300,"Grand Rapids, MI Urbanized Area (2010)",9321.0,34300
34327,"Grand Rapids, MN Urban Cluster (2010)",226.0,34327
34354,"Grand Saline, TX Urban Cluster (2010)",37.0,34354
34381,"Grandview, WA Urban Cluster (2010)",188.0,34381
34397,"Granger, WA Urban Cluster (2010)",71.0,34397
34408,"Grangerland, TX Urban Cluster (2010)",0.0,34408
34435,"Grangeville, ID Urban Cluster (2010)",30.0,34435
34462,"Granite Falls, MN Urban Cluster (2010)",269.0,34462
34470,"Granite Falls, WA Urban Cluster (2010)",61.0,34470
34478,"Granite Shoals, TX Urban Cluster (2010)",59.0,34478
34489,"Grants, NM Urban Cluster (2010)",2528.0,34489
34516,"Grants Pass, OR Urbanized Area (2010)",1710.0,34516
34543,"Grantsville, UT Urban Cluster (2010)",171.0,34543
34554,"Grantville, GA Urban Cluster (2010)",34.0,34554
34570,"Granville, NY--VT Urban Cluster (2010)",30.0,34570
34597,"Grass Valley, CA Urban Cluster (2010)",1405.0,34597
34613,"Gray, GA Urban Cluster (2010)",54.0,34613
34624,"Grayling, MI Urban Cluster (2010)",12.0,34624
34651,"Grayson, KY Urban Cluster (2010)",72.0,34651
34678,"Great Barrington, MA Urban Cluster (2010)",10.0,34678
34705,"Great Bend, KS Urban Cluster (2010)",298.0,34705
34759,"Great Falls, MT Urbanized Area (2010)",5024.0,34759
34786,"Greeley, CO Urbanized Area (2010)",2515.0,34786
34813,"Green Bay, WI Urbanized Area (2010)",8153.0,34813
34826,"Greenbrier, AR Urban Cluster (2010)",59.0,34826
34840,"Greencastle, IN Urban Cluster (2010)",50.0,34840
34894,"Greeneville, TN Urban Cluster (2010)",142.0,34894
34921,"Greenfield, CA Urban Cluster (2010)",99.0,34921
34975,"Greenfield, MA Urban Cluster (2010)",231.0,34975
35002,"Greenfield, OH Urban Cluster (2010)",8.0,35002
35029,"Green Forest, AR Urban Cluster (2010)",63.0,35029
35083,"Green River, WY Urban Cluster (2010)",237.0,35083
35137,"Greensboro, GA Urban Cluster (2010)",0.0,35137
35164,"Greensboro, NC Urbanized Area (2010)",4201.0,35164
35191,"Greensburg, IN Urban Cluster (2010)",49.0,35191
35218,"Greentown, IN Urban Cluster (2010)",21.0,35218
35272,"Greenville, AL Urban Cluster (2010)",34.0,35272
35299,"Greenville, IL Urban Cluster (2010)",43.0,35299
35326,"Greenville, MI Urban Cluster (2010)",78.0,35326
35353,"Greenville, MS Urban Cluster (2010)",193.0,35353
35380,"Greenville, NC Urbanized Area (2010)",815.0,35380
35407,"Greenville, OH Urban Cluster (2010)",102.0,35407
35434,"Greenville, PA Urban Cluster (2010)",24.0,35434
35461,"Greenville, SC Urbanized Area (2010)",3428.0,35461
35488,"Greenville, TX Urban Cluster (2010)",297.0,35488
35515,"Greenwich, NY Urban Cluster (2010)",14.0,35515
35542,"Greenwood, AR Urban Cluster (2010)",189.0,35542
35569,"Greenwood, MS Urban Cluster (2010)",14.0,35569
35596,"Greenwood, SC Urban Cluster (2010)",179.0,35596
35623,"Grenada, MS Urban Cluster (2010)",37.0,35623
35677,"Gridley, CA Urban Cluster (2010)",181.0,35677
35690,"Grifton, NC Urban Cluster (2010)",5.0,35690
35704,"Grinnell, IA Urban Cluster (2010)",28.0,35704
35716,"Grissom AFB, IN Urban Cluster (2010)",35.0,35716
35731,"Groesbeck, TX Urban Cluster (2010)",19.0,35731
35758,"Grottoes, VA Urban Cluster (2010)",0.0,35758
35785,"Grove, OK Urban Cluster (2010)",990.0,35785
35812,"Grove City, PA Urban Cluster (2010)",5.0,35812
35839,"Guadalupe, CA Urban Cluster (2010)",160.0,35839
35866,"Guayama, PR Urbanized Area (2010)",132.0,35866
35893,"Guerneville, CA Urban Cluster (2010)",109.0,35893
35920,"Gulfport, MS Urbanized Area (2010)",2582.0,35920
35974,"Gun Barrel City, TX Urban Cluster (2010)",161.0,35974
35987,"Gun Lake, MI Urban Cluster (2010)",0.0,35987
36001,"Gunnison, CO Urban Cluster (2010)",66.0,36001
36028,"Gunnison, UT Urban Cluster (2010)",210.0,36028
36055,"Gustine, CA Urban Cluster (2010)",80.0,36055
36082,"Guthrie, OK Urban Cluster (2010)",674.0,36082
36109,"Guymon, OK Urban Cluster (2010)",315.0,36109
36136,"Gypsum, CO Urban Cluster (2010)",49.0,36136
36190,"Hagerstown, MD--WV--PA Urbanized Area (2010)",1978.0,36190
36217,"Hailey, ID Urban Cluster (2010)",96.0,36217
36231,"Haleiwa--Waialua--Pupukea, HI Urban Cluster (2010)",277.0,36231
36244,"Haleyville, AL Urban Cluster (2010)",30.0,36244
36271,"Half Moon Bay, CA Urban Cluster (2010)",260.0,36271
36298,"Halls, TN Urban Cluster (2010)",10.0,36298
36325,"Hallsville, TX Urban Cluster (2010)",60.0,36325
36352,"Hamburg, AR Urban Cluster (2010)",11.0,36352
36396,"Hamilton, AL Urban Cluster (2010)",60.0,36396
36406,"Hamilton, MT Urban Cluster (2010)",121.0,36406
36433,"Hamilton, NY Urban Cluster (2010)",15.0,36433
36460,"Hamilton, TX Urban Cluster (2010)",85.0,36460
36514,"Hammond, LA Urbanized Area (2010)",806.0,36514
36541,"Hammonton, NJ Urban Cluster (2010)",127.0,36541
36568,"Hampshire, IL Urban Cluster (2010)",0.0,36568
36585,"Hampstead, NC Urban Cluster (2010)",92.0,36585
36622,"Hampton, IA Urban Cluster (2010)",39.0,36622
36649,"Hampton, SC Urban Cluster (2010)",6.0,36649
36676,"Hanceville, AL Urban Cluster (2010)",26.0,36676
36703,"Hanford, CA Urbanized Area (2010)",1624.0,36703
36730,"Hannibal, MO Urban Cluster (2010)",101.0,36730
36784,"Hanover, PA Urbanized Area (2010)",254.0,36784
36798,"Hardeeville, SC Urban Cluster (2010)",0.0,36798
36811,"Hardin, MT Urban Cluster (2010)",1833.0,36811
36823,"Hardyston Township West, NJ Urban Cluster (2010)",51.0,36823
36838,"Harlan, IA Urban Cluster (2010)",66.0,36838
36865,"Harlan, KY Urban Cluster (2010)",39.0,36865
36878,"Harlem, GA Urban Cluster (2010)",0.0,36878
36892,"Harlingen, TX Urbanized Area (2010)",796.0,36892
36919,"Harrah, OK Urban Cluster (2010)",550.0,36919
36946,"Harriman--Kingston--Rockwood, TN Urban Cluster (2010)",219.0,36946
36973,"Harrington, DE Urban Cluster (2010)",38.0,36973
37000,"Harrisburg, IL Urban Cluster (2010)",123.0,37000
37054,"Harrisburg, OR Urban Cluster (2010)",101.0,37054
37081,"Harrisburg, PA Urbanized Area (2010)",3062.0,37081
37091,"Harrisburg, SD Urban Cluster (2010)",96.0,37091
37108,"Harrison, AR Urban Cluster (2010)",283.0,37108
37135,"Harrison, MI Urban Cluster (2010)",20.0,37135
37145,"Harrison, OH--IN Urban Cluster (2010)",87.0,37145
37162,"Harrisonburg, VA Urbanized Area (2010)",534.0,37162
37189,"Harrisonville, MO Urban Cluster (2010)",182.0,37189
37216,"Harrodsburg, KY Urban Cluster (2010)",75.0,37216
37232,"Hart, MI Urban Cluster (2010)",44.0,37232
37243,"Hartford, CT Urbanized Area (2010)",8492.0,37243
37324,"Hartford City, IN Urban Cluster (2010)",81.0,37324
37378,"Hartshorne, OK Urban Cluster (2010)",698.0,37378
37405,"Hartsville, SC Urban Cluster (2010)",132.0,37405
37432,"Hartwell, GA Urban Cluster (2010)",22.0,37432
37459,"Harvard, IL Urban Cluster (2010)",34.0,37459
37486,"Haskell, TX Urban Cluster (2010)",50.0,37486
37513,"Hastings, MI Urban Cluster (2010)",125.0,37513
37540,"Hastings, MN Urban Cluster (2010)",291.0,37540
37567,"Hastings, NE Urban Cluster (2010)",280.0,37567
37594,"Hattiesburg, MS Urbanized Area (2010)",675.0,37594
37621,"Havana, FL Urban Cluster (2010)",19.0,37621
37648,"Havana, IL Urban Cluster (2010)",45.0,37648
37675,"Havelock, NC Urban Cluster (2010)",511.0,37675
37702,"Havre, MT Urban Cluster (2010)",1655.0,37702
37716,"Hawaiian Paradise Park, HI Urban Cluster (2010)",558.0,37716
37729,"Hawkinsville, GA Urban Cluster (2010)",21.0,37729
37756,"Hawthorne, NV Urban Cluster (2010)",229.0,37756
37783,"Hays, KS Urban Cluster (2010)",212.0,37783
37810,"Hayti, MO Urban Cluster (2010)",43.0,37810
37823,"Hayward, WI Urban Cluster (2010)",331.0,37823
37837,"Hazard, KY Urban Cluster (2010)",14.0,37837
37864,"Hazel Green, AL Urban Cluster (2010)",59.0,37864
37891,"Hazlehurst, GA Urban Cluster (2010)",0.0,37891
37918,"Hazlehurst, MS Urban Cluster (2010)",0.0,37918
37945,"Hazleton, PA Urbanized Area (2010)",401.0,37945
37959,"Headland, AL Urban Cluster (2010)",54.0,37959
37972,"Hearne, TX Urban Cluster (2010)",15.0,37972
37999,"Heavener, OK Urban Cluster (2010)",447.0,37999
38026,"Hebbronville, TX Urban Cluster (2010)",15.0,38026
38053,"Heber, UT Urban Cluster (2010)",332.0,38053
38080,"Heber Springs, AR Urban Cluster (2010)",3.0,38080
38134,"Hebron, IN Urban Cluster (2010)",0.0,38134
38161,"Helena, MT Urban Cluster (2010)",1776.0,38161
38172,"Helena-West Helena, AR Urban Cluster (2010)",31.0,38172
38215,"Hemet, CA Urbanized Area (2010)",5909.0,38215
38242,"Hempstead, TX Urban Cluster (2010)",87.0,38242
38269,"Henderson, NC Urban Cluster (2010)",451.0,38269
38296,"Henderson, TN Urban Cluster (2010)",29.0,38296
38323,"Henderson, TX Urban Cluster (2010)",71.0,38323
38350,"Henrietta, TX Urban Cluster (2010)",78.0,38350
38404,"Henryetta, OK Urban Cluster (2010)",1645.0,38404
38431,"Hereford, TX Urban Cluster (2010)",540.0,38431
38445,"Heritage Lake, IN Urban Cluster (2010)",0.0,38445
38485,"Hermiston, OR Urban Cluster (2010)",902.0,38485
38566,"Hesston, KS Urban Cluster (2010)",46.0,38566
38580,"Heyworth, IL Urban Cluster (2010)",20.0,38580
