3000004,"Mountain View Elementary School District, Montana",0.0,0.0,0.0,0.0,0.0,0.0,0.0,0.0,0.0,0.0,0.0,0.0,0.0,0.0,0.0,0.0,0.0,00004,30
3027740,"Whitefish Elementary School District, Montana",5939.0,408.0,386.0,87.0,376.0,294.0,275.0,218.0,395.0,291.0,366.0,534.0,658.0,586.0,341.0,403.0,321.0,27740,30
3027810,"Whitehall Elementary School District, Montana",1491.0,133.0,85.0,73.0,98.0,42.0,100.0,105.0,95.0,53.0,187.0,127.0,153.0,157.0,65.0,7.0,11.0,27810,30
3000002,"Somers Elementary School District, Montana",2423.0,172.0,36.0,51.0,145.0,166.0,122.0,152.0,78.0,106.0,154.0,393.0,363.0,239.0,120.0,54.0,72.0,00002,30
3000003,"Cut Bank Elementary School District, Montana",1466.0,93.0,154.0,69.0,156.0,65.0,124.0,55.0,91.0,36.0,110.0,93.0,94.0,133.0,96.0,43.0,54.0,00003,30
3000005,"Helena Elementary School District, Montana",22079.0,1019.0,1144.0,689.0,1158.0,740.0,1239.0,947.0,1249.0,914.0,1743.0,2696.0,3258.0,2109.0,1304.0,1153.0,717.0,00005,30
3000006,"Broadus Elementary School District, Montana",615.0,29.0,27.0,48.0,24.0,38.0,40.0,27.0,48.0,25.0,71.0,63.0,59.0,36.0,33.0,44.0,3.0,00006,30
3000007,"South Stacey Elementary School District, Montana",20.0,3.0,0.0,2.0,2.0,4.0,0.0,0.0,1.0,1.0,0.0,1.0,4.0,0.0,2.0,0.0,0.0,00007,30
3000093,"Liberty Elementary School District, Montana",38.0,16.0,0.0,1.0,0.0,0.0,0.0,3.0,7.0,2.0,1.0,4.0,0.0,2.0,0.0,0.0,2.0,00093,30
3000008,"Ashland Elementary School District, Montana",444.0,31.0,18.0,32.0,21.0,15.0,53.0,31.0,26.0,18.0,51.0,33.0,56.0,35.0,16.0,4.0,4.0,00008,30
3000089,"Cottonwood Elementary School District (Custer County), Montana",36.0,3.0,0.0,1.0,0.0,3.0,0.0,0.0,4.0,2.0,4.0,8.0,1.0,4.0,2.0,4.0,0.0,00089,30
3000090,"Noxon Elementary School District, Montana",651.0,68.0,81.0,46.0,52.0,26.0,23.0,34.0,54.0,44.0,47.0,74.0,2.0,59.0,13.0,4.0,24.0,00090,30
3000094,"West Glacier Elementary School District, Montana",210.0,0.0,7.0,4.0,16.0,26.0,16.0,10.0,11.0,39.0,21.0,10.0,20.0,6.0,4.0,11.0,9.0,00094,30
3000096,"North Star Elementary School District, Montana",431.0,17.0,41.0,9.0,32.0,38.0,16.0,9.0,27.0,19.0,58.0,43.0,82.0,30.0,2.0,8.0,0.0,00096,30
3000098,"Chester-Joplin-Inverness Elementary School District, Montana",863.0,20.0,80.0,32.0,50.0,56.0,72.0,52.0,52.0,21.0,87.0,102.0,126.0,21.0,18.0,20.0,54.0,00098,30
3000932,"Shields Valley Elementary School District, Montana",751.0,49.0,30.0,40.0,49.0,37.0,48.0,43.0,39.0,22.0,72.0,89.0,70.0,66.0,42.0,27.0,28.0,00932,30
3001710,"Absarokee Elementary School District, Montana",783.0,11.0,46.0,47.0,16.0,0.0,75.0,71.0,55.0,5.0,71.0,42.0,125.0,114.0,26.0,37.0,42.0,01710,30
3001950,"Alzada Elementary School District, Montana",85.0,0.0,14.0,3.0,0.0,5.0,0.0,14.0,0.0,13.0,5.0,15.0,3.0,1.0,1.0,1.0,10.0,01950,30
3001980,"Amsterdam Elementary School District, Montana",644.0,22.0,11.0,16.0,22.0,32.0,25.0,22.0,47.0,30.0,61.0,143.0,117.0,27.0,17.0,32.0,20.0,01980,30
3002010,"Anaconda Elementary School District, Montana",3897.0,422.0,302.0,270.0,261.0,178.0,261.0,198.0,320.0,183.0,315.0,248.0,404.0,239.0,138.0,73.0,85.0,02010,30
3002070,"Anderson Elementary School District, Montana",492.0,23.0,10.0,6.0,0.0,24.0,23.0,9.0,19.0,27.0,30.0,59.0,66.0,33.0,64.0,51.0,48.0,02070,30
3002220,"Arlee Elementary School District, Montana",1054.0,103.0,83.0,45.0,27.0,48.0,70.0,76.0,57.0,52.0,85.0,105.0,104.0,103.0,33.0,29.0,34.0,02220,30
3002300,"Arrowhead Elementary School District, Montana",855.0,59.0,37.0,55.0,59.0,36.0,25.0,91.0,41.0,23.0,56.0,127.0,88.0,61.0,35.0,39.0,23.0,02300,30
3301500,"Andover School District, New Hampshire",1076.0,39.0,39.0,18.0,56.0,24.0,76.0,47.0,103.0,7.0,78.0,109.0,164.0,147.0,78.0,56.0,35.0,01500,33
3304170,"Landaff School District, New Hampshire",195.0,6.0,29.0,4.0,15.0,6.0,8.0,6.0,14.0,15.0,12.0,24.0,17.0,16.0,9.0,5.0,9.0,04170,33
3304500,"Lyme School District, New Hampshire",661.0,18.0,3.0,12.0,5.0,20.0,3.0,29.0,34.0,32.0,17.0,34.0,92.0,73.0,39.0,89.0,161.0,04500,33
3304560,"Madison School District, New Hampshire",1069.0,33.0,59.0,17.0,67.0,27.0,35.0,66.0,23.0,56.0,158.0,118.0,127.0,73.0,126.0,14.0,70.0,04560,33
3301380,"Allenstown School District, New Hampshire",1744.0,55.0,227.0,8.0,42.0,73.0,142.0,87.0,74.0,56.0,190.0,236.0,236.0,127.0,89.0,90.0,12.0,01380,33
3301440,"Alton School District, New Hampshire",2159.0,49.0,63.0,19.0,94.0,58.0,90.0,104.0,145.0,56.0,113.0,179.0,526.0,300.0,114.0,206.0,43.0,01440,33
3301470,"Amherst School District, New Hampshire",3996.0,60.0,14.0,106.0,73.0,95.0,63.0,41.0,42.0,148.0,128.0,193.0,484.0,498.0,472.0,752.0,827.0,01470,33
3301560,"Ashland School District, New Hampshire",924.0,68.0,50.0,81.0,55.0,94.0,58.0,33.0,67.0,22.0,82.0,105.0,130.0,15.0,26.0,22.0,16.0,01560,33
3301590,"Auburn School District, New Hampshire",1984.0,21.0,19.0,20.0,54.0,17.0,20.0,9.0,130.0,27.0,64.0,100.0,312.0,369.0,296.0,273.0,253.0,01590,33
3301620,"Barnstead School District, New Hampshire",1666.0,40.0,46.0,46.0,35.0,25.0,76.0,20.0,50.0,94.0,188.0,225.0,309.0,276.0,97.0,64.0,75.0,01620,33
3301650,"Barrington School District, New Hampshire",3388.0,120.0,158.0,110.0,120.0,40.0,172.0,66.0,166.0,54.0,123.0,337.0,418.0,277.0,310.0,781.0,136.0,01650,33
3301680,"Bartlett School District, New Hampshire",1408.0,104.0,35.0,120.0,51.0,28.0,118.0,65.0,115.0,66.0,122.0,132.0,255.0,51.0,50.0,23.0,73.0,01680,33
3301710,"Bath School District, New Hampshire",362.0,19.0,12.0,18.0,21.0,19.0,29.0,18.0,10.0,21.0,16.0,62.0,55.0,7.0,10.0,26.0,19.0,01710,33
3301890,"Bethlehem School District, New Hampshire",1094.0,65.0,85.0,22.0,107.0,39.0,77.0,36.0,21.0,28.0,137.0,127.0,138.0,90.0,56.0,38.0,28.0,01890,33
3302010,"Brentwood School District, New Hampshire",1598.0,33.0,34.0,70.0,87.0,37.0,18.0,9.0,16.0,26.0,82.0,115.0,148.0,179.0,156.0,259.0,329.0,02010,33
3302070,"Brookline School District, New Hampshire",1750.0,11.0,11.0,0.0,7.0,13.0,40.0,57.0,26.0,16.0,94.0,75.0,209.0,308.0,211.0,386.0,286.0,02070,33
3302100,"Campton School District, New Hampshire",1661.0,100.0,131.0,18.0,46.0,45.0,65.0,104.0,107.0,61.0,103.0,242.0,220.0,71.0,95.0,125.0,128.0,02100,33
3302130,"Candia School District, New Hampshire",1522.0,49.0,7.0,40.0,37.0,41.0,102.0,51.0,37.0,28.0,72.0,137.0,245.0,176.0,78.0,267.0,155.0,02130,33
3302250,"Chester School District, New Hampshire",1694.0,9.0,12.0,0.0,23.0,30.0,22.0,38.0,12.0,18.0,54.0,160.0,271.0,213.0,234.0,316.0,282.0,02250,33
3302280,"Chesterfield School District, New Hampshire",1443.0,63.0,26.0,0.0,64.0,49.0,17.0,97.0,82.0,95.0,87.0,123.0,198.0,195.0,73.0,74.0,200.0,02280,33
3302310,"Chichester School District, New Hampshire",967.0,12.0,26.0,17.0,27.0,17.0,17.0,20.0,32.0,75.0,62.0,132.0,191.0,133.0,44.0,99.0,63.0,02310,33
3302520,"Cornish School District, New Hampshire",722.0,19.0,10.0,26.0,14.0,26.0,44.0,47.0,14.0,28.0,36.0,87.0,99.0,113.0,67.0,46.0,46.0,02520,33
3302550,"Croydon School District, New Hampshire",274.0,1.0,14.0,7.0,16.0,6.0,6.0,12.0,14.0,3.0,27.0,34.0,54.0,15.0,35.0,23.0,7.0,02550,33
3302580,"Deerfield School District, New Hampshire",1623.0,50.0,25.0,6.0,0.0,34.0,58.0,36.0,24.0,83.0,97.0,129.0,367.0,280.0,169.0,162.0,103.0,02580,33
3302610,"Derry School District, New Hampshire",12962.0,330.0,387.0,417.0,370.0,354.0,428.0,629.0,427.0,720.0,1228.0,1848.0,1703.0,1652.0,955.0,864.0,650.0,02610,33
3302760,"Dunbarton School District, New Hampshire",977.0,10.0,5.0,4.0,17.0,29.0,37.0,19.0,34.0,50.0,53.0,55.0,166.0,140.0,91.0,118.0,149.0,02760,33
3302790,"East Kingston School District, New Hampshire",892.0,25.0,0.0,11.0,10.0,24.0,32.0,22.0,9.0,47.0,46.0,90.0,142.0,94.0,98.0,152.0,90.0,02790,33
3302910,"Epsom School District, New Hampshire",1792.0,26.0,49.0,72.0,84.0,59.0,134.0,42.0,26.0,65.0,203.0,242.0,168.0,134.0,231.0,114.0,143.0,02910,33
3302940,"Errol School District, New Hampshire",136.0,1.0,24.0,12.0,8.0,2.0,19.0,1.0,10.0,1.0,14.0,16.0,12.0,5.0,0.0,6.0,5.0,02940,33
3302970,"Exeter School District, New Hampshire",6476.0,256.0,270.0,195.0,260.0,299.0,279.0,112.0,217.0,199.0,535.0,638.0,933.0,551.0,365.0,535.0,832.0,02970,33
3303120,"Freedom School District, New Hampshire",587.0,32.0,21.0,7.0,34.0,11.0,43.0,33.0,30.0,30.0,60.0,55.0,97.0,70.0,10.0,20.0,34.0,03120,33
3303210,"Gilmanton School District, New Hampshire",1443.0,46.0,5.0,42.0,70.0,63.0,96.0,56.0,11.0,24.0,169.0,211.0,324.0,122.0,114.0,40.0,50.0,03210,33
3303360,"Grantham School District, New Hampshire",1153.0,0.0,0.0,34.0,0.0,51.0,12.0,0.0,81.0,26.0,43.0,152.0,138.0,258.0,153.0,65.0,140.0,03360,33
3303600,"Hanover School District, New Hampshire",2862.0,151.0,37.0,37.0,175.0,43.0,93.0,70.0,7.0,28.0,120.0,189.0,312.0,213.0,245.0,345.0,797.0,03600,33
3303420,"Greenland School District, New Hampshire",1469.0,33.0,26.0,11.0,20.0,44.0,31.0,17.0,60.0,52.0,51.0,62.0,243.0,176.0,133.0,249.0,261.0,03420,33
3303690,"Henniker School District, New Hampshire",1666.0,63.0,106.0,123.0,31.0,35.0,113.0,27.0,34.0,40.0,39.0,277.0,251.0,195.0,86.0,139.0,107.0,03690,33
3303510,"Hampton School District, New Hampshire",7098.0,180.0,257.0,268.0,198.0,195.0,339.0,194.0,195.0,338.0,524.0,635.0,986.0,805.0,537.0,756.0,691.0,03510,33
3303540,"Hampton Falls School District, New Hampshire",894.0,29.0,4.0,25.0,7.0,16.0,25.0,26.0,4.0,9.0,37.0,50.0,110.0,70.0,119.0,105.0,258.0,03540,33
3303630,"Harrisville School District, New Hampshire",437.0,11.0,6.0,9.0,13.0,14.0,9.0,18.0,26.0,28.0,56.0,50.0,49.0,63.0,26.0,34.0,25.0,03630,33
3303720,"Hill School District, New Hampshire",392.0,3.0,0.0,0.0,24.0,7.0,11.0,42.0,18.0,13.0,25.0,60.0,113.0,33.0,27.0,5.0,11.0,03720,33
3303810,"Holderness School District, New Hampshire",764.0,5.0,14.0,65.0,34.0,17.0,49.0,47.0,56.0,50.0,11.0,96.0,98.0,84.0,35.0,58.0,45.0,03810,33
3303840,"Hollis School District, New Hampshire",3010.0,16.0,79.0,37.0,58.0,52.0,49.0,53.0,80.0,78.0,210.0,167.0,140.0,454.0,298.0,409.0,830.0,03840,33
3303870,"Hooksett School District, New Hampshire",5174.0,104.0,176.0,133.0,167.0,121.0,123.0,264.0,223.0,145.0,261.0,569.0,862.0,635.0,602.0,318.0,471.0,03870,33
3303990,"Jackson School District, New Hampshire",455.0,19.0,2.0,28.0,14.0,8.0,12.0,29.0,38.0,3.0,52.0,37.0,57.0,66.0,20.0,32.0,38.0,03990,33
3304080,"Kensington School District, New Hampshire",806.0,18.0,6.0,19.0,9.0,10.0,25.0,16.0,8.0,20.0,41.0,57.0,111.0,137.0,70.0,101.0,158.0,04080,33
3304150,"Lafayette Regional School District, New Hampshire",896.0,25.0,16.0,26.0,39.0,17.0,59.0,25.0,59.0,27.0,71.0,101.0,91.0,110.0,56.0,86.0,88.0,04150,33
3304620,"Marlborough School District, New Hampshire",906.0,10.0,49.0,19.0,72.0,69.0,73.0,45.0,43.0,33.0,66.0,76.0,94.0,93.0,69.0,62.0,33.0,04620,33
3304650,"Marlow School District, New Hampshire",282.0,12.0,7.0,10.0,8.0,4.0,8.0,14.0,8.0,34.0,33.0,37.0,36.0,41.0,19.0,5.0,6.0,04650,33
3304800,"Milan School District, New Hampshire",574.0,30.0,14.0,42.0,20.0,40.0,15.0,22.0,44.0,46.0,40.0,75.0,87.0,54.0,24.0,12.0,9.0,04800,33
3304920,"Monroe School District, New Hampshire",333.0,2.0,6.0,15.0,21.0,25.0,12.0,24.0,10.0,8.0,39.0,34.0,46.0,41.0,24.0,16.0,10.0,04920,33
3304950,"Mont Vernon School District, New Hampshire",854.0,10.0,0.0,21.0,21.0,29.0,25.0,14.0,17.0,29.0,32.0,49.0,143.0,115.0,102.0,119.0,128.0,04950,33
3305010,"Nelson School District, New Hampshire",226.0,18.0,0.0,5.0,10.0,9.0,10.0,6.0,8.0,10.0,14.0,25.0,25.0,16.0,32.0,6.0,32.0,05010,33
3305040,"New Boston School District, New Hampshire",1866.0,9.0,24.0,18.0,14.0,89.0,26.0,13.0,71.0,19.0,118.0,177.0,302.0,366.0,88.0,261.0,271.0,05040,33
3305070,"New Castle School District, New Hampshire",467.0,5.0,0.0,7.0,18.0,3.0,21.0,18.0,4.0,0.0,68.0,26.0,34.0,44.0,57.0,54.0,108.0,05070,33
3305190,"Newfields School District, New Hampshire",540.0,7.0,2.0,9.0,5.0,13.0,6.0,12.0,20.0,20.0,36.0,26.0,47.0,76.0,49.0,67.0,145.0,05190,33
3305250,"Newington School District, New Hampshire",340.0,10.0,3.0,5.0,4.0,6.0,10.0,7.0,10.0,4.0,22.0,25.0,74.0,40.0,21.0,62.0,37.0,05250,33
3305370,"North Hampton School District, New Hampshire",1747.0,43.0,16.0,34.0,29.0,41.0,43.0,16.0,15.0,13.0,171.0,169.0,225.0,187.0,101.0,242.0,402.0,05370,33
3305430,"Northwood School District, New Hampshire",1582.0,0.0,16.0,50.0,61.0,15.0,27.0,35.0,98.0,56.0,151.0,121.0,314.0,291.0,112.0,130.0,105.0,05430,33
3305460,"Nottingham School District, New Hampshire",1764.0,6.0,20.0,25.0,33.0,57.0,35.0,46.0,39.0,12.0,100.0,235.0,255.0,147.0,263.0,320.0,171.0,05460,33
3305670,"Piermont School District, New Hampshire",352.0,9.0,4.0,6.0,22.0,12.0,10.0,20.0,10.0,14.0,20.0,63.0,49.0,41.0,27.0,22.0,23.0,05670,33
3305760,"Plainfield School District, New Hampshire",920.0,22.0,0.0,0.0,16.0,68.0,26.0,42.0,27.0,33.0,65.0,102.0,143.0,114.0,90.0,80.0,92.0,05760,33
3305790,"Plymouth School District, New Hampshire",2036.0,241.0,186.0,233.0,107.0,63.0,127.0,31.0,100.0,73.0,79.0,133.0,229.0,85.0,116.0,129.0,104.0,05790,33
3305970,"Rollinsford School District, New Hampshire",1048.0,17.0,30.0,25.0,34.0,69.0,31.0,19.0,25.0,29.0,135.0,117.0,153.0,128.0,67.0,109.0,60.0,05970,33
3306000,"Rumney School District, New Hampshire",657.0,44.0,20.0,31.0,28.0,20.0,18.0,32.0,51.0,35.0,59.0,76.0,122.0,56.0,27.0,10.0,28.0,06000,33
3306030,"Rye School District, New Hampshire",2209.0,78.0,15.0,49.0,82.0,29.0,82.0,74.0,30.0,65.0,121.0,238.0,210.0,261.0,279.0,222.0,374.0,06030,33
3306150,"Seabrook School District, New Hampshire",3946.0,198.0,116.0,233.0,139.0,104.0,219.0,134.0,218.0,202.0,383.0,503.0,600.0,378.0,193.0,218.0,108.0,06150,33
3306270,"South Hampton School District, New Hampshire",310.0,7.0,2.0,4.0,3.0,10.0,25.0,4.0,8.0,7.0,20.0,19.0,33.0,27.0,53.0,44.0,44.0,06270,33
3306330,"Stark School District, New Hampshire",224.0,25.0,4.0,11.0,14.0,12.0,16.0,16.0,16.0,15.0,25.0,14.0,20.0,25.0,2.0,7.0,2.0,06330,33
3306360,"Stewartstown School District, New Hampshire",340.0,16.0,39.0,13.0,44.0,21.0,12.0,13.0,19.0,16.0,16.0,26.0,25.0,44.0,28.0,4.0,4.0,06360,33
3306390,"Stoddard School District, New Hampshire",484.0,3.0,3.0,0.0,3.0,42.0,37.0,31.0,22.0,13.0,29.0,49.0,70.0,77.0,51.0,45.0,9.0,06390,33
3306420,"Strafford School District, New Hampshire",1432.0,46.0,0.0,44.0,26.0,73.0,27.0,44.0,11.0,85.0,115.0,98.0,115.0,213.0,233.0,165.0,137.0,06420,33
3306480,"Stratham School District, New Hampshire",2783.0,13.0,47.0,41.0,13.0,133.0,0.0,117.0,191.0,86.0,142.0,243.0,241.0,296.0,180.0,398.0,642.0,06480,33
3306600,"Tamworth School District, New Hampshire",1378.0,117.0,101.0,66.0,56.0,131.0,75.0,56.0,0.0,32.0,159.0,215.0,76.0,124.0,58.0,63.0,49.0,06600,33
3306660,"Thornton School District, New Hampshire",869.0,12.0,34.0,21.0,41.0,62.0,41.0,49.0,26.0,69.0,41.0,127.0,217.0,51.0,59.0,10.0,9.0,06660,33
3306750,"Unity School District, New Hampshire",526.0,13.0,26.0,7.0,41.0,29.0,19.0,3.0,27.0,43.0,22.0,75.0,72.0,73.0,53.0,19.0,4.0,06750,33
3306780,"Wakefield School District, New Hampshire",2066.0,50.0,146.0,79.0,98.0,66.0,79.0,106.0,144.0,68.0,241.0,326.0,173.0,203.0,116.0,111.0,60.0,06780,33
3306870,"Warren School District, New Hampshire",325.0,28.0,16.0,20.0,24.0,21.0,22.0,16.0,12.0,11.0,47.0,38.0,27.0,15.0,5.0,17.0,6.0,06870,33
3306900,"Washington School District, New Hampshire",556.0,21.0,18.0,18.0,21.0,31.0,23.0,28.0,15.0,9.0,37.0,63.0,86.0,73.0,51.0,6.0,56.0,06900,33
3306910,"Waterville Valley School District, New Hampshire",86.0,0.0,0.0,0.0,0.0,5.0,7.0,2.0,0.0,2.0,11.0,3.0,16.0,13.0,3.0,8.0,16.0,06910,33
3306930,"Weare School District, New Hampshire",3211.0,68.0,34.0,64.0,161.0,48.0,20.0,90.0,76.0,178.0,120.0,356.0,671.0,436.0,228.0,357.0,304.0,06930,33
3306990,"Wentworth School District, New Hampshire",328.0,14.0,15.0,17.0,13.0,15.0,17.0,19.0,3.0,14.0,32.0,62.0,38.0,24.0,11.0,20.0,14.0,06990,33
3307020,"Westmoreland School District, New Hampshire",656.0,16.0,14.0,2.0,21.0,10.0,7.0,9.0,11.0,13.0,74.0,65.0,127.0,102.0,88.0,36.0,61.0,07020,33
3307140,"Winchester School District, New Hampshire",1718.0,84.0,50.0,129.0,193.0,72.0,114.0,57.0,53.0,120.0,102.0,255.0,272.0,147.0,30.0,40.0,0.0,07140,33
3399999,"Remainder of New Hampshire, New Hampshire",392856.0,16802.0,14410.0,15623.0,16421.0,16376.0,16752.0,15443.0,15575.0,15822.0,28990.0,42383.0,55829.0,41570.0,26777.0,28932.0,25151.0,99999,33
3303276,"Mason School District, New Hampshire",583.0,14.0,19.0,10.0,18.0,19.0,19.0,6.0,26.0,8.0,23.0,69.0,82.0,92.0,64.0,55.0,59.0,03276,33
3306450,"Stratford School District, New Hampshire",287.0,51.0,30.0,23.0,16.0,16.0,15.0,20.0,17.0,14.0,18.0,35.0,16.0,4.0,4.0,6.0,2.0,06450,33
3303150,"Fremont School District, New Hampshire",1723.0,38.0,24.0,8.0,9.0,20.0,39.0,45.0,41.0,81.0,121.0,227.0,292.0,228.0,145.0,240.0,165.0,03150,33
3303480,"Hampstead School District, New Hampshire",3590.0,126.0,118.0,49.0,111.0,82.0,230.0,72.0,117.0,101.0,277.0,309.0,355.0,545.0,335.0,427.0,336.0,03480,33
3303303,"Lempster School District, New Hampshire",409.0,7.0,19.0,16.0,39.0,11.0,23.0,11.0,22.0,22.0,20.0,51.0,76.0,49.0,4.0,21.0,18.0,03303,33
3402790,"Carlstadt Borough School District, New Jersey",2328.0,91.0,33.0,35.0,15.0,126.0,86.0,50.0,18.0,101.0,203.0,126.0,325.0,244.0,416.0,258.0,201.0,02790,34
3402550,"Byram Township School District, New Jersey",2940.0,95.0,37.0,56.0,65.0,45.0,45.0,39.0,142.0,54.0,158.0,189.0,430.0,469.0,303.0,425.0,388.0,02550,34
3402610,"Califon Borough School District, New Jersey",465.0,12.0,2.0,10.0,13.0,2.0,2.0,7.0,35.0,17.0,26.0,52.0,72.0,34.0,35.0,69.0,77.0,02610,34
3402700,"Cape May City School District, New Jersey",1341.0,138.0,9.0,65.0,70.0,97.0,30.0,63.0,37.0,50.0,119.0,88.0,85.0,177.0,78.0,116.0,119.0,02700,34
3403060,"Chester Township School District, New Jersey",3263.0,45.0,129.0,50.0,25.0,32.0,12.0,20.0,13.0,72.0,146.0,122.0,346.0,389.0,295.0,493.0,1074.0,03060,34
3403090,"Chesterfield Township School District, New Jersey",1836.0,38.0,7.0,0.0,40.0,19.0,28.0,18.0,29.0,22.0,112.0,88.0,176.0,255.0,156.0,367.0,481.0,03090,34
3403360,"Clinton Township School District, New Jersey",3810.0,112.0,41.0,31.0,7.0,84.0,71.0,86.0,7.0,109.0,113.0,349.0,427.0,364.0,371.0,607.0,1031.0,03360,34
3403390,"Closter Borough School District, New Jersey",2681.0,11.0,32.0,19.0,41.0,32.0,58.0,102.0,58.0,57.0,167.0,176.0,248.0,284.0,265.0,422.0,709.0,03390,34
3417640,"Woodland Park Borough School District, New Jersey",4301.0,145.0,90.0,79.0,108.0,175.0,226.0,346.0,166.0,140.0,260.0,458.0,551.0,458.0,190.0,493.0,416.0,17640,34
3403450,"Colts Neck Township School District, New Jersey",3208.0,46.0,75.0,56.0,36.0,59.0,56.0,45.0,65.0,65.0,95.0,111.0,175.0,244.0,279.0,454.0,1347.0,03450,34
3403660,"Deerfield Township School District, New Jersey",1089.0,86.0,32.0,38.0,26.0,27.0,60.0,24.0,58.0,61.0,76.0,196.0,138.0,110.0,51.0,81.0,25.0,03660,34
3403720,"Delaware Township School District, New Jersey",1764.0,21.0,24.0,7.0,50.0,121.0,32.0,61.0,0.0,11.0,61.0,124.0,162.0,226.0,213.0,331.0,320.0,03720,34
3403330,"Clinton Town-Glen Gardner School District, New Jersey",1805.0,75.0,32.0,93.0,40.0,64.0,64.0,78.0,71.0,71.0,113.0,145.0,181.0,184.0,138.0,192.0,264.0,03330,34
3406150,"Greenwich Township School District, New Jersey",316.0,13.0,4.0,17.0,7.0,0.0,15.0,21.0,18.0,18.0,19.0,39.0,44.0,40.0,23.0,21.0,17.0,06150,34
3412240,"Oradell Borough School District, New Jersey",2696.0,13.0,55.0,41.0,39.0,21.0,77.0,56.0,125.0,34.0,84.0,119.0,338.0,275.0,155.0,440.0,824.0,12240,34
3412120,"Oceanport Borough School District, New Jersey",2847.0,117.0,181.0,10.0,94.0,65.0,84.0,31.0,56.0,88.0,281.0,154.0,260.0,276.0,301.0,492.0,357.0,12120,34
3412150,"Ogdensburg Borough School District, New Jersey",842.0,30.0,9.0,9.0,19.0,13.0,7.0,30.0,24.0,39.0,37.0,153.0,151.0,140.0,31.0,74.0,76.0,12150,34
3412180,"Old Tappan Borough School District, New Jersey",2057.0,62.0,37.0,25.0,53.0,50.0,13.0,71.0,55.0,48.0,106.0,34.0,163.0,179.0,182.0,244.0,735.0,12180,34
3412660,"Long Hill Township School District, New Jersey",3250.0,50.0,64.0,78.0,16.0,106.0,62.0,48.0,46.0,13.0,154.0,115.0,403.0,332.0,391.0,456.0,916.0,12660,34
3413470,"Prospect Park Borough School District, New Jersey",1656.0,92.0,96.0,111.0,99.0,61.0,95.0,87.0,67.0,105.0,101.0,170.0,178.0,176.0,70.0,102.0,46.0,13470,34
3413710,"Readington Township School District, New Jersey",6270.0,127.0,96.0,56.0,142.0,35.0,151.0,64.0,132.0,162.0,366.0,565.0,584.0,464.0,555.0,936.0,1835.0,13710,34
3413740,"Red Bank Borough School District, New Jersey",5108.0,203.0,222.0,169.0,298.0,206.0,329.0,133.0,212.0,117.0,331.0,331.0,690.0,609.0,294.0,600.0,364.0,13740,34
3413860,"Ringwood Borough School District, New Jersey",3939.0,18.0,72.0,26.0,56.0,102.0,89.0,56.0,135.0,56.0,166.0,227.0,687.0,419.0,436.0,607.0,787.0,13860,34
3413890,"River Edge Borough School District, New Jersey",4004.0,115.0,23.0,34.0,56.0,170.0,100.0,97.0,114.0,74.0,245.0,224.0,407.0,365.0,214.0,794.0,972.0,13890,34
3413950,"River Vale Township School District, New Jersey",3485.0,81.0,30.0,62.0,50.0,67.0,71.0,15.0,134.0,27.0,176.0,164.0,318.0,363.0,303.0,567.0,1057.0,13950,34
3414100,"Rockaway Borough School District, New Jersey",2416.0,0.0,0.0,57.0,98.0,17.0,67.0,139.0,51.0,143.0,187.0,312.0,363.0,394.0,181.0,164.0,243.0,14100,34
3414130,"Rockaway Township School District, New Jersey",9280.0,207.0,214.0,158.0,158.0,206.0,280.0,226.0,191.0,299.0,440.0,628.0,1283.0,1239.0,985.0,1252.0,1514.0,14130,34
3414250,"Roseland Borough School District, New Jersey",2415.0,91.0,54.0,29.0,133.0,34.0,65.0,37.0,51.0,53.0,114.0,187.0,193.0,290.0,233.0,295.0,556.0,14250,34
3414370,"Rumson Borough School District, New Jersey",2224.0,57.0,0.0,36.0,46.0,44.0,77.0,10.0,37.0,24.0,113.0,62.0,162.0,125.0,267.0,188.0,976.0,14370,34
3414430,"Runnemede Borough School District, New Jersey",3191.0,226.0,65.0,211.0,201.0,131.0,110.0,151.0,142.0,73.0,240.0,430.0,470.0,284.0,276.0,134.0,47.0,14430,34
3414610,"Sandyston-Walpack Township School District, New Jersey",713.0,8.0,19.0,21.0,28.0,35.0,37.0,14.0,17.0,4.0,52.0,103.0,97.0,110.0,54.0,72.0,42.0,14610,34
3403810,"Demarest Borough School District, New Jersey",1661.0,50.0,33.0,0.0,18.0,0.0,29.0,26.0,26.0,36.0,65.0,47.0,174.0,233.0,97.0,263.0,564.0,03810,34
3403870,"Denville Township School District, New Jersey",6420.0,148.0,143.0,116.0,182.0,218.0,247.0,146.0,66.0,53.0,315.0,542.0,569.0,706.0,683.0,977.0,1309.0,03870,34
3404050,"Eagleswood Township School District, New Jersey",570.0,6.0,25.0,7.0,15.0,36.0,24.0,17.0,8.0,20.0,58.0,60.0,100.0,65.0,58.0,40.0,31.0,04050,34
3404080,"East Amwell Township School District, New Jersey",1467.0,25.0,19.0,65.0,22.0,17.0,74.0,33.0,0.0,33.0,88.0,134.0,180.0,100.0,185.0,264.0,228.0,04080,34
3404140,"East Greenwich Township School District, New Jersey",3253.0,114.0,14.0,96.0,45.0,55.0,46.0,47.0,26.0,113.0,144.0,235.0,221.0,542.0,154.0,649.0,752.0,04140,34
3404170,"East Hanover Township School District, New Jersey",3811.0,45.0,175.0,42.0,87.0,60.0,53.0,75.0,59.0,74.0,218.0,301.0,444.0,329.0,364.0,680.0,805.0,04170,34
3404290,"East Rutherford Borough School District, New Jersey",3850.0,190.0,255.0,142.0,266.0,68.0,83.0,92.0,102.0,100.0,92.0,511.0,540.0,329.0,475.0,302.0,303.0,04290,34
3404350,"Eastampton Township School District, New Jersey",2056.0,24.0,21.0,10.0,78.0,34.0,40.0,85.0,75.0,61.0,155.0,241.0,306.0,311.0,242.0,311.0,62.0,04350,34
3404410,"Eatontown Borough School District, New Jersey",5285.0,319.0,274.0,141.0,327.0,219.0,193.0,211.0,129.0,316.0,328.0,420.0,820.0,467.0,345.0,342.0,434.0,04410,34
3404530,"Egg Harbor City School District, New Jersey",1370.0,68.0,70.0,99.0,26.0,76.0,135.0,77.0,42.0,75.0,145.0,130.0,211.0,80.0,88.0,36.0,12.0,04530,34
3404620,"Elk Township School District, New Jersey",1396.0,30.0,28.0,55.0,94.0,103.0,64.0,58.0,27.0,10.0,78.0,91.0,175.0,164.0,62.0,221.0,136.0,04620,34
3405010,"Fairfield Township School District (Essex County), New Jersey",2534.0,0.0,48.0,52.0,88.0,71.0,144.0,18.0,67.0,65.0,174.0,136.0,354.0,228.0,236.0,352.0,501.0,05010,34
3404830,"Essex Fells Borough School District, New Jersey",735.0,3.0,3.0,11.0,9.0,3.0,6.0,27.0,0.0,3.0,31.0,58.0,61.0,33.0,45.0,71.0,371.0,04830,34
3404890,"Evesham Township School District, New Jersey",17357.0,485.0,327.0,438.0,435.0,522.0,458.0,381.0,507.0,366.0,1030.0,1728.0,2431.0,2141.0,1681.0,2128.0,2299.0,04890,34
3404950,"Fair Haven Borough School District, New Jersey",1889.0,10.0,34.0,28.0,40.0,42.0,25.0,8.0,8.0,59.0,46.0,25.0,173.0,182.0,169.0,348.0,692.0,04950,34
3405040,"Fairfield Township School District (Cumberland County), New Jersey",1749.0,141.0,87.0,106.0,85.0,79.0,84.0,78.0,98.0,76.0,172.0,172.0,195.0,172.0,94.0,72.0,38.0,05040,34
3405130,"Farmingdale Borough School District, New Jersey",577.0,28.0,46.0,31.0,31.0,25.0,57.0,4.0,14.0,21.0,36.0,64.0,68.0,64.0,44.0,9.0,35.0,05130,34
3405190,"Flemington-Raritan Regional School District, New Jersey",9882.0,379.0,220.0,284.0,344.0,179.0,213.0,128.0,309.0,356.0,506.0,735.0,942.0,1140.0,738.0,1552.0,1857.0,05190,34
3405250,"Florham Park Borough School District, New Jersey",4114.0,64.0,258.0,88.0,170.0,106.0,91.0,77.0,63.0,63.0,222.0,135.0,479.0,284.0,358.0,519.0,1137.0,05250,34
3405340,"Frankford Township School District, New Jersey",2315.0,82.0,32.0,59.0,67.0,77.0,44.0,70.0,89.0,66.0,151.0,284.0,294.0,371.0,204.0,233.0,192.0,05340,34
3405460,"Franklin Township School District (Hunterdon County), New Jersey",1159.0,25.0,14.0,12.0,36.0,25.0,28.0,38.0,25.0,26.0,60.0,105.0,127.0,145.0,106.0,114.0,273.0,05460,34
3405370,"Franklin Lakes Borough School District, New Jersey",3853.0,105.0,42.0,56.0,53.0,56.0,41.0,78.0,81.0,12.0,55.0,160.0,413.0,380.0,318.0,458.0,1545.0,05370,34
3405400,"Franklin Borough School District, New Jersey",1937.0,91.0,94.0,63.0,126.0,91.0,73.0,99.0,70.0,71.0,243.0,184.0,189.0,226.0,159.0,119.0,39.0,05400,34
3405430,"Franklin Township School District (Gloucester County), New Jersey",5735.0,253.0,107.0,199.0,194.0,240.0,172.0,157.0,248.0,106.0,379.0,553.0,821.0,874.0,536.0,614.0,282.0,05430,34
3405850,"Gibbsboro Borough School District, New Jersey",774.0,17.0,13.0,3.0,23.0,22.0,41.0,40.0,19.0,15.0,74.0,72.0,126.0,99.0,47.0,100.0,63.0,05850,34
3405670,"Frelinghuysen Township School District, New Jersey",777.0,16.0,9.0,18.0,7.0,18.0,27.0,8.0,8.0,21.0,73.0,66.0,79.0,111.0,80.0,105.0,131.0,05670,34
