geoid,name,universe,10_and_under,10_15,15_20,20_25,25_30,30_35,35_40,40_45,45_50,50_60,60_75,75_100,100_125,125_150,150_200,200_and_up,school district (elementary),state
0100195,"Pike Road City School District, Alabama",3152.0,74.0,66.0,58.0,82.0,116.0,21.0,69.0,12.0,101.0,181.0,326.0,413.0,600.0,410.0,397.0,226.0,00195,01
0199999,"Remainder of Alabama, Alabama",1853543.0,170576.0,121622.0,116215.0,112324.0,102474.0,100202.0,92070.0,88975.0,75969.0,149311.0,176263.0,206023.0,133018.0,76529.0,71351.0,60621.0,99999,01
0408550,"Toltec Elementary District, Arizona",5827.0,367.0,350.0,336.0,508.0,386.0,164.0,482.0,319.0,330.0,807.0,409.0,656.0,293.0,192.0,158.0,70.0,08550,04
0408640,"Topock Elementary District, Arizona",1023.0,28.0,115.0,101.0,53.0,153.0,17.0,137.0,100.0,89.0,51.0,64.0,0.0,56.0,0.0,59.0,0.0,08640,04
0408820,"Union Elementary District, Arizona",4383.0,197.0,88.0,127.0,105.0,215.0,152.0,267.0,244.0,150.0,507.0,777.0,706.0,394.0,228.0,128.0,98.0,08820,04
0408880,"Valentine Elementary District, Arizona",97.0,8.0,26.0,4.0,2.0,4.0,13.0,1.0,6.0,7.0,0.0,1.0,9.0,2.0,3.0,1.0,10.0,08880,04
0409030,"Walnut Grove Elementary District, Arizona",50.0,8.0,2.0,2.0,2.0,1.0,4.0,4.0,3.0,0.0,6.0,5.0,6.0,0.0,1.0,4.0,2.0,09030,04
0409060,"Washington Elementary District, Arizona",88394.0,7735.0,4948.0,5454.0,5963.0,5255.0,5226.0,4701.0,5586.0,3589.0,7851.0,8810.0,9642.0,5642.0,2701.0,2615.0,2676.0,09060,04
0409090,"Wellton Elementary District, Arizona",1767.0,152.0,90.0,35.0,104.0,163.0,56.0,70.0,121.0,150.0,192.0,278.0,192.0,129.0,10.0,15.0,10.0,09090,04
0409120,"Wenden Elementary District, Arizona",204.0,41.0,11.0,20.0,32.0,37.0,0.0,7.0,14.0,0.0,3.0,5.0,12.0,11.0,0.0,11.0,0.0,09120,04
0409360,"Williamson Valley Elementary School District, Arizona",286.0,18.0,14.0,8.0,4.0,33.0,16.0,34.0,12.0,7.0,29.0,16.0,26.0,14.0,31.0,5.0,19.0,09360,04
0409390,"Wilson Elementary District, Arizona",1035.0,186.0,96.0,119.0,155.0,87.0,74.0,35.0,30.0,62.0,53.0,42.0,48.0,10.0,18.0,15.0,5.0,09390,04
0409510,"Yarnell Elementary District, Arizona",637.0,80.0,45.0,59.0,45.0,42.0,27.0,48.0,32.0,29.0,72.0,60.0,47.0,10.0,3.0,29.0,9.0,09510,04
0409540,"Young Elementary School District, Arizona",335.0,37.0,24.0,13.0,32.0,18.0,25.0,22.0,18.0,24.0,25.0,37.0,53.0,5.0,0.0,2.0,0.0,09540,04
0409570,"Yucca Elementary District, Arizona",250.0,14.0,29.0,8.0,31.0,26.0,26.0,18.0,0.0,6.0,26.0,9.0,27.0,15.0,0.0,15.0,0.0,09570,04
0409600,"Yuma Elementary District, Arizona",40306.0,3159.0,2303.0,2559.0,2630.0,2663.0,2536.0,2305.0,2322.0,2105.0,3180.0,4166.0,4732.0,2660.0,1200.0,1186.0,600.0,09600,04
0499999,"Remainder of Arizona, Arizona",1687651.0,109483.0,75251.0,81040.0,83742.0,83276.0,82949.0,77660.0,82095.0,72005.0,139098.0,172622.0,213324.0,144810.0,87992.0,90737.0,91567.0,99999,04
0407920,"Sonoita Elementary District, Arizona",828.0,78.0,59.0,19.0,12.0,11.0,57.0,28.0,53.0,44.0,55.0,57.0,92.0,106.0,59.0,56.0,42.0,07920,04
0408130,"Stanfield Elementary District, Arizona",1341.0,272.0,73.0,176.0,40.0,71.0,161.0,42.0,47.0,54.0,47.0,137.0,147.0,25.0,16.0,33.0,0.0,08130,04
0408310,"Tempe School District, Arizona",58958.0,7512.0,3169.0,3032.0,3904.0,2705.0,3166.0,2987.0,3081.0,2382.0,5328.0,5940.0,6652.0,3811.0,2248.0,1859.0,1182.0,08310,04
0400022,"Vernon Elementary District, Arizona",669.0,24.0,31.0,17.0,12.0,48.0,26.0,20.0,35.0,37.0,103.0,112.0,106.0,84.0,14.0,0.0,0.0,00022,04
0400480,"Aguila Elementary District, Arizona",299.0,51.0,28.0,31.0,19.0,24.0,19.0,12.0,10.0,3.0,32.0,22.0,0.0,35.0,2.0,11.0,0.0,00480,04
0400004,"Clarkdale-Jerome Elementary District, Arizona",2079.0,303.0,147.0,152.0,87.0,135.0,52.0,48.0,141.0,228.0,120.0,258.0,96.0,61.0,135.0,54.0,62.0,00004,04
0400005,"Salome Consolidated Elementary District, Arizona",1244.0,101.0,128.0,48.0,92.0,81.0,33.0,140.0,117.0,31.0,94.0,131.0,207.0,35.0,6.0,0.0,0.0,00005,04
0400840,"Arlington Elementary District, Arizona",516.0,72.0,9.0,46.0,55.0,6.0,60.0,29.0,29.0,43.0,11.0,32.0,84.0,24.0,11.0,5.0,0.0,00840,04
0400600,"Alhambra Elementary District, Arizona",26414.0,3555.0,2598.0,2077.0,2648.0,2018.0,1671.0,1606.0,1338.0,1499.0,2229.0,2022.0,1659.0,703.0,556.0,153.0,82.0,00600,04
0400630,"Alpine Elementary District, Arizona",175.0,3.0,21.0,17.0,3.0,0.0,0.0,8.0,6.0,5.0,17.0,8.0,50.0,10.0,20.0,2.0,5.0,00630,04
0400750,"Apache Elementary District, Arizona",74.0,16.0,5.0,9.0,4.0,5.0,7.0,0.0,1.0,7.0,2.0,6.0,8.0,1.0,0.0,3.0,0.0,00750,04
0400870,"Ash Creek Elementary District, Arizona",316.0,59.0,22.0,18.0,23.0,17.0,27.0,10.0,15.0,30.0,16.0,35.0,17.0,18.0,7.0,2.0,0.0,00870,04
0400960,"Avondale Elementary District, Arizona",14687.0,1350.0,652.0,549.0,565.0,640.0,578.0,725.0,755.0,599.0,1397.0,1746.0,2094.0,1401.0,943.0,359.0,334.0,00960,04
0401050,"Balsz Elementary District, Arizona",13409.0,1050.0,779.0,875.0,876.0,1035.0,967.0,1023.0,836.0,790.0,1302.0,1502.0,1045.0,650.0,323.0,226.0,130.0,01050,04
0401080,"Beaver Creek Elementary District, Arizona",2206.0,204.0,202.0,122.0,47.0,116.0,148.0,330.0,78.0,26.0,287.0,182.0,302.0,59.0,8.0,95.0,0.0,01080,04
0401230,"Blue Elementary District, Arizona",30.0,0.0,10.0,0.0,0.0,2.0,6.0,0.0,2.0,0.0,4.0,0.0,4.0,0.0,0.0,2.0,0.0,01230,04
0401260,"Bonita Elementary District, Arizona",97.0,7.0,7.0,2.0,4.0,0.0,0.0,4.0,11.0,7.0,17.0,6.0,23.0,5.0,2.0,0.0,2.0,01260,04
0401290,"Bouse Elementary District, Arizona",519.0,30.0,57.0,31.0,27.0,17.0,29.0,25.0,15.0,28.0,88.0,47.0,69.0,27.0,3.0,26.0,0.0,01290,04
0401380,"Buckeye Elementary District, Arizona",10733.0,694.0,354.0,463.0,418.0,479.0,494.0,584.0,464.0,660.0,1403.0,1441.0,1625.0,816.0,520.0,176.0,142.0,01380,04
0401500,"Bullhead City School District, Arizona",17421.0,1432.0,1105.0,1107.0,1732.0,1289.0,1434.0,912.0,914.0,953.0,1572.0,1723.0,1587.0,760.0,373.0,276.0,252.0,01500,04
0401650,"Canon Elementary District, Arizona",1285.0,70.0,120.0,61.0,146.0,100.0,121.0,43.0,46.0,78.0,111.0,128.0,146.0,42.0,46.0,27.0,0.0,01650,04
0401680,"Cartwright Elementary District, Arizona",31782.0,3059.0,2271.0,2435.0,2411.0,2445.0,2140.0,2445.0,2192.0,1502.0,3039.0,2989.0,2681.0,1141.0,578.0,272.0,182.0,01680,04
0401710,"Casa Grande Elementary District, Arizona",21997.0,1880.0,1134.0,1105.0,1455.0,1260.0,1382.0,1276.0,998.0,1024.0,2089.0,2311.0,2635.0,1462.0,898.0,768.0,320.0,01710,04
0402190,"Concho Elementary District, Arizona",976.0,39.0,63.0,112.0,75.0,64.0,70.0,29.0,107.0,41.0,109.0,106.0,45.0,53.0,32.0,21.0,10.0,02190,04
0402220,"Congress Elementary District, Arizona",815.0,72.0,55.0,6.0,103.0,48.0,10.0,86.0,25.0,34.0,83.0,122.0,113.0,23.0,17.0,12.0,6.0,02220,04
0401920,"Chevelon Butte School District, Arizona",338.0,25.0,24.0,11.0,24.0,4.0,21.0,19.0,19.0,16.0,24.0,30.0,57.0,19.0,20.0,18.0,7.0,01920,04
0402130,"Cochise Elementary District, Arizona",128.0,12.0,20.0,3.0,2.0,13.0,11.0,4.0,1.0,5.0,3.0,22.0,7.0,12.0,6.0,5.0,2.0,02130,04
0402430,"Creighton Elementary District, Arizona",25585.0,2614.0,1661.0,1507.0,1796.0,1636.0,2004.0,1532.0,1648.0,1096.0,1857.0,2183.0,2333.0,1363.0,777.0,658.0,920.0,02430,04
0402250,"Continental Elementary District, Arizona",15707.0,556.0,741.0,808.0,895.0,910.0,968.0,865.0,1087.0,885.0,1401.0,1618.0,2282.0,1087.0,679.0,416.0,509.0,02250,04
0402370,"Cottonwood-Oak Creek Elementary District, Arizona",13232.0,1064.0,779.0,798.0,897.0,1137.0,681.0,735.0,710.0,658.0,1067.0,1669.0,1392.0,844.0,285.0,284.0,232.0,02370,04
0402400,"Crane Elementary District, Arizona",14614.0,999.0,780.0,757.0,825.0,998.0,722.0,735.0,595.0,633.0,1446.0,1388.0,1910.0,1138.0,653.0,425.0,610.0,02400,04
0402460,"Crown King Elementary District, Arizona",44.0,1.0,9.0,7.0,0.0,0.0,0.0,0.0,5.0,0.0,1.0,5.0,0.0,10.0,0.0,5.0,1.0,02460,04
0402490,"Double Adobe Elementary District, Arizona",201.0,23.0,32.0,9.0,6.0,12.0,6.0,12.0,4.0,24.0,11.0,27.0,12.0,6.0,9.0,3.0,5.0,02490,04
0402710,"Eagle Elementary District, Arizona",14.0,0.0,0.0,0.0,0.0,0.0,0.0,2.0,0.0,0.0,0.0,5.0,5.0,0.0,0.0,2.0,0.0,02710,04
0402760,"Elfrida Elementary District, Arizona",373.0,17.0,15.0,28.0,22.0,22.0,60.0,22.0,16.0,25.0,33.0,8.0,63.0,21.0,2.0,16.0,3.0,02760,04
0402790,"Eloy Elementary District, Arizona",1775.0,400.0,249.0,75.0,174.0,105.0,131.0,116.0,34.0,25.0,136.0,117.0,129.0,35.0,21.0,16.0,12.0,02790,04
0402820,"Empire Elementary District, Arizona",245.0,8.0,9.0,4.0,15.0,10.0,7.0,26.0,0.0,21.0,28.0,11.0,17.0,18.0,57.0,9.0,5.0,02820,04
0403060,"Fowler Elementary District, Arizona",9782.0,746.0,553.0,413.0,654.0,506.0,759.0,521.0,707.0,592.0,1102.0,1029.0,1025.0,601.0,412.0,76.0,86.0,03060,04
0403240,"Gadsden Elementary District, Arizona",8237.0,556.0,539.0,1010.0,574.0,808.0,865.0,329.0,626.0,408.0,828.0,878.0,354.0,209.0,88.0,106.0,59.0,03240,04
0403420,"Glendale Elementary District, Arizona",34050.0,4300.0,2642.0,2395.0,2703.0,2219.0,2083.0,2189.0,1902.0,1072.0,2707.0,3029.0,3283.0,1676.0,836.0,680.0,334.0,03420,04
0403660,"Hackberry School District, Arizona",533.0,40.0,32.0,23.0,39.0,54.0,31.0,33.0,33.0,59.0,56.0,74.0,33.0,18.0,4.0,4.0,0.0,03660,04
0403900,"Hyder Elementary District, Arizona",202.0,6.0,25.0,22.0,16.0,10.0,14.0,17.0,8.0,11.0,30.0,29.0,2.0,12.0,0.0,0.0,0.0,03900,04
0403960,"Isaac Elementary District, Arizona",11474.0,2238.0,1120.0,778.0,1037.0,855.0,765.0,646.0,470.0,510.0,721.0,920.0,758.0,322.0,176.0,136.0,22.0,03960,04
0404170,"Kirkland Elementary District, Arizona",487.0,49.0,12.0,44.0,36.0,65.0,47.0,41.0,20.0,10.0,32.0,49.0,32.0,24.0,15.0,6.0,5.0,04170,04
0404200,"Klondyke Elementary District, Arizona",22.0,2.0,4.0,0.0,2.0,2.0,0.0,4.0,0.0,2.0,2.0,1.0,1.0,2.0,0.0,0.0,0.0,04200,04
0404230,"Kyrene Elementary District, Arizona",61212.0,1925.0,1111.0,1137.0,1681.0,1465.0,1935.0,2034.0,2325.0,1940.0,4524.0,6589.0,8611.0,7528.0,5046.0,6566.0,6795.0,04230,04
0404290,"Laveen Elementary District, Arizona",13737.0,755.0,273.0,394.0,330.0,680.0,434.0,620.0,600.0,664.0,1286.0,1755.0,2301.0,1669.0,807.0,795.0,374.0,04290,04
0404320,"Liberty Elementary District, Arizona",8928.0,398.0,231.0,183.0,170.0,383.0,283.0,333.0,389.0,284.0,1067.0,1175.0,1477.0,1026.0,658.0,542.0,329.0,04320,04
0404380,"Litchfield Elementary District, Arizona",29269.0,918.0,644.0,646.0,632.0,1012.0,964.0,1017.0,1111.0,1019.0,2548.0,3004.0,4293.0,4224.0,2274.0,2708.0,2255.0,04380,04
0404440,"Littleton Elementary District, Arizona",12638.0,690.0,249.0,311.0,349.0,448.0,916.0,477.0,738.0,685.0,1459.0,1865.0,2370.0,965.0,452.0,512.0,152.0,04440,04
0404500,"Madison Elementary District, Arizona",28170.0,1891.0,1376.0,1163.0,1454.0,1027.0,1073.0,1367.0,1473.0,1025.0,1984.0,2699.0,3251.0,2319.0,1503.0,1583.0,2982.0,04500,04
0404530,"Maine Consolidated School District, Arizona",856.0,36.0,0.0,12.0,38.0,46.0,67.0,67.0,40.0,0.0,88.0,88.0,90.0,101.0,66.0,53.0,64.0,04530,04
0404770,"Altar Valley Elementary District, Arizona",2570.0,191.0,127.0,300.0,165.0,121.0,242.0,218.0,97.0,160.0,207.0,231.0,198.0,118.0,90.0,96.0,9.0,04770,04
0404860,"McNary Elementary District, Arizona",126.0,13.0,13.0,9.0,24.0,12.0,7.0,2.0,14.0,8.0,6.0,5.0,3.0,3.0,5.0,2.0,0.0,04860,04
0404920,"McNeal Elementary District, Arizona",183.0,11.0,14.0,8.0,12.0,18.0,0.0,6.0,19.0,17.0,13.0,42.0,4.0,11.0,0.0,8.0,0.0,04920,04
0405100,"Mobile Elementary District, Arizona",39.0,10.0,5.0,0.0,4.0,2.0,2.0,0.0,2.0,1.0,7.0,0.0,2.0,4.0,0.0,0.0,0.0,05100,04
0405190,"Mohave Valley Elementary District, Arizona",9566.0,662.0,576.0,474.0,750.0,801.0,620.0,486.0,697.0,596.0,979.0,881.0,944.0,529.0,164.0,226.0,181.0,05190,04
0405220,"Mohawk Valley Elementary District, Arizona",618.0,21.0,50.0,26.0,45.0,42.0,103.0,87.0,59.0,12.0,12.0,29.0,52.0,33.0,21.0,15.0,11.0,05220,04
0405340,"Morristown Elementary District, Arizona",735.0,62.0,73.0,72.0,66.0,31.0,47.0,45.0,48.0,39.0,65.0,48.0,69.0,30.0,11.0,12.0,17.0,05340,04
0405400,"Murphy Elementary District, Arizona",2479.0,574.0,242.0,146.0,289.0,233.0,152.0,140.0,106.0,77.0,186.0,139.0,85.0,28.0,31.0,25.0,26.0,05400,04
0405430,"Naco Elementary District, Arizona",462.0,64.0,37.0,39.0,45.0,31.0,23.0,28.0,14.0,23.0,22.0,55.0,58.0,10.0,0.0,8.0,5.0,05430,04
0405640,"Oracle Elementary District, Arizona",7410.0,275.0,226.0,106.0,330.0,267.0,392.0,341.0,376.0,345.0,631.0,1047.0,1222.0,753.0,323.0,488.0,288.0,05640,04
0405670,"Osborn Elementary District, Arizona",18209.0,1901.0,1158.0,1388.0,1091.0,835.0,924.0,914.0,1238.0,867.0,1476.0,1939.0,1683.0,1088.0,702.0,572.0,433.0,05670,04
0405730,"Owens-Whitney Elementary District, Arizona",282.0,24.0,19.0,22.0,16.0,3.0,26.0,7.0,8.0,4.0,13.0,60.0,28.0,37.0,15.0,0.0,0.0,05730,04
0405760,"Tonto Basin Elementary District, Arizona",940.0,113.0,127.0,105.0,92.0,57.0,62.0,42.0,36.0,36.0,106.0,18.0,73.0,0.0,73.0,0.0,0.0,05760,04
0405850,"Palo Verde Elementary District, Arizona",891.0,10.0,38.0,41.0,16.0,65.0,65.0,91.0,81.0,51.0,88.0,75.0,79.0,96.0,62.0,20.0,13.0,05850,04
0405880,"Palominas Elementary District, Arizona",4525.0,197.0,182.0,243.0,202.0,197.0,151.0,140.0,152.0,233.0,424.0,576.0,680.0,411.0,322.0,171.0,244.0,05880,04
0406000,"Patagonia Elementary District, Arizona",633.0,78.0,42.0,55.0,41.0,27.0,56.0,27.0,24.0,34.0,80.0,46.0,40.0,16.0,38.0,12.0,17.0,06000,04
0406150,"Pearce Elementary District, Arizona",1091.0,125.0,39.0,104.0,94.0,36.0,72.0,53.0,86.0,93.0,34.0,182.0,67.0,27.0,16.0,26.0,37.0,06150,04
0406210,"Pendergast Elementary District, Arizona",22321.0,1092.0,674.0,644.0,1176.0,803.0,1227.0,1207.0,1451.0,1027.0,2034.0,3243.0,3442.0,2084.0,954.0,1009.0,254.0,06210,04
0406300,"Phoenix Elementary District, Arizona",20659.0,3676.0,1785.0,1241.0,1331.0,1285.0,1303.0,903.0,883.0,759.0,1098.0,1728.0,1597.0,1102.0,564.0,644.0,760.0,06300,04
0406360,"Picacho Elementary District, Arizona",339.0,39.0,15.0,27.0,34.0,19.0,20.0,16.0,21.0,2.0,20.0,36.0,35.0,42.0,11.0,2.0,0.0,06360,04
0406510,"Pine Strawberry Elementary District, Arizona",1185.0,46.0,32.0,45.0,22.0,100.0,76.0,9.0,92.0,56.0,185.0,142.0,264.0,84.0,8.0,14.0,10.0,06510,04
0406930,"Redington Elementary District, Arizona",44.0,2.0,8.0,9.0,3.0,7.0,0.0,0.0,0.0,4.0,3.0,0.0,1.0,4.0,1.0,0.0,2.0,06930,04
0406630,"Pomerene Elementary District, Arizona",470.0,30.0,7.0,26.0,64.0,36.0,34.0,10.0,32.0,5.0,50.0,30.0,45.0,32.0,18.0,23.0,28.0,06630,04
0406780,"Quartzsite Elementary District, Arizona",2972.0,207.0,276.0,150.0,455.0,313.0,147.0,130.0,118.0,137.0,213.0,276.0,370.0,123.0,37.0,20.0,0.0,06780,04
0406900,"Red Rock Elementary District, Arizona",1275.0,90.0,22.0,35.0,35.0,50.0,83.0,49.0,24.0,85.0,150.0,146.0,256.0,90.0,120.0,28.0,12.0,06900,04
0407020,"Riverside Elementary District, Arizona",2287.0,217.0,94.0,103.0,24.0,246.0,145.0,159.0,57.0,145.0,325.0,275.0,222.0,131.0,85.0,59.0,0.0,07020,04
0407080,"Roosevelt Elementary District, Arizona",32955.0,2953.0,2174.0,1852.0,2082.0,1888.0,1925.0,1671.0,1723.0,1674.0,2798.0,2918.0,3690.0,2488.0,1323.0,1062.0,734.0,07080,04
0407140,"Rucker Elementary District, Arizona",13.0,4.0,0.0,0.0,0.0,0.0,0.0,0.0,3.0,0.0,0.0,0.0,4.0,2.0,0.0,0.0,0.0,07140,04
0407200,"Sacaton Elementary District, Arizona",1745.0,814.0,168.0,73.0,98.0,117.0,35.0,49.0,104.0,30.0,52.0,14.0,132.0,59.0,0.0,0.0,0.0,07200,04
0407380,"San Fernando Elementary District, Arizona",16.0,3.0,0.0,5.0,0.0,0.0,4.0,0.0,0.0,0.0,0.0,2.0,2.0,0.0,0.0,0.0,0.0,07380,04
0407500,"Santa Cruz Elementary District, Arizona",579.0,55.0,0.0,17.0,27.0,47.0,33.0,33.0,50.0,58.0,49.0,103.0,67.0,22.0,4.0,4.0,10.0,07500,04
0407680,"Sentinel Elementary District, Arizona",56.0,1.0,2.0,0.0,0.0,3.0,5.0,13.0,0.0,11.0,0.0,9.0,7.0,2.0,3.0,0.0,0.0,07680,04
0407770,"Skull Valley Elementary District, Arizona",213.0,4.0,7.0,19.0,14.0,39.0,0.0,12.0,7.0,12.0,18.0,16.0,18.0,23.0,14.0,3.0,7.0,07770,04
0407860,"Solomon Elementary District, Arizona",654.0,41.0,27.0,45.0,43.0,30.0,50.0,21.0,19.0,53.0,38.0,118.0,88.0,40.0,14.0,27.0,0.0,07860,04
0407890,"Somerton Elementary District, Arizona",5926.0,737.0,625.0,439.0,405.0,271.0,446.0,316.0,295.0,65.0,554.0,619.0,602.0,273.0,95.0,83.0,101.0,07890,04
0408430,"Paloma School District, Arizona",57.0,2.0,0.0,6.0,9.0,6.0,11.0,12.0,4.0,0.0,7.0,0.0,0.0,0.0,0.0,0.0,0.0,08430,04
0408460,"Hillside Elementary District, Arizona",41.0,3.0,0.0,0.0,0.0,0.0,7.0,0.0,10.0,5.0,0.0,5.0,8.0,0.0,0.0,0.0,3.0,08460,04
0408490,"Tolleson Elementary District, Arizona",4777.0,322.0,171.0,268.0,262.0,301.0,285.0,228.0,374.0,194.0,479.0,610.0,619.0,371.0,181.0,77.0,35.0,08490,04
0612810,"Enterprise Elementary School District, California",12459.0,814.0,739.0,879.0,894.0,902.0,788.0,837.0,638.0,617.0,949.0,1273.0,1428.0,736.0,254.0,417.0,294.0,12810,06
0612960,"Etiwanda Elementary School District, California",26558.0,585.0,202.0,551.0,385.0,484.0,275.0,581.0,524.0,700.0,1525.0,2201.0,4809.0,3892.0,2719.0,4079.0,3046.0,12960,06
0612690,"Empire Union Elementary School District, California",8703.0,384.0,638.0,416.0,299.0,365.0,571.0,485.0,504.0,436.0,756.0,939.0,1194.0,720.0,407.0,393.0,196.0,12690,06
0612750,"Encinitas Union Elementary School District, California",28145.0,1182.0,604.0,549.0,875.0,751.0,744.0,536.0,529.0,764.0,1526.0,2058.0,2919.0,2693.0,2282.0,3565.0,6568.0,12750,06
0613080,"Eureka Union Elementary School District, California",10242.0,295.0,329.0,241.0,146.0,184.0,251.0,271.0,203.0,251.0,448.0,1039.0,1081.0,1008.0,948.0,1371.0,2176.0,13080,06
0613140,"Evergreen Elementary School District, California",28657.0,708.0,783.0,511.0,493.0,532.0,654.0,608.0,595.0,535.0,1364.0,2060.0,2942.0,3137.0,2634.0,4046.0,7055.0,13140,06
0613170,"Evergreen Union Elementary School District, California",3626.0,181.0,197.0,239.0,188.0,230.0,203.0,212.0,97.0,99.0,360.0,356.0,460.0,349.0,125.0,141.0,189.0,13170,06
0613290,"Fairfax Elementary School District, California",3713.0,242.0,421.0,46.0,170.0,268.0,233.0,288.0,279.0,237.0,245.0,404.0,544.0,145.0,22.0,85.0,84.0,13290,06
0613500,"Fallbrook Union Elementary School District, California",16739.0,795.0,555.0,309.0,1093.0,1086.0,817.0,804.0,818.0,831.0,1539.0,1638.0,1658.0,1483.0,1008.0,1085.0,1220.0,13500,06
0613710,"Feather Falls Union Elementary School District, California",165.0,15.0,28.0,14.0,20.0,13.0,5.0,16.0,4.0,7.0,4.0,8.0,11.0,9.0,7.0,2.0,2.0,13710,06
0613740,"Fieldbrook Elementary School District, California",329.0,13.0,11.0,9.0,15.0,13.0,19.0,15.0,10.0,13.0,32.0,38.0,47.0,28.0,25.0,22.0,19.0,13740,06
0613860,"Flournoy Union Elementary School District, California",118.0,6.0,14.0,9.0,6.0,1.0,9.0,1.0,10.0,1.0,7.0,8.0,19.0,20.0,5.0,2.0,0.0,13860,06
0613980,"Foresthill Union Elementary School District, California",2609.0,246.0,138.0,96.0,67.0,14.0,50.0,88.0,60.0,63.0,205.0,212.0,380.0,385.0,314.0,193.0,98.0,13980,06
0614010,"Forestville Union Elementary School District, California",3304.0,198.0,149.0,134.0,110.0,33.0,241.0,121.0,132.0,161.0,293.0,386.0,436.0,181.0,213.0,235.0,281.0,14010,06
0614040,"Forks of Salmon Elementary School District, California",70.0,16.0,8.0,5.0,5.0,8.0,4.0,3.0,10.0,1.0,0.0,2.0,3.0,5.0,0.0,0.0,0.0,14040,06
0614130,"Fort Ross Elementary School District, California",234.0,21.0,10.0,11.0,12.0,5.0,34.0,15.0,7.0,0.0,18.0,10.0,22.0,36.0,9.0,19.0,5.0,14130,06
0614220,"Fountain Valley Elementary School District, California",18585.0,592.0,435.0,541.0,683.0,581.0,535.0,428.0,523.0,587.0,1056.0,1493.0,2778.0,2520.0,1458.0,2279.0,2096.0,14220,06
0614340,"Franklin Elementary School District, California",963.0,56.0,48.0,40.0,27.0,0.0,28.0,18.0,31.0,49.0,81.0,100.0,125.0,102.0,97.0,38.0,123.0,14340,06
0614370,"Franklin-McKinley Elementary School District, California",25948.0,1035.0,1386.0,1129.0,1310.0,1025.0,1099.0,900.0,1076.0,1057.0,1741.0,2606.0,3176.0,2519.0,1773.0,2261.0,1855.0,14370,06
0614490,"French Gulch-Whiskeytown Elementary School District, California",248.0,27.0,11.0,16.0,17.0,28.0,14.0,13.0,9.0,14.0,32.0,26.0,20.0,16.0,2.0,1.0,2.0,14490,06
0614520,"Freshwater Elementary School District, California",1069.0,57.0,83.0,75.0,87.0,73.0,58.0,22.0,48.0,39.0,103.0,70.0,169.0,70.0,49.0,9.0,57.0,14520,06
0614700,"Fruitvale Elementary School District, California",7493.0,333.0,307.0,143.0,234.0,233.0,121.0,271.0,233.0,270.0,590.0,1033.0,1354.0,950.0,583.0,449.0,389.0,14700,06
0614730,"Fullerton Elementary School District, California",38694.0,2090.0,1391.0,1303.0,1506.0,1010.0,1355.0,1422.0,1374.0,1442.0,2923.0,4017.0,5280.0,3548.0,2862.0,3151.0,4020.0,14730,06
0614790,"Galt Joint Union Elementary School District, California",9490.0,434.0,417.0,412.0,323.0,482.0,409.0,285.0,404.0,357.0,659.0,1171.0,1351.0,1098.0,655.0,624.0,409.0,14790,06
0614910,"Garfield Elementary School District, California",145.0,0.0,0.0,0.0,1.0,4.0,10.0,9.0,5.0,1.0,12.0,28.0,24.0,18.0,15.0,8.0,10.0,14910,06
0614940,"Garvey Elementary School District, California",14568.0,744.0,1041.0,1096.0,1101.0,809.0,706.0,671.0,904.0,757.0,1172.0,1400.0,1402.0,1152.0,521.0,505.0,587.0,14940,06
0614970,"Gazelle Union Elementary School District, California",96.0,6.0,12.0,7.0,5.0,5.0,3.0,10.0,4.0,4.0,7.0,9.0,6.0,14.0,1.0,3.0,0.0,14970,06
0615000,"General Shafter Elementary School District, California",319.0,5.0,15.0,11.0,7.0,12.0,20.0,67.0,5.0,5.0,30.0,27.0,40.0,21.0,17.0,17.0,20.0,15000,06
0615090,"Gerber Union Elementary School District, California",1204.0,114.0,78.0,110.0,57.0,96.0,78.0,74.0,42.0,68.0,144.0,89.0,102.0,80.0,39.0,21.0,12.0,15090,06
0615390,"Gold Oak Union Elementary School District, California",3232.0,172.0,75.0,52.0,111.0,148.0,112.0,59.0,184.0,148.0,201.0,461.0,504.0,386.0,255.0,195.0,169.0,15390,06
0615450,"Gold Trail Union Elementary School District, California",2286.0,80.0,103.0,53.0,73.0,145.0,92.0,70.0,57.0,44.0,110.0,192.0,310.0,246.0,201.0,248.0,262.0,15450,06
0615480,"Golden Feather Union Elementary School District, California",1236.0,92.0,119.0,104.0,103.0,20.0,59.0,51.0,95.0,48.0,80.0,126.0,107.0,55.0,53.0,62.0,62.0,15480,06
0615510,"Goleta Union Elementary School District, California",23573.0,1860.0,911.0,774.0,995.0,662.0,734.0,922.0,724.0,697.0,1267.0,1748.0,2908.0,2363.0,1927.0,2433.0,2648.0,15510,06
0615600,"Gorman Elementary School District, California",31.0,2.0,1.0,0.0,0.0,1.0,0.0,0.0,0.0,2.0,0.0,9.0,13.0,0.0,2.0,1.0,0.0,15600,06
0615690,"Grant Elementary School District, California",1006.0,19.0,60.0,21.0,38.0,23.0,43.0,48.0,33.0,8.0,49.0,90.0,101.0,154.0,94.0,93.0,132.0,15690,06
0615780,"Grass Valley Elementary School District, California",10941.0,736.0,873.0,742.0,797.0,726.0,502.0,569.0,511.0,502.0,839.0,901.0,943.0,958.0,477.0,481.0,384.0,15780,06
0615810,"Gratton Elementary School District, California",191.0,10.0,0.0,14.0,7.0,8.0,13.0,3.0,3.0,19.0,13.0,11.0,15.0,16.0,14.0,14.0,31.0,15810,06
0615840,"Gravenstein Union Elementary School District, California",2420.0,46.0,101.0,105.0,104.0,20.0,91.0,35.0,81.0,55.0,199.0,236.0,356.0,301.0,196.0,309.0,185.0,15840,06
0615870,"Graves Elementary School District, California",31.0,0.0,0.0,7.0,0.0,0.0,6.0,1.0,4.0,0.0,0.0,5.0,3.0,2.0,2.0,1.0,0.0,15870,06
0615990,"Green Point Elementary School District, California",85.0,3.0,9.0,2.0,5.0,4.0,5.0,10.0,0.0,0.0,6.0,6.0,11.0,5.0,0.0,17.0,2.0,15990,06
0616320,"Guerneville Elementary School District, California",2562.0,148.0,251.0,197.0,158.0,89.0,68.0,212.0,54.0,59.0,227.0,272.0,226.0,271.0,74.0,157.0,99.0,16320,06
0616110,"Grenada Elementary School District, California",498.0,37.0,36.0,29.0,19.0,49.0,24.0,36.0,16.0,20.0,40.0,42.0,81.0,30.0,12.0,15.0,12.0,16110,06
0616260,"Guadalupe Union Elementary School District, California",1953.0,72.0,108.0,82.0,92.0,137.0,179.0,180.0,147.0,220.0,94.0,152.0,133.0,248.0,48.0,30.0,31.0,16260,06
0616300,"Cucamonga Elementary School District, California",10512.0,562.0,443.0,484.0,326.0,365.0,641.0,628.0,565.0,369.0,989.0,1290.0,1685.0,868.0,479.0,608.0,210.0,16300,06
0620790,"Lakeside Union Elementary School District (San Diego County), California",14597.0,578.0,467.0,720.0,565.0,433.0,480.0,333.0,701.0,558.0,1278.0,1539.0,2506.0,1593.0,1022.0,824.0,1000.0,20790,06
0620850,"Lamont Elementary School District, California",3958.0,215.0,320.0,421.0,346.0,289.0,186.0,295.0,315.0,282.0,270.0,499.0,240.0,168.0,44.0,53.0,15.0,20850,06
0620880,"Lancaster Elementary School District, California",37010.0,5511.0,2071.0,1496.0,1535.0,1375.0,2125.0,2062.0,1668.0,2144.0,2994.0,4016.0,4004.0,2515.0,1251.0,1395.0,848.0,20880,06
0620910,"Larkspur Elementary School District, California",5942.0,210.0,140.0,201.0,328.0,99.0,147.0,187.0,112.0,42.0,257.0,358.0,598.0,399.0,527.0,549.0,1788.0,20910,06
0621090,"Lassen View Union Elementary School District, California",1081.0,132.0,31.0,90.0,57.0,74.0,43.0,37.0,45.0,40.0,67.0,52.0,156.0,99.0,49.0,62.0,47.0,21090,06
0621180,"Latrobe Elementary School District, California",1273.0,25.0,15.0,19.0,65.0,33.0,45.0,43.0,22.0,19.0,70.0,56.0,146.0,163.0,121.0,251.0,180.0,21180,06
0621210,"Lawndale Elementary School District, California",14752.0,663.0,600.0,476.0,542.0,757.0,908.0,696.0,705.0,771.0,1471.0,1406.0,2265.0,1420.0,947.0,696.0,429.0,21210,06
0621240,"Le Grand Union Elementary School District, California",620.0,20.0,58.0,41.0,38.0,43.0,7.0,10.0,65.0,48.0,54.0,64.0,49.0,48.0,44.0,21.0,10.0,21240,06
0621330,"Lemon Grove Elementary School District, California",11147.0,396.0,583.0,487.0,460.0,615.0,672.0,543.0,485.0,596.0,692.0,1211.0,1887.0,1193.0,743.0,409.0,175.0,21330,06
0621360,"Lemoore Union Elementary School District, California",9235.0,239.0,450.0,484.0,576.0,451.0,391.0,503.0,636.0,440.0,780.0,1099.0,1194.0,839.0,488.0,465.0,200.0,21360,06
0621420,"Lennox Elementary School District, California",6732.0,282.0,411.0,473.0,791.0,432.0,555.0,325.0,424.0,261.0,632.0,750.0,634.0,335.0,239.0,110.0,78.0,21420,06
0621480,"Lewiston Elementary School District, California",748.0,35.0,80.0,57.0,66.0,24.0,114.0,20.0,53.0,12.0,34.0,88.0,53.0,58.0,21.0,28.0,5.0,21480,06
0621540,"Liberty Elementary School District (Sonoma County), California",844.0,30.0,22.0,27.0,22.0,17.0,27.0,17.0,16.0,16.0,61.0,106.0,145.0,66.0,56.0,107.0,109.0,21540,06
0621570,"Liberty Elementary School District (Tulare County), California",791.0,26.0,45.0,61.0,75.0,50.0,50.0,61.0,12.0,15.0,85.0,121.0,47.0,27.0,33.0,66.0,17.0,21570,06
