geoid,name,universe,urban area
63703,"Northfield, VT Urban Cluster (2010)",50.0,63703
63784,"North Manchester, IN Urban Cluster (2010)",0.0,63784
63811,"North Platte, NE Urban Cluster (2010)",204.0,63811
63838,"North Port--Port Charlotte, FL Urbanized Area (2010)",1219.0,63838
63851,"North Shore, CA Urban Cluster (2010)",0.0,63851
63865,"North Vernon, IN Urban Cluster (2010)",63.0,63865
63892,"North Webster, IN Urban Cluster (2010)",61.0,63892
63946,"North Wilkesboro--Wilkesboro, NC Urban Cluster (2010)",235.0,63946
64000,"Norton, KS Urban Cluster (2010)",4.0,64000
64027,"Norton--Wise, VA Urban Cluster (2010)",57.0,64027
64054,"Norwalk, OH Urban Cluster (2010)",99.0,64054
64108,"Norwich, NY Urban Cluster (2010)",122.0,64108
64135,"Norwich--New London, CT--RI Urbanized Area (2010)",5384.0,64135
64189,"Norwood Young America, MN Urban Cluster (2010)",59.0,64189
64216,"Nowata, OK Urban Cluster (2010)",931.0,64216
64243,"Nyssa, OR Urban Cluster (2010)",12.0,64243
64297,"Oakdale, LA Urban Cluster (2010)",314.0,64297
64351,"Oak Harbor, OH Urban Cluster (2010)",0.0,64351
64378,"Oak Harbor, WA Urban Cluster (2010)",1125.0,64378
64432,"Oakhurst, CA Urban Cluster (2010)",38.0,64432
64459,"Oak Island, NC Urban Cluster (2010)",109.0,64459
64475,"Oakland, TN Urban Cluster (2010)",5.0,64475
64486,"Oakland City, IN Urban Cluster (2010)",12.0,64486
64513,"Oakridge, OR Urban Cluster (2010)",274.0,64513
64550,"Oberlin, OH Urban Cluster (2010)",233.0,64550
64567,"Ocala, FL Urbanized Area (2010)",1306.0,64567
64577,"Ocala Estates, FL Urban Cluster (2010)",0.0,64577
64594,"Oceana, WV Urban Cluster (2010)",0.0,64594
64648,"Ocean Park, WA Urban Cluster (2010)",194.0,64648
64660,"Ocean Pines, MD--DE Urban Cluster (2010)",223.0,64660
64675,"Ocean Shores, WA Urban Cluster (2010)",264.0,64675
64702,"Ocean View, DE Urban Cluster (2010)",40.0,64702
64729,"Ocilla, GA Urban Cluster (2010)",0.0,64729
64756,"Oconto, WI Urban Cluster (2010)",71.0,64756
64783,"Oconto Falls, WI Urban Cluster (2010)",107.0,64783
64810,"Odem, TX Urban Cluster (2010)",5.0,64810
64837,"Odessa, MO Urban Cluster (2010)",12.0,64837
64864,"Odessa, TX Urbanized Area (2010)",2090.0,64864
64891,"Oelwein, IA Urban Cluster (2010)",57.0,64891
64918,"Ogallala, NE Urban Cluster (2010)",60.0,64918
64945,"Ogden--Layton, UT Urbanized Area (2010)",7928.0,64945
64972,"Ogdensburg, NY Urban Cluster (2010)",184.0,64972
64999,"Oil City, PA Urban Cluster (2010)",171.0,64999
65026,"Okeechobee--Taylor Creek, FL Urban Cluster (2010)",455.0,65026
65053,"Okemah, OK Urban Cluster (2010)",923.0,65053
65080,"Oklahoma City, OK Urbanized Area (2010)",64587.0,65080
65107,"Okmulgee, OK Urban Cluster (2010)",3828.0,65107
65161,"Olean, NY Urban Cluster (2010)",245.0,65161
65188,"Olney, IL Urban Cluster (2010)",71.0,65188
65215,"Olney, TX Urban Cluster (2010)",5.0,65215
65242,"Olympia--Lacey, WA Urbanized Area (2010)",5191.0,65242
65269,"Omaha, NE--IA Urbanized Area (2010)",10427.0,65269
65296,"Omak, WA Urban Cluster (2010)",994.0,65296
65323,"Omro, WI Urban Cluster (2010)",0.0,65323
65338,"Onalaska, TX Urban Cluster (2010)",33.0,65338
65350,"Onawa, IA Urban Cluster (2010)",261.0,65350
65404,"Oneida, NY Urban Cluster (2010)",344.0,65404
65431,"Oneida, TN Urban Cluster (2010)",36.0,65431
65458,"O'Neill, NE Urban Cluster (2010)",69.0,65458
65485,"Oneonta, AL Urban Cluster (2010)",65.0,65485
65512,"Oneonta, NY Urban Cluster (2010)",138.0,65512
65539,"Ontario, OR--ID Urban Cluster (2010)",700.0,65539
65566,"Oostburg, WI Urban Cluster (2010)",0.0,65566
65593,"Opelousas, LA Urban Cluster (2010)",98.0,65593
65620,"Opp, AL Urban Cluster (2010)",60.0,65620
65674,"Orange, VA Urban Cluster (2010)",12.0,65674
65701,"Orangeburg, SC Urban Cluster (2010)",285.0,65701
65728,"Orange City, IA Urban Cluster (2010)",7.0,65728
65755,"Orange Cove, CA Urban Cluster (2010)",148.0,65755
65767,"Orangetree, FL Urban Cluster (2010)",0.0,65767
65782,"Oregon, IL Urban Cluster (2010)",27.0,65782
65809,"Oregon, WI Urban Cluster (2010)",75.0,65809
65836,"Orland, CA Urban Cluster (2010)",86.0,65836
65863,"Orlando, FL Urbanized Area (2010)",13963.0,65863
65890,"Orofino, ID Urban Cluster (2010)",161.0,65890
65917,"Orosi, CA Urban Cluster (2010)",165.0,65917
65944,"Oroville, CA Urban Cluster (2010)",2998.0,65944
65971,"Orrville, OH Urban Cluster (2010)",230.0,65971
66025,"Orwigsburg, PA Urban Cluster (2010)",7.0,66025
66052,"Osage, IA Urban Cluster (2010)",37.0,66052
66060,"Osage Beach, MO Urban Cluster (2010)",115.0,66060
66068,"Osage City, KS Urban Cluster (2010)",42.0,66068
66079,"Osawatomie, KS Urban Cluster (2010)",26.0,66079
66093,"Osburn, ID Urban Cluster (2010)",86.0,66093
66106,"Osceola, AR Urban Cluster (2010)",31.0,66106
66133,"Osceola, IA Urban Cluster (2010)",131.0,66133
66134,"Osceola, WI Urban Cluster (2010)",9.0,66134
66160,"Oshkosh, WI Urbanized Area (2010)",347.0,66160
66187,"Oskaloosa, IA Urban Cluster (2010)",85.0,66187
66214,"Ossian, IN Urban Cluster (2010)",29.0,66214
66241,"Oswego, NY Urban Cluster (2010)",479.0,66241
66268,"Othello, WA Urban Cluster (2010)",417.0,66268
66276,"Otisville, NY Urban Cluster (2010)",33.0,66276
66285,"Otsego--Plainwell, MI Urban Cluster (2010)",304.0,66285
66295,"Ottawa, IL Urban Cluster (2010)",126.0,66295
66322,"Ottawa, KS Urban Cluster (2010)",117.0,66322
66349,"Ottawa, OH Urban Cluster (2010)",6.0,66349
66376,"Ottumwa, IA Urban Cluster (2010)",173.0,66376
66430,"Owatonna, MN Urban Cluster (2010)",165.0,66430
66457,"Owego, NY Urban Cluster (2010)",39.0,66457
66484,"Owensboro, KY Urbanized Area (2010)",383.0,66484
66511,"Owensville, MO Urban Cluster (2010)",10.0,66511
66538,"Owosso, MI Urban Cluster (2010)",270.0,66538
66565,"Oxford, MS Urban Cluster (2010)",57.0,66565
66592,"Oxford, NC Urban Cluster (2010)",132.0,66592
66619,"Oxford, OH Urban Cluster (2010)",109.0,66619
66673,"Oxnard, CA Urbanized Area (2010)",9401.0,66673
66690,"Ozark, AL Urban Cluster (2010)",264.0,66690
66700,"Ozark, AR Urban Cluster (2010)",64.0,66700
66727,"Ozona, TX Urban Cluster (2010)",0.0,66727
66740,"Pacific, MO Urban Cluster (2010)",100.0,66740
66754,"Paden City, WV Urban Cluster (2010)",20.0,66754
66781,"Paducah, KY--IL Urban Cluster (2010)",483.0,66781
66808,"Page, AZ Urban Cluster (2010)",3723.0,66808
66835,"Pageland, SC Urban Cluster (2010)",73.0,66835
66889,"Pagosa Springs, CO Urban Cluster (2010)",54.0,66889
66916,"Pahokee, FL Urban Cluster (2010)",22.0,66916
66943,"Pahrump, NV Urban Cluster (2010)",393.0,66943
66997,"Paintsville, KY Urban Cluster (2010)",12.0,66997
67024,"Palacios, TX Urban Cluster (2010)",1.0,67024
67051,"Palatka, FL Urban Cluster (2010)",365.0,67051
67078,"Palestine, TX Urban Cluster (2010)",172.0,67078
67105,"Palm Bay--Melbourne, FL Urbanized Area (2010)",4527.0,67105
67134,"Palm Coast--Daytona Beach--Port Orange, FL Urbanized Area (2010)",3132.0,67134
67213,"Palmyra, MO Urban Cluster (2010)",19.0,67213
67223,"Palmyra, NY Urban Cluster (2010)",36.0,67223
67231,"Paloma Creek South--Paloma Creek, TX Urban Cluster (2010)",240.0,67231
67240,"Pampa, TX Urban Cluster (2010)",511.0,67240
67267,"Pana, IL Urban Cluster (2010)",16.0,67267
67294,"Panama City, FL Urbanized Area (2010)",2247.0,67294
67305,"Panama City Northeast, FL Urban Cluster (2010)",10.0,67305
67321,"Paola, KS Urban Cluster (2010)",36.0,67321
67348,"Paoli, IN Urban Cluster (2010)",18.0,67348
67375,"Paradise, CA Urban Cluster (2010)",1366.0,67375
67402,"Paragould, AR Urban Cluster (2010)",312.0,67402
67456,"Paris, AR Urban Cluster (2010)",70.0,67456
67483,"Paris, IL Urban Cluster (2010)",0.0,67483
67510,"Paris, KY Urban Cluster (2010)",25.0,67510
67537,"Paris, TN Urban Cluster (2010)",79.0,67537
67564,"Paris, TX Urban Cluster (2010)",755.0,67564
67618,"Park City, UT Urban Cluster (2010)",96.0,67618
67645,"Parker, AZ--CA Urban Cluster (2010)",1244.0,67645
67672,"Parkersburg, WV--OH Urbanized Area (2010)",552.0,67672
67726,"Park Rapids, MN Urban Cluster (2010)",189.0,67726
67753,"Parlier, CA Urban Cluster (2010)",40.0,67753
67765,"Parowan, UT Urban Cluster (2010)",68.0,67765
67780,"Parsons, KS Urban Cluster (2010)",315.0,67780
67807,"Pascagoula, MS Urbanized Area (2010)",478.0,67807
67861,"Patterson, CA Urban Cluster (2010)",360.0,67861
67882,"Patton, PA Urban Cluster (2010)",6.0,67882
67915,"Paulding, OH Urban Cluster (2010)",30.0,67915
67942,"Pauls Valley, OK Urban Cluster (2010)",680.0,67942
67969,"Pawhuska, OK Urban Cluster (2010)",1307.0,67969
67996,"Pawleys Island, SC Urban Cluster (2010)",100.0,67996
68050,"Pawnee, IL Urban Cluster (2010)",5.0,68050
68077,"Paw Paw, MI Urban Cluster (2010)",163.0,68077
68106,"Paw Paw Lake--Hartford, MI Urban Cluster (2010)",552.0,68106
68131,"Paxton, IL Urban Cluster (2010)",9.0,68131
68158,"Payson, AZ Urban Cluster (2010)",533.0,68158
68171,"Peaceful Valley, WA Urban Cluster (2010)",43.0,68171
68196,"Pearisburg, VA Urban Cluster (2010)",0.0,68196
68212,"Pearsall, TX Urban Cluster (2010)",48.0,68212
68228,"Pecan Acres, TX Urban Cluster (2010)",100.0,68228
68239,"Pecan Plantation, TX Urban Cluster (2010)",37.0,68239
68266,"Pecos, TX Urban Cluster (2010)",202.0,68266
68320,"Pelham, GA Urban Cluster (2010)",0.0,68320
68347,"Pella, IA Urban Cluster (2010)",0.0,68347
68374,"Pell City, AL Urban Cluster (2010)",79.0,68374
68401,"Pembroke, NC Urban Cluster (2010)",3623.0,68401
68428,"Pendleton, OR Urban Cluster (2010)",1012.0,68428
68455,"Penn Yan, NY Urban Cluster (2010)",18.0,68455
68482,"Pensacola, FL--AL Urbanized Area (2010)",7639.0,68482
68509,"Peoria, IL Urbanized Area (2010)",2329.0,68509
68536,"Peotone, IL Urban Cluster (2010)",31.0,68536
68572,"Perham, MN Urban Cluster (2010)",60.0,68572
68590,"Perry, FL Urban Cluster (2010)",57.0,68590
68644,"Perry, IA Urban Cluster (2010)",27.0,68644
68671,"Perry, MI Urban Cluster (2010)",22.0,68671
68698,"Perry, NY Urban Cluster (2010)",10.0,68698
68725,"Perry, OK Urban Cluster (2010)",298.0,68725
68752,"Perryton, TX Urban Cluster (2010)",316.0,68752
68779,"Perryville, MO Urban Cluster (2010)",101.0,68779
68806,"Peru, IN Urban Cluster (2010)",194.0,68806
68833,"Peru--LaSalle, IL Urban Cluster (2010)",112.0,68833
68860,"Peshtigo, WI Urban Cluster (2010)",97.0,68860
68887,"Petaluma, CA Urbanized Area (2010)",913.0,68887
68900,"Peterborough, NH Urban Cluster (2010)",6.0,68900
68941,"Petersburg, IL Urban Cluster (2010)",40.0,68941
68995,"Petersburg, WV Urban Cluster (2010)",20.0,68995
69022,"Petoskey, MI Urban Cluster (2010)",561.0,69022
69034,"Phelan, CA Urban Cluster (2010)",141.0,69034
69049,"Philadelphia, MS Urban Cluster (2010)",523.0,69049
69076,"Philadelphia, PA--NJ--DE--MD Urbanized Area (2010)",45704.0,69076
69103,"Philippi, WV Urban Cluster (2010)",111.0,69103
69130,"Philipsburg, PA Urban Cluster (2010)",49.0,69130
69157,"Phillipsburg, KS Urban Cluster (2010)",16.0,69157
69184,"Phoenix--Mesa, AZ Urbanized Area (2010)",106883.0,69184
69211,"Picayune, MS Urban Cluster (2010)",169.0,69211
69238,"Picture Rocks, AZ Urban Cluster (2010)",268.0,69238
69265,"Piedmont, AL Urban Cluster (2010)",20.0,69265
69292,"Pierre, SD Urban Cluster (2010)",2311.0,69292
69319,"Pierre Part, LA Urban Cluster (2010)",87.0,69319
69346,"Piggott, AR Urban Cluster (2010)",50.0,69346
69373,"Pikeville, KY Urban Cluster (2010)",60.0,69373
69400,"Pilot Point, TX Urban Cluster (2010)",119.0,69400
69427,"Pinckneyville, IL Urban Cluster (2010)",24.0,69427
69454,"Pine Bluff, AR Urbanized Area (2010)",165.0,69454
69481,"Pine City, MN Urban Cluster (2010)",19.0,69481
69508,"Pine Grove, PA Urban Cluster (2010)",0.0,69508
69517,"Pinehurst--Southern Pines, NC Urban Cluster (2010)",671.0,69517
69526,"Pine Island, MN Urban Cluster (2010)",0.0,69526
69535,"Pine Ridge, SD Urban Cluster (2010)",2770.0,69535
69589,"Pipestone, MN Urban Cluster (2010)",187.0,69589
69616,"Piqua, OH Urban Cluster (2010)",86.0,69616
69632,"Pittsboro, NC Urban Cluster (2010)",36.0,69632
69643,"Pittsburg, KS Urban Cluster (2010)",565.0,69643
69670,"Pittsburg, TX Urban Cluster (2010)",15.0,69670
69697,"Pittsburgh, PA Urbanized Area (2010)",12440.0,69697
69724,"Pittsfield, IL Urban Cluster (2010)",4.0,69724
69751,"Pittsfield, ME Urban Cluster (2010)",22.0,69751
69778,"Pittsfield, MA Urbanized Area (2010)",569.0,69778
69832,"Placerville--Diamond Springs, CA Urban Cluster (2010)",721.0,69832
69886,"Plain City, OH Urban Cluster (2010)",11.0,69886
69940,"Plainview, MN Urban Cluster (2010)",20.0,69940
69967,"Plainview, TX Urban Cluster (2010)",989.0,69967
70021,"Planada, CA Urban Cluster (2010)",9.0,70021
70102,"Platte City, MO Urban Cluster (2010)",83.0,70102
70129,"Platteville, WI Urban Cluster (2010)",73.0,70129
70156,"Plattsburgh, NY Urban Cluster (2010)",320.0,70156
70183,"Plattsmouth, NE Urban Cluster (2010)",18.0,70183
70210,"Pleasant Hill, MO Urban Cluster (2010)",29.0,70210
70237,"Pleasanton, TX Urban Cluster (2010)",223.0,70237
70270,"Pleasant View, TN Urban Cluster (2010)",52.0,70270
70280,"Plumas Lake, CA Urban Cluster (2010)",155.0,70280
70291,"Plymouth, IN Urban Cluster (2010)",87.0,70291
70318,"Plymouth, NH Urban Cluster (2010)",23.0,70318
70345,"Plymouth, NC Urban Cluster (2010)",3.0,70345
70372,"Plymouth, WI Urban Cluster (2010)",97.0,70372
70399,"Pocahontas, AR Urban Cluster (2010)",54.0,70399
70426,"Pocatello, ID Urbanized Area (2010)",2066.0,70426
70453,"Pocomoke City, MD Urban Cluster (2010)",9.0,70453
70465,"Pocono Woodland Lakes, PA Urban Cluster (2010)",30.0,70465
70480,"Poinciana, FL Urban Cluster (2010)",819.0,70480
70490,"Poinciana Southwest, FL Urban Cluster (2010)",142.0,70490
70507,"Point Pleasant--Gallipolis, OH--WV Urban Cluster (2010)",141.0,70507
70534,"Pojoaque, NM Urban Cluster (2010)",590.0,70534
70548,"Polk City, IA Urban Cluster (2010)",50.0,70548
70588,"Polson, MT Urban Cluster (2010)",1122.0,70588
70615,"Ponca City, OK Urban Cluster (2010)",3707.0,70615
70642,"Ponce, PR Urbanized Area (2010)",494.0,70642
70669,"Pontiac, IL Urban Cluster (2010)",53.0,70669
70696,"Pontotoc, MS Urban Cluster (2010)",4.0,70696
70750,"Poolesville, MD Urban Cluster (2010)",71.0,70750
70777,"Poplar, MT Urban Cluster (2010)",2776.0,70777
70804,"Poplar Bluff, MO Urban Cluster (2010)",262.0,70804
70815,"Poplar-Cotton Center, CA Urban Cluster (2010)",0.0,70815
70831,"Portage, PA Urban Cluster (2010)",3.0,70831
70858,"Portage, WI Urban Cluster (2010)",239.0,70858
70885,"Portageville, MO Urban Cluster (2010)",26.0,70885
70912,"Portales, NM Urban Cluster (2010)",320.0,70912
70939,"Port Angeles, WA Urban Cluster (2010)",1166.0,70939
70993,"Port Arthur, TX Urbanized Area (2010)",1411.0,70993
71020,"Port Barre, LA Urban Cluster (2010)",0.0,71020
71047,"Port Clinton, OH Urban Cluster (2010)",75.0,71047
71074,"Porterville, CA Urbanized Area (2010)",1448.0,71074
71128,"Port Hadlock-Irondale, WA Urban Cluster (2010)",311.0,71128
71155,"Port Huron, MI Urbanized Area (2010)",1298.0,71155
71182,"Port Isabel--Laguna Heights, TX Urban Cluster (2010)",36.0,71182
71209,"Port Jervis, NY--PA Urban Cluster (2010)",311.0,71209
71236,"Portland, IN Urban Cluster (2010)",51.0,71236
71263,"Portland, ME Urbanized Area (2010)",2462.0,71263
71290,"Portland, MI Urban Cluster (2010)",26.0,71290
71317,"Portland, OR--WA Urbanized Area (2010)",44170.0,71317
71344,"Portland, TN--KY Urban Cluster (2010)",77.0,71344
71371,"Port Lavaca, TX Urban Cluster (2010)",400.0,71371
71398,"Portola, CA Urban Cluster (2010)",52.0,71398
71452,"Port St. Joe, FL Urban Cluster (2010)",36.0,71452
71479,"Port St. Lucie, FL Urbanized Area (2010)",2642.0,71479
71506,"Portsmouth, NH--ME Urbanized Area (2010)",524.0,71506
71533,"Portsmouth, OH--KY Urban Cluster (2010)",587.0,71533
71560,"Port Townsend, WA Urban Cluster (2010)",164.0,71560
71614,"Post, TX Urban Cluster (2010)",37.0,71614
71641,"Poteau, OK Urban Cluster (2010)",1085.0,71641
71668,"Poteet, TX Urban Cluster (2010)",105.0,71668
71695,"Potosi, MO Urban Cluster (2010)",74.0,71695
71722,"Potsdam, NY Urban Cluster (2010)",95.0,71722
71749,"Pottstown, PA Urbanized Area (2010)",648.0,71749
71776,"Pottsville, PA Urban Cluster (2010)",98.0,71776
71803,"Poughkeepsie--Newburgh, NY--NJ Urbanized Area (2010)",3923.0,71803
71830,"Powell, WY Urban Cluster (2010)",96.0,71830
71857,"Prairie du Chien, WI--IA Urban Cluster (2010)",90.0,71857
71884,"Prairie du Sac--Sauk City, WI Urban Cluster (2010)",24.0,71884
71911,"Prairie Grove, AR Urban Cluster (2010)",122.0,71911
71938,"Prairie View, TX Urban Cluster (2010)",77.0,71938
71965,"Pratt, KS Urban Cluster (2010)",112.0,71965
72019,"Premont, TX Urban Cluster (2010)",84.0,72019
72073,"Prescott, AR Urban Cluster (2010)",7.0,72073
72100,"Prescott, WI Urban Cluster (2010)",52.0,72100
72112,"Prescott Valley--Prescott, AZ Urbanized Area (2010)",1771.0,72112
72120,"Presidential Lakes Estates, NJ Urban Cluster (2010)",0.0,72120
72127,"Presidio, TX Urban Cluster (2010)",17.0,72127
72154,"Presque Isle, ME Urban Cluster (2010)",314.0,72154
72181,"Preston, ID Urban Cluster (2010)",59.0,72181
72208,"Prestonsburg, KY Urban Cluster (2010)",18.0,72208
72235,"Price, UT Urban Cluster (2010)",399.0,72235
72244,"Priceville, AL Urban Cluster (2010)",120.0,72244
72253,"Prince Frederick, MD Urban Cluster (2010)",72.0,72253
72262,"Princess Anne, MD Urban Cluster (2010)",73.0,72262
72289,"Princeton, IL Urban Cluster (2010)",24.0,72289
72316,"Princeton, IN Urban Cluster (2010)",56.0,72316
72343,"Princeton, KY Urban Cluster (2010)",26.0,72343
72370,"Princeton, MN Urban Cluster (2010)",167.0,72370
72410,"Princeville, HI Urban Cluster (2010)",33.0,72410
72424,"Prineville, OR Urban Cluster (2010)",305.0,72424
72505,"Providence, RI--MA Urbanized Area (2010)",15170.0,72505
72532,"Provincetown, MA Urban Cluster (2010)",65.0,72532
72559,"Provo--Orem, UT Urbanized Area (2010)",5732.0,72559
72586,"Pryor Creek, OK Urban Cluster (2010)",2313.0,72586
72613,"Pueblo, CO Urbanized Area (2010)",8267.0,72613
72640,"Pukalani--Makawao--Haiku-Pauwela, HI Urban Cluster (2010)",558.0,72640
72667,"Pulaski, TN Urban Cluster (2010)",113.0,72667
72694,"Pulaski, VA Urban Cluster (2010)",186.0,72694
72721,"Pulaski, WI Urban Cluster (2010)",10.0,72721
72748,"Pullman, WA Urban Cluster (2010)",740.0,72748
72775,"Punxsutawney, PA Urban Cluster (2010)",42.0,72775
72829,"Purcell, OK Urban Cluster (2010)",685.0,72829
72856,"Purcellville, VA Urban Cluster (2010)",236.0,72856
72910,"Quarryville, PA Urban Cluster (2010)",35.0,72910
72937,"Quartzsite, AZ Urban Cluster (2010)",0.0,72937
73018,"Quincy, FL Urban Cluster (2010)",49.0,73018
73045,"Quincy, IL Urban Cluster (2010)",212.0,73045
73072,"Quincy, WA Urban Cluster (2010)",171.0,73072
73126,"Quitman, GA Urban Cluster (2010)",8.0,73126
73136,"Quitman, TX Urban Cluster (2010)",38.0,73136
73153,"Racine, WI Urbanized Area (2010)",2180.0,73153
73245,"Rainbow Lakes Estates, FL Urban Cluster (2010)",0.0,73245
73261,"Raleigh, NC Urbanized Area (2010)",10461.0,73261
73288,"Ramona, CA Urban Cluster (2010)",570.0,73288
73300,"Ramseur, NC Urban Cluster (2010)",67.0,73300
73315,"Rancho Calaveras--Valley Springs, CA Urban Cluster (2010)",276.0,73315
73342,"Rancho Murieta, CA Urban Cluster (2010)",32.0,73342
73369,"Rantoul, IL Urban Cluster (2010)",86.0,73369
73396,"Rapid City, SD Urbanized Area (2010)",11617.0,73396
73423,"Rathdrum, ID Urban Cluster (2010)",266.0,73423
73450,"Raton, NM Urban Cluster (2010)",232.0,73450
73477,"Ravena, NY Urban Cluster (2010)",48.0,73477
73504,"Ravenswood, WV Urban Cluster (2010)",57.0,73504
73531,"Rawlins, WY Urban Cluster (2010)",341.0,73531
73554,"Raymond, MS Urban Cluster (2010)",14.0,73554
73585,"Raymond, WA Urban Cluster (2010)",201.0,73585
73612,"Raymondville, TX Urban Cluster (2010)",37.0,73612
73639,"Rayne, LA Urban Cluster (2010)",61.0,73639
73666,"Rayville, LA Urban Cluster (2010)",17.0,73666
73693,"Reading, PA Urbanized Area (2010)",12575.0,73693
73720,"Red Bluff, CA Urban Cluster (2010)",820.0,73720
73747,"Red Bud, IL Urban Cluster (2010)",19.0,73747
73774,"Redding, CA Urbanized Area (2010)",5486.0,73774
73828,"Red Hook, NY Urban Cluster (2010)",60.0,73828
73882,"Redmond, OR Urban Cluster (2010)",1110.0,73882
73909,"Red Oak, IA Urban Cluster (2010)",24.0,73909
73936,"Red Springs, NC Urban Cluster (2010)",641.0,73936
73963,"Red Wing, MN Urban Cluster (2010)",441.0,73963
73990,"Redwood Falls, MN Urban Cluster (2010)",326.0,73990
74044,"Reedley--Dinuba, CA Urban Cluster (2010)",733.0,74044
74071,"Reedsburg, WI Urban Cluster (2010)",275.0,74071
74098,"Reedsport, OR Urban Cluster (2010)",264.0,74098
74125,"Refugio, TX Urban Cluster (2010)",125.0,74125
74142,"Reidsville, GA Urban Cluster (2010)",25.0,74142
74152,"Reidsville, NC Urban Cluster (2010)",124.0,74152
74179,"Reno, NV--CA Urbanized Area (2010)",10067.0,74179
74206,"Rensselaer, IN Urban Cluster (2010)",7.0,74206
74260,"Rexburg, ID Urban Cluster (2010)",221.0,74260
74287,"Reynoldsville, PA Urban Cluster (2010)",0.0,74287
74314,"Rhinebeck, NY Urban Cluster (2010)",6.0,74314
74341,"Rhinelander, WI Urban Cluster (2010)",269.0,74341
74368,"Rice Lake, WI Urban Cluster (2010)",107.0,74368
74395,"Richfield, UT Urban Cluster (2010)",266.0,74395
74449,"Richgrove, CA Urban Cluster (2010)",44.0,74449
74557,"Richland Center, WI Urban Cluster (2010)",7.0,74557
74584,"Richlands, VA Urban Cluster (2010)",52.0,74584
74601,"Richlands South, NC Urban Cluster (2010)",81.0,74601
74638,"Richmond, IN--OH Urban Cluster (2010)",359.0,74638
74665,"Richmond, KY Urban Cluster (2010)",329.0,74665
74692,"Richmond, MI Urban Cluster (2010)",79.0,74692
74719,"Richmond, MO Urban Cluster (2010)",41.0,74719
74746,"Richmond, VA Urbanized Area (2010)",11343.0,74746
74827,"Ridgecrest, CA Urban Cluster (2010)",1185.0,74827
74840,"Ridgefield, WA Urban Cluster (2010)",0.0,74840
74854,"Ridgeland, SC Urban Cluster (2010)",0.0,74854
74881,"Ridge Manor, FL Urban Cluster (2010)",0.0,74881
74908,"Ridgway, PA Urban Cluster (2010)",40.0,74908
74935,"Rifle, CO Urban Cluster (2010)",289.0,74935
74962,"Rigby, ID Urban Cluster (2010)",198.0,74962
74989,"Rincon, GA Urban Cluster (2010)",181.0,74989
75016,"Rio Bravo--El Cenizo, TX Urban Cluster (2010)",25.0,75016
75043,"Rio Dell, CA Urban Cluster (2010)",305.0,75043
75072,"Rio Grande City--Roma, TX Urban Cluster (2010)",50.0,75072
75080,"Rio Hondo, TX Urban Cluster (2010)",0.0,75080
75089,"Rio Rico Northeast, AZ Urban Cluster (2010)",0.0,75089
75097,"Rio Vista, CA Urban Cluster (2010)",48.0,75097
75124,"Ripley, MS Urban Cluster (2010)",7.0,75124
75151,"Ripley, TN Urban Cluster (2010)",150.0,75151
75178,"Ripley, WV Urban Cluster (2010)",0.0,75178
75205,"Ripon, WI Urban Cluster (2010)",42.0,75205
75270,"Riverdale, CA Urban Cluster (2010)",0.0,75270
75286,"River Falls, WI Urban Cluster (2010)",134.0,75286
75340,"Riverside--San Bernardino, CA Urbanized Area (2010)",35845.0,75340
75367,"Riverton, WY Urban Cluster (2010)",1363.0,75367
75394,"Roanoke, AL Urban Cluster (2010)",63.0,75394
75421,"Roanoke, VA Urbanized Area (2010)",1906.0,75421
75448,"Roanoke Rapids, NC Urban Cluster (2010)",228.0,75448
75475,"Roaring Spring, PA Urban Cluster (2010)",0.0,75475
75502,"Robertsdale, AL Urban Cluster (2010)",160.0,75502
75529,"Robinson, IL Urban Cluster (2010)",54.0,75529
75556,"Robstown, TX Urban Cluster (2010)",34.0,75556
75583,"Rochelle, IL Urban Cluster (2010)",95.0,75583
75610,"Rochester, IN Urban Cluster (2010)",74.0,75610
75637,"Rochester, MN Urbanized Area (2010)",840.0,75637
75664,"Rochester, NY Urbanized Area (2010)",8246.0,75664
75691,"Rockdale, TX Urban Cluster (2010)",0.0,75691
75718,"Rockford, IL Urbanized Area (2010)",3025.0,75718
75732,"Rockford, MN Urban Cluster (2010)",17.0,75732
75745,"Rock Hill, SC Urbanized Area (2010)",2137.0,75745
75772,"Rockingham--Hamlet, NC Urban Cluster (2010)",897.0,75772
75799,"Rockland, ME Urban Cluster (2010)",159.0,75799
75826,"Rockmart, GA Urban Cluster (2010)",91.0,75826
75853,"Rockport, TX Urban Cluster (2010)",698.0,75853
75880,"Rock Springs, WY Urban Cluster (2010)",661.0,75880
75907,"Rock Valley, IA Urban Cluster (2010)",0.0,75907
75934,"Rockville, IN Urban Cluster (2010)",13.0,75934
75961,"Rocky Ford, CO Urban Cluster (2010)",189.0,75961
75988,"Rocky Mount, NC Urbanized Area (2010)",851.0,75988
76015,"Rocky Mount, VA Urban Cluster (2010)",8.0,76015
76042,"Rogers City, MI Urban Cluster (2010)",19.0,76042
76059,"Rogersville, MO Urban Cluster (2010)",25.0,76059
76069,"Rogersville, TN Urban Cluster (2010)",48.0,76069
76123,"Rolla, MO Urban Cluster (2010)",168.0,76123
76177,"Romancoke, MD Urban Cluster (2010)",15.0,76177
76204,"Rome, GA Urbanized Area (2010)",580.0,76204
76231,"Rome, NY Urban Cluster (2010)",290.0,76231
76258,"Roosevelt, UT Urban Cluster (2010)",532.0,76258
76285,"Rosamond, CA Urban Cluster (2010)",529.0,76285
76312,"Roseau, MN Urban Cluster (2010)",63.0,76312
76339,"Roseburg, OR Urban Cluster (2010)",1404.0,76339
76366,"Rose Hill, KS Urban Cluster (2010)",43.0,76366
76447,"Roswell, NM Urban Cluster (2010)",1334.0,76447
76474,"Round Lake Beach--McHenry--Grayslake, IL--WI Urbanized Area (2010)",2192.0,76474
76501,"Roxboro, NC Urban Cluster (2010)",129.0,76501
76528,"Roxborough Park, CO Urban Cluster (2010)",205.0,76528
76582,"Royston, GA Urban Cluster (2010)",0.0,76582
76595,"Ruckersville, VA Urban Cluster (2010)",34.0,76595
76609,"Rugby, ND Urban Cluster (2010)",171.0,76609
76636,"Ruidoso, NM Urban Cluster (2010)",389.0,76636
76663,"Ruleville, MS Urban Cluster (2010)",0.0,76663
76690,"Rumford, ME Urban Cluster (2010)",42.0,76690
76717,"Running Springs, CA Urban Cluster (2010)",99.0,76717
76744,"Rupert, ID Urban Cluster (2010)",61.0,76744
76759,"Rush City, MN Urban Cluster (2010)",120.0,76759
76771,"Rushville, IL Urban Cluster (2010)",4.0,76771
76798,"Rushville, IN Urban Cluster (2010)",26.0,76798
76825,"Rusk, TX Urban Cluster (2010)",55.0,76825
76852,"Russell, KS Urban Cluster (2010)",112.0,76852
76879,"Russells Point, OH Urban Cluster (2010)",37.0,76879
76906,"Russellville, AL Urban Cluster (2010)",276.0,76906
76933,"Russellville, AR Urban Cluster (2010)",335.0,76933
76960,"Russellville, KY Urban Cluster (2010)",48.0,76960
76987,"Ruston, LA Urban Cluster (2010)",260.0,76987
77014,"Rutland, VT Urban Cluster (2010)",174.0,77014
