B07004B_001E,B07004B_002E,B07004B_003E,B07004B_004E,B07004B_005E,B07004B_006E,name,public use microdata area,state
30577.0,26233.0,2158.0,1349.0,707.0,130.0,"Limestone & Madison (Outer) Counties--Huntsville City (Far West & Southwest) PUMA, Alabama",00200,01
2695.0,2123.0,355.0,111.0,105.0,1.0,"DeKalb & Jackson Counties PUMA, Alabama",00400,01
44152.0,37733.0,4324.0,1322.0,650.0,123.0,"Houston, Dale, Geneva & Henry Counties--Dothan City PUMA; Alabama",02500,01
21640.0,19415.0,1499.0,276.0,426.0,24.0,"Tuscaloosa (Outer) & Pickens Counties--Northport City (North & West) PUMA, Alabama",01500,01
74855.0,69059.0,3469.0,1801.0,428.0,98.0,"Dallas, Bibb, Marengo, Hale, Sumter, Perry & Greene Counties PUMA; Alabama",01700,01
33814.0,30014.0,2355.0,1018.0,353.0,74.0,"Talladega, Cherokee, Randolph, Cleburne & Clay Counties PUMA; Alabama",01000,01
2954.0,2375.0,345.0,153.0,65.0,16.0,"Marshall & Madison (Southeast) Counties--Huntsville City (Far Southeast) PUMA, Alabama",00500,01
8450.0,6376.0,989.0,895.0,190.0,0.0,"Walker, Marion (South & West), Fayette & Lamar Counties PUMA; Alabama",01400,01
32089.0,28431.0,2369.0,968.0,299.0,22.0,"Chilton, Tallapoosa, Chambers & Coosa Counties PUMA; Alabama",01800,01
55208.0,51124.0,2560.0,1065.0,360.0,99.0,"Southwest Alabama PUMA, Alabama",02200,01
8961.0,8149.0,245.0,470.0,89.0,8.0,"St. Clair & Blount Counties PUMA, Alabama",00800,01
19501.0,16237.0,1789.0,946.0,459.0,70.0,"Lauderdale, Colbert, Franklin & Marion (Northeast) Counties PUMA; Alabama",00100,01
73116.0,63037.0,5200.0,1814.0,2741.0,324.0,"Russell, Pike, Barbour, Macon & Bullock Counties PUMA; Alabama",02400,01
25940.0,22338.0,2328.0,831.0,395.0,48.0,"Coffee, Covington, Butler & Crenshaw Counties PUMA; Alabama",02300,01
33413.0,30376.0,2289.0,134.0,586.0,28.0,"Mobile County (Outer)--Prichard City, Tillmans Corner & Saraland City PUMA; Alabama",02703,01
70695.0,60180.0,9218.0,425.0,778.0,94.0,"Mobile City (East) PUMA, Alabama",02701,01
40363.0,34576.0,4752.0,474.0,512.0,49.0,"Mobile City (West) PUMA, Alabama",02702,01
1045.0,833.0,95.0,80.0,37.0,0.0,"Cullman & Winston Counties PUMA, Alabama",00700,01
35737.0,28899.0,4071.0,1256.0,1408.0,103.0,"Lee County--Auburn City PUMA, Alabama",01900,01
48767.0,41359.0,3484.0,3250.0,552.0,122.0,"Elmore, Autauga, Montgomery (Outer) & Lowndes Counties PUMA; Alabama",02100,01
114946.0,85076.0,22231.0,4357.0,3053.0,229.0,"Montgomery City & Pike Road Town (North) PUMA, Alabama",02000,01
18507.0,14652.0,2692.0,990.0,161.0,12.0,"Morgan & Lawrence Counties--Decatur City PUMA, Alabama",00600,01
23311.0,17748.0,4275.0,796.0,492.0,0.0,"Calhoun County PUMA, Alabama",01100,01
15943.0,12926.0,2108.0,604.0,247.0,58.0,"Etowah County PUMA, Alabama",00900,01
49602.0,40552.0,5824.0,1830.0,1313.0,83.0,"Tuscaloosa & Northport (Southeast) Cities PUMA, Alabama",01600,01
24377.0,19818.0,1390.0,2039.0,1087.0,43.0,"Shelby County PUMA, Alabama",01200,01
45142.0,36233.0,6468.0,998.0,1238.0,205.0,"Huntsville (North) & Madison (East) Cities PUMA, Alabama",00301,01
19559.0,13747.0,3953.0,893.0,863.0,103.0,"Huntsville City (Central & South) PUMA, Alabama",00302,01
19141.0,17277.0,798.0,618.0,348.0,100.0,"Baldwin County PUMA, Alabama",02600,01
57670.0,47398.0,8292.0,1242.0,574.0,164.0,"Birmingham City (East) PUMA, Alabama",01302,01
86949.0,72138.0,12851.0,1033.0,804.0,123.0,"Birmingham City (West) PUMA, Alabama",01301,01
26578.0,20099.0,4699.0,754.0,965.0,61.0,"Jefferson County (Southeast)--Hoover (North), Vestavia Hills & Homewood Cities PUMA; Alabama",01303,01
59573.0,48278.0,9663.0,916.0,680.0,36.0,"Jefferson County (Northeast)--Trussville, Center Point & Gardendale Cities PUMA; Alabama",01304,01
46269.0,39690.0,5217.0,720.0,533.0,109.0,"Jefferson County (West)--Bessemer, Hueytown & Pleasant Grove Cities PUMA; Alabama",01305,01
6503.0,5281.0,948.0,55.0,127.0,92.0,"Anchorage Municipality (South) PUMA, Alaska",00102,02
1098.0,707.0,52.0,44.0,264.0,31.0,"Subsistence Alaska PUMA, Alaska",00400,02
1440.0,1034.0,97.0,216.0,83.0,10.0,"Matanuska-Susitna & Kenai Peninsula Boroughs PUMA, Alaska",00200,02
4771.0,2953.0,822.0,227.0,685.0,84.0,"Greater Fairbanks, Greater Juneau, Ketchikan Gateway Borough & Road-Connected Alaska PUMA; Alaska",00300,02
9681.0,7000.0,1706.0,81.0,843.0,51.0,"Anchorage Municipality (North) PUMA, Alaska",00101,02
6948.0,5745.0,855.0,147.0,193.0,8.0,"Maricopa County (West) & Gila River Indian Community (Northwest) PUMA, Arizona",00134,04
3046.0,2179.0,542.0,21.0,252.0,52.0,"Tucson (West) & Marana Cities PUMA, Arizona",00202,04
1282.0,913.0,84.0,210.0,75.0,0.0,"Gila, Graham, Greenlee & Pinal (East) Counties PUMA; Arizona",00800,04
1966.0,940.0,355.0,282.0,389.0,0.0,"Coconino County--Flagstaff City PUMA, Arizona",00400,04
2867.0,2221.0,385.0,0.0,259.0,2.0,"Phoenix (Far North) & Peoria (Northwest) Cities PUMA, Arizona",00129,04
9714.0,7918.0,986.0,106.0,505.0,199.0,"Maricopa County--Goodyear, Glendale (West) & Litchfield Park (Northwest) Cities PUMA; Arizona",00132,04
6668.0,5825.0,428.0,0.0,415.0,0.0,"Maricopa County--Surprise City (Central) PUMA, Arizona",00131,04
4958.0,4182.0,505.0,0.0,219.0,52.0,"Maricopa County--El Mirage City & Sun City PUMA, Arizona",00130,04
848.0,557.0,151.0,21.0,119.0,0.0,"Maricopa County (Northeast)--Scottsdale City (Southeast) & Fountain Hills Town PUMA, Arizona",00111,04
3884.0,2574.0,536.0,56.0,704.0,14.0,"Maricopa County--Chandler City (South) PUMA, Arizona",00107,04
10711.0,8950.0,1185.0,131.0,425.0,20.0,"Maricopa County--Avondale (Central) & Litchfield Park (Central) Cities PUMA, Arizona",00133,04
970.0,799.0,104.0,0.0,28.0,39.0,"Maricopa County--Scottsdale (North), Phoenix (Far Northeast) Cities & Cave Creek PUMA; Arizona",00112,04
1696.0,1355.0,168.0,5.0,153.0,15.0,"Phoenix City (Northeast) PUMA, Arizona",00113,04
3510.0,2837.0,335.0,7.0,322.0,9.0,"Maricopa County--Gilbert Town (North) PUMA, Arizona",00105,04
4572.0,3386.0,877.0,71.0,128.0,110.0,"Phoenix City (Northwest Central) PUMA, Arizona",00115,04
3148.0,2380.0,631.0,0.0,137.0,0.0,"Phoenix City (Northeast Central) PUMA, Arizona",00114,04
5537.0,4078.0,1105.0,74.0,235.0,45.0,"Phoenix City (East) PUMA, Arizona",00117,04
11487.0,8433.0,2407.0,218.0,407.0,22.0,"Phoenix City--Downtown & Sky Harbor International Airport PUMA, Arizona",00118,04
5405.0,3140.0,1594.0,176.0,495.0,0.0,"Maricopa County--Mesa City (West) PUMA, Arizona",00103,04
3942.0,3183.0,600.0,30.0,88.0,41.0,"Maricopa County--Mesa City (South Central) PUMA, Arizona",00104,04
6277.0,4631.0,1199.0,27.0,358.0,62.0,"Phoenix City--Maryvale (East) PUMA, Arizona",00122,04
9385.0,6939.0,1975.0,24.0,341.0,106.0,"Phoenix City (Uptown) PUMA, Arizona",00116,04
7393.0,4931.0,1995.0,138.0,239.0,90.0,"Tucson City (Southeast) PUMA, Arizona",00209,04
7265.0,5404.0,1435.0,38.0,305.0,83.0,"Phoenix City (West) PUMA, Arizona",00125,04
1253.0,737.0,212.0,268.0,13.0,23.0,"Navajo & Apache Counties PUMA, Arizona",00300,04
4061.0,1917.0,946.0,475.0,588.0,135.0,"Tucson City (Northwest) PUMA, Arizona",00207,04
5546.0,3272.0,1433.0,133.0,305.0,403.0,"Tucson City (Northeast) PUMA, Arizona",00206,04
2205.0,1448.0,543.0,19.0,179.0,16.0,"Pima County (North Central)--Oro Valley Town PUMA, Arizona",00203,04
3528.0,2544.0,883.0,60.0,35.0,6.0,"Tucson City (South) PUMA, Arizona",00208,04
1713.0,1273.0,233.0,0.0,207.0,0.0,"Pima County (Northeast) PUMA, Arizona",00204,04
5662.0,4129.0,757.0,357.0,407.0,12.0,"Pima County (Southeast)--Tucson City (Far Southeast) & Sahuarita Town PUMA, Arizona",00205,04
1265.0,1131.0,39.0,20.0,66.0,9.0,"Pima County (West) PUMA, Arizona",00201,04
2344.0,1549.0,150.0,205.0,408.0,32.0,"Mohave & La Paz Counties--Lake Havasu City PUMA, Arizona",00600,04
4922.0,3575.0,382.0,494.0,422.0,49.0,"Cochise & Santa Cruz Counties--Sierra Vista City PUMA, Arizona",00900,04
4157.0,2862.0,680.0,131.0,356.0,128.0,"Yuma County--Yuma City PUMA, Arizona",00700,04
1169.0,724.0,198.0,149.0,87.0,11.0,"Yavapai County PUMA, Arizona",00500,04
3507.0,2346.0,136.0,477.0,417.0,131.0,"Pinal County (North)--Apache Junction City PUMA, Arizona",00803,04
6365.0,4591.0,618.0,754.0,343.0,59.0,"Pinal County (Central)--Florence Town, Eloy (Northeast) & Coolidge Cities PUMA; Arizona",00805,04
8079.0,5692.0,953.0,492.0,915.0,27.0,"Pinal County (West)--Maricopa, Casa Grande & Eloy (Southeast) Cities PUMA; Arizona",00807,04
6971.0,4803.0,1409.0,63.0,591.0,105.0,"Maricopa County--Tempe (South) & Chandler (Northwest) Cities PUMA, Arizona",00108,04
4614.0,3072.0,1274.0,99.0,169.0,0.0,"Maricopa County--Mesa City (North Central) PUMA, Arizona",00102,04
3956.0,3131.0,334.0,103.0,367.0,21.0,"Maricopa County--Mesa City (East) PUMA, Arizona",00101,04
4626.0,3826.0,468.0,75.0,257.0,0.0,"Maricopa County--Gilbert (South) & Queen Creek Towns PUMA, Arizona",00100,04
8272.0,6011.0,1617.0,196.0,448.0,0.0,"Phoenix City--Ahwatukee & South Mountain PUMA, Arizona",00120,04
16152.0,12129.0,2626.0,13.0,1365.0,19.0,"Phoenix (Southwest) & Tolleson Cities PUMA, Arizona",00121,04
3063.0,2331.0,596.0,4.0,97.0,35.0,"Phoenix City (North) PUMA, Arizona",00128,04
9992.0,6968.0,2172.0,97.0,454.0,301.0,"Maricopa County--Glendale City (South) PUMA, Arizona",00124,04
3903.0,3119.0,647.0,0.0,94.0,43.0,"Maricopa County--Peoria City (South & Central) PUMA, Arizona",00127,04
4344.0,3543.0,646.0,13.0,134.0,8.0,"Maricopa County--Glendale City (North) PUMA, Arizona",00126,04
3011.0,2406.0,419.0,24.0,162.0,0.0,"Maricopa County--Scottsdale City (Southwest) & Paradise Valley Town PUMA, Arizona",00110,04
6998.0,4852.0,1305.0,184.0,594.0,63.0,"Maricopa County--Tempe City (North) PUMA, Arizona",00109,04
6482.0,4519.0,1609.0,33.0,290.0,31.0,"Maricopa County--Chandler City (Northeast) PUMA, Arizona",00106,04
18510.0,15101.0,2849.0,74.0,460.0,26.0,"Phoenix City (South) PUMA, Arizona",00119,04
8475.0,5707.0,2013.0,137.0,618.0,0.0,"Phoenix City--Maryvale (West) PUMA, Arizona",00123,04
31747.0,27979.0,2459.0,934.0,352.0,23.0,"Southeast Arkansas PUMA, Arkansas",01800,05
35300.0,30181.0,3187.0,1265.0,641.0,26.0,"South Central Arkansas PUMA, Arkansas",01900,05
724.0,452.0,176.0,92.0,4.0,0.0,"Baxter, Boone, Carroll, Marion, Madison, Newton & Searcy Counties PUMA; Arkansas",00300,05
25436.0,20517.0,2510.0,1094.0,1292.0,23.0,"Southwest Arkansas PUMA, Arkansas",02000,05
5374.0,4404.0,624.0,308.0,38.0,0.0,"Pope, Johnson, Yell, Conway & Perry Counties PUMA; Arkansas",01300,05
4363.0,3551.0,458.0,165.0,189.0,0.0,"Logan, Polk, Franklin, Sevier, Howard & Scott Counties PUMA; Arkansas",01500,05
1369.0,828.0,276.0,241.0,24.0,0.0,"Independence, Cleburne, Van Buren, Sharp, Izard, Stone & Fulton Counties PUMA; Arkansas",00400,05
9095.0,6878.0,1504.0,362.0,320.0,31.0,"Sebastian & Crawford Counties PUMA, Arkansas",01400,05
7719.0,4155.0,1668.0,889.0,929.0,78.0,"Washington County PUMA, Arkansas",00200,05
40149.0,32626.0,5751.0,1159.0,571.0,42.0,"St. Francis, Poinsett, Phillips, Cross, Lee & Monroe Counties PUMA; Arkansas",00700,05
43867.0,38170.0,3903.0,1201.0,493.0,100.0,"Jefferson, Grant & Arkansas (Northwest) Counties PUMA; Arkansas",01700,05
14483.0,9637.0,3547.0,794.0,394.0,111.0,"Craighead (West), Greene, Randolph, Lawrence & Clay Counties PUMA; Arkansas",00500,05
16912.0,12699.0,2229.0,1471.0,491.0,22.0,"Garland, Hot Spring, Clark & Montgomery Counties PUMA; Arkansas",01600,05
38750.0,31113.0,5676.0,578.0,1305.0,78.0,"Crittenden, Mississippi & Craighead (East) Counties PUMA; Arkansas",00600,05
9039.0,7419.0,557.0,869.0,194.0,0.0,"White, Jackson, Prairie & Woodruff Counties PUMA; Arkansas",00800,05
18017.0,14827.0,1702.0,946.0,492.0,50.0,"Faulkner & Lonoke Counties PUMA, Arkansas",01100,05
61900.0,47509.0,12140.0,1420.0,789.0,42.0,"Pulaski County (Outer)--North Little Rock, Sherwood & Jacksonville Cities PUMA; Arkansas",00900,05
77721.0,65188.0,9902.0,1370.0,1185.0,76.0,"Pulaski County (Central)--Little Rock City PUMA, Arkansas",01000,05
7315.0,6156.0,691.0,395.0,73.0,0.0,"Saline County PUMA, Arkansas",01200,05
4097.0,3328.0,328.0,129.0,191.0,121.0,"Benton County PUMA, Arkansas",00100,05
2318.0,1682.0,209.0,198.0,223.0,6.0,"Ventura County (South Central)--Camarillo & Moorpark Cities PUMA, California",11106,06
8265.0,5992.0,1802.0,147.0,180.0,144.0,"San Diego County (Central)--El Cajon & Santee Cities PUMA, California",07313,06
6635.0,5346.0,914.0,72.0,272.0,31.0,"San Diego County (Southwest)--Chula Vista (West) & National City Cities PUMA, California",07321,06
12580.0,9823.0,1869.0,339.0,421.0,128.0,"Kern County (Central)--Bakersfield City (West) PUMA, California",02902,06
7529.0,6506.0,955.0,8.0,43.0,17.0,"Kern County (Central)--Bakersfield City (Southeast) PUMA, California",02904,06
1866.0,1158.0,299.0,111.0,267.0,31.0,"Los Angeles County--Calabasas, Agoura Hills, Malibu & Westlake Village Cities PUMA; California",03726,06
5567.0,4564.0,719.0,188.0,83.0,13.0,"Ventura County (Southwest)--Oxnard & Port Hueneme Cities PUMA, California",11103,06
2614.0,2005.0,256.0,238.0,97.0,18.0,"Ventura County (Southwest)--San Buenaventura (Ventura) City PUMA, California",11104,06
766.0,638.0,88.0,40.0,0.0,0.0,"Ventura County (North)--Santa Paula, Fillmore & Ojai Cities PUMA; California",11105,06
1779.0,1377.0,208.0,129.0,27.0,38.0,"Ventura County (Southeast)--Thousand Oaks City PUMA, California",11102,06
1660.0,1291.0,267.0,62.0,40.0,0.0,"Ventura County (Southeast)--Simi Valley City PUMA, California",11101,06
9629.0,7951.0,1190.0,264.0,73.0,151.0,"Los Angeles County (North)--LA City (Northwest/Chatsworth & Porter Ranch) PUMA, California",03705,06
1369.0,1098.0,114.0,148.0,9.0,0.0,"Butte County (Southeast)--Oroville City & Paradise Town PUMA, California",00702,06
1997.0,1224.0,463.0,279.0,13.0,18.0,"Butte County (Northwest)--Chico City PUMA, California",00701,06
8444.0,7367.0,603.0,311.0,97.0,66.0,"Riverside County (Northwest)--Jurupa Valley & Eastvale Cities PUMA, California",06514,06
20240.0,15386.0,2998.0,1552.0,243.0,61.0,"San Joaquin County (Central)--Stockton City (North) PUMA, California",07701,06
14943.0,12086.0,1576.0,1042.0,231.0,8.0,"San Joaquin County (Central)--Stockton City (South) PUMA, California",07702,06
11543.0,9678.0,916.0,741.0,198.0,10.0,"San Joaquin County (South)--Tracy, Manteca & Lathrop Cities PUMA; California",07703,06
8637.0,7231.0,765.0,475.0,164.0,2.0,"Riverside County (Northwest)--Riverside City (West) PUMA, California",06511,06
26183.0,22799.0,3035.0,230.0,110.0,9.0,"Los Angeles County (South Central)--Long Beach City (North) PUMA, California",03763,06
23437.0,21614.0,1395.0,208.0,147.0,73.0,"Los Angeles County (South Central)--Carson City PUMA, California",03762,06
9257.0,7380.0,1140.0,440.0,297.0,0.0,"Los Angeles County (West Central)--LA City (West Central/Westwood & West Los Angeles) PUMA, California",03729,06
7173.0,5644.0,1253.0,103.0,173.0,0.0,"Los Angeles County (Northwest)--LA City (Northwest/Encino & Tarzana) PUMA, California",03724,06
40003.0,35820.0,3729.0,141.0,162.0,151.0,"Los Angeles County (South Central)--Gardena, Lawndale Cities & West Athens PUMA; California",03758,06
7136.0,5509.0,1342.0,121.0,157.0,7.0,"Los Angeles County--LA City (Northwest/Canoga Park, Winnetka & Woodland Hills) PUMA; California",03725,06
34207.0,31488.0,2225.0,308.0,131.0,55.0,"Los Angeles County (North Central)--Lancaster City PUMA, California",03703,06
19606.0,16032.0,2901.0,502.0,153.0,18.0,"Los Angeles County (North Central)--Palmdale City PUMA, California",03704,06
8735.0,6945.0,1477.0,142.0,143.0,28.0,"Los Angeles County (Northwest)--Santa Clarita City PUMA, California",03702,06
11026.0,10521.0,383.0,37.0,85.0,0.0,"Los Angeles County (Central)--San Gabriel Valley Region (North) PUMA, California",03709,06
5843.0,5072.0,553.0,133.0,72.0,13.0,"Los Angeles County--Baldwin Park, Azusa, Duarte & Irwindale Cities PUMA; California",03710,06
5849.0,4857.0,673.0,258.0,61.0,0.0,"Los Angeles County (East Central)--Glendora, Claremont, San Dimas & La Verne Cities PUMA; California",03711,06
49527.0,45061.0,3881.0,407.0,142.0,36.0,"Los Angeles County (South Central)--Compton City & West Rancho Dominguez PUMA, California",03757,06
63440.0,57804.0,4765.0,310.0,364.0,197.0,"Los Angeles County (South Central)--LA City (South Central/Westmont) PUMA, California",03750,06
66941.0,61310.0,4646.0,384.0,421.0,180.0,"Los Angeles County (Central)--LA City (Central/West Adams & Baldwin Hills) PUMA, California",03747,06
5070.0,4382.0,639.0,16.0,33.0,0.0,"Los Angeles County (North)--LA City (North Central/Granada Hills & Sylmar) PUMA, California",03706,06
7022.0,5240.0,933.0,156.0,668.0,25.0,"San Diego County (West Central)--San Diego City (Central/Clairemont & Kearny Mesa) PUMA, California",07315,06
3542.0,3052.0,300.0,74.0,110.0,6.0,"San Diego County (Northwest)--San Marcos & Escondido (West) Cities PUMA, California",07305,06
7883.0,6808.0,638.0,249.0,109.0,79.0,"San Bernardino County (Southwest)--Colton, Loma Linda & Grand Terrace Cities PUMA; California",07106,06
8766.0,7225.0,1092.0,91.0,287.0,71.0,"San Diego County (Central)--San Diego (East Central/Navajo) & La Mesa Cities PUMA, California",07314,06
23098.0,19653.0,2331.0,127.0,490.0,497.0,"San Diego County (South Central)--San Diego City (Central/Mid-City) PUMA, California",07317,06
20021.0,15954.0,2667.0,1191.0,201.0,8.0,"San Bernardino County (Southwest)--San Bernardino City (West) PUMA, California",07108,06
12770.0,10473.0,1723.0,540.0,25.0,9.0,"San Bernardino County (Southwest)--Rialto City PUMA, California",07109,06
7247.0,6134.0,470.0,551.0,86.0,6.0,"San Bernardino County (Southwest)--Fontana City (East) PUMA, California",07110,06
8752.0,5898.0,410.0,1935.0,318.0,191.0,"San Bernardino County (Southwest)--Chino & Chino Hills Cities PUMA, California",07114,06
10005.0,8433.0,933.0,507.0,109.0,23.0,"San Bernardino County (Southwest)--Ontario City PUMA, California",07113,06
2277.0,1812.0,213.0,0.0,14.0,238.0,"Los Angeles County (Southwest)--Palos Verdes Peninsula PUMA, California",03768,06
2741.0,1784.0,799.0,70.0,88.0,0.0,"Los Angeles County--Redondo Beach, Manhattan Beach & Hermosa Beach Cities PUMA; California",03760,06
11154.0,9463.0,1437.0,150.0,94.0,10.0,"Los Angeles County (South)--LA City (South/San Pedro) PUMA, California",03767,06
7312.0,6029.0,993.0,202.0,41.0,47.0,"Los Angeles County (Southeast)--Long Beach City (East) PUMA, California",03765,06
13503.0,11411.0,1771.0,90.0,231.0,0.0,"Los Angeles County (Southeast)--Long Beach (Central) & Signal Hill Cities PUMA, California",03769,06
14171.0,11294.0,2026.0,256.0,570.0,25.0,"Los Angeles County (South)--Long Beach City (Southwest & Port) PUMA, California",03766,06
7588.0,6038.0,1259.0,173.0,85.0,33.0,"Los Angeles County (North/Unincorporated)--Castaic PUMA, California",03701,06
27711.0,24025.0,2814.0,341.0,415.0,116.0,"Los Angeles County--LA (Southwest/Marina del Rey & Westchester) & Culver City Cities PUMA, California",03748,06
4754.0,3800.0,796.0,13.0,73.0,72.0,"Los Angeles County (Southwest)--Santa Monica City PUMA, California",03728,06
6289.0,5044.0,618.0,117.0,480.0,30.0,"Los Angeles County (Central)--LA City (Central/Pacific Palisades) PUMA, California",03727,06
5515.0,4984.0,387.0,46.0,76.0,22.0,"Los Angeles County--LA (North Central/Arleta & Pacoima) & San Fernando Cities PUMA, California",03707,06
3389.0,2785.0,570.0,23.0,10.0,1.0,"Los Angeles County (South Central)--Torrance City PUMA, California",03761,06
20812.0,17650.0,2810.0,140.0,167.0,45.0,"Los Angeles County (South Central)--Hawthorne City PUMA, California",03759,06
45503.0,40241.0,4568.0,372.0,308.0,14.0,"Los Angeles County (Central)--Inglewood City PUMA, California",03749,06
2931.0,2488.0,289.0,19.0,134.0,1.0,"Los Angeles County (North)--LA City (Northeast/Sunland, Sun Valley & Tujunga) PUMA; California",03708,06
3177.0,2641.0,366.0,73.0,89.0,8.0,"San Diego County (Northwest)--Vista City PUMA, California",07303,06
2291.0,1473.0,391.0,297.0,25.0,105.0,"San Luis Obispo County (West)--Coastal Region PUMA, California",07901,06
3048.0,2210.0,102.0,684.0,52.0,0.0,"San Luis Obispo County (East)--Inland Region PUMA, California",07902,06
5251.0,3480.0,801.0,814.0,111.0,45.0,"Yolo County--Davis, Woodland & West Sacramento Cities PUMA; California",11300,06
1851.0,1549.0,148.0,103.0,51.0,0.0,"San Mateo County (South & West)--San Mateo (South) & Half Moon Bay Cities PUMA, California",08104,06
4378.0,3925.0,154.0,221.0,78.0,0.0,"San Mateo County (North Central)--Daly City, Pacifica Cities & Colma Town PUMA; California",08101,06
3269.0,2235.0,355.0,292.0,365.0,22.0,"Santa Clara County (Northwest)--Mountain View, Palo Alto & Los Altos Cities PUMA; California",08501,06
5668.0,4994.0,358.0,222.0,55.0,39.0,"San Mateo County (Southeast)--Menlo Park, East Palo Alto Cities & Atherton Town PUMA; California",08106,06
1934.0,1383.0,333.0,213.0,5.0,0.0,"San Mateo County (East Central)--Redwood City, San Carlos & Belmont Cities PUMA; California",08105,06
1959.0,1708.0,114.0,93.0,44.0,0.0,"San Mateo County (Central)--San Mateo (North), Burlingame & Millbrae Cities PUMA; California",08103,06
2643.0,2291.0,65.0,189.0,85.0,13.0,"San Mateo County (North Central)--South San Francisco, San Bruno & Brisbane Cities PUMA; California",08102,06
1341.0,1084.0,246.0,11.0,0.0,0.0,"Tulare County (Outside Visalia, Tulare & Porterville Cities) PUMA; California",10703,06
2902.0,2481.0,350.0,65.0,6.0,0.0,"Tulare County (West Central)--Tulare & Porterville Cities PUMA, California",10702,06
2799.0,2266.0,403.0,75.0,55.0,0.0,"Tulare County (Northwest)--Visalia City PUMA, California",10701,06
4917.0,4232.0,141.0,536.0,0.0,8.0,"Madera County--Madera City PUMA, California",03900,06
2028.0,1635.0,286.0,10.0,97.0,0.0,"Santa Clara County (East)--Gilroy, Morgan Hill & San Jose (South) Cities PUMA; California",08506,06
1040.0,942.0,70.0,10.0,18.0,0.0,"Santa Clara County (Southwest)--Cupertino, Saratoga Cities & Los Gatos Town PUMA; California",08507,06
2783.0,2563.0,186.0,23.0,11.0,0.0,"Santa Clara County (Central)--San Jose City (Southwest/Almaden Valley) PUMA, California",08512,06
2527.0,2137.0,176.0,200.0,14.0,0.0,"Santa Clara County (North Central)--San Jose City (East Central) & Alum Rock PUMA, California",08505,06
3403.0,3119.0,199.0,73.0,12.0,0.0,"Santa Clara County (Central)--San Jose City (Southeast/Evergreen) PUMA, California",08513,06
4685.0,3597.0,952.0,54.0,82.0,0.0,"Santa Clara County (Central)--San Jose (West Central) & Campbell Cities PUMA, California",08508,06
2336.0,2124.0,130.0,61.0,8.0,13.0,"Santa Clara County (Central)--San Jose City (East Central/East Valley) PUMA, California",08514,06
4046.0,3167.0,761.0,44.0,42.0,32.0,"Santa Clara County (Central)--San Jose City (South Central/Branham) & Cambrian Park PUMA, California",08511,06
5318.0,4388.0,430.0,225.0,173.0,102.0,"Santa Clara County (Northwest)--San Jose (Northwest) & Santa Clara Cities PUMA, California",08503,06
4270.0,3501.0,470.0,133.0,142.0,24.0,"Santa Clara County (Central)--San Jose City (Central) PUMA, California",08510,06
5524.0,3508.0,1191.0,525.0,198.0,102.0,"Santa Clara County (Central)--San Jose City (Northwest) PUMA, California",08509,06
8313.0,7319.0,449.0,257.0,113.0,175.0,"San Francisco County (North & West)--Richmond District PUMA, California",07501,06
3188.0,2339.0,34.0,685.0,87.0,43.0,"Monterey (South & East) & San Benito Counties PUMA, California",05303,06
6114.0,5088.0,336.0,454.0,155.0,81.0,"Monterey County (North Central)--Seaside, Monterey, Marina & Pacific Grove Cities PUMA; California",05301,06
2197.0,1653.0,279.0,232.0,32.0,1.0,"Monterey County (Northeast)--Salinas City PUMA, California",05302,06
6309.0,5281.0,423.0,483.0,53.0,69.0,"San Francisco County (South Central)--Sunset District (South) PUMA, California",07506,06
1967.0,1601.0,279.0,30.0,57.0,0.0,"San Francisco County (Central)--Sunset District (North) PUMA, California",07505,06
4239.0,3295.0,723.0,92.0,87.0,42.0,"San Francisco County (Central)--Inner Mission & Castro PUMA, California",07504,06
2553.0,2039.0,213.0,166.0,125.0,10.0,"San Francisco County (North & East)--North Beach & Chinatown PUMA, California",07502,06
13834.0,12809.0,667.0,130.0,222.0,6.0,"San Francisco County (South Central)--Bayview & Hunters Point PUMA, California",07507,06
1609.0,813.0,348.0,407.0,39.0,2.0,"Humboldt County PUMA, California",02300,06
7958.0,6028.0,1344.0,373.0,202.0,11.0,"San Francisco County (Central)--South of Market & Potrero PUMA, California",07503,06
27210.0,22822.0,2304.0,1667.0,381.0,36.0,"Solano County (Southwest)--Vallejo & Benicia Cities PUMA, California",09501,06
11630.0,9361.0,1019.0,931.0,319.0,0.0,"Solano County (Northeast)--Vacaville & Dixon Cities PUMA, California",09503,06
22234.0,17947.0,2897.0,964.0,304.0,122.0,"Solano County (Central)--Fairfield & Suisun City Cities PUMA, California",09502,06
4785.0,4157.0,319.0,273.0,28.0,8.0,"Imperial County--El Centro City PUMA, California",02500,06
5220.0,3951.0,599.0,537.0,108.0,25.0,"Riverside County (East)--Indio, Coachella, Blythe & La Quinta (East) Cities PUMA; California",06501,06
4905.0,3946.0,487.0,376.0,93.0,3.0,"Riverside County--Palm Desert, La Quinta (West) & Desert Hot Springs Cities PUMA; California",06515,06
3293.0,2488.0,600.0,72.0,87.0,46.0,"Los Angeles County (Central)--Glendale City PUMA, California",03719,06
7916.0,6491.0,1117.0,68.0,228.0,12.0,"Los Angeles County (Northwest)--LA City (North Central/Van Nuys & North Sherman Oaks) PUMA, California",03722,06
2809.0,2432.0,279.0,39.0,32.0,27.0,"Los Angeles County (East Central)--Arcadia, San Gabriel & Temple City Cities PUMA; California",03717,06
11046.0,9860.0,1034.0,116.0,15.0,21.0,"Los Angeles County (South)--Lakewood, Cerritos, Artesia & Hawaiian Gardens Cities PUMA; California",03764,06
4122.0,3266.0,542.0,52.0,153.0,109.0,"Los Angeles County (Central)--West Hollywood & Beverly Hills Cities PUMA, California",03731,06
14059.0,12402.0,1160.0,262.0,199.0,36.0,"Los Angeles County (Central)--Pasadena City PUMA, California",03718,06
530.0,411.0,91.0,14.0,7.0,7.0,"Los Angeles County (Central)--El Monte & South El Monte Cities PUMA, California",03738,06
