B19013I_001E,name,public use microdata area,state
50379.0,"Limestone & Madison (Outer) Counties--Huntsville City (Far West & Southwest) PUMA, Alabama",00200,01
30782.0,"DeKalb & Jackson Counties PUMA, Alabama",00400,01
35000.0,"Houston, Dale, Geneva & Henry Counties--Dothan City PUMA; Alabama",02500,01
49306.0,"Tuscaloosa (Outer) & Pickens Counties--Northport City (North & West) PUMA, Alabama",01500,01
37083.0,"Dallas, Bibb, Marengo, Hale, Sumter, Perry & Greene Counties PUMA; Alabama",01700,01
20265.0,"Talladega, Cherokee, Randolph, Cleburne & Clay Counties PUMA; Alabama",01000,01
29578.0,"Marshall & Madison (Southeast) Counties--Huntsville City (Far Southeast) PUMA, Alabama",00500,01
32787.0,"Walker, Marion (South & West), Fayette & Lamar Counties PUMA; Alabama",01400,01
26966.0,"Chilton, Tallapoosa, Chambers & Coosa Counties PUMA; Alabama",01800,01
28281.0,"Southwest Alabama PUMA, Alabama",02200,01
36748.0,"St. Clair & Blount Counties PUMA, Alabama",00800,01
44219.0,"Lauderdale, Colbert, Franklin & Marion (Northeast) Counties PUMA; Alabama",00100,01
36027.0,"Russell, Pike, Barbour, Macon & Bullock Counties PUMA; Alabama",02400,01
33095.0,"Coffee, Covington, Butler & Crenshaw Counties PUMA; Alabama",02300,01
65170.0,"Mobile County (Outer)--Prichard City, Tillmans Corner & Saraland City PUMA; Alabama",02703,01
45764.0,"Mobile City (East) PUMA, Alabama",02701,01
29699.0,"Mobile City (West) PUMA, Alabama",02702,01
29848.0,"Cullman & Winston Counties PUMA, Alabama",00700,01
46828.0,"Lee County--Auburn City PUMA, Alabama",01900,01
51933.0,"Elmore, Autauga, Montgomery (Outer) & Lowndes Counties PUMA; Alabama",02100,01
39714.0,"Montgomery City & Pike Road Town (North) PUMA, Alabama",02000,01
35465.0,"Morgan & Lawrence Counties--Decatur City PUMA, Alabama",00600,01
33698.0,"Calhoun County PUMA, Alabama",01100,01
30270.0,"Etowah County PUMA, Alabama",00900,01
39614.0,"Tuscaloosa & Northport (Southeast) Cities PUMA, Alabama",01600,01
45276.0,"Shelby County PUMA, Alabama",01200,01
49353.0,"Huntsville (North) & Madison (East) Cities PUMA, Alabama",00301,01
25039.0,"Huntsville City (Central & South) PUMA, Alabama",00302,01
43012.0,"Baldwin County PUMA, Alabama",02600,01
26435.0,"Birmingham City (East) PUMA, Alabama",01302,01
33924.0,"Birmingham City (West) PUMA, Alabama",01301,01
45688.0,"Jefferson County (Southeast)--Hoover (North), Vestavia Hills & Homewood Cities PUMA; Alabama",01303,01
36712.0,"Jefferson County (Northeast)--Trussville, Center Point & Gardendale Cities PUMA; Alabama",01304,01
43906.0,"Jefferson County (West)--Bessemer, Hueytown & Pleasant Grove Cities PUMA; Alabama",01305,01
68883.0,"Anchorage Municipality (South) PUMA, Alaska",00102,02
71625.0,"Subsistence Alaska PUMA, Alaska",00400,02
57500.0,"Matanuska-Susitna & Kenai Peninsula Boroughs PUMA, Alaska",00200,02
63221.0,"Greater Fairbanks, Greater Juneau, Ketchikan Gateway Borough & Road-Connected Alaska PUMA; Alaska",00300,02
60465.0,"Anchorage Municipality (North) PUMA, Alaska",00101,02
51541.0,"Maricopa County (West) & Gila River Indian Community (Northwest) PUMA, Arizona",00134,04
45293.0,"Tucson (West) & Marana Cities PUMA, Arizona",00202,04
42368.0,"Gila, Graham, Greenlee & Pinal (East) Counties PUMA; Arizona",00800,04
44717.0,"Coconino County--Flagstaff City PUMA, Arizona",00400,04
76365.0,"Phoenix (Far North) & Peoria (Northwest) Cities PUMA, Arizona",00129,04
70675.0,"Maricopa County--Goodyear, Glendale (West) & Litchfield Park (Northwest) Cities PUMA; Arizona",00132,04
65567.0,"Maricopa County--Surprise City (Central) PUMA, Arizona",00131,04
45800.0,"Maricopa County--El Mirage City & Sun City PUMA, Arizona",00130,04
70827.0,"Maricopa County (Northeast)--Scottsdale City (Southeast) & Fountain Hills Town PUMA, Arizona",00111,04
73704.0,"Maricopa County--Chandler City (South) PUMA, Arizona",00107,04
52906.0,"Maricopa County--Avondale (Central) & Litchfield Park (Central) Cities PUMA, Arizona",00133,04
79348.0,"Maricopa County--Scottsdale (North), Phoenix (Far Northeast) Cities & Cave Creek PUMA; Arizona",00112,04
50457.0,"Phoenix City (Northeast) PUMA, Arizona",00113,04
75394.0,"Maricopa County--Gilbert Town (North) PUMA, Arizona",00105,04
41790.0,"Phoenix City (Northwest Central) PUMA, Arizona",00115,04
34012.0,"Phoenix City (Northeast Central) PUMA, Arizona",00114,04
39496.0,"Phoenix City (East) PUMA, Arizona",00117,04
31421.0,"Phoenix City--Downtown & Sky Harbor International Airport PUMA, Arizona",00118,04
35102.0,"Maricopa County--Mesa City (West) PUMA, Arizona",00103,04
42531.0,"Maricopa County--Mesa City (South Central) PUMA, Arizona",00104,04
31713.0,"Phoenix City--Maryvale (East) PUMA, Arizona",00122,04
36344.0,"Phoenix City (Uptown) PUMA, Arizona",00116,04
38332.0,"Tucson City (Southeast) PUMA, Arizona",00209,04
41693.0,"Phoenix City (West) PUMA, Arizona",00125,04
33701.0,"Navajo & Apache Counties PUMA, Arizona",00300,04
26839.0,"Tucson City (Northwest) PUMA, Arizona",00207,04
33840.0,"Tucson City (Northeast) PUMA, Arizona",00206,04
64761.0,"Pima County (North Central)--Oro Valley Town PUMA, Arizona",00203,04
31308.0,"Tucson City (South) PUMA, Arizona",00208,04
59621.0,"Pima County (Northeast) PUMA, Arizona",00204,04
59669.0,"Pima County (Southeast)--Tucson City (Far Southeast) & Sahuarita Town PUMA, Arizona",00205,04
42151.0,"Pima County (West) PUMA, Arizona",00201,04
40535.0,"Mohave & La Paz Counties--Lake Havasu City PUMA, Arizona",00600,04
37431.0,"Cochise & Santa Cruz Counties--Sierra Vista City PUMA, Arizona",00900,04
39114.0,"Yuma County--Yuma City PUMA, Arizona",00700,04
44378.0,"Yavapai County PUMA, Arizona",00500,04
54355.0,"Pinal County (North)--Apache Junction City PUMA, Arizona",00803,04
39771.0,"Pinal County (Central)--Florence Town, Eloy (Northeast) & Coolidge Cities PUMA; Arizona",00805,04
45186.0,"Pinal County (West)--Maricopa, Casa Grande & Eloy (Southeast) Cities PUMA; Arizona",00807,04
58110.0,"Maricopa County--Tempe (South) & Chandler (Northwest) Cities PUMA, Arizona",00108,04
40695.0,"Maricopa County--Mesa City (North Central) PUMA, Arizona",00102,04
56657.0,"Maricopa County--Mesa City (East) PUMA, Arizona",00101,04
81879.0,"Maricopa County--Gilbert (South) & Queen Creek Towns PUMA, Arizona",00100,04
60823.0,"Phoenix City--Ahwatukee & South Mountain PUMA, Arizona",00120,04
46647.0,"Phoenix (Southwest) & Tolleson Cities PUMA, Arizona",00121,04
63591.0,"Phoenix City (North) PUMA, Arizona",00128,04
36551.0,"Maricopa County--Glendale City (South) PUMA, Arizona",00124,04
52847.0,"Maricopa County--Peoria City (South & Central) PUMA, Arizona",00127,04
53673.0,"Maricopa County--Glendale City (North) PUMA, Arizona",00126,04
51778.0,"Maricopa County--Scottsdale City (Southwest) & Paradise Valley Town PUMA, Arizona",00110,04
40343.0,"Maricopa County--Tempe City (North) PUMA, Arizona",00109,04
48583.0,"Maricopa County--Chandler City (Northeast) PUMA, Arizona",00106,04
38361.0,"Phoenix City (South) PUMA, Arizona",00119,04
40743.0,"Phoenix City--Maryvale (West) PUMA, Arizona",00123,04
25269.0,"Southeast Arkansas PUMA, Arkansas",01800,05
30268.0,"South Central Arkansas PUMA, Arkansas",01900,05
37692.0,"Baxter, Boone, Carroll, Marion, Madison, Newton & Searcy Counties PUMA; Arkansas",00300,05
20899.0,"Southwest Arkansas PUMA, Arkansas",02000,05
30858.0,"Pope, Johnson, Yell, Conway & Perry Counties PUMA; Arkansas",01300,05
35236.0,"Logan, Polk, Franklin, Sevier, Howard & Scott Counties PUMA; Arkansas",01500,05
30798.0,"Independence, Cleburne, Van Buren, Sharp, Izard, Stone & Fulton Counties PUMA; Arkansas",00400,05
31937.0,"Sebastian & Crawford Counties PUMA, Arkansas",01400,05
38530.0,"Washington County PUMA, Arkansas",00200,05
26310.0,"St. Francis, Poinsett, Phillips, Cross, Lee & Monroe Counties PUMA; Arkansas",00700,05
25826.0,"Jefferson, Grant & Arkansas (Northwest) Counties PUMA; Arkansas",01700,05
33040.0,"Craighead (West), Greene, Randolph, Lawrence & Clay Counties PUMA; Arkansas",00500,05
27143.0,"Garland, Hot Spring, Clark & Montgomery Counties PUMA; Arkansas",01600,05
40121.0,"Crittenden, Mississippi & Craighead (East) Counties PUMA; Arkansas",00600,05
31631.0,"White, Jackson, Prairie & Woodruff Counties PUMA; Arkansas",00800,05
43214.0,"Faulkner & Lonoke Counties PUMA, Arkansas",01100,05
44637.0,"Pulaski County (Outer)--North Little Rock, Sherwood & Jacksonville Cities PUMA; Arkansas",00900,05
34587.0,"Pulaski County (Central)--Little Rock City PUMA, Arkansas",01000,05
49116.0,"Saline County PUMA, Arkansas",01200,05
45771.0,"Benton County PUMA, Arkansas",00100,05
73852.0,"Ventura County (South Central)--Camarillo & Moorpark Cities PUMA, California",11106,06
53240.0,"San Diego County (Central)--El Cajon & Santee Cities PUMA, California",07313,06
41964.0,"San Diego County (Southwest)--Chula Vista (West) & National City Cities PUMA, California",07321,06
65814.0,"Kern County (Central)--Bakersfield City (West) PUMA, California",02902,06
39045.0,"Kern County (Central)--Bakersfield City (Southeast) PUMA, California",02904,06
105772.0,"Los Angeles County--Calabasas, Agoura Hills, Malibu & Westlake Village Cities PUMA; California",03726,06
59086.0,"Ventura County (Southwest)--Oxnard & Port Hueneme Cities PUMA, California",11103,06
62881.0,"Ventura County (Southwest)--San Buenaventura (Ventura) City PUMA, California",11104,06
54371.0,"Ventura County (North)--Santa Paula, Fillmore & Ojai Cities PUMA; California",11105,06
77744.0,"Ventura County (Southeast)--Thousand Oaks City PUMA, California",11102,06
83570.0,"Ventura County (Southeast)--Simi Valley City PUMA, California",11101,06
60823.0,"Los Angeles County (North)--LA City (Northwest/Chatsworth & Porter Ranch) PUMA, California",03705,06
41143.0,"Butte County (Southeast)--Oroville City & Paradise Town PUMA, California",00702,06
40338.0,"Butte County (Northwest)--Chico City PUMA, California",00701,06
68842.0,"Riverside County (Northwest)--Jurupa Valley & Eastvale Cities PUMA, California",06514,06
52032.0,"San Joaquin County (Central)--Stockton City (North) PUMA, California",07701,06
38491.0,"San Joaquin County (Central)--Stockton City (South) PUMA, California",07702,06
65933.0,"San Joaquin County (South)--Tracy, Manteca & Lathrop Cities PUMA; California",07703,06
53919.0,"Riverside County (Northwest)--Riverside City (West) PUMA, California",06511,06
51452.0,"Los Angeles County (South Central)--Long Beach City (North) PUMA, California",03763,06
62163.0,"Los Angeles County (South Central)--Carson City PUMA, California",03762,06
53291.0,"Los Angeles County (West Central)--LA City (West Central/Westwood & West Los Angeles) PUMA, California",03729,06
56208.0,"Los Angeles County (Northwest)--LA City (Northwest/Encino & Tarzana) PUMA, California",03724,06
45488.0,"Los Angeles County (South Central)--Gardena, Lawndale Cities & West Athens PUMA; California",03758,06
55178.0,"Los Angeles County--LA City (Northwest/Canoga Park, Winnetka & Woodland Hills) PUMA; California",03725,06
46818.0,"Los Angeles County (North Central)--Lancaster City PUMA, California",03703,06
51072.0,"Los Angeles County (North Central)--Palmdale City PUMA, California",03704,06
71991.0,"Los Angeles County (Northwest)--Santa Clarita City PUMA, California",03702,06
72675.0,"Los Angeles County (Central)--San Gabriel Valley Region (North) PUMA, California",03709,06
58085.0,"Los Angeles County--Baldwin Park, Azusa, Duarte & Irwindale Cities PUMA; California",03710,06
75534.0,"Los Angeles County (East Central)--Glendora, Claremont, San Dimas & La Verne Cities PUMA; California",03711,06
49567.0,"Los Angeles County (South Central)--Compton City & West Rancho Dominguez PUMA, California",03757,06
37489.0,"Los Angeles County (South Central)--LA City (South Central/Westmont) PUMA, California",03750,06
41358.0,"Los Angeles County (Central)--LA City (Central/West Adams & Baldwin Hills) PUMA, California",03747,06
67384.0,"Los Angeles County (North)--LA City (North Central/Granada Hills & Sylmar) PUMA, California",03706,06
56581.0,"San Diego County (West Central)--San Diego City (Central/Clairemont & Kearny Mesa) PUMA, California",07315,06
55784.0,"San Diego County (Northwest)--San Marcos & Escondido (West) Cities PUMA, California",07305,06
49026.0,"San Bernardino County (Southwest)--Colton, Loma Linda & Grand Terrace Cities PUMA; California",07106,06
63647.0,"San Diego County (Central)--San Diego (East Central/Navajo) & La Mesa Cities PUMA, California",07314,06
40169.0,"San Diego County (South Central)--San Diego City (Central/Mid-City) PUMA, California",07317,06
40650.0,"San Bernardino County (Southwest)--San Bernardino City (West) PUMA, California",07108,06
57161.0,"San Bernardino County (Southwest)--Rialto City PUMA, California",07109,06
48814.0,"San Bernardino County (Southwest)--Fontana City (East) PUMA, California",07110,06
76342.0,"San Bernardino County (Southwest)--Chino & Chino Hills Cities PUMA, California",07114,06
56315.0,"San Bernardino County (Southwest)--Ontario City PUMA, California",07113,06
76676.0,"Los Angeles County (Southwest)--Palos Verdes Peninsula PUMA, California",03768,06
86351.0,"Los Angeles County--Redondo Beach, Manhattan Beach & Hermosa Beach Cities PUMA; California",03760,06
43533.0,"Los Angeles County (South)--LA City (South/San Pedro) PUMA, California",03767,06
76023.0,"Los Angeles County (Southeast)--Long Beach City (East) PUMA, California",03765,06
44367.0,"Los Angeles County (Southeast)--Long Beach (Central) & Signal Hill Cities PUMA, California",03769,06
39540.0,"Los Angeles County (South)--Long Beach City (Southwest & Port) PUMA, California",03766,06
63156.0,"Los Angeles County (North/Unincorporated)--Castaic PUMA, California",03701,06
61026.0,"Los Angeles County--LA (Southwest/Marina del Rey & Westchester) & Culver City Cities PUMA, California",03748,06
51481.0,"Los Angeles County (Southwest)--Santa Monica City PUMA, California",03728,06
77526.0,"Los Angeles County (Central)--LA City (Central/Pacific Palisades) PUMA, California",03727,06
57698.0,"Los Angeles County--LA (North Central/Arleta & Pacoima) & San Fernando Cities PUMA, California",03707,06
64979.0,"Los Angeles County (South Central)--Torrance City PUMA, California",03761,06
46323.0,"Los Angeles County (South Central)--Hawthorne City PUMA, California",03759,06
42574.0,"Los Angeles County (Central)--Inglewood City PUMA, California",03749,06
45645.0,"Los Angeles County (North)--LA City (Northeast/Sunland, Sun Valley & Tujunga) PUMA; California",03708,06
54013.0,"San Diego County (Northwest)--Vista City PUMA, California",07303,06
54972.0,"San Luis Obispo County (West)--Coastal Region PUMA, California",07901,06
52942.0,"San Luis Obispo County (East)--Inland Region PUMA, California",07902,06
51474.0,"Yolo County--Davis, Woodland & West Sacramento Cities PUMA; California",11300,06
78569.0,"San Mateo County (South & West)--San Mateo (South) & Half Moon Bay Cities PUMA, California",08104,06
78387.0,"San Mateo County (North Central)--Daly City, Pacifica Cities & Colma Town PUMA; California",08101,06
64654.0,"Santa Clara County (Northwest)--Mountain View, Palo Alto & Los Altos Cities PUMA; California",08501,06
63088.0,"San Mateo County (Southeast)--Menlo Park, East Palo Alto Cities & Atherton Town PUMA; California",08106,06
61122.0,"San Mateo County (East Central)--Redwood City, San Carlos & Belmont Cities PUMA; California",08105,06
64866.0,"San Mateo County (Central)--San Mateo (North), Burlingame & Millbrae Cities PUMA; California",08103,06
79712.0,"San Mateo County (North Central)--South San Francisco, San Bruno & Brisbane Cities PUMA; California",08102,06
32839.0,"Tulare County (Outside Visalia, Tulare & Porterville Cities) PUMA; California",10703,06
37285.0,"Tulare County (West Central)--Tulare & Porterville Cities PUMA, California",10702,06
44997.0,"Tulare County (Northwest)--Visalia City PUMA, California",10701,06
41021.0,"Madera County--Madera City PUMA, California",03900,06
68550.0,"Santa Clara County (East)--Gilroy, Morgan Hill & San Jose (South) Cities PUMA; California",08506,06
97431.0,"Santa Clara County (Southwest)--Cupertino, Saratoga Cities & Los Gatos Town PUMA; California",08507,06
111849.0,"Santa Clara County (Central)--San Jose City (Southwest/Almaden Valley) PUMA, California",08512,06
83093.0,"Santa Clara County (North Central)--San Jose City (East Central) & Alum Rock PUMA, California",08505,06
74750.0,"Santa Clara County (Central)--San Jose City (Southeast/Evergreen) PUMA, California",08513,06
64947.0,"Santa Clara County (Central)--San Jose (West Central) & Campbell Cities PUMA, California",08508,06
63623.0,"Santa Clara County (Central)--San Jose City (East Central/East Valley) PUMA, California",08514,06
78600.0,"Santa Clara County (Central)--San Jose City (South Central/Branham) & Cambrian Park PUMA, California",08511,06
63647.0,"Santa Clara County (Northwest)--San Jose (Northwest) & Santa Clara Cities PUMA, California",08503,06
62391.0,"Santa Clara County (Central)--San Jose City (Central) PUMA, California",08510,06
54810.0,"Santa Clara County (Central)--San Jose City (Northwest) PUMA, California",08509,06
86324.0,"San Francisco County (North & West)--Richmond District PUMA, California",07501,06
54934.0,"Monterey (South & East) & San Benito Counties PUMA, California",05303,06
58247.0,"Monterey County (North Central)--Seaside, Monterey, Marina & Pacific Grove Cities PUMA; California",05301,06
51998.0,"Monterey County (Northeast)--Salinas City PUMA, California",05302,06
66772.0,"San Francisco County (South Central)--Sunset District (South) PUMA, California",07506,06
111055.0,"San Francisco County (Central)--Sunset District (North) PUMA, California",07505,06
66725.0,"San Francisco County (Central)--Inner Mission & Castro PUMA, California",07504,06
101343.0,"San Francisco County (North & East)--North Beach & Chinatown PUMA, California",07502,06
64810.0,"San Francisco County (South Central)--Bayview & Hunters Point PUMA, California",07507,06
36610.0,"Humboldt County PUMA, California",02300,06
48180.0,"San Francisco County (Central)--South of Market & Potrero PUMA, California",07503,06
61891.0,"Solano County (Southwest)--Vallejo & Benicia Cities PUMA, California",09501,06
60946.0,"Solano County (Northeast)--Vacaville & Dixon Cities PUMA, California",09503,06
63612.0,"Solano County (Central)--Fairfield & Suisun City Cities PUMA, California",09502,06
41992.0,"Imperial County--El Centro City PUMA, California",02500,06
36480.0,"Riverside County (East)--Indio, Coachella, Blythe & La Quinta (East) Cities PUMA; California",06501,06
41624.0,"Riverside County--Palm Desert, La Quinta (West) & Desert Hot Springs Cities PUMA; California",06515,06
51587.0,"Los Angeles County (Central)--Glendale City PUMA, California",03719,06
39829.0,"Los Angeles County (Northwest)--LA City (North Central/Van Nuys & North Sherman Oaks) PUMA, California",03722,06
60890.0,"Los Angeles County (East Central)--Arcadia, San Gabriel & Temple City Cities PUMA; California",03717,06
68894.0,"Los Angeles County (South)--Lakewood, Cerritos, Artesia & Hawaiian Gardens Cities PUMA; California",03764,06
66039.0,"Los Angeles County (Central)--West Hollywood & Beverly Hills Cities PUMA, California",03731,06
57553.0,"Los Angeles County (Central)--Pasadena City PUMA, California",03718,06
41055.0,"Los Angeles County (Central)--El Monte & South El Monte Cities PUMA, California",03738,06
74977.0,"Santa Clara County (Northwest)--Sunnyvale & San Jose (North) Cities PUMA, California",08502,06
79958.0,"Alameda County (Southwest)--Union City, Newark & Fremont (West) Cities PUMA; California",00108,06
66789.0,"Alameda County (Central)--Hayward City PUMA, California",00107,06
57148.0,"Sacramento County (Northwest)--Sacramento City (Northwest/Natomas) PUMA, California",06705,06
95754.0,"Sacramento County (Northeast)--Folsom City, Orangevale & Fair Oaks (East) PUMA; California",06712,06
61157.0,"Sacramento County (South)--Galt, Isleton Cities & Delta Region PUMA; California",06711,06
43816.0,"San Joaquin County (North)--Lodi, Ripon & Escalon Cities PUMA; California",07704,06
45576.0,"Sacramento County (North)--Sacramento City (North), Antelope & Rio Linda PUMA; California",06706,06
70344.0,"Los Angeles County (East Central)--West Covina City PUMA, California",03715,06
63677.0,"Los Angeles County (East Central)--La Puente & Industry Cities PUMA, California",03716,06
75691.0,"Los Angeles County (East Central)--Covina & Walnut Cities PUMA, California",03713,06
53293.0,"Los Angeles County (East Central)--Pomona City PUMA, California",03712,06
47942.0,"Los Angeles County--LA City (Mount Washington, Highland Park & Glassell Park) PUMA; California",03735,06
48988.0,"Los Angeles County (Southeast)--Bellflower & Paramount Cities PUMA, California",03756,06
38912.0,"Los Angeles County (South Central)--LA City (South Central/Watts) PUMA, California",03751,06
47200.0,"Los Angeles County (West Central)--LA City (Central/Hancock Park & Mid-Wilshire) PUMA, California",03730,06
42845.0,"Los Angeles County (North)--LA City (North Central/Mission Hills & Panorama City) PUMA, California",03723,06
59321.0,"Los Angeles County (Central)--Burbank City PUMA, California",03720,06
63825.0,"Los Angeles County (Central)--Alhambra & South Pasadena Cities PUMA, California",03736,06
80041.0,"Los Angeles County--Diamond Bar, La Habra Heights (East) Cities & Rowland Heights PUMA; California",03714,06
35327.0,"Los Angeles County--LA City (Central/Univ. of Southern California & Exposition Park) PUMA, California",03746,06
41670.0,"Los Angeles County (North)--LA City (Northeast/North Hollywood & Valley Village) PUMA, California",03721,06
48428.0,"Los Angeles County (Central)--Monterey Park & Rosemead Cities PUMA, California",03737,06
38778.0,"Los Angeles County (Central)--Huntington Park City, Florence-Graham & Walnut Park PUMA; California",03742,06
67705.0,"Los Angeles County (Southeast)--La Mirada & Santa Fe Springs Cities PUMA, California",03754,06
62508.0,"Los Angeles County (Southeast)--Norwalk City PUMA, California",03755,06
46837.0,"Los Angeles County (South)--South Gate & Lynwood Cities PUMA, California",03752,06
34852.0,"Los Angeles County (Central)--LA City (Southeast/East Vernon) PUMA, California",03745,06
37089.0,"Los Angeles County (Central)--LA City (East Central/Hollywood) PUMA, California",03732,06
74008.0,"Los Angeles County (Southeast)--Whittier City & Hacienda Heights PUMA, California",03739,06
67600.0,"Los Angeles County (South)--Downey City PUMA, California",03753,06
32498.0,"Los Angeles County--LA City (East Central/Silver Lake, Echo Park & Westlake) PUMA; California",03734,06
34394.0,"Los Angeles County (Central)--LA City (Central/Koreatown) PUMA, California",03733,06
53851.0,"Los Angeles County (Central)--Pico Rivera & Montebello Cities PUMA, California",03740,06
34813.0,"Los Angeles County (Central)--LA City (East Central/Central City & Boyle Heights) PUMA, California",03744,06
39561.0,"Los Angeles County (Central)--Bell Gardens, Bell, Maywood, Cudahy & Commerce Cities PUMA; California",03741,06
42868.0,"Los Angeles County (Central)--East Los Angeles PUMA, California",03743,06
66423.0,"Alameda County (West)--San Leandro, Alameda & Oakland (Southwest) Cities PUMA; California",00105,06
78693.0,"Alameda County (Northeast)--Oakland (East) & Piedmont Cities PUMA, California",00103,06
52102.0,"Alameda County (Northwest)--Oakland (Northwest) & Emeryville Cities PUMA, California",00102,06
66941.0,"Alameda County (North Central)--Castro Valley, San Lorenzo & Ashland PUMA; California",00106,06
51572.0,"Alameda County (North Central)--Oakland City (South Central) PUMA, California",00104,06
52734.0,"Alpine, Amador, Calaveras, Inyo, Mariposa, Mono & Tuolumne Counties PUMA; California",00300,06
68136.0,"Placer County (East/High Country Region)--Auburn & Colfax Cities PUMA, California",06103,06
59937.0,"Placer County (Southwest)--Roseville City PUMA, California",06101,06
77068.0,"Placer County (Central)--Rocklin, Lincoln Cities & Loomis Town PUMA; California",06102,06
58182.0,"El Dorado County--El Dorado Hills PUMA, California",01700,06
52171.0,"Santa Cruz County (South & Coastal)--Santa Cruz City PUMA, California",08702,06
52917.0,"Santa Cruz County (North)--Watsonville & Scotts Valley Cities PUMA, California",08701,06
39383.0,"Merced County (Northeast)--Merced & Atwater Cities PUMA, California",04702,06
44923.0,"Merced County (West & South)--Los Banos & Livingston Cities PUMA, California",04701,06
36269.0,"Lake & Mendocino Counties PUMA, California",03300,06
32219.0,"Del Norte, Lassen, Modoc, Plumas & Siskiyou Counties PUMA; California",01500,06
45334.0,"Colusa, Glenn, Tehama & Trinity Counties PUMA; California",01100,06
59520.0,"Santa Barbara County--South Coast Region PUMA, California",08303,06
49236.0,"Santa Barbara County (North)--Lompoc, Guadalupe, Solvang & Buellton Cities PUMA; California",08302,06
52444.0,"Santa Barbara County (Northwest)--Santa Maria City & Orcutt PUMA, California",08301,06
43112.0,"Sutter & Yuba Counties--Yuba City PUMA, California",10100,06
63503.0,"Marin County (North & West)--Novato & San Rafael (North) Cities PUMA, California",04101,06
53671.0,"Marin County (Southeast)--San Rafael (South), Mill Valley & Sausalito Cities PUMA; California",04102,06
45688.0,"Nevada & Sierra Counties PUMA, California",05700,06
60787.0,"Napa County--Napa City PUMA, California",05500,06
40366.0,"Kings County--Hanford City PUMA, California",03100,06
77333.0,"Contra Costa County (Far Northwest)--Richmond (North), Hercules & El Cerrito Cites PUMA; California",01302,06
48531.0,"Contra Costa County (Far Southwest)--Richmond (Southwest) & San Pablo Cities PUMA, California",01301,06
62803.0,"Contra Costa County (Northwest)--Concord (West), Martinez & Pleasant Hill Cities PUMA; California",01303,06
67796.0,"Orange County (Central)--Orange & Villa Park Cities PUMA, California",05911,06
83750.0,"Orange County (South Central)--Mission Viejo & Rancho Santa Margarita (West) Cities PUMA, California",05902,06
77558.0,"Orange County (North)--Yorba Linda, La Habra & Brea Cities PUMA; California",05906,06
