2807.0,2349.0,62.0,2287.0,1347.0,188.0,1956.0,777.0,260.0,105.0,0.0,10.0,448.0,"Village of Oak Creek (Big Park), AZ Urban Cluster (2010)",90640
21608.0,17217.0,161.0,17056.0,8650.0,942.0,15746.0,8005.0,673.0,126.0,87.0,696.0,3695.0,"Villas, NJ Urbanized Area (2010)",90658
3782.0,1806.0,0.0,1806.0,1239.0,503.0,1172.0,486.0,170.0,54.0,0.0,89.0,1887.0,"Ville Platte, LA Urban Cluster (2010)",90676
34296.0,25020.0,203.0,24817.0,13079.0,1291.0,23057.0,11165.0,811.0,147.0,96.0,1639.0,7637.0,"Vineland, NJ Urbanized Area (2010)",90730
3683.0,2779.0,23.0,2756.0,1325.0,79.0,2598.0,1341.0,119.0,62.0,0.0,252.0,652.0,"Vineyard Haven, MA Urban Cluster (2010)",90757
2126.0,1238.0,16.0,1222.0,763.0,207.0,894.0,391.0,129.0,35.0,8.0,85.0,803.0,"Vinita, OK Urban Cluster (2010)",90784
1949.0,1372.0,44.0,1328.0,767.0,96.0,1095.0,480.0,102.0,64.0,17.0,66.0,511.0,"Vinton, IA Urban Cluster (2010)",90811
944.0,601.0,12.0,589.0,267.0,67.0,489.0,314.0,50.0,8.0,0.0,27.0,316.0,"Vinton, LA Urban Cluster (2010)",90838
1816.0,1419.0,12.0,1407.0,849.0,125.0,1046.0,426.0,308.0,81.0,25.0,66.0,331.0,"Virden, IL Urban Cluster (2010)",90851
6029.0,4325.0,56.0,4269.0,2425.0,582.0,3463.0,1654.0,384.0,105.0,13.0,316.0,1388.0,"Virginia, MN Urban Cluster (2010)",90865
544510.0,449797.0,2087.0,447710.0,298102.0,44877.0,393225.0,142063.0,16080.0,1856.0,375.0,21038.0,73675.0,"Virginia Beach, VA Urbanized Area (2010)",90892
1806.0,1113.0,30.0,1083.0,472.0,109.0,935.0,555.0,69.0,26.0,0.0,63.0,630.0,"Viroqua, WI Urban Cluster (2010)",90919
71238.0,54024.0,447.0,53577.0,35562.0,8116.0,42743.0,16369.0,4029.0,830.0,119.0,2247.0,14967.0,"Visalia, CA Urbanized Area (2010)",90946
2852.0,2818.0,7.0,2811.0,2115.0,164.0,2516.0,587.0,252.0,13.0,37.0,8.0,26.0,"Vistancia, AZ Urban Cluster (2010)",90959
1135.0,498.0,0.0,498.0,299.0,65.0,378.0,167.0,47.0,32.0,0.0,135.0,502.0,"Vivian, LA Urban Cluster (2010)",90973
3127.0,2483.0,7.0,2476.0,1444.0,170.0,2214.0,957.0,150.0,29.0,9.0,91.0,553.0,"Waverly, IA Urban Cluster (2010)",93079
31241.0,25083.0,231.0,24852.0,16056.0,2257.0,21831.0,8170.0,1095.0,179.0,20.0,856.0,5302.0,"Wausau, WI Urbanized Area (2010)",93025
2778.0,2155.0,24.0,2131.0,1414.0,327.0,1711.0,655.0,232.0,14.0,0.0,114.0,509.0,"Wauseon, OH Urban Cluster (2010)",93052
970.0,604.0,0.0,604.0,334.0,94.0,483.0,239.0,18.0,0.0,17.0,52.0,314.0,"Wautoma, WI Urban Cluster (2010)",93065
1138.0,1031.0,0.0,1031.0,611.0,130.0,869.0,356.0,56.0,14.0,14.0,24.0,83.0,"Waverly, NE Urban Cluster (2010)",93092
1399.0,1009.0,0.0,1009.0,664.0,300.0,618.0,326.0,69.0,19.0,0.0,38.0,352.0,"Waverly, TN Urban Cluster (2010)",93106
2896.0,1923.0,14.0,1909.0,939.0,213.0,1631.0,922.0,65.0,35.0,0.0,85.0,888.0,"Waverly City, OH Urban Cluster (2010)",93133
9648.0,6335.0,45.0,6290.0,2770.0,495.0,5406.0,3038.0,670.0,246.0,0.0,555.0,2758.0,"Waycross, GA Urban Cluster (2010)",93187
1611.0,1212.0,33.0,1179.0,747.0,183.0,938.0,429.0,61.0,3.0,0.0,61.0,338.0,"Wayland, MI Urban Cluster (2010)",93214
1911.0,1596.0,0.0,1596.0,1060.0,222.0,1286.0,454.0,87.0,61.0,11.0,42.0,273.0,"Wayne, NE Urban Cluster (2010)",93241
2023.0,1304.0,30.0,1274.0,971.0,434.0,821.0,289.0,79.0,4.0,0.0,41.0,678.0,"Waynesboro, GA Urban Cluster (2010)",93268
1607.0,819.0,0.0,819.0,453.0,138.0,669.0,349.0,37.0,0.0,0.0,165.0,623.0,"Waynesboro, MS Urban Cluster (2010)",93295
10863.0,8521.0,204.0,8317.0,4091.0,629.0,7525.0,3921.0,259.0,37.0,10.0,279.0,2063.0,"Waynesboro, PA--MD Urban Cluster (2010)",93322
2523.0,1888.0,10.0,1878.0,1279.0,285.0,1541.0,535.0,76.0,10.0,16.0,90.0,545.0,"Waynesburg, PA Urban Cluster (2010)",93376
4235.0,3550.0,32.0,3518.0,2092.0,297.0,3033.0,1197.0,192.0,69.0,61.0,175.0,510.0,"Weatherford, OK Urban Cluster (2010)",93457
14194.0,11926.0,84.0,11842.0,8245.0,1263.0,9261.0,2894.0,1709.0,347.0,38.0,461.0,1807.0,"Weatherford, TX Urban Cluster (2010)",93484
3155.0,2154.0,0.0,2154.0,1253.0,171.0,1774.0,780.0,283.0,107.0,0.0,166.0,835.0,"Webster City, IA Urban Cluster (2010)",93511
1831.0,1662.0,0.0,1662.0,863.0,86.0,1531.0,747.0,88.0,21.0,0.0,65.0,104.0,"Wedgefield, FL Urban Cluster (2010)",93525
965.0,612.0,18.0,594.0,226.0,16.0,564.0,327.0,47.0,14.0,0.0,38.0,315.0,"Welch, WV Urban Cluster (2010)",93646
1267.0,923.0,12.0,911.0,591.0,92.0,804.0,286.0,19.0,8.0,3.0,78.0,266.0,"Weedsport, NY Urban Cluster (2010)",93565
29486.0,20888.0,153.0,20735.0,12157.0,2255.0,17726.0,8013.0,1115.0,196.0,69.0,909.0,7689.0,"Weirton--Steubenville, WV--OH--PA Urbanized Area (2010)",93592
1953.0,1200.0,2.0,1198.0,691.0,186.0,868.0,407.0,155.0,73.0,1.0,91.0,662.0,"Weiser, ID--OR Urban Cluster (2010)",93619
2451.0,2179.0,0.0,2179.0,1523.0,93.0,1890.0,600.0,401.0,0.0,0.0,20.0,252.0,"Wellington, CO Urban Cluster (2010)",93673
3060.0,2125.0,26.0,2099.0,1070.0,200.0,1832.0,944.0,58.0,20.0,16.0,234.0,701.0,"Wellington, KS Urban Cluster (2010)",93700
2071.0,1441.0,15.0,1426.0,788.0,182.0,1085.0,551.0,187.0,39.0,25.0,91.0,539.0,"Wellington, OH Urban Cluster (2010)",93727
2653.0,1846.0,40.0,1806.0,980.0,168.0,1574.0,719.0,99.0,32.0,25.0,131.0,676.0,"Wellsville, NY Urban Cluster (2010)",93808
885.0,588.0,0.0,588.0,360.0,99.0,453.0,206.0,51.0,9.0,0.0,29.0,268.0,"Welsh, LA Urban Cluster (2010)",93835
25338.0,19844.0,175.0,19669.0,10805.0,1382.0,17438.0,8128.0,1278.0,319.0,89.0,850.0,4644.0,"Wenatchee, WA Urbanized Area (2010)",93862
909.0,635.0,7.0,628.0,225.0,54.0,527.0,356.0,47.0,30.0,0.0,4.0,270.0,"Wendell, ID Urban Cluster (2010)",93871
5009.0,4205.0,0.0,4205.0,2604.0,160.0,3882.0,1370.0,445.0,101.0,0.0,107.0,697.0,"Wendell--Zebulon, NC Urban Cluster (2010)",93880
1113.0,808.0,12.0,796.0,394.0,96.0,635.0,352.0,120.0,44.0,0.0,63.0,242.0,"West, TX Urban Cluster (2010)",93889
28493.0,23171.0,172.0,22999.0,13642.0,1372.0,20866.0,8731.0,989.0,233.0,57.0,687.0,4635.0,"West Bend, WI Urbanized Area (2010)",93916
1837.0,1281.0,7.0,1274.0,722.0,92.0,1093.0,477.0,278.0,20.0,0.0,135.0,421.0,"West Columbia, TX Urban Cluster (2010)",93970
3340.0,2554.0,8.0,2546.0,1619.0,263.0,2218.0,892.0,94.0,14.0,0.0,86.0,700.0,"Salem, IL Urban Cluster (2010)",78094
4008.0,3324.0,36.0,3288.0,1881.0,311.0,2917.0,1353.0,93.0,15.0,2.0,113.0,571.0,"St. Peter, MN Urban Cluster (2010)",78013
6108.0,5376.0,0.0,5376.0,3541.0,387.0,4921.0,1790.0,312.0,35.0,5.0,196.0,536.0,"St. Simons, GA Urban Cluster (2010)",78026
2112.0,1359.0,19.0,1340.0,792.0,297.0,963.0,489.0,120.0,26.0,0.0,102.0,651.0,"Salamanca, NY Urban Cluster (2010)",78067
2819.0,1810.0,17.0,1793.0,1019.0,143.0,1521.0,679.0,168.0,59.0,11.0,147.0,862.0,"Salem, IN Urban Cluster (2010)",78121
1966.0,1258.0,9.0,1249.0,715.0,83.0,1118.0,510.0,100.0,24.0,0.0,74.0,634.0,"Salem, MO Urban Cluster (2010)",78148
2279.0,1335.0,9.0,1326.0,559.0,80.0,1199.0,690.0,47.0,25.0,11.0,131.0,813.0,"Salem, NJ Urban Cluster (2010)",78175
7653.0,5585.0,21.0,5564.0,3389.0,457.0,4895.0,2006.0,371.0,59.0,0.0,265.0,1803.0,"Salem, OH Urban Cluster (2010)",78202
89124.0,74069.0,535.0,73534.0,49285.0,8556.0,61959.0,22062.0,4320.0,1211.0,199.0,2755.0,12300.0,"Salem, OR Urbanized Area (2010)",78229
3116.0,2351.0,11.0,2340.0,1240.0,194.0,2029.0,946.0,189.0,46.0,0.0,179.0,586.0,"Salida, CO Urban Cluster (2010)",78256
19272.0,14457.0,58.0,14399.0,8412.0,1218.0,12659.0,5485.0,825.0,97.0,68.0,970.0,3845.0,"Salina, KS Urban Cluster (2010)",78283
50735.0,38732.0,194.0,38538.0,25826.0,6634.0,28689.0,9075.0,5231.0,2032.0,55.0,1508.0,10495.0,"Salinas, CA Urbanized Area (2010)",78310
37010.0,27200.0,193.0,27007.0,14837.0,2228.0,24036.0,11343.0,1146.0,210.0,72.0,1657.0,8153.0,"Salisbury, MD--DE Urbanized Area (2010)",78364
3167.0,2256.0,14.0,2242.0,1451.0,435.0,1710.0,749.0,97.0,18.0,3.0,155.0,756.0,"Sallisaw, OK Urban Cluster (2010)",78418
1416.0,961.0,41.0,920.0,442.0,80.0,745.0,397.0,126.0,72.0,0.0,59.0,396.0,"Salmon, ID Urban Cluster (2010)",78445
1705.0,1279.0,31.0,1248.0,796.0,217.0,990.0,356.0,97.0,21.0,0.0,78.0,348.0,"Saltillo, MS Urban Cluster (2010)",78472
358731.0,299896.0,2279.0,297617.0,196549.0,26177.0,256973.0,89807.0,24403.0,4472.0,921.0,21753.0,37082.0,"Salt Lake City--West Valley City, UT Urbanized Area (2010)",78499
1181.0,532.0,7.0,525.0,463.0,236.0,258.0,54.0,13.0,0.0,0.0,63.0,586.0,"Saluda, SC Urban Cluster (2010)",78526
36504.0,26421.0,159.0,26262.0,15344.0,2643.0,22732.0,10288.0,1388.0,318.0,0.0,1429.0,8654.0,"San Angelo, TX Urbanized Area (2010)",78553
651449.0,505111.0,2258.0,502853.0,320714.0,59315.0,427179.0,166239.0,34236.0,5118.0,1725.0,28286.0,118052.0,"San Antonio, TX Urbanized Area (2010)",78580
978.0,277.0,0.0,277.0,111.0,56.0,202.0,130.0,39.0,0.0,0.0,186.0,515.0,"San Carlos, AZ Urban Cluster (2010)",78607
2798.0,1731.0,3.0,1728.0,708.0,100.0,1482.0,830.0,220.0,102.0,21.0,87.0,980.0,"Sandersville, GA Urban Cluster (2010)",78634
1066816.0,932282.0,3712.0,928570.0,619221.0,58286.0,849576.0,285248.0,62256.0,6768.0,1399.0,21878.0,112656.0,"San Diego, CA Urbanized Area (2010)",78661
1558.0,768.0,0.0,768.0,514.0,113.0,655.0,240.0,19.0,0.0,0.0,0.0,790.0,"San Diego, TX Urban Cluster (2010)",78688
5173.0,3713.0,23.0,3690.0,2062.0,401.0,3054.0,1449.0,279.0,130.0,18.0,114.0,1346.0,"Sandpoint, ID Urban Cluster (2010)",78715
20459.0,15373.0,49.0,15324.0,10187.0,1641.0,13302.0,4793.0,661.0,99.0,57.0,810.0,4276.0,"Sandusky, OH Urban Cluster (2010)",78769
1283314.0,1105648.0,5299.0,1100349.0,791164.0,73946.0,1000794.0,286382.0,47564.0,5685.0,2755.0,32677.0,144989.0,"San Francisco--Oakland, CA Urbanized Area (2010)",78904
3895.0,3355.0,15.0,3340.0,2373.0,368.0,2758.0,772.0,245.0,58.0,68.0,85.0,455.0,"Sandy, OR Urban Cluster (2010)",78823
6015.0,4277.0,70.0,4207.0,2318.0,434.0,3643.0,1784.0,160.0,48.0,22.0,266.0,1472.0,"Sanford, ME Urban Cluster (2010)",78850
12559.0,9155.0,82.0,9073.0,6066.0,840.0,7589.0,2511.0,885.0,186.0,49.0,659.0,2745.0,"Sanford, NC Urban Cluster (2010)",78877
7588.0,5369.0,12.0,5357.0,3529.0,949.0,4158.0,1640.0,323.0,38.0,21.0,209.0,2010.0,"Sanger, CA Urban Cluster (2010)",78931
2358.0,1905.0,0.0,1905.0,1036.0,248.0,1522.0,840.0,266.0,0.0,0.0,101.0,352.0,"Sanger, TX Urban Cluster (2010)",78958
38554.0,11492.0,262.0,11230.0,6540.0,1922.0,8825.0,4388.0,436.0,191.0,12.0,565.0,26497.0,"San Germán--Cabo Rojo--Sabana Grande, PR Urbanized Area (2010)",78985
1096.0,759.0,8.0,751.0,440.0,105.0,556.0,276.0,79.0,25.0,0.0,59.0,278.0,"Sandusky, MI Urban Cluster (2010)",78742
60861.0,43824.0,349.0,43475.0,24536.0,4320.0,38039.0,17791.0,2069.0,542.0,74.0,3904.0,13133.0,"Topeka, KS Urbanized Area (2010)",88084
1914.0,1495.0,13.0,1482.0,929.0,92.0,1369.0,518.0,131.0,0.0,0.0,124.0,295.0,"Tonganoxie, KS Urban Cluster (2010)",88003
1189.0,885.0,10.0,875.0,618.0,134.0,677.0,217.0,73.0,26.0,4.0,38.0,266.0,"Tonkawa, OK Urban Cluster (2010)",88030
10525.0,8962.0,52.0,8910.0,6228.0,1642.0,6214.0,2130.0,1281.0,406.0,0.0,244.0,1319.0,"Tooele, UT Urban Cluster (2010)",88057
4127.0,2614.0,32.0,2582.0,1494.0,537.0,1915.0,1023.0,134.0,35.0,0.0,93.0,1420.0,"Toppenish, WA Urban Cluster (2010)",88111
520.0,281.0,15.0,266.0,172.0,69.0,154.0,64.0,30.0,30.0,0.0,49.0,190.0,"Tornillo, TX Urban Cluster (2010)",88165
17267.0,13484.0,30.0,13454.0,6405.0,544.0,12731.0,6775.0,286.0,52.0,27.0,478.0,3305.0,"Torrington, CT Urban Cluster (2010)",88192
3029.0,2198.0,25.0,2173.0,1186.0,271.0,1656.0,867.0,239.0,78.0,0.0,104.0,727.0,"Torrington, WY Urban Cluster (2010)",88219
2024.0,1415.0,56.0,1359.0,611.0,59.0,1246.0,691.0,89.0,23.0,8.0,46.0,563.0,"Towanda, PA Urban Cluster (2010)",88246
26782.0,24308.0,124.0,24184.0,15397.0,2423.0,21135.0,8095.0,1530.0,204.0,59.0,743.0,1731.0,"Tracy, CA Urbanized Area (2010)",88273
20798.0,16786.0,80.0,16706.0,10535.0,1233.0,15104.0,5856.0,455.0,70.0,24.0,904.0,3108.0,"Traverse City, MI Urban Cluster (2010)",88300
1084.0,1017.0,0.0,1017.0,530.0,0.0,976.0,487.0,88.0,0.0,0.0,0.0,67.0,"Treasure Lake, PA Urban Cluster (2010)",88327
3203.0,2618.0,35.0,2583.0,1371.0,121.0,2094.0,889.0,398.0,237.0,0.0,71.0,514.0,"Tremonton, UT Urban Cluster (2010)",88354
635.0,339.0,2.0,337.0,156.0,40.0,285.0,162.0,27.0,9.0,0.0,34.0,262.0,"Trenton, FL Urban Cluster (2010)",88371
998.0,602.0,9.0,593.0,333.0,99.0,474.0,236.0,37.0,20.0,0.0,68.0,328.0,"Trenton, GA Urban Cluster (2010)",88381
1027.0,842.0,21.0,821.0,526.0,71.0,712.0,252.0,97.0,19.0,5.0,30.0,155.0,"Trenton, IL Urban Cluster (2010)",88408
2124.0,1498.0,40.0,1458.0,878.0,324.0,987.0,529.0,171.0,36.0,0.0,58.0,568.0,"Trenton, MO Urban Cluster (2010)",88435
104853.0,82670.0,535.0,82135.0,49711.0,6300.0,74738.0,30726.0,2000.0,205.0,149.0,3682.0,18501.0,"Trenton, NJ Urbanized Area (2010)",88462
1518.0,681.0,9.0,672.0,534.0,72.0,477.0,104.0,175.0,6.0,28.0,182.0,655.0,"Trenton, TN Urban Cluster (2010)",88489
3281.0,2613.0,45.0,2568.0,1355.0,354.0,2088.0,1117.0,170.0,48.0,0.0,105.0,563.0,"Tri-City--Myrtle Creek, OR Urban Cluster (2010)",88504
3690.0,2496.0,53.0,2443.0,1613.0,289.0,2028.0,729.0,287.0,64.0,0.0,171.0,1023.0,"Trinidad, CO Urban Cluster (2010)",88516
1560.0,766.0,50.0,716.0,474.0,168.0,528.0,216.0,41.0,6.0,0.0,61.0,733.0,"Trinity, TX Urban Cluster (2010)",88526
5770.0,3863.0,160.0,3703.0,1972.0,607.0,2894.0,1589.0,304.0,53.0,10.0,194.0,1713.0,"Troy, AL Urban Cluster (2010)",88543
4748.0,3778.0,38.0,3740.0,2630.0,395.0,3235.0,1014.0,347.0,17.0,3.0,155.0,815.0,"Troy, MO Urban Cluster (2010)",88570
1202.0,695.0,15.0,680.0,461.0,184.0,404.0,196.0,88.0,10.0,0.0,26.0,481.0,"Troy, NC Urban Cluster (2010)",88597
4681.0,4339.0,22.0,4317.0,3030.0,252.0,3967.0,1211.0,305.0,50.0,0.0,108.0,234.0,"Truckee, CA Urban Cluster (2010)",88624
2745.0,1739.0,17.0,1722.0,1160.0,326.0,1354.0,515.0,85.0,14.0,0.0,68.0,938.0,"Trumann, AR Urban Cluster (2010)",88651
3678.0,2087.0,91.0,1996.0,875.0,259.0,1459.0,924.0,298.0,160.0,11.0,255.0,1336.0,"Truth or Consequences, NM Urban Cluster (2010)",88678
2533.0,953.0,77.0,876.0,224.0,163.0,476.0,386.0,249.0,174.0,25.0,154.0,1426.0,"Tuba City, AZ Urban Cluster (2010)",88705
1533.0,1096.0,0.0,1096.0,579.0,192.0,791.0,384.0,105.0,22.0,67.0,54.0,383.0,"Tulia, TX Urban Cluster (2010)",88894
342587.0,277478.0,1999.0,275479.0,183695.0,32841.0,232267.0,83800.0,16545.0,2991.0,938.0,13812.0,51297.0,"Tucson, AZ Urbanized Area (2010)",88732
1750.0,886.0,31.0,855.0,403.0,53.0,705.0,378.0,139.0,53.0,0.0,39.0,825.0,"Tucumcari, NM Urban Cluster (2010)",88813
1225.0,775.0,0.0,775.0,441.0,111.0,604.0,334.0,60.0,0.0,0.0,0.0,450.0,"Tularosa, NM Urban Cluster (2010)",88867
7528.0,5278.0,0.0,5278.0,2739.0,354.0,4789.0,2340.0,214.0,34.0,18.0,607.0,1643.0,"Tullahoma, TN Urban Cluster (2010)",88921
268685.0,214030.0,898.0,213132.0,148220.0,25340.0,181784.0,59601.0,11152.0,1753.0,285.0,9130.0,45525.0,"Tulsa, OK Urbanized Area (2010)",88948
1399.0,754.0,6.0,748.0,498.0,176.0,530.0,194.0,43.0,33.0,0.0,113.0,532.0,"Tunica, MS Urban Cluster (2010)",88975
1517.0,1109.0,0.0,1109.0,616.0,277.0,674.0,431.0,158.0,57.0,0.0,60.0,348.0,"West Wendover, NV--UT Urban Cluster (2010)",94591
2838.0,1570.0,37.0,1533.0,988.0,393.0,770.0,293.0,459.0,216.0,5.0,117.0,1151.0,"West Tawakoni, TX Urban Cluster (2010)",94520
1235.0,557.0,0.0,557.0,392.0,100.0,446.0,165.0,28.0,0.0,0.0,82.0,596.0,"West Union, OH Urban Cluster (2010)",94537
886.0,695.0,15.0,680.0,233.0,41.0,563.0,382.0,89.0,44.0,3.0,30.0,161.0,"Westville, IN Urban Cluster (2010)",94564
2824.0,1993.0,0.0,1993.0,1332.0,147.0,1846.0,661.0,10.0,0.0,0.0,172.0,659.0,"Wetumpka, AL Urban Cluster (2010)",94618
1154.0,650.0,35.0,615.0,345.0,106.0,472.0,248.0,81.0,7.0,1.0,74.0,430.0,"Wewoka, OK Urban Cluster (2010)",94645
797.0,575.0,0.0,575.0,256.0,91.0,484.0,302.0,0.0,0.0,0.0,52.0,170.0,"Weyers Cave, VA Urban Cluster (2010)",94658
3352.0,1801.0,27.0,1774.0,1058.0,339.0,1259.0,624.0,158.0,79.0,0.0,180.0,1371.0,"Wharton, TX Urban Cluster (2010)",94672
1222.0,1138.0,0.0,1138.0,651.0,149.0,969.0,456.0,55.0,0.0,0.0,0.0,84.0,"Wheatland, CA Urban Cluster (2010)",94685
1549.0,1099.0,7.0,1092.0,641.0,98.0,847.0,309.0,235.0,115.0,0.0,52.0,398.0,"Wheatland, WY Urban Cluster (2010)",94699
33865.0,22910.0,178.0,22732.0,12010.0,2154.0,20033.0,10055.0,866.0,183.0,60.0,1419.0,9536.0,"Wheeling, WV--OH Urbanized Area (2010)",94726
1359.0,1234.0,10.0,1224.0,603.0,48.0,1128.0,528.0,151.0,48.0,0.0,0.0,125.0,"Whispering Pines, NC Urban Cluster (2010)",94739
3253.0,2823.0,9.0,2814.0,1489.0,215.0,2491.0,1232.0,161.0,61.0,0.0,82.0,348.0,"Whitefish, MT Urban Cluster (2010)",94753
1580.0,1004.0,21.0,983.0,536.0,158.0,774.0,419.0,62.0,23.0,0.0,45.0,531.0,"White Hall, IL Urban Cluster (2010)",94780
4256.0,3340.0,34.0,3306.0,1734.0,263.0,2931.0,1480.0,144.0,43.0,29.0,160.0,756.0,"Whitehall, MI Urban Cluster (2010)",94807
2103.0,1938.0,0.0,1938.0,1280.0,182.0,1620.0,614.0,163.0,26.0,8.0,26.0,139.0,"Whiteman AFB, MO Urban Cluster (2010)",94870
1208.0,707.0,6.0,701.0,489.0,145.0,541.0,212.0,28.0,0.0,0.0,136.0,365.0,"White Pine, TN Urban Cluster (2010)",94879
1501.0,480.0,5.0,475.0,327.0,130.0,311.0,81.0,40.0,26.0,8.0,22.0,999.0,"Whiteriver, AZ Urban Cluster (2010)",94888
1954.0,1805.0,12.0,1793.0,1061.0,62.0,1636.0,653.0,187.0,52.0,0.0,0.0,149.0,"White Rock, NM Urban Cluster (2010)",94915
1694.0,1060.0,32.0,1028.0,703.0,45.0,880.0,243.0,105.0,41.0,15.0,133.0,501.0,"Whitesboro, TX Urban Cluster (2010)",94942
1335.0,908.0,23.0,885.0,621.0,182.0,693.0,264.0,16.0,0.0,0.0,38.0,389.0,"White Sulphur Springs, WV Urban Cluster (2010)",94969
2874.0,1895.0,7.0,1888.0,1172.0,239.0,1585.0,593.0,38.0,8.0,49.0,205.0,774.0,"Whiteville, NC Urban Cluster (2010)",94996
2368.0,1675.0,0.0,1675.0,885.0,200.0,1301.0,578.0,254.0,130.0,0.0,59.0,634.0,"St. Clair, MO Urban Cluster (2010)",77311
1079.0,811.0,4.0,807.0,531.0,85.0,644.0,200.0,108.0,27.0,8.0,77.0,191.0,"St. Anthony, ID Urban Cluster (2010)",77203
31189.0,24985.0,226.0,24759.0,14222.0,2050.0,22033.0,9829.0,1369.0,240.0,91.0,1501.0,4703.0,"St. Augustine, FL Urbanized Area (2010)",77230
1034.0,775.0,0.0,775.0,424.0,58.0,678.0,336.0,24.0,15.0,0.0,41.0,218.0,"St. Charles, MN Urban Cluster (2010)",77284
43921.0,35737.0,229.0,35508.0,21436.0,2920.0,30889.0,13035.0,2052.0,587.0,90.0,2736.0,5448.0,"St. Cloud, MN Urbanized Area (2010)",77338
2873.0,2503.0,40.0,2463.0,1631.0,165.0,2231.0,763.0,189.0,24.0,0.0,58.0,312.0,"St. Helena, CA Urban Cluster (2010)",77500
1820.0,1228.0,22.0,1206.0,703.0,182.0,901.0,460.0,122.0,43.0,0.0,29.0,563.0,"Ste. Genevieve, MO Urban Cluster (2010)",77365
2223.0,2026.0,71.0,1955.0,1112.0,199.0,1670.0,755.0,132.0,31.0,10.0,42.0,155.0,"St. Francis, MN Urban Cluster (2010)",77392
37768.0,31867.0,328.0,31539.0,20062.0,3250.0,25033.0,9539.0,4336.0,1347.0,117.0,1450.0,4451.0,"St. George, UT Urbanized Area (2010)",77446
10118.0,8617.0,46.0,8571.0,5486.0,724.0,7448.0,2815.0,594.0,94.0,34.0,256.0,1245.0,"St. Helens, OR Urban Cluster (2010)",77527
1264.0,917.0,6.0,911.0,522.0,45.0,840.0,366.0,20.0,8.0,0.0,49.0,298.0,"St. Ignace, MI Urban Cluster (2010)",77554
1787.0,1003.0,0.0,1003.0,537.0,171.0,738.0,358.0,97.0,21.0,0.0,112.0,672.0,"St. James, MN Urban Cluster (2010)",77581
1641.0,1178.0,0.0,1178.0,543.0,131.0,1020.0,617.0,27.0,18.0,0.0,81.0,382.0,"St. James, MO Urban Cluster (2010)",77608
1714.0,1659.0,13.0,1646.0,1112.0,57.0,1579.0,534.0,78.0,0.0,0.0,19.0,36.0,"St. James, NC Urban Cluster (2010)",77618
820.0,489.0,0.0,489.0,153.0,0.0,412.0,291.0,64.0,32.0,13.0,5.0,326.0,"St. Johns, AZ Urban Cluster (2010)",77635
3362.0,2679.0,17.0,2662.0,1298.0,292.0,2246.0,1269.0,169.0,40.0,3.0,93.0,590.0,"St. Johns, MI Urban Cluster (2010)",77662
2115.0,1491.0,17.0,1474.0,715.0,180.0,1235.0,714.0,38.0,23.0,0.0,112.0,512.0,"St. Johnsbury, VT Urban Cluster (2010)",77689
2061.0,1888.0,17.0,1871.0,961.0,176.0,1512.0,703.0,294.0,84.0,0.0,39.0,134.0,"St. Joseph, IL Urban Cluster (2010)",77716
30259.0,21666.0,137.0,21529.0,14395.0,2878.0,17942.0,6671.0,1058.0,201.0,55.0,927.0,7666.0,"St. Joseph, MO--KS Urbanized Area (2010)",77743
867196.0,691755.0,4361.0,687394.0,445551.0,58688.0,607020.0,221216.0,40247.0,6946.0,1376.0,29983.0,145458.0,"St. Louis, MO--IL Urbanized Area (2010)",77770
1140.0,707.0,24.0,683.0,356.0,136.0,330.0,184.0,198.0,139.0,4.0,58.0,375.0,"St. Maries, ID Urban Cluster (2010)",77797
2659.0,1604.0,0.0,1604.0,1085.0,360.0,1208.0,459.0,127.0,6.0,0.0,240.0,815.0,"St. Martinville, LA Urban Cluster (2010)",77824
773.0,653.0,4.0,649.0,314.0,36.0,598.0,315.0,39.0,10.0,0.0,13.0,107.0,"St. Marys, KS Urban Cluster (2010)",77841
3658.0,2794.0,27.0,2767.0,1865.0,178.0,2523.0,850.0,140.0,11.0,17.0,110.0,754.0,"St. Marys, OH Urban Cluster (2010)",77851
4214.0,3262.0,83.0,3179.0,1656.0,211.0,2841.0,1316.0,253.0,73.0,0.0,65.0,887.0,"St. Marys, PA Urban Cluster (2010)",77878
1769.0,1289.0,5.0,1284.0,557.0,77.0,1191.0,687.0,29.0,13.0,3.0,73.0,407.0,"St. Marys, WV--OH Urban Cluster (2010)",77905
12661.0,10710.0,52.0,10658.0,6230.0,920.0,9516.0,4009.0,718.0,169.0,0.0,395.0,1556.0,"St. Marys--Kingsland, GA Urban Cluster (2010)",77932
1089.0,592.0,7.0,585.0,235.0,34.0,525.0,332.0,26.0,6.0,0.0,10.0,487.0,"St. Pauls, NC Urban Cluster (2010)",77986
105842.0,79003.0,673.0,78330.0,44187.0,6739.0,68863.0,31092.0,4280.0,1033.0,325.0,4512.0,22327.0,"South Bend, IN--MI Urbanized Area (2010)",83116
2981.0,1665.0,29.0,1636.0,755.0,160.0,1420.0,753.0,119.0,52.0,4.0,203.0,1113.0,"South Boston, VA Urban Cluster (2010)",83143
2066.0,1664.0,0.0,1664.0,1088.0,109.0,1542.0,541.0,34.0,0.0,0.0,199.0,203.0,"South Deerfield, MA Urban Cluster (2010)",83156
744.0,365.0,0.0,365.0,179.0,70.0,295.0,176.0,0.0,0.0,0.0,0.0,379.0,"South Fallsburg, NY Urban Cluster (2010)",83210
2838.0,1851.0,38.0,1813.0,1209.0,320.0,1428.0,546.0,98.0,41.0,0.0,159.0,828.0,"South Haven, MI Urban Cluster (2010)",83251
1659.0,1059.0,18.0,1041.0,552.0,150.0,831.0,464.0,52.0,11.0,0.0,49.0,551.0,"South Hill, VA Urban Cluster (2010)",83278
11708.0,9633.0,93.0,9540.0,5499.0,670.0,8715.0,3820.0,272.0,83.0,14.0,480.0,1595.0,"South Lake Tahoe, CA--NV Urban Cluster (2010)",83305
49476.0,42237.0,231.0,42006.0,27655.0,2216.0,38921.0,13462.0,1938.0,337.0,54.0,1778.0,5461.0,"South Lyon--Howell, MI Urbanized Area (2010)",83332
4277.0,3499.0,8.0,3491.0,1756.0,251.0,3200.0,1690.0,64.0,5.0,11.0,203.0,575.0,"Southold, NY Urban Cluster (2010)",83359
1972.0,1300.0,0.0,1300.0,571.0,124.0,1143.0,719.0,31.0,0.0,0.0,171.0,501.0,"South Paris, ME Urban Cluster (2010)",83368
2195.0,1332.0,0.0,1332.0,780.0,226.0,1041.0,487.0,112.0,37.0,7.0,94.0,769.0,"South Pittsburg, TN--AL Urban Cluster (2010)",83377
927.0,653.0,0.0,653.0,415.0,55.0,588.0,221.0,87.0,0.0,0.0,0.0,274.0,"South Vacherie, LA Urban Cluster (2010)",83386
859.0,344.0,0.0,344.0,138.0,39.0,278.0,200.0,29.0,6.0,0.0,40.0,475.0,"Sparta, GA Urban Cluster (2010)",83440
1791.0,1296.0,26.0,1270.0,676.0,104.0,1129.0,565.0,58.0,16.0,0.0,11.0,484.0,"Sparta, IL Urban Cluster (2010)",83467
1599.0,1037.0,0.0,1037.0,689.0,66.0,952.0,337.0,30.0,0.0,0.0,72.0,490.0,"Sparta, MI Urban Cluster (2010)",83480
2101.0,1260.0,19.0,1241.0,624.0,187.0,1022.0,563.0,58.0,18.0,8.0,120.0,721.0,"Sparta, TN Urban Cluster (2010)",83494
1203.0,855.0,0.0,855.0,664.0,118.0,660.0,175.0,106.0,0.0,0.0,58.0,290.0,"Spearman, TX Urban Cluster (2010)",83602
4481.0,3349.0,0.0,3349.0,1819.0,318.0,2805.0,1273.0,394.0,138.0,4.0,46.0,1086.0,"Sparta, WI Urban Cluster (2010)",83521
73742.0,55289.0,208.0,55081.0,38400.0,7726.0,45243.0,15120.0,3624.0,542.0,118.0,3183.0,15270.0,"Spartanburg, SC Urbanized Area (2010)",83548
5222.0,4133.0,19.0,4114.0,2675.0,424.0,3595.0,1318.0,179.0,30.0,0.0,251.0,838.0,"Spearfish, SD Urban Cluster (2010)",83575
4822.0,3736.0,22.0,3714.0,2480.0,266.0,3334.0,1122.0,189.0,0.0,51.0,246.0,840.0,"Spencer, IA Urban Cluster (2010)",83629
1239.0,772.0,0.0,772.0,338.0,54.0,699.0,429.0,24.0,5.0,0.0,62.0,405.0,"Spencer, WV Urban Cluster (2010)",83656
5282.0,4142.0,25.0,4117.0,2494.0,360.0,3467.0,1420.0,428.0,125.0,0.0,288.0,852.0,"Spirit Lake, IA Urban Cluster (2010)",83710
162598.0,135104.0,1111.0,133993.0,91719.0,11991.0,117440.0,38940.0,5982.0,1126.0,417.0,4780.0,22714.0,"Spokane, WA Urbanized Area (2010)",83764
1258.0,782.0,21.0,761.0,436.0,111.0,618.0,312.0,18.0,6.0,0.0,61.0,415.0,"Spooner, WI Urban Cluster (2010)",83791
5242.0,4812.0,9.0,4803.0,3048.0,258.0,4424.0,1621.0,254.0,33.0,7.0,128.0,302.0,"Spout Springs, NC Urban Cluster (2010)",83818
1271.0,988.0,7.0,981.0,509.0,190.0,680.0,366.0,162.0,57.0,0.0,123.0,160.0,"Spring Creek North, NV Urban Cluster (2010)",83851
1394.0,1311.0,17.0,1294.0,745.0,98.0,1140.0,531.0,93.0,18.0,0.0,19.0,64.0,"Spring Creek South, NV Urban Cluster (2010)",83859
1353.0,964.0,15.0,949.0,499.0,68.0,859.0,438.0,34.0,12.0,0.0,7.0,382.0,"Springfield, GA Urban Cluster (2010)",83872
69320.0,54683.0,390.0,54293.0,37196.0,5182.0,46705.0,15625.0,4144.0,374.0,110.0,3093.0,11544.0,"Springfield, IL Urbanized Area (2010)",83899
233333.0,183298.0,1220.0,182078.0,100479.0,12051.0,166533.0,76847.0,4953.0,907.0,458.0,7062.0,42973.0,"Springfield, MA--CT Urbanized Area (2010)",83926
119215.0,90632.0,532.0,90100.0,55110.0,8776.0,78082.0,32314.0,5980.0,960.0,221.0,8626.0,19957.0,"Springfield, MO Urbanized Area (2010)",83953
34553.0,26011.0,107.0,25904.0,18291.0,3814.0,21280.0,6872.0,1365.0,303.0,12.0,1092.0,7450.0,"Springfield, OH Urbanized Area (2010)",83980
6485.0,4700.0,13.0,4687.0,3221.0,1046.0,3443.0,1321.0,282.0,56.0,7.0,149.0,1636.0,"Springfield, TN Urban Cluster (2010)",83993
13655.0,8850.0,69.0,8781.0,5114.0,1414.0,6741.0,3167.0,825.0,239.0,93.0,1014.0,3791.0,"Shawnee, OK Urban Cluster (2010)",81091
1079.0,993.0,21.0,972.0,697.0,38.0,878.0,246.0,52.0,29.0,0.0,8.0,78.0,"Shorewood Forest, IN Urban Cluster (2010)",81701
1034.0,769.0,34.0,735.0,366.0,23.0,704.0,361.0,67.0,0.0,0.0,102.0,163.0,"Shannondale, WV Urban Cluster (2010)",81002
4469.0,3230.0,40.0,3190.0,2110.0,550.0,2524.0,1027.0,153.0,16.0,0.0,132.0,1107.0,"Shawano, WI Urban Cluster (2010)",81064
30035.0,24070.0,218.0,23852.0,15120.0,1772.0,21404.0,8231.0,986.0,253.0,29.0,986.0,4979.0,"Sheboygan, WI Urbanized Area (2010)",81118
1026.0,754.0,39.0,715.0,434.0,68.0,585.0,255.0,44.0,0.0,9.0,67.0,205.0,"Shelby, MT Urban Cluster (2010)",81172
11154.0,6525.0,12.0,6513.0,3795.0,848.0,5420.0,2471.0,428.0,92.0,34.0,798.0,3831.0,"Shelby, NC Urban Cluster (2010)",81199
