B28002_001E,B28002_002E,B28002_003E,B28002_004E,B28002_005E,B28002_006E,B28002_007E,B28002_008E,B28002_009E,B28002_010E,B28002_011E,B28002_012E,B28002_013E,name,urban area
3537.0,2762.0,19.0,2743.0,1376.0,212.0,2499.0,1313.0,102.0,13.0,4.0,108.0,667.0,"Medina, NY Urban Cluster (2010)",56035
1147.0,799.0,11.0,788.0,508.0,33.0,729.0,270.0,50.0,10.0,0.0,74.0,274.0,"Melrose, MN Urban Cluster (2010)",56089
399125.0,285362.0,1694.0,283668.0,186688.0,37130.0,234898.0,87179.0,21193.0,3530.0,742.0,20126.0,93637.0,"Memphis, TN--MS--AR Urbanized Area (2010)",56116
6478.0,5209.0,55.0,5154.0,3162.0,261.0,4794.0,1863.0,246.0,12.0,9.0,232.0,1037.0,"Menomonie, WI Urban Cluster (2010)",56224
2149.0,1335.0,0.0,1335.0,684.0,257.0,921.0,517.0,154.0,73.0,8.0,61.0,753.0,"Mena, AR Urban Cluster (2010)",56143
2745.0,1211.0,7.0,1204.0,561.0,149.0,1048.0,622.0,38.0,7.0,0.0,42.0,1492.0,"Mendota, CA Urban Cluster (2010)",56170
2562.0,1878.0,38.0,1840.0,1270.0,200.0,1573.0,535.0,51.0,16.0,12.0,45.0,639.0,"Mendota, IL Urban Cluster (2010)",56197
43094.0,35110.0,269.0,34841.0,25995.0,6491.0,26402.0,7485.0,2565.0,719.0,152.0,1350.0,6634.0,"Merced, CA Urbanized Area (2010)",56251
956.0,716.0,5.0,711.0,401.0,35.0,667.0,294.0,35.0,0.0,0.0,41.0,199.0,"Mercer, PA Urban Cluster (2010)",56278
15976.0,9307.0,90.0,9217.0,5476.0,1845.0,7013.0,3511.0,503.0,78.0,0.0,1854.0,4815.0,"Meridian, MS Urban Cluster (2010)",56305
4447.0,3295.0,34.0,3261.0,1993.0,314.0,2776.0,1140.0,198.0,101.0,0.0,185.0,967.0,"Merrill, WI Urban Cluster (2010)",56359
2132.0,1261.0,18.0,1243.0,817.0,161.0,983.0,355.0,184.0,42.0,5.0,179.0,692.0,"Mexia, TX Urban Cluster (2010)",56521
1055.0,724.0,0.0,724.0,454.0,53.0,635.0,270.0,13.0,0.0,0.0,107.0,224.0,"Mescalero Park, TX Urban Cluster (2010)",56386
6431.0,4927.0,135.0,4792.0,2897.0,512.0,4059.0,1731.0,357.0,22.0,0.0,286.0,1218.0,"Mesquite, NV--AZ Urban Cluster (2010)",56413
1292.0,652.0,7.0,645.0,380.0,87.0,508.0,215.0,56.0,30.0,0.0,24.0,616.0,"Metter, GA Urban Cluster (2010)",56494
1416.0,1169.0,17.0,1152.0,764.0,92.0,1047.0,359.0,87.0,13.0,0.0,15.0,232.0,"Metamora, IL Urban Cluster (2010)",56440
2801.0,1579.0,40.0,1539.0,945.0,237.0,1225.0,525.0,110.0,58.0,0.0,114.0,1108.0,"Metropolis, IL Urban Cluster (2010)",56467
4555.0,3281.0,23.0,3258.0,2000.0,381.0,2813.0,1109.0,175.0,24.0,0.0,125.0,1149.0,"Mexico, MO Urban Cluster (2010)",56548
1017.0,660.0,13.0,647.0,322.0,102.0,524.0,300.0,29.0,0.0,12.0,37.0,320.0,"Meyersdale, PA Urban Cluster (2010)",56575
1343.0,1194.0,0.0,1194.0,774.0,140.0,1010.0,406.0,121.0,14.0,0.0,15.0,134.0,"Middlebury, IN Urban Cluster (2010)",56710
2057630.0,1610110.0,9063.0,1601047.0,961275.0,137757.0,1420786.0,592404.0,98200.0,14936.0,2551.0,80097.0,367423.0,"Miami, FL Urbanized Area (2010)",56602
6025.0,3594.0,35.0,3559.0,1997.0,499.0,2834.0,1371.0,337.0,98.0,11.0,660.0,1771.0,"Miami, OK Urban Cluster (2010)",56629
26877.0,19721.0,123.0,19598.0,9768.0,2068.0,16713.0,9017.0,1117.0,375.0,42.0,731.0,6425.0,"Michigan City--La Porte, IN--MI Urbanized Area (2010)",56656
1609.0,1072.0,9.0,1063.0,579.0,67.0,969.0,465.0,36.0,8.0,0.0,131.0,406.0,"Middlebury, VT Urban Cluster (2010)",56737
2067.0,1451.0,17.0,1434.0,690.0,62.0,1323.0,697.0,35.0,26.0,3.0,55.0,561.0,"Middlefield, OH Urban Cluster (2010)",56764
3153.0,1962.0,20.0,1942.0,1216.0,294.0,1629.0,691.0,62.0,7.0,0.0,105.0,1086.0,"Middleport, OH--WV Urban Cluster (2010)",56791
5909.0,3539.0,34.0,3505.0,1555.0,276.0,3072.0,1736.0,147.0,38.0,81.0,281.0,2089.0,"Middlesborough, KY--TN--VA Urban Cluster (2010)",56818
10089.0,9379.0,19.0,9360.0,5754.0,636.0,8658.0,3438.0,239.0,49.0,0.0,232.0,478.0,"Middletown, DE Urban Cluster (2010)",56845
1104.0,703.0,0.0,703.0,364.0,42.0,607.0,300.0,66.0,23.0,0.0,57.0,344.0,"Middletown, IN Urban Cluster (2010)",56872
21721.0,14084.0,103.0,13981.0,8115.0,749.0,13020.0,5386.0,864.0,56.0,16.0,2806.0,4831.0,"Middletown, NY Urbanized Area (2010)",56899
38426.0,28833.0,70.0,28763.0,18830.0,3048.0,25047.0,9342.0,1316.0,166.0,31.0,1535.0,8058.0,"Middletown, OH Urbanized Area (2010)",56926
1156.0,897.0,0.0,897.0,599.0,76.0,792.0,268.0,44.0,11.0,8.0,9.0,250.0,"Middleville, MI Urban Cluster (2010)",56953
24050.0,19459.0,240.0,19219.0,12852.0,1564.0,17092.0,6034.0,671.0,202.0,6.0,973.0,3618.0,"Midland, MI Urbanized Area (2010)",56980
8798.0,6811.0,113.0,6698.0,3663.0,592.0,5814.0,2655.0,505.0,208.0,13.0,204.0,1783.0,"Marshfield, WI Urban Cluster (2010)",55144
4562.0,3233.0,42.0,3191.0,2027.0,294.0,2649.0,958.0,282.0,84.0,18.0,177.0,1152.0,"Marshall, MO Urban Cluster (2010)",55009
7463.0,4325.0,19.0,4306.0,2702.0,786.0,3283.0,1455.0,481.0,67.0,0.0,268.0,2870.0,"Marshall, TX Urban Cluster (2010)",55036
1355.0,1172.0,18.0,1154.0,641.0,184.0,943.0,513.0,18.0,0.0,0.0,51.0,132.0,"Marshall, WI Urban Cluster (2010)",55063
10012.0,6878.0,124.0,6754.0,3856.0,871.0,5583.0,2649.0,431.0,106.0,17.0,446.0,2688.0,"Marshalltown, IA Urban Cluster (2010)",55090
2667.0,1670.0,33.0,1637.0,981.0,202.0,1361.0,620.0,77.0,17.0,0.0,185.0,812.0,"Marshfield, MO Urban Cluster (2010)",55117
3897.0,2953.0,12.0,2941.0,2059.0,431.0,2466.0,845.0,58.0,15.0,0.0,160.0,784.0,"Martin, TN Urban Cluster (2010)",55171
1283.0,867.0,10.0,857.0,486.0,91.0,716.0,361.0,55.0,0.0,0.0,44.0,372.0,"Martinsburg, PA Urban Cluster (2010)",55198
4911.0,3545.0,13.0,3532.0,2446.0,433.0,3009.0,1041.0,212.0,12.0,0.0,186.0,1180.0,"Martinsville, IN Urban Cluster (2010)",55225
14709.0,9518.0,94.0,9424.0,5746.0,1256.0,7715.0,3351.0,652.0,84.0,49.0,676.0,4515.0,"Martinsville, VA Urban Cluster (2010)",55252
1292.0,922.0,7.0,915.0,556.0,129.0,769.0,343.0,53.0,8.0,0.0,139.0,231.0,"Marysville, KS Urban Cluster (2010)",55279
7996.0,6777.0,33.0,6744.0,4158.0,494.0,6179.0,2440.0,204.0,51.0,15.0,140.0,1079.0,"Marysville, OH Urban Cluster (2010)",55306
11994.0,8672.0,59.0,8613.0,5051.0,793.0,7161.0,3005.0,765.0,423.0,6.0,546.0,2776.0,"Mason City, IA Urban Cluster (2010)",55414
56034.0,48541.0,460.0,48081.0,32789.0,2861.0,43833.0,14124.0,2169.0,466.0,201.0,1613.0,5880.0,"Marysville, WA Urbanized Area (2010)",55333
4775.0,3713.0,18.0,3695.0,2528.0,359.0,3266.0,1091.0,193.0,25.0,0.0,174.0,888.0,"Maryville, MO Urban Cluster (2010)",55360
2590.0,2157.0,40.0,2117.0,1380.0,107.0,1926.0,667.0,99.0,56.0,14.0,63.0,370.0,"Mascoutah, IL Urban Cluster (2010)",55375
1809.0,1171.0,26.0,1145.0,562.0,156.0,962.0,512.0,94.0,27.0,0.0,56.0,582.0,"Masontown, PA Urban Cluster (2010)",55441
4867.0,3677.0,18.0,3659.0,2159.0,186.0,3433.0,1482.0,51.0,18.0,0.0,190.0,1000.0,"Massena, NY Urban Cluster (2010)",55468
1965.0,1035.0,13.0,1022.0,601.0,124.0,868.0,383.0,70.0,6.0,0.0,23.0,907.0,"Mathis, TX Urban Cluster (2010)",55495
941.0,575.0,0.0,575.0,372.0,118.0,406.0,173.0,47.0,10.0,5.0,45.0,321.0,"Mattawa, WA Urban Cluster (2010)",55522
7616.0,5740.0,9.0,5731.0,3676.0,546.0,5028.0,1937.0,232.0,60.0,8.0,157.0,1719.0,"Mattoon, IL Urban Cluster (2010)",55576
49310.0,43327.0,148.0,43179.0,28148.0,2421.0,39808.0,14089.0,2327.0,446.0,0.0,1233.0,4750.0,"Mauldin--Simpsonville, SC Urbanized Area (2010)",55603
1649.0,1154.0,0.0,1154.0,726.0,133.0,979.0,391.0,72.0,12.0,0.0,101.0,394.0,"Mauston, WI Urban Cluster (2010)",55684
37205.0,20358.0,216.0,20142.0,14071.0,4659.0,14688.0,5382.0,992.0,255.0,66.0,644.0,16203.0,"Mayagüez, PR Urbanized Area (2010)",55738
1330.0,1036.0,13.0,1023.0,527.0,7.0,1011.0,462.0,34.0,5.0,0.0,66.0,228.0,"Maybrook, NY Urban Cluster (2010)",55750
4561.0,2968.0,25.0,2943.0,1903.0,685.0,2133.0,950.0,159.0,10.0,39.0,194.0,1399.0,"Mayfield, KY Urban Cluster (2010)",55765
2128.0,1344.0,0.0,1344.0,823.0,176.0,1141.0,499.0,56.0,7.0,0.0,92.0,692.0,"Mayodan, NC Urban Cluster (2010)",55792
4773.0,3014.0,18.0,2996.0,1879.0,377.0,2519.0,1022.0,158.0,32.0,4.0,137.0,1622.0,"Maysville, KY--OH Urban Cluster (2010)",55819
2123.0,1572.0,24.0,1548.0,808.0,115.0,1335.0,673.0,87.0,31.0,0.0,68.0,483.0,"Mayville, WI Urban Cluster (2010)",55846
1299.0,1027.0,6.0,1021.0,558.0,63.0,926.0,428.0,43.0,22.0,0.0,83.0,189.0,"Mazomanie, WI Urban Cluster (2010)",55860
9782.0,7152.0,86.0,7066.0,3931.0,610.0,6274.0,2928.0,194.0,73.0,18.0,475.0,2155.0,"Meadville, PA Urban Cluster (2010)",55900
2112.0,1052.0,0.0,1052.0,722.0,387.0,548.0,227.0,130.0,47.0,14.0,13.0,1047.0,"Mecca, CA Urban Cluster (2010)",55927
65136.0,53219.0,402.0,52817.0,29294.0,4381.0,45946.0,20607.0,4072.0,1462.0,131.0,2613.0,9304.0,"Medford, OR Urbanized Area (2010)",55981
1289.0,1018.0,4.0,1014.0,726.0,258.0,705.0,250.0,117.0,24.0,0.0,54.0,217.0,"Woodstock, AL Urban Cluster (2010)",97119
2008.0,1665.0,0.0,1665.0,1064.0,211.0,1293.0,544.0,169.0,49.0,0.0,63.0,280.0,"Woodland, WA Urban Cluster (2010)",97021
4526.0,4126.0,49.0,4077.0,2349.0,156.0,3356.0,1338.0,572.0,261.0,33.0,133.0,267.0,"Woodland Park, CO Urban Cluster (2010)",97048
1490.0,1030.0,0.0,1030.0,761.0,336.0,682.0,220.0,13.0,0.0,0.0,36.0,424.0,"Woodruff, SC Urban Cluster (2010)",97102
9728.0,8193.0,78.0,8115.0,6031.0,705.0,7151.0,1901.0,352.0,78.0,21.0,236.0,1299.0,"Woodstock, IL Urban Cluster (2010)",97129
2976.0,1960.0,3.0,1957.0,1420.0,490.0,1368.0,480.0,145.0,11.0,7.0,70.0,946.0,"Woodstock, VA Urban Cluster (2010)",97156
1604.0,1311.0,0.0,1311.0,660.0,27.0,1245.0,587.0,69.0,0.0,25.0,31.0,262.0,"Woodstown, NJ Urban Cluster (2010)",97183
698.0,516.0,0.0,516.0,228.0,85.0,424.0,244.0,33.0,0.0,7.0,7.0,175.0,"Woodville, FL Urban Cluster (2010)",97200
926.0,556.0,5.0,551.0,319.0,59.0,434.0,209.0,38.0,5.0,13.0,98.0,272.0,"Woodville, TX Urban Cluster (2010)",97210
4371.0,3312.0,17.0,3295.0,1754.0,441.0,2577.0,1351.0,357.0,77.0,74.0,236.0,823.0,"Woodward, OK Urban Cluster (2010)",97237
12759.0,9820.0,22.0,9798.0,5949.0,950.0,8524.0,3634.0,333.0,98.0,0.0,316.0,2623.0,"Wooster, OH Urban Cluster (2010)",97264
189575.0,153267.0,1119.0,152148.0,92915.0,8812.0,140288.0,56274.0,5490.0,991.0,182.0,5787.0,30521.0,"Worcester, MA--CT Urbanized Area (2010)",97291
2235.0,1673.0,32.0,1641.0,877.0,138.0,1476.0,731.0,109.0,17.0,4.0,131.0,431.0,"Worland, WY Urban Cluster (2010)",97318
2512.0,2229.0,0.0,2229.0,1250.0,0.0,2229.0,832.0,147.0,0.0,0.0,241.0,42.0,"World Golf Village, FL Urban Cluster (2010)",97331
4425.0,3251.0,40.0,3211.0,1960.0,256.0,2558.0,1108.0,519.0,36.0,7.0,185.0,989.0,"Worthington, MN Urban Cluster (2010)",97345
976.0,703.0,34.0,669.0,389.0,46.0,611.0,245.0,56.0,0.0,0.0,46.0,227.0,"Wright City, MO Urban Cluster (2010)",97352
1076.0,963.0,0.0,963.0,562.0,54.0,881.0,390.0,48.0,11.0,0.0,16.0,97.0,"Wrightstown, WI Urban Cluster (2010)",97359
969.0,475.0,6.0,469.0,212.0,83.0,374.0,226.0,13.0,0.0,0.0,102.0,392.0,"Wrightsville, GA Urban Cluster (2010)",97366
1513.0,1315.0,9.0,1306.0,775.0,120.0,1145.0,481.0,41.0,41.0,0.0,54.0,144.0,"Wrightwood, CA Urban Cluster (2010)",97372
1345.0,1199.0,4.0,1195.0,668.0,107.0,1064.0,487.0,40.0,24.0,0.0,30.0,116.0,"Wurtsboro, NY Urban Cluster (2010)",97399
2735.0,1848.0,8.0,1840.0,1256.0,422.0,1300.0,502.0,118.0,30.0,0.0,73.0,814.0,"Wynne, AR Urban Cluster (2010)",97426
3253.0,2108.0,16.0,2092.0,1258.0,271.0,1679.0,799.0,135.0,15.0,0.0,182.0,963.0,"Wytheville, VA Urban Cluster (2010)",97453
1295.0,860.0,5.0,855.0,488.0,71.0,778.0,333.0,31.0,0.0,0.0,6.0,429.0,"Yadkinville, NC Urban Cluster (2010)",97480
47556.0,34982.0,380.0,34602.0,20805.0,3696.0,29282.0,12569.0,2429.0,553.0,76.0,2435.0,10139.0,"Yakima, WA Urbanized Area (2010)",97507
6047.0,4576.0,46.0,4530.0,2637.0,227.0,4233.0,1816.0,159.0,0.0,0.0,321.0,1150.0,"Yankton, SD Urban Cluster (2010)",97534
26257.0,13167.0,330.0,12837.0,9256.0,3810.0,8477.0,3238.0,508.0,150.0,18.0,1082.0,12008.0,"Yauco, PR Urbanized Area (2010)",97561
4180.0,2016.0,28.0,1988.0,1488.0,593.0,1296.0,457.0,181.0,35.0,0.0,192.0,1972.0,"Yazoo City, MS Urban Cluster (2010)",97588
1831.0,1594.0,0.0,1594.0,996.0,93.0,1409.0,516.0,73.0,35.0,0.0,44.0,193.0,"Yellow Springs, OH Urban Cluster (2010)",97615
4633.0,3815.0,18.0,3797.0,2507.0,467.0,3296.0,1235.0,108.0,9.0,0.0,58.0,760.0,"Yelm, WA Urban Cluster (2010)",97642
1447.0,986.0,2.0,984.0,765.0,331.0,506.0,164.0,120.0,16.0,0.0,14.0,447.0,"Yerington, NV Urban Cluster (2010)",97669
2226.0,1419.0,20.0,1399.0,1158.0,103.0,943.0,196.0,487.0,0.0,7.0,134.0,673.0,"Yoakum, TX Urban Cluster (2010)",97696
3262.0,2537.0,80.0,2457.0,1245.0,288.0,2092.0,1122.0,136.0,70.0,0.0,152.0,573.0,"York, NE Urban Cluster (2010)",97723
90156.0,68766.0,698.0,68068.0,39616.0,5446.0,60534.0,26727.0,2729.0,726.0,176.0,3081.0,18309.0,"York, PA Urbanized Area (2010)",97750
1260.0,861.0,30.0,831.0,374.0,49.0,763.0,441.0,29.0,3.0,6.0,60.0,339.0,"Youngsville, PA Urban Cluster (2010)",97858
3018.0,1797.0,0.0,1797.0,1271.0,380.0,1368.0,496.0,132.0,16.0,0.0,328.0,893.0,"York, SC Urban Cluster (2010)",97777
1042.0,901.0,0.0,901.0,612.0,163.0,716.0,267.0,87.0,22.0,0.0,35.0,106.0,"Yorkville, GA Urban Cluster (2010)",97812
162256.0,117033.0,1107.0,115926.0,65268.0,11299.0,101656.0,47499.0,5555.0,1096.0,93.0,7082.0,38141.0,"Youngstown, OH--PA Urbanized Area (2010)",97831
1346.0,1139.0,6.0,1133.0,814.0,110.0,980.0,283.0,49.0,10.0,9.0,22.0,185.0,"Yountville, CA Urban Cluster (2010)",97885
3291.0,2411.0,73.0,2338.0,1528.0,295.0,1882.0,685.0,220.0,48.0,14.0,181.0,699.0,"Yreka, CA Urban Cluster (2010)",97912
40579.0,32483.0,168.0,32315.0,23273.0,5673.0,25508.0,8052.0,2044.0,296.0,50.0,1317.0,6779.0,"Yuba City, CA Urbanized Area (2010)",97939
10056.0,8303.0,45.0,8258.0,5320.0,1124.0,6917.0,2719.0,420.0,21.0,19.0,318.0,1435.0,"Yucca Valley, CA Urban Cluster (2010)",97966
2804.0,2154.0,13.0,2141.0,940.0,104.0,1929.0,1131.0,94.0,0.0,58.0,153.0,497.0,"Yulee, FL Urban Cluster (2010)",97993
51689.0,39248.0,212.0,39036.0,25140.0,4974.0,31213.0,10334.0,4848.0,1656.0,62.0,1316.0,11125.0,"Yuma, AZ--CA Urbanized Area (2010)",98020
1681.0,1101.0,35.0,1066.0,663.0,376.0,654.0,351.0,87.0,17.0,0.0,23.0,557.0,"Yuma, CO Urban Cluster (2010)",98047
17714.0,12710.0,127.0,12583.0,5442.0,1505.0,10870.0,6851.0,306.0,100.0,31.0,496.0,4508.0,"Zanesville, OH Urban Cluster (2010)",98074
1408.0,1135.0,26.0,1109.0,662.0,158.0,951.0,431.0,52.0,0.0,0.0,22.0,251.0,"Zumbrota, MN Urban Cluster (2010)",98236
3520.0,1979.0,32.0,1947.0,991.0,112.0,1636.0,783.0,249.0,161.0,0.0,424.0,1117.0,"Zapata--Medina, TX Urban Cluster (2010)",98101
28540.0,20288.0,320.0,19968.0,11472.0,2032.0,16957.0,7744.0,1414.0,382.0,32.0,1193.0,7059.0,"Zephyrhills, FL Urbanized Area (2010)",98182
2707.0,2231.0,18.0,2213.0,1562.0,132.0,2019.0,605.0,183.0,15.0,0.0,54.0,422.0,"Zimmerman, MN Urban Cluster (2010)",98209
1650.0,777.0,17.0,760.0,618.0,368.0,310.0,91.0,74.0,41.0,0.0,23.0,850.0,"Zuni Pueblo, NM Urban Cluster (2010)",98263
26557.0,20385.0,172.0,20213.0,11420.0,1358.0,18281.0,8340.0,762.0,141.0,52.0,1663.0,4509.0,"Winchester, VA Urbanized Area (2010)",96103
2078.0,1459.0,20.0,1439.0,974.0,241.0,1156.0,420.0,65.0,31.0,0.0,78.0,541.0,"Winchester, IN Urban Cluster (2010)",96022
10501.0,7418.0,23.0,7395.0,5028.0,854.0,6292.0,2226.0,444.0,59.0,0.0,510.0,2573.0,"Winchester, KY Urban Cluster (2010)",96049
5044.0,3500.0,0.0,3500.0,1951.0,291.0,3018.0,1315.0,373.0,115.0,30.0,266.0,1278.0,"Winchester, TN Urban Cluster (2010)",96076
13474.0,10598.0,168.0,10430.0,6650.0,908.0,9127.0,3449.0,1016.0,110.0,28.0,455.0,2421.0,"Winder, GA Urban Cluster (2010)",96130
1919.0,1408.0,8.0,1400.0,890.0,94.0,1133.0,423.0,235.0,41.0,13.0,111.0,400.0,"Windom, MN Urban Cluster (2010)",96211
992.0,457.0,40.0,417.0,197.0,79.0,304.0,196.0,64.0,24.0,0.0,23.0,512.0,"Window Rock, AZ--NM Urban Cluster (2010)",96223
1034.0,820.0,0.0,820.0,522.0,241.0,536.0,261.0,54.0,13.0,0.0,5.0,209.0,"Windsor, MO Urban Cluster (2010)",96265
1001.0,599.0,9.0,590.0,353.0,121.0,457.0,231.0,22.0,0.0,0.0,30.0,372.0,"Windsor, NC Urban Cluster (2010)",96278
1258.0,864.0,8.0,856.0,476.0,33.0,812.0,380.0,81.0,0.0,0.0,132.0,262.0,"Windsor, VT--NH Urban Cluster (2010)",96292
4150.0,3118.0,34.0,3084.0,1945.0,292.0,2638.0,1019.0,191.0,80.0,13.0,154.0,878.0,"Winfield, KS Urban Cluster (2010)",96319
1579.0,1224.0,6.0,1218.0,760.0,132.0,1040.0,449.0,58.0,9.0,0.0,53.0,302.0,"Winneconne, WI Urban Cluster (2010)",96350
3636.0,2609.0,38.0,2571.0,1341.0,322.0,1860.0,1016.0,290.0,139.0,74.0,92.0,935.0,"Winnemucca, NV Urban Cluster (2010)",96373
1292.0,907.0,0.0,907.0,516.0,68.0,816.0,313.0,61.0,17.0,0.0,16.0,369.0,"Winner, SD Urban Cluster (2010)",96400
2054.0,1423.0,9.0,1414.0,915.0,373.0,1030.0,482.0,7.0,0.0,0.0,41.0,590.0,"Winnfield, LA Urban Cluster (2010)",96427
1375.0,983.0,0.0,983.0,574.0,288.0,561.0,275.0,116.0,104.0,0.0,0.0,392.0,"Winnie, TX Urban Cluster (2010)",96454
1845.0,618.0,0.0,618.0,411.0,143.0,445.0,171.0,70.0,0.0,0.0,213.0,1014.0,"Winnsboro, LA Urban Cluster (2010)",96481
2000.0,938.0,0.0,938.0,483.0,73.0,838.0,421.0,77.0,27.0,0.0,232.0,830.0,"Winnsboro, SC Urban Cluster (2010)",96508
2597.0,1702.0,0.0,1702.0,791.0,209.0,1385.0,787.0,163.0,61.0,8.0,91.0,804.0,"Winslow, AZ Urban Cluster (2010)",96616
1162.0,740.0,11.0,729.0,596.0,258.0,418.0,112.0,100.0,12.0,0.0,69.0,353.0,"Winnsboro, TX Urban Cluster (2010)",96535
11766.0,9441.0,24.0,9417.0,5243.0,482.0,8643.0,3956.0,328.0,168.0,13.0,306.0,2019.0,"Winona, MN Urban Cluster (2010)",96562
1655.0,959.0,13.0,946.0,621.0,119.0,764.0,302.0,200.0,0.0,0.0,66.0,630.0,"Winona, MS Urban Cluster (2010)",96589
160350.0,124519.0,875.0,123644.0,66742.0,12860.0,107199.0,52957.0,6196.0,1704.0,268.0,4478.0,31353.0,"Winston-Salem, NC Urbanized Area (2010)",96670
2152.0,1479.0,25.0,1454.0,960.0,141.0,1222.0,384.0,174.0,67.0,0.0,97.0,576.0,"Winterset, IA Urban Cluster (2010)",96778
77266.0,46665.0,497.0,46168.0,25436.0,3660.0,40597.0,18936.0,2867.0,853.0,99.0,12667.0,17934.0,"Winter Haven, FL Urbanized Area (2010)",96697
2482.0,2073.0,0.0,2073.0,1691.0,412.0,1624.0,330.0,98.0,9.0,0.0,82.0,327.0,"Winters, CA Urban Cluster (2010)",96724
985.0,491.0,9.0,482.0,306.0,152.0,267.0,131.0,77.0,31.0,10.0,11.0,483.0,"Winters, TX Urban Cluster (2010)",96751
12285.0,9254.0,16.0,9238.0,5014.0,736.0,8336.0,3944.0,300.0,30.0,9.0,349.0,2682.0,"Wisconsin Rapids, WI Urban Cluster (2010)",96832
1066.0,788.0,0.0,788.0,457.0,85.0,687.0,305.0,25.0,13.0,0.0,48.0,230.0,"Wolf Point, MT Urban Cluster (2010)",96859
1438.0,1289.0,15.0,1274.0,834.0,105.0,1155.0,440.0,59.0,0.0,0.0,32.0,117.0,"Wonder Lake, IL Urban Cluster (2010)",96886
10712.0,7992.0,62.0,7930.0,5253.0,1045.0,6431.0,2427.0,602.0,113.0,29.0,479.0,2241.0,"Woodburn, OR Urban Cluster (2010)",96913
979.0,500.0,5.0,495.0,320.0,148.0,283.0,144.0,46.0,13.0,0.0,130.0,349.0,"Woodbury, TN Urban Cluster (2010)",96926
2447.0,2053.0,6.0,2047.0,1271.0,300.0,1519.0,631.0,272.0,113.0,13.0,55.0,339.0,"Woodcreek, TX Urban Cluster (2010)",96940
2228.0,1296.0,0.0,1296.0,866.0,342.0,909.0,341.0,60.0,0.0,13.0,215.0,717.0,"Woodlake, CA Urban Cluster (2010)",96967
20161.0,15930.0,147.0,15783.0,10561.0,2355.0,12748.0,4475.0,1628.0,308.0,14.0,574.0,3657.0,"Woodland, CA Urbanized Area (2010)",96994
8021.0,6286.0,35.0,6251.0,3708.0,748.0,5284.0,2415.0,315.0,34.0,32.0,261.0,1474.0,"Norwalk, OH Urban Cluster (2010)",64054
3363.0,2438.0,8.0,2430.0,1284.0,204.0,2211.0,1104.0,73.0,0.0,7.0,263.0,662.0,"Norwich, NY Urban Cluster (2010)",64108
1080.0,811.0,24.0,787.0,466.0,53.0,704.0,308.0,36.0,0.0,13.0,47.0,222.0,"Norton, KS Urban Cluster (2010)",64000
4065.0,2672.0,26.0,2646.0,1171.0,169.0,2427.0,1362.0,129.0,50.0,0.0,496.0,897.0,"Norton--Wise, VA Urban Cluster (2010)",64027
83511.0,68288.0,329.0,67959.0,41952.0,5162.0,60816.0,23937.0,3559.0,873.0,108.0,2607.0,12616.0,"Norwich--New London, CT--RI Urbanized Area (2010)",64135
1470.0,1083.0,8.0,1075.0,715.0,75.0,972.0,330.0,44.0,19.0,0.0,127.0,260.0,"Norwood Young America, MN Urban Cluster (2010)",64189
1464.0,849.0,16.0,833.0,446.0,193.0,493.0,271.0,48.0,18.0,88.0,77.0,538.0,"Nowata, OK Urban Cluster (2010)",64216
1096.0,720.0,11.0,709.0,454.0,110.0,583.0,199.0,33.0,8.0,0.0,60.0,316.0,"Nyssa, OR Urban Cluster (2010)",64243
2074.0,1250.0,4.0,1246.0,841.0,325.0,794.0,306.0,176.0,25.0,0.0,106.0,718.0,"Oakdale, LA Urban Cluster (2010)",64297
1079.0,783.0,0.0,783.0,358.0,37.0,708.0,365.0,69.0,38.0,0.0,59.0,237.0,"Oak Harbor, OH Urban Cluster (2010)",64351
13535.0,11860.0,41.0,11819.0,7299.0,538.0,10949.0,4284.0,548.0,109.0,18.0,315.0,1360.0,"Oak Harbor, WA Urban Cluster (2010)",64378
1219.0,853.0,22.0,831.0,642.0,68.0,745.0,174.0,22.0,0.0,0.0,29.0,337.0,"Oakhurst, CA Urban Cluster (2010)",64432
5564.0,4515.0,50.0,4465.0,2751.0,476.0,3891.0,1652.0,137.0,22.0,0.0,157.0,892.0,"Oak Island, NC Urban Cluster (2010)",64459
2954.0,2542.0,9.0,2533.0,1882.0,172.0,2336.0,628.0,128.0,0.0,0.0,64.0,348.0,"Oakland, TN Urban Cluster (2010)",64475
1065.0,727.0,17.0,710.0,440.0,88.0,569.0,235.0,59.0,35.0,0.0,28.0,310.0,"Oakland City, IN Urban Cluster (2010)",64486
1505.0,839.0,32.0,807.0,545.0,129.0,540.0,185.0,155.0,34.0,0.0,157.0,509.0,"Oakridge, OR Urban Cluster (2010)",64513
888.0,515.0,0.0,515.0,337.0,73.0,418.0,166.0,12.0,12.0,0.0,52.0,321.0,"Oceana, WV Urban Cluster (2010)",64594
2488.0,1940.0,16.0,1924.0,1097.0,135.0,1740.0,748.0,114.0,24.0,18.0,179.0,369.0,"Oberlin, OH Urban Cluster (2010)",64550
65343.0,49874.0,915.0,48959.0,27324.0,4207.0,42629.0,19180.0,3746.0,751.0,139.0,1968.0,13501.0,"Ocala, FL Urbanized Area (2010)",64567
1109.0,594.0,0.0,594.0,233.0,55.0,504.0,328.0,42.0,20.0,0.0,10.0,505.0,"Ocala Estates, FL Urban Cluster (2010)",64577
1486.0,1126.0,0.0,1126.0,594.0,34.0,1043.0,463.0,100.0,19.0,0.0,0.0,360.0,"Ocean Park, WA Urban Cluster (2010)",64648
15322.0,12529.0,185.0,12344.0,7044.0,959.0,11133.0,5069.0,455.0,54.0,21.0,557.0,2236.0,"Ocean Pines, MD--DE Urban Cluster (2010)",64660
2699.0,2450.0,0.0,2450.0,1517.0,339.0,1923.0,839.0,317.0,72.0,0.0,0.0,249.0,"Ocean Shores, WA Urban Cluster (2010)",64675
6531.0,5456.0,25.0,5431.0,3136.0,393.0,4886.0,2103.0,362.0,69.0,4.0,160.0,915.0,"Ocean View, DE Urban Cluster (2010)",64702
1056.0,589.0,8.0,581.0,266.0,60.0,436.0,248.0,106.0,51.0,0.0,22.0,445.0,"Ocilla, GA Urban Cluster (2010)",64729
1734.0,1296.0,31.0,1265.0,871.0,178.0,1026.0,362.0,101.0,24.0,0.0,50.0,388.0,"Oconto, WI Urban Cluster (2010)",64756
1170.0,878.0,0.0,878.0,508.0,164.0,672.0,305.0,91.0,16.0,0.0,0.0,292.0,"Oconto Falls, WI Urban Cluster (2010)",64783
913.0,608.0,0.0,608.0,249.0,66.0,521.0,359.0,8.0,0.0,0.0,0.0,305.0,"Odem, TX Urban Cluster (2010)",64810
2022.0,1424.0,0.0,1424.0,964.0,118.0,1298.0,413.0,20.0,0.0,0.0,51.0,547.0,"Odessa, MO Urban Cluster (2010)",64837
46904.0,37662.0,122.0,37540.0,28767.0,8715.0,26680.0,7636.0,2822.0,569.0,82.0,1305.0,7937.0,"Odessa, TX Urbanized Area (2010)",64864
2859.0,2030.0,29.0,2001.0,1294.0,320.0,1568.0,611.0,137.0,16.0,14.0,121.0,708.0,"Oelwein, IA Urban Cluster (2010)",64891
2208.0,1770.0,8.0,1762.0,1002.0,191.0,1514.0,678.0,88.0,34.0,7.0,18.0,420.0,"Ogallala, NE Urban Cluster (2010)",64918
185630.0,159634.0,1163.0,158471.0,96769.0,13696.0,133591.0,55145.0,17011.0,3964.0,510.0,4804.0,21192.0,"Ogden--Layton, UT Urbanized Area (2010)",64945
4124.0,3030.0,8.0,3022.0,1549.0,129.0,2800.0,1378.0,133.0,24.0,0.0,99.0,995.0,"Ogdensburg, NY Urban Cluster (2010)",64972
6480.0,4775.0,55.0,4720.0,2391.0,299.0,4219.0,2094.0,303.0,96.0,9.0,128.0,1577.0,"Oil City, PA Urban Cluster (2010)",64999
14959.0,10207.0,174.0,10033.0,4398.0,540.0,9162.0,4906.0,339.0,118.0,18.0,495.0,4257.0,"Portsmouth, OH--KY Urban Cluster (2010)",71533
4199.0,3478.0,40.0,3438.0,2041.0,371.0,2938.0,1238.0,200.0,53.0,19.0,185.0,536.0,"Port Townsend, WA Urban Cluster (2010)",71560
154490.0,124988.0,743.0,124245.0,76374.0,9705.0,111808.0,44866.0,6926.0,829.0,243.0,5084.0,24418.0,"Port St. Lucie, FL Urbanized Area (2010)",71479
39844.0,34813.0,130.0,34683.0,22308.0,1827.0,32541.0,11993.0,711.0,95.0,21.0,1395.0,3636.0,"Portsmouth, NH--ME Urbanized Area (2010)",71506
1405.0,854.0,19.0,835.0,512.0,181.0,585.0,283.0,74.0,25.0,2.0,37.0,514.0,"Potosi, MO Urban Cluster (2010)",71695
1225.0,789.0,8.0,781.0,478.0,87.0,671.0,300.0,39.0,0.0,0.0,0.0,436.0,"Post, TX Urban Cluster (2010)",71614
2776.0,1891.0,17.0,1874.0,1335.0,464.0,1323.0,485.0,104.0,18.0,4.0,113.0,772.0,"Poteau, OK Urban Cluster (2010)",71641
1036.0,679.0,0.0,679.0,626.0,267.0,398.0,41.0,17.0,0.0,8.0,30.0,327.0,"Poteet, TX Urban Cluster (2010)",71668
2230.0,1714.0,17.0,1697.0,1134.0,145.0,1542.0,522.0,37.0,0.0,0.0,90.0,426.0,"Potsdam, NY Urban Cluster (2010)",71722
42530.0,34544.0,363.0,34181.0,22463.0,2065.0,31489.0,11078.0,1010.0,211.0,25.0,1001.0,6985.0,"Pottstown, PA Urbanized Area (2010)",71749
17965.0,12826.0,175.0,12651.0,6929.0,930.0,11458.0,5505.0,522.0,54.0,0.0,528.0,4611.0,"Pottsville, PA Urban Cluster (2010)",71776
146391.0,118928.0,660.0,118268.0,70223.0,5157.0,111843.0,44967.0,3749.0,314.0,37.0,5045.0,22418.0,"Poughkeepsie--Newburgh, NY--NJ Urbanized Area (2010)",71803
2585.0,2160.0,26.0,2134.0,1159.0,293.0,1788.0,846.0,212.0,0.0,35.0,130.0,295.0,"Powell, WY Urban Cluster (2010)",71830
2713.0,1960.0,17.0,1943.0,984.0,192.0,1614.0,876.0,153.0,61.0,0.0,136.0,617.0,"Prairie du Chien, WI--IA Urban Cluster (2010)",71857
3262.0,2595.0,43.0,2552.0,1417.0,178.0,2274.0,1066.0,114.0,17.0,8.0,56.0,611.0,"Prairie du Sac--Sauk City, WI Urban Cluster (2010)",71884
1318.0,1038.0,27.0,1011.0,570.0,113.0,822.0,383.0,84.0,42.0,0.0,62.0,218.0,"Prairie Grove, AR Urban Cluster (2010)",71911
711.0,312.0,12.0,300.0,228.0,123.0,137.0,18.0,39.0,36.0,0.0,101.0,298.0,"Prairie View, TX Urban Cluster (2010)",71938
2590.0,1822.0,9.0,1813.0,1065.0,112.0,1625.0,685.0,109.0,29.0,0.0,52.0,716.0,"Pratt, KS Urban Cluster (2010)",71965
791.0,533.0,14.0,519.0,295.0,241.0,234.0,180.0,44.0,44.0,0.0,11.0,247.0,"Port Barre, LA Urban Cluster (2010)",71020
6204.0,4692.0,96.0,4596.0,2695.0,528.0,3973.0,1803.0,182.0,19.0,21.0,413.0,1099.0,"Port Clinton, OH Urban Cluster (2010)",71047
20131.0,13719.0,141.0,13578.0,10116.0,5689.0,6933.0,2933.0,1184.0,314.0,35.0,705.0,5707.0,"Porterville, CA Urbanized Area (2010)",71074
1957.0,1734.0,24.0,1710.0,1124.0,264.0,1352.0,507.0,154.0,43.0,0.0,28.0,195.0,"Port Hadlock-Irondale, WA Urban Cluster (2010)",71128
35984.0,27693.0,361.0,27332.0,17150.0,3370.0,22938.0,9412.0,1403.0,262.0,61.0,1252.0,7039.0,"Port Huron, MI Urbanized Area (2010)",71155
