1683.0,1084.0,18.0,1066.0,613.0,155.0,776.0,424.0,132.0,14.0,0.0,46.0,553.0,"Giddings, TX Urban Cluster (2010)",33193
2172.0,1672.0,44.0,1628.0,988.0,238.0,1206.0,521.0,181.0,107.0,0.0,32.0,468.0,"Gillespie, IL Urban Cluster (2010)",33220
1073.0,775.0,6.0,769.0,498.0,110.0,594.0,234.0,85.0,26.0,0.0,43.0,255.0,"Gilman, IL Urban Cluster (2010)",33274
1605.0,1113.0,0.0,1113.0,837.0,366.0,699.0,216.0,86.0,22.0,0.0,55.0,437.0,"Gilmer, TX Urban Cluster (2010)",33301
33197.0,28731.0,166.0,28565.0,19364.0,2572.0,24127.0,7622.0,3026.0,968.0,147.0,1221.0,3245.0,"Gilroy--Morgan Hill, CA Urbanized Area (2010)",33328
931.0,667.0,8.0,659.0,369.0,24.0,607.0,264.0,58.0,23.0,3.0,29.0,235.0,"Girard, KS Urban Cluster (2010)",33355
1260.0,755.0,0.0,755.0,393.0,133.0,567.0,306.0,41.0,23.0,15.0,154.0,351.0,"Gladwin, MI Urban Cluster (2010)",33409
5821.0,4224.0,43.0,4181.0,1781.0,389.0,3738.0,2261.0,123.0,19.0,20.0,119.0,1478.0,"Glasgow, KY Urban Cluster (2010)",33436
1577.0,1172.0,30.0,1142.0,874.0,51.0,1036.0,243.0,39.0,17.0,0.0,109.0,296.0,"Glasgow, MT Urban Cluster (2010)",33463
26788.0,21924.0,119.0,21805.0,12364.0,1436.0,19982.0,8956.0,609.0,196.0,55.0,648.0,4216.0,"Glens Falls, NY Urbanized Area (2010)",33598
2101.0,1570.0,28.0,1542.0,836.0,151.0,1303.0,618.0,82.0,71.0,17.0,153.0,378.0,"Glencoe, MN Urban Cluster (2010)",33490
2975.0,2234.0,9.0,2225.0,1298.0,140.0,2035.0,804.0,183.0,43.0,0.0,59.0,682.0,"Glendive, MT Urban Cluster (2010)",33517
1395.0,768.0,38.0,730.0,569.0,113.0,534.0,144.0,104.0,13.0,0.0,68.0,559.0,"Glennville, GA Urban Cluster (2010)",33544
646.0,488.0,8.0,480.0,192.0,21.0,443.0,279.0,20.0,9.0,0.0,34.0,124.0,"Glenville, WV Urban Cluster (2010)",33612
2126.0,1654.0,7.0,1647.0,1083.0,95.0,1391.0,501.0,248.0,38.0,6.0,82.0,390.0,"Glenwood, IA Urban Cluster (2010)",33625
1160.0,1108.0,0.0,1108.0,721.0,11.0,1079.0,340.0,39.0,0.0,0.0,19.0,33.0,"Glenwood, MD Urban Cluster (2010)",33635
4534.0,3639.0,59.0,3580.0,1997.0,657.0,2722.0,1430.0,258.0,106.0,0.0,142.0,753.0,"Glenwood Springs, CO Urban Cluster (2010)",33652
5544.0,2556.0,0.0,2556.0,1145.0,349.0,2073.0,1279.0,184.0,97.0,15.0,708.0,2280.0,"Globe, AZ Urban Cluster (2010)",33679
1473.0,1034.0,0.0,1034.0,518.0,121.0,896.0,499.0,33.0,17.0,0.0,47.0,392.0,"Gloucester Courthouse, VA Urban Cluster (2010)",33695
947.0,614.0,8.0,606.0,332.0,115.0,467.0,257.0,25.0,13.0,0.0,42.0,291.0,"Glouster, OH Urban Cluster (2010)",33706
11481.0,8544.0,61.0,8483.0,3931.0,597.0,7453.0,3326.0,345.0,88.0,298.0,491.0,2446.0,"Gloversville, NY Urban Cluster (2010)",33733
1394.0,1040.0,0.0,1040.0,556.0,38.0,965.0,374.0,70.0,37.0,0.0,66.0,288.0,"Gold Beach, OR Urban Cluster (2010)",33749
1393.0,1225.0,9.0,1216.0,727.0,119.0,1076.0,471.0,49.0,12.0,0.0,0.0,168.0,"Golden Beach, MD Urban Cluster (2010)",33760
1421.0,863.0,0.0,863.0,532.0,36.0,606.0,244.0,174.0,37.0,11.0,64.0,494.0,"Goldendale, WA Urban Cluster (2010)",33787
1470.0,1292.0,11.0,1281.0,847.0,0.0,1281.0,398.0,76.0,0.0,0.0,93.0,85.0,"Golden Gate Estates, FL Urban Cluster (2010)",33798
23680.0,17239.0,78.0,17161.0,11469.0,2436.0,14089.0,5378.0,745.0,116.0,46.0,893.0,5548.0,"Goldsboro, NC Urbanized Area (2010)",33814
1990.0,1328.0,48.0,1280.0,850.0,237.0,879.0,262.0,234.0,132.0,0.0,39.0,623.0,"Gonzales, CA Urban Cluster (2010)",33841
2585.0,1741.0,0.0,1741.0,1107.0,86.0,1349.0,546.0,391.0,0.0,8.0,64.0,780.0,"Gonzales, TX Urban Cluster (2010)",33868
1486.0,1061.0,0.0,1061.0,363.0,41.0,906.0,634.0,194.0,46.0,0.0,57.0,368.0,"Gooding, ID Urban Cluster (2010)",33895
2134.0,1808.0,72.0,1736.0,829.0,6.0,1607.0,786.0,177.0,82.0,0.0,27.0,299.0,"Goodland, KS Urban Cluster (2010)",33922
2317.0,2052.0,67.0,1985.0,1273.0,94.0,1826.0,656.0,96.0,15.0,9.0,46.0,219.0,"Goodrich, MI Urban Cluster (2010)",33938
1595.0,1066.0,0.0,1066.0,441.0,143.0,883.0,585.0,40.0,40.0,0.0,43.0,486.0,"Georgetown, OH Urban Cluster (2010)",33004
4545.0,2999.0,0.0,2999.0,1874.0,230.0,2644.0,1080.0,124.0,35.0,10.0,314.0,1232.0,"Georgetown, SC Urban Cluster (2010)",33031
24584.0,17237.0,152.0,17085.0,8153.0,2157.0,14557.0,8259.0,821.0,168.0,18.0,1244.0,6103.0,"Gadsden, AL Urbanized Area (2010)",32113
1712.0,976.0,0.0,976.0,650.0,212.0,722.0,292.0,65.0,17.0,0.0,110.0,626.0,"Fulton, KY--TN Urban Cluster (2010)",32032
994.0,616.0,0.0,616.0,438.0,115.0,430.0,157.0,61.0,11.0,10.0,52.0,326.0,"Fulton, MS Urban Cluster (2010)",32059
3747.0,2391.0,12.0,2379.0,1313.0,267.0,2048.0,1002.0,105.0,9.0,14.0,114.0,1242.0,"Fulton, MO Urban Cluster (2010)",32086
7350.0,4452.0,8.0,4444.0,2395.0,659.0,3626.0,1716.0,309.0,71.0,14.0,284.0,2614.0,"Gaffney, SC Urban Cluster (2010)",32140
74578.0,62092.0,141.0,61951.0,42150.0,3762.0,57238.0,18700.0,1804.0,312.0,130.0,3270.0,9216.0,"Gainesville, FL Urbanized Area (2010)",32167
45492.0,35336.0,62.0,35274.0,22919.0,4058.0,30265.0,11354.0,2374.0,423.0,35.0,1219.0,8937.0,"Gainesville, GA Urbanized Area (2010)",32194
5976.0,3729.0,9.0,3720.0,2707.0,759.0,2809.0,902.0,233.0,12.0,23.0,501.0,1746.0,"Gainesville, TX Urban Cluster (2010)",32221
2911.0,1715.0,8.0,1707.0,1019.0,300.0,1351.0,578.0,86.0,40.0,4.0,113.0,1083.0,"Galax, VA Urban Cluster (2010)",32248
1412.0,1080.0,28.0,1052.0,593.0,129.0,866.0,430.0,74.0,14.0,0.0,87.0,245.0,"Galena, IL Urban Cluster (2010)",32275
888.0,672.0,9.0,663.0,362.0,89.0,552.0,280.0,59.0,0.0,0.0,38.0,178.0,"Galena, KS--MO Urban Cluster (2010)",32302
13969.0,9571.0,125.0,9446.0,5715.0,1112.0,8089.0,3384.0,442.0,103.0,17.0,490.0,3908.0,"Galesburg, IL Urban Cluster (2010)",32329
6614.0,4789.0,35.0,4754.0,2484.0,385.0,4236.0,2203.0,138.0,12.0,0.0,313.0,1512.0,"Galion, OH Urban Cluster (2010)",32356
7914.0,5604.0,34.0,5570.0,3383.0,737.0,4730.0,1854.0,340.0,14.0,29.0,169.0,2141.0,"Galliano--Larose--Cut Off, LA Urban Cluster (2010)",32383
7269.0,4408.0,111.0,4297.0,2739.0,851.0,3347.0,1397.0,302.0,38.0,0.0,288.0,2573.0,"Gallup, NM Urban Cluster (2010)",32437
8312.0,7207.0,163.0,7044.0,4585.0,659.0,5810.0,2043.0,786.0,228.0,73.0,193.0,912.0,"Galt, CA Urban Cluster (2010)",32451
19238.0,13838.0,60.0,13778.0,9395.0,2556.0,10821.0,4074.0,681.0,121.0,32.0,1103.0,4297.0,"Galveston, TX Urban Cluster (2010)",32491
1471.0,945.0,0.0,945.0,497.0,76.0,816.0,430.0,61.0,0.0,0.0,88.0,438.0,"Garnett, KS Urban Cluster (2010)",32626
10321.0,7903.0,54.0,7849.0,5364.0,1588.0,5972.0,2236.0,482.0,86.0,27.0,394.0,2024.0,"Garden City, KS Urban Cluster (2010)",32518
8849.0,7563.0,94.0,7469.0,4729.0,770.0,6419.0,2555.0,483.0,54.0,16.0,134.0,1152.0,"Gardnerville Ranchos, NV Urban Cluster (2010)",32572
1252.0,990.0,0.0,990.0,571.0,106.0,856.0,392.0,47.0,8.0,0.0,84.0,178.0,"Garner, IA Urban Cluster (2010)",32599
2085.0,1560.0,20.0,1540.0,671.0,102.0,1368.0,841.0,49.0,15.0,4.0,150.0,375.0,"Garrettsville, OH Urban Cluster (2010)",32637
66225.0,49613.0,296.0,49317.0,32008.0,7043.0,40551.0,16007.0,3709.0,452.0,103.0,2206.0,14406.0,"Gastonia, NC--SC Urbanized Area (2010)",32653
2741.0,1923.0,5.0,1918.0,1454.0,555.0,1200.0,353.0,209.0,12.0,14.0,120.0,698.0,"Gatesville, TX Urban Cluster (2010)",32707
1493.0,1002.0,21.0,981.0,598.0,98.0,829.0,383.0,91.0,0.0,0.0,0.0,491.0,"Gautier, MS Urban Cluster (2010)",32720
3464.0,2631.0,15.0,2616.0,1490.0,254.0,2283.0,1087.0,84.0,0.0,8.0,211.0,622.0,"Gaylord, MI Urban Cluster (2010)",32734
2586.0,2022.0,28.0,1994.0,1403.0,265.0,1710.0,512.0,70.0,0.0,0.0,144.0,420.0,"Geneseo, IL Urban Cluster (2010)",32761
2199.0,1782.0,22.0,1760.0,891.0,138.0,1563.0,802.0,83.0,35.0,0.0,122.0,295.0,"Geneseo, NY Urban Cluster (2010)",32788
2303.0,1969.0,4.0,1965.0,1182.0,198.0,1682.0,653.0,98.0,74.0,0.0,45.0,289.0,"Genoa, IL Urban Cluster (2010)",32869
1070.0,794.0,0.0,794.0,389.0,97.0,626.0,365.0,84.0,40.0,0.0,0.0,276.0,"Geneva, AL Urban Cluster (2010)",32815
11681.0,9070.0,44.0,9026.0,5606.0,827.0,8005.0,3227.0,251.0,80.0,9.0,359.0,2252.0,"Geneva, NY Urban Cluster (2010)",32842
3074.0,2210.0,18.0,2192.0,1183.0,269.0,1892.0,971.0,111.0,0.0,0.0,85.0,779.0,"Geneva, OH Urban Cluster (2010)",32850
1213.0,921.0,9.0,912.0,461.0,48.0,794.0,396.0,72.0,27.0,0.0,28.0,264.0,"Genoa, OH Urban Cluster (2010)",32896
2601.0,1458.0,0.0,1458.0,717.0,90.0,1327.0,636.0,105.0,0.0,0.0,96.0,1047.0,"Georgetown, DE Urban Cluster (2010)",32950
12490.0,10243.0,57.0,10186.0,7532.0,1702.0,8090.0,2459.0,638.0,123.0,22.0,523.0,1724.0,"Georgetown, KY Urban Cluster (2010)",32977
685.0,503.0,0.0,503.0,266.0,94.0,398.0,220.0,24.0,0.0,0.0,8.0,174.0,"Graceville, FL Urban Cluster (2010)",34072
1359.0,1033.0,7.0,1026.0,561.0,93.0,908.0,437.0,45.0,7.0,0.0,51.0,275.0,"Gothenburg, NE Urban Cluster (2010)",34003
1709.0,1135.0,0.0,1135.0,807.0,135.0,992.0,320.0,48.0,0.0,8.0,146.0,428.0,"Gouverneur, NY Urban Cluster (2010)",34030
1639.0,1002.0,13.0,989.0,575.0,135.0,799.0,357.0,58.0,26.0,3.0,118.0,519.0,"Gowanda, NY Urban Cluster (2010)",34057
1872.0,1290.0,0.0,1290.0,935.0,155.0,1086.0,328.0,58.0,0.0,3.0,51.0,531.0,"Grafton, ND Urban Cluster (2010)",34084
2345.0,1614.0,13.0,1601.0,852.0,241.0,1253.0,722.0,100.0,27.0,0.0,26.0,705.0,"Grafton, WV Urban Cluster (2010)",34111
3435.0,2417.0,22.0,2395.0,1370.0,265.0,2086.0,999.0,124.0,26.0,0.0,171.0,847.0,"Graham, TX Urban Cluster (2010)",34138
5432.0,3757.0,36.0,3721.0,2408.0,242.0,3235.0,1075.0,434.0,125.0,0.0,133.0,1542.0,"Gramercy--Lutcher, LA Urban Cluster (2010)",34151
12182.0,9835.0,49.0,9786.0,6056.0,1893.0,7275.0,3384.0,792.0,170.0,31.0,385.0,1962.0,"Granbury, TX Urban Cluster (2010)",34165
1652.0,1273.0,15.0,1258.0,941.0,130.0,1096.0,285.0,75.0,0.0,16.0,22.0,357.0,"Grand Bay, AL Urban Cluster (2010)",34192
27908.0,22087.0,196.0,21891.0,13574.0,1836.0,19664.0,7813.0,824.0,159.0,11.0,1346.0,4475.0,"Grand Forks, ND--MN Urbanized Area (2010)",34219
223255.0,183946.0,1054.0,182892.0,121121.0,16242.0,160977.0,57229.0,7699.0,1615.0,604.0,7965.0,31344.0,"Grand Rapids, MI Urbanized Area (2010)",34300
891.0,804.0,1.0,803.0,541.0,33.0,754.0,255.0,55.0,6.0,0.0,33.0,54.0,"Grand Forks AFB, ND Urban Cluster (2010)",34229
19636.0,14862.0,148.0,14714.0,8827.0,2017.0,12040.0,5474.0,884.0,164.0,20.0,633.0,4141.0,"Grand Island, NE Urbanized Area (2010)",34246
52965.0,44026.0,407.0,43619.0,30464.0,4407.0,37816.0,12107.0,1975.0,489.0,40.0,1460.0,7479.0,"Grand Junction, CO Urbanized Area (2010)",34273
4232.0,3308.0,3.0,3305.0,2128.0,299.0,2924.0,1089.0,144.0,18.0,0.0,123.0,801.0,"Grand Rapids, MN Urban Cluster (2010)",34327
1003.0,519.0,0.0,519.0,253.0,56.0,410.0,217.0,70.0,29.0,0.0,97.0,387.0,"Grand Saline, TX Urban Cluster (2010)",34354
6789.0,4894.0,76.0,4818.0,3016.0,846.0,3480.0,1468.0,653.0,183.0,14.0,431.0,1464.0,"Grandview, WA Urban Cluster (2010)",34381
681.0,429.0,9.0,420.0,259.0,105.0,289.0,143.0,26.0,0.0,9.0,15.0,237.0,"Granger, WA Urban Cluster (2010)",34397
1636.0,1290.0,19.0,1271.0,757.0,145.0,1111.0,499.0,48.0,15.0,0.0,86.0,260.0,"Grangerland, TX Urban Cluster (2010)",34408
1315.0,944.0,15.0,929.0,635.0,128.0,618.0,174.0,255.0,44.0,20.0,61.0,310.0,"Grangeville, ID Urban Cluster (2010)",34435
1218.0,970.0,18.0,952.0,592.0,132.0,709.0,305.0,74.0,5.0,0.0,50.0,198.0,"Granite Falls, MN Urban Cluster (2010)",34462
2415.0,2057.0,16.0,2041.0,1444.0,221.0,1776.0,574.0,90.0,14.0,0.0,55.0,303.0,"Granite Falls, WA Urban Cluster (2010)",34470
1925.0,1421.0,17.0,1404.0,859.0,277.0,967.0,388.0,211.0,117.0,2.0,82.0,422.0,"Granite Shoals, TX Urban Cluster (2010)",34478
932.0,643.0,0.0,643.0,431.0,176.0,358.0,155.0,136.0,29.0,11.0,65.0,224.0,"Grantville, GA Urban Cluster (2010)",34554
4359.0,2476.0,47.0,2429.0,1157.0,609.0,1530.0,1036.0,303.0,155.0,9.0,285.0,1598.0,"Grants, NM Urban Cluster (2010)",34489
21226.0,16142.0,218.0,15924.0,8023.0,1316.0,13459.0,6947.0,1556.0,601.0,38.0,828.0,4256.0,"Grants Pass, OR Urbanized Area (2010)",34516
2210.0,1972.0,7.0,1965.0,1356.0,222.0,1305.0,454.0,451.0,131.0,9.0,24.0,214.0,"Grantsville, UT Urban Cluster (2010)",34543
1225.0,836.0,5.0,831.0,328.0,86.0,740.0,474.0,33.0,5.0,0.0,80.0,309.0,"Granville, NY--VT Urban Cluster (2010)",34570
15046.0,12001.0,136.0,11865.0,6576.0,942.0,10348.0,4835.0,730.0,122.0,62.0,551.0,2494.0,"Grass Valley, CA Urban Cluster (2010)",34597
1601.0,1193.0,17.0,1176.0,553.0,78.0,1055.0,607.0,58.0,16.0,0.0,61.0,347.0,"Gray, GA Urban Cluster (2010)",34613
1521.0,1154.0,0.0,1154.0,585.0,155.0,964.0,544.0,33.0,17.0,8.0,48.0,319.0,"Grayling, MI Urban Cluster (2010)",34624
2025.0,1302.0,13.0,1289.0,583.0,123.0,1084.0,618.0,90.0,54.0,0.0,83.0,640.0,"Grayson, KY Urban Cluster (2010)",34651
44383.0,34718.0,287.0,34431.0,22520.0,3962.0,29135.0,10734.0,2274.0,521.0,88.0,2144.0,7521.0,"Greeley, CO Urbanized Area (2010)",34786
1800.0,1498.0,17.0,1481.0,971.0,161.0,1320.0,510.0,22.0,0.0,0.0,20.0,282.0,"Great Barrington, MA Urban Cluster (2010)",34678
6636.0,4787.0,56.0,4731.0,2928.0,487.0,3963.0,1579.0,479.0,60.0,11.0,315.0,1534.0,"Great Bend, KS Urban Cluster (2010)",34705
28112.0,20889.0,106.0,20783.0,11823.0,2032.0,17949.0,8125.0,1220.0,424.0,47.0,961.0,6262.0,"Great Falls, MT Urbanized Area (2010)",34759
85517.0,69660.0,579.0,69081.0,43592.0,8130.0,58708.0,23805.0,3323.0,645.0,139.0,2668.0,13189.0,"Green Bay, WI Urbanized Area (2010)",34813
1531.0,1055.0,0.0,1055.0,614.0,84.0,879.0,383.0,135.0,47.0,0.0,142.0,334.0,"Greenbrier, AR Urban Cluster (2010)",34826
3526.0,2703.0,45.0,2658.0,1293.0,203.0,2344.0,1261.0,216.0,38.0,0.0,223.0,600.0,"Greencastle, IN Urban Cluster (2010)",34840
9105.0,6151.0,80.0,6071.0,3651.0,815.0,5009.0,2234.0,299.0,77.0,36.0,285.0,2669.0,"Greeneville, TN Urban Cluster (2010)",34894
3702.0,2416.0,68.0,2348.0,1487.0,422.0,1561.0,601.0,418.0,197.0,5.0,70.0,1216.0,"Greenfield, CA Urban Cluster (2010)",34921
10160.0,7783.0,40.0,7743.0,4122.0,343.0,7326.0,3423.0,246.0,31.0,0.0,300.0,2077.0,"Greenfield, MA Urban Cluster (2010)",34975
1041.0,363.0,0.0,363.0,232.0,57.0,306.0,131.0,8.0,0.0,0.0,83.0,595.0,"Greensboro, GA Urban Cluster (2010)",35137
130191.0,89977.0,589.0,89388.0,56277.0,7999.0,79080.0,30692.0,4245.0,745.0,305.0,13556.0,26658.0,"Greensboro, NC Urbanized Area (2010)",35164
4970.0,3389.0,39.0,3350.0,2063.0,361.0,2847.0,1129.0,164.0,25.0,34.0,442.0,1139.0,"Greensburg, IN Urban Cluster (2010)",35191
4540.0,3912.0,75.0,3837.0,2475.0,363.0,3209.0,1205.0,337.0,103.0,10.0,151.0,477.0,"Green River, WY Urban Cluster (2010)",35083
1383.0,1060.0,0.0,1060.0,662.0,126.0,869.0,353.0,95.0,20.0,0.0,82.0,241.0,"Greentown, IN Urban Cluster (2010)",35218
1818.0,1251.0,17.0,1234.0,631.0,162.0,1024.0,514.0,73.0,17.0,0.0,35.0,532.0,"Greenville, AL Urban Cluster (2010)",35272
1976.0,1549.0,19.0,1530.0,913.0,155.0,1320.0,504.0,249.0,18.0,7.0,18.0,409.0,"Greenville, IL Urban Cluster (2010)",35299
3674.0,2615.0,11.0,2604.0,1429.0,154.0,2400.0,1056.0,96.0,24.0,0.0,216.0,843.0,"Greenville, MI Urban Cluster (2010)",35326
2119.0,1243.0,20.0,1223.0,523.0,58.0,1089.0,636.0,98.0,48.0,0.0,166.0,710.0,"Greenfield, OH Urban Cluster (2010)",35002
852.0,472.0,14.0,458.0,272.0,113.0,302.0,142.0,45.0,14.0,15.0,48.0,332.0,"Green Forest, AR Urban Cluster (2010)",35029
3930.0,2711.0,24.0,2687.0,1640.0,189.0,2388.0,965.0,199.0,47.0,0.0,136.0,1083.0,"Greenville, PA Urban Cluster (2010)",35434
12196.0,7503.0,26.0,7477.0,5257.0,1489.0,5683.0,1899.0,631.0,68.0,4.0,539.0,4154.0,"Greenville, MS Urban Cluster (2010)",35353
49369.0,38482.0,155.0,38327.0,23646.0,6082.0,31400.0,13841.0,1436.0,390.0,39.0,3454.0,7433.0,"Greenville, NC Urbanized Area (2010)",35380
5977.0,4174.0,98.0,4076.0,2151.0,526.0,3464.0,1879.0,132.0,10.0,7.0,400.0,1403.0,"Greenville, OH Urban Cluster (2010)",35407
163918.0,121863.0,561.0,121302.0,76971.0,10740.0,106388.0,40465.0,7795.0,1319.0,356.0,5103.0,36952.0,"Greenville, SC Urbanized Area (2010)",35461
8848.0,6390.0,96.0,6294.0,4051.0,1117.0,5059.0,2039.0,306.0,59.0,0.0,626.0,1832.0,"Greenville, TX Urban Cluster (2010)",35488
1102.0,820.0,18.0,802.0,366.0,34.0,758.0,432.0,23.0,0.0,0.0,131.0,151.0,"Greenwich, NY Urban Cluster (2010)",35515
3156.0,2463.0,42.0,2421.0,1427.0,171.0,2188.0,955.0,94.0,0.0,0.0,124.0,569.0,"Greenwood, AR Urban Cluster (2010)",35542
7540.0,3059.0,32.0,3027.0,1392.0,256.0,2637.0,1395.0,330.0,121.0,0.0,413.0,4068.0,"Greenwood, MS Urban Cluster (2010)",35569
16610.0,10849.0,104.0,10745.0,5917.0,1302.0,9143.0,4405.0,697.0,137.0,0.0,1098.0,4663.0,"Greenwood, SC Urban Cluster (2010)",35596
3669.0,2197.0,9.0,2188.0,1324.0,322.0,1770.0,804.0,184.0,38.0,5.0,198.0,1274.0,"Grenada, MS Urban Cluster (2010)",35623
2928.0,2187.0,40.0,2147.0,1522.0,480.0,1582.0,569.0,140.0,56.0,0.0,89.0,652.0,"Gridley, CA Urban Cluster (2010)",35677
1318.0,874.0,8.0,866.0,576.0,232.0,576.0,261.0,55.0,7.0,0.0,60.0,384.0,"Grifton, NC Urban Cluster (2010)",35690
3529.0,2634.0,52.0,2582.0,1419.0,244.0,2224.0,1112.0,136.0,17.0,0.0,146.0,749.0,"Grinnell, IA Urban Cluster (2010)",35704
989.0,812.0,0.0,812.0,393.0,88.0,706.0,384.0,30.0,9.0,0.0,38.0,139.0,"Grissom AFB, IN Urban Cluster (2010)",35716
1357.0,797.0,18.0,779.0,397.0,54.0,714.0,382.0,26.0,0.0,0.0,105.0,455.0,"Groesbeck, TX Urban Cluster (2010)",35731
1684.0,1207.0,10.0,1197.0,693.0,166.0,982.0,431.0,57.0,5.0,5.0,35.0,442.0,"Grottoes, VA Urban Cluster (2010)",35758
3495.0,2607.0,24.0,2583.0,1570.0,296.0,1942.0,684.0,319.0,147.0,86.0,162.0,726.0,"Grove, OK Urban Cluster (2010)",35785
3742.0,3034.0,0.0,3034.0,1734.0,99.0,2908.0,1278.0,38.0,3.0,0.0,96.0,612.0,"Grove City, PA Urban Cluster (2010)",35812
1944.0,1314.0,23.0,1291.0,885.0,214.0,1001.0,376.0,109.0,0.0,19.0,33.0,597.0,"Guadalupe, CA Urban Cluster (2010)",35839
26137.0,13574.0,102.0,13472.0,9384.0,5161.0,7713.0,3780.0,723.0,197.0,16.0,612.0,11951.0,"Guayama, PR Urbanized Area (2010)",35866
2377.0,1994.0,9.0,1985.0,1083.0,188.0,1764.0,788.0,157.0,11.0,0.0,167.0,216.0,"Guerneville, CA Urban Cluster (2010)",35893
86629.0,64900.0,339.0,64561.0,40938.0,9847.0,51490.0,21647.0,4533.0,1172.0,110.0,2655.0,19074.0,"Gulfport, MS Urbanized Area (2010)",35920
6286.0,4197.0,37.0,4160.0,2865.0,396.0,3513.0,1016.0,1184.0,143.0,0.0,342.0,1747.0,"Gun Barrel City, TX Urban Cluster (2010)",35974
1136.0,938.0,0.0,938.0,577.0,63.0,755.0,307.0,120.0,36.0,0.0,80.0,118.0,"Gun Lake, MI Urban Cluster (2010)",35987
3482.0,2850.0,0.0,2850.0,884.0,337.0,2355.0,1723.0,188.0,145.0,3.0,57.0,575.0,"Hailey, ID Urban Cluster (2010)",36217
2689.0,2115.0,16.0,2099.0,732.0,117.0,1902.0,1302.0,104.0,26.0,11.0,163.0,411.0,"Gunnison, CO Urban Cluster (2010)",36001
689.0,593.0,8.0,585.0,302.0,28.0,535.0,245.0,29.0,14.0,8.0,4.0,92.0,"Gunnison, UT Urban Cluster (2010)",36028
3024.0,2111.0,0.0,2111.0,1191.0,310.0,1744.0,749.0,65.0,30.0,27.0,149.0,764.0,"Guthrie, OK Urban Cluster (2010)",36082
1986.0,1354.0,43.0,1311.0,788.0,148.0,1053.0,387.0,227.0,31.0,0.0,55.0,577.0,"Gustine, CA Urban Cluster (2010)",36055
3742.0,2298.0,31.0,2267.0,1397.0,179.0,2036.0,870.0,80.0,0.0,0.0,221.0,1223.0,"Guymon, OK Urban Cluster (2010)",36109
2039.0,1703.0,48.0,1655.0,1141.0,598.0,990.0,514.0,63.0,0.0,0.0,118.0,218.0,"Gypsum, CO Urban Cluster (2010)",36136
72110.0,55022.0,617.0,54405.0,33592.0,5178.0,47536.0,19411.0,2622.0,481.0,84.0,3367.0,13721.0,"Hagerstown, MD--WV--PA Urbanized Area (2010)",36190
4525.0,3765.0,7.0,3758.0,3011.0,258.0,3486.0,735.0,100.0,0.0,4.0,242.0,518.0,"Haleiwa--Waialua--Pupukea, HI Urban Cluster (2010)",36231
1521.0,919.0,27.0,892.0,492.0,153.0,664.0,334.0,51.0,8.0,43.0,75.0,527.0,"Haleyville, AL Urban Cluster (2010)",36244
8228.0,7325.0,66.0,7259.0,5573.0,335.0,6701.0,1557.0,411.0,24.0,0.0,75.0,828.0,"Half Moon Bay, CA Urban Cluster (2010)",36271
1126.0,662.0,8.0,654.0,446.0,137.0,456.0,164.0,68.0,20.0,0.0,32.0,432.0,"Halls, TN Urban Cluster (2010)",36298
1380.0,1118.0,0.0,1118.0,632.0,174.0,858.0,456.0,33.0,15.0,12.0,0.0,262.0,"Hallsville, TX Urban Cluster (2010)",36325
1080.0,586.0,0.0,586.0,389.0,101.0,424.0,132.0,85.0,28.0,7.0,61.0,433.0,"Hamburg, AR Urban Cluster (2010)",36352
1442.0,1037.0,0.0,1037.0,681.0,342.0,663.0,339.0,32.0,17.0,0.0,17.0,388.0,"Hamilton, AL Urban Cluster (2010)",36396
3151.0,2300.0,16.0,2284.0,1271.0,229.0,1977.0,868.0,183.0,59.0,0.0,43.0,808.0,"Hamilton, MT Urban Cluster (2010)",36406
866.0,620.0,7.0,613.0,423.0,45.0,551.0,161.0,38.0,7.0,8.0,50.0,196.0,"Hamilton, NY Urban Cluster (2010)",36433
1160.0,711.0,0.0,711.0,343.0,123.0,559.0,360.0,17.0,0.0,8.0,16.0,433.0,"Hamilton, TX Urban Cluster (2010)",36460
25489.0,19101.0,68.0,19033.0,13181.0,2307.0,16061.0,5247.0,871.0,309.0,40.0,1101.0,5287.0,"Hammond, LA Urbanized Area (2010)",36514
4849.0,4015.0,75.0,3940.0,2240.0,144.0,3786.0,1629.0,106.0,6.0,0.0,78.0,756.0,"Hammonton, NJ Urban Cluster (2010)",36541
1494.0,1461.0,0.0,1461.0,919.0,29.0,1352.0,491.0,174.0,51.0,0.0,0.0,33.0,"Hampshire, IL Urban Cluster (2010)",36568
4792.0,3925.0,109.0,3816.0,2200.0,125.0,3626.0,1514.0,169.0,39.0,0.0,150.0,717.0,"Hampstead, NC Urban Cluster (2010)",36585
1646.0,1025.0,30.0,995.0,506.0,93.0,828.0,407.0,132.0,29.0,0.0,92.0,529.0,"Hampton, IA Urban Cluster (2010)",36622
1736.0,1029.0,12.0,1017.0,731.0,234.0,702.0,253.0,105.0,24.0,0.0,77.0,630.0,"Hampton, SC Urban Cluster (2010)",36649
1204.0,772.0,22.0,750.0,444.0,135.0,579.0,298.0,61.0,8.0,0.0,52.0,380.0,"Hanceville, AL Urban Cluster (2010)",36676
29480.0,23259.0,158.0,23101.0,13801.0,2116.0,20038.0,8545.0,1585.0,288.0,45.0,830.0,5391.0,"Hanford, CA Urbanized Area (2010)",36703
7204.0,5325.0,34.0,5291.0,3368.0,651.0,4483.0,1755.0,208.0,83.0,12.0,261.0,1618.0,"Hannibal, MO Urban Cluster (2010)",36730
25945.0,19559.0,315.0,19244.0,11888.0,1547.0,17097.0,6918.0,791.0,160.0,19.0,653.0,5733.0,"Hanover, PA Urbanized Area (2010)",36784
884.0,363.0,7.0,356.0,189.0,70.0,278.0,167.0,0.0,0.0,0.0,52.0,469.0,"Hardeeville, SC Urban Cluster (2010)",36798
1194.0,831.0,4.0,827.0,502.0,101.0,626.0,260.0,113.0,58.0,0.0,36.0,327.0,"Hardin, MT Urban Cluster (2010)",36811
1008.0,869.0,9.0,860.0,524.0,150.0,702.0,321.0,69.0,8.0,0.0,31.0,108.0,"Hardyston Township West, NJ Urban Cluster (2010)",36823
2168.0,1676.0,26.0,1650.0,869.0,90.0,1524.0,751.0,81.0,7.0,0.0,55.0,437.0,"Harlan, IA Urban Cluster (2010)",36838
2733.0,1639.0,6.0,1633.0,642.0,107.0,1455.0,917.0,92.0,36.0,13.0,136.0,958.0,"Harlan, KY Urban Cluster (2010)",36865
1060.0,580.0,19.0,561.0,358.0,89.0,422.0,160.0,96.0,28.0,0.0,54.0,426.0,"Harlem, GA Urban Cluster (2010)",36878
42291.0,24544.0,159.0,24385.0,15106.0,4020.0,19129.0,8224.0,2047.0,437.0,11.0,1988.0,15759.0,"Harlingen, TX Urbanized Area (2010)",36892
1678.0,1269.0,44.0,1225.0,737.0,135.0,1044.0,454.0,53.0,8.0,0.0,65.0,344.0,"Harrah, OK Urban Cluster (2010)",36919
9332.0,6160.0,23.0,6137.0,3887.0,712.0,5155.0,2012.0,318.0,85.0,0.0,514.0,2658.0,"Harriman--Kingston--Rockwood, TN Urban Cluster (2010)",36946
1590.0,1150.0,9.0,1141.0,451.0,89.0,1042.0,690.0,25.0,0.0,0.0,136.0,304.0,"Harrington, DE Urban Cluster (2010)",36973
1304.0,1221.0,49.0,1172.0,713.0,81.0,1068.0,434.0,26.0,0.0,11.0,30.0,53.0,"Harrisburg, SD Urban Cluster (2010)",37091
3973.0,2657.0,23.0,2634.0,1673.0,480.0,2065.0,857.0,190.0,33.0,14.0,179.0,1137.0,"Harrisburg, IL Urban Cluster (2010)",37000
1170.0,927.0,0.0,927.0,642.0,141.0,752.0,251.0,54.0,34.0,0.0,0.0,243.0,"Harrisburg, OR Urban Cluster (2010)",37054
187177.0,151211.0,1283.0,149928.0,95150.0,11092.0,134993.0,51696.0,5367.0,902.0,349.0,5899.0,30067.0,"Harrisburg, PA Urbanized Area (2010)",37081
5781.0,4409.0,14.0,4395.0,2328.0,782.0,3488.0,1966.0,180.0,59.0,5.0,158.0,1214.0,"Harrison, AR Urban Cluster (2010)",37108
3889.0,2581.0,0.0,2581.0,1650.0,307.0,2154.0,895.0,227.0,9.0,0.0,331.0,977.0,"Harrisonville, MO Urban Cluster (2010)",37189
23772.0,17711.0,69.0,17642.0,11125.0,2008.0,15095.0,6017.0,902.0,135.0,21.0,2163.0,3898.0,"Harrisonburg, VA Urbanized Area (2010)",37162
1480.0,954.0,19.0,935.0,501.0,118.0,789.0,374.0,52.0,2.0,7.0,72.0,454.0,"Harrison, MI Urban Cluster (2010)",37135
5423.0,4237.0,109.0,4128.0,2583.0,384.0,3595.0,1467.0,197.0,13.0,17.0,50.0,1136.0,"Harrison, OH--IN Urban Cluster (2010)",37145
3650.0,2452.0,42.0,2410.0,1528.0,236.0,2037.0,715.0,294.0,63.0,16.0,94.0,1104.0,"Harrodsburg, KY Urban Cluster (2010)",37216
994.0,652.0,5.0,647.0,312.0,62.0,542.0,307.0,32.0,6.0,4.0,77.0,265.0,"Hart, MI Urban Cluster (2010)",37232
361980.0,290833.0,1905.0,288928.0,175410.0,20111.0,263290.0,107398.0,10178.0,1414.0,536.0,11683.0,59464.0,"Hartford, CT Urbanized Area (2010)",37243
2467.0,1778.0,20.0,1758.0,901.0,255.0,1382.0,775.0,133.0,64.0,0.0,151.0,538.0,"Hartford City, IN Urban Cluster (2010)",37324
987.0,668.0,2.0,666.0,477.0,183.0,456.0,159.0,46.0,6.0,0.0,14.0,305.0,"Hartshorne, OK Urban Cluster (2010)",37378
5848.0,4162.0,8.0,4154.0,1898.0,660.0,3428.0,2204.0,166.0,14.0,0.0,280.0,1406.0,"Hartsville, SC Urban Cluster (2010)",37405
2057.0,1222.0,6.0,1216.0,639.0,162.0,1038.0,567.0,36.0,10.0,0.0,142.0,693.0,"Hartwell, GA Urban Cluster (2010)",37432
3150.0,2594.0,24.0,2570.0,1774.0,282.0,2088.0,703.0,230.0,60.0,11.0,53.0,503.0,"Harvard, IL Urban Cluster (2010)",37459
836.0,457.0,0.0,457.0,289.0,27.0,423.0,148.0,39.0,0.0,0.0,0.0,379.0,"Haskell, TX Urban Cluster (2010)",37486
29797.0,22468.0,143.0,22325.0,13727.0,3964.0,17349.0,7790.0,1337.0,481.0,51.0,1402.0,5927.0,"Hattiesburg, MS Urbanized Area (2010)",37594
3317.0,2727.0,0.0,2727.0,1770.0,422.0,2043.0,784.0,219.0,139.0,0.0,47.0,543.0,"Hastings, MI Urban Cluster (2010)",37513
8999.0,7387.0,67.0,7320.0,4710.0,525.0,6665.0,2520.0,394.0,36.0,0.0,211.0,1401.0,"Hastings, MN Urban Cluster (2010)",37540
9855.0,7400.0,44.0,7356.0,4160.0,838.0,6208.0,2937.0,397.0,127.0,8.0,267.0,2188.0,"Hastings, NE Urban Cluster (2010)",37567
1217.0,562.0,3.0,559.0,296.0,29.0,486.0,221.0,90.0,16.0,0.0,26.0,629.0,"Havana, FL Urban Cluster (2010)",37621
1334.0,959.0,0.0,959.0,583.0,38.0,877.0,339.0,44.0,10.0,0.0,91.0,284.0,"Havana, IL Urban Cluster (2010)",37648
6367.0,5653.0,6.0,5647.0,4133.0,378.0,5079.0,1345.0,332.0,76.0,14.0,195.0,519.0,"Havelock, NC Urban Cluster (2010)",37675
4028.0,3050.0,27.0,3023.0,2047.0,296.0,2645.0,928.0,87.0,0.0,12.0,241.0,737.0,"Havre, MT Urban Cluster (2010)",37702
7319.0,5054.0,142.0,4912.0,2016.0,367.0,4395.0,2741.0,204.0,93.0,27.0,139.0,2126.0,"Hawaiian Paradise Park, HI Urban Cluster (2010)",37716
1643.0,878.0,13.0,865.0,551.0,67.0,798.0,281.0,33.0,0.0,0.0,68.0,697.0,"Hawkinsville, GA Urban Cluster (2010)",37729
