12899.0,"Martinsville, IN Urban Cluster (2010)",55225
33679.0,"Martinsville, VA Urban Cluster (2010)",55252
2829.0,"Marysville, KS Urban Cluster (2010)",55279
23769.0,"Marysville, OH Urban Cluster (2010)",55306
156338.0,"Marysville, WA Urbanized Area (2010)",55333
13053.0,"Maryville, MO Urban Cluster (2010)",55360
7841.0,"Mascoutah, IL Urban Cluster (2010)",55375
26385.0,"Mason City, IA Urban Cluster (2010)",55414
4239.0,"Masontown, PA Urban Cluster (2010)",55441
11098.0,"Massena, NY Urban Cluster (2010)",55468
5690.0,"Mathis, TX Urban Cluster (2010)",55495
5086.0,"Mattawa, WA Urban Cluster (2010)",55522
17846.0,"Mattoon, IL Urban Cluster (2010)",55576
136967.0,"Mauldin--Simpsonville, SC Urbanized Area (2010)",55603
4290.0,"Mauston, WI Urban Cluster (2010)",55684
99747.0,"Mayagüez, PR Urbanized Area (2010)",55738
3272.0,"Maybrook, NY Urban Cluster (2010)",55750
11738.0,"Mayfield, KY Urban Cluster (2010)",55765
4855.0,"Mayodan, NC Urban Cluster (2010)",55792
11102.0,"Maysville, KY--OH Urban Cluster (2010)",55819
4918.0,"Mayville, WI Urban Cluster (2010)",55846
3088.0,"Mazomanie, WI Urban Cluster (2010)",55860
23314.0,"Meadville, PA Urban Cluster (2010)",55900
8321.0,"Mecca, CA Urban Cluster (2010)",55927
162254.0,"Medford, OR Urbanized Area (2010)",55981
3801.0,"Medford, WI Urban Cluster (2010)",56008
4759.0,"Medical Lake, WA Urban Cluster (2010)",56023
8141.0,"Medina, NY Urban Cluster (2010)",56035
4202.0,"Medina, TN Urban Cluster (2010)",56072
3020.0,"Melrose, MN Urban Cluster (2010)",56089
1074348.0,"Memphis, TN--MS--AR Urbanized Area (2010)",56116
5343.0,"Mena, AR Urban Cluster (2010)",56143
11418.0,"Mendota, CA Urban Cluster (2010)",56170
6721.0,"Mendota, IL Urban Cluster (2010)",56197
17727.0,"Menomonie, WI Urban Cluster (2010)",56224
144321.0,"Merced, CA Urbanized Area (2010)",56251
3690.0,"Mercer, PA Urban Cluster (2010)",56278
38978.0,"Meridian, MS Urban Cluster (2010)",56305
9888.0,"Merrill, WI Urban Cluster (2010)",56359
3455.0,"Mescalero Park, TX Urban Cluster (2010)",56386
14868.0,"Mesquite, NV--AZ Urban Cluster (2010)",56413
3772.0,"Metamora, IL Urban Cluster (2010)",56440
6248.0,"Metropolis, IL Urban Cluster (2010)",56467
3498.0,"Metter, GA Urban Cluster (2010)",56494
7246.0,"Mexia, TX Urban Cluster (2010)",56521
11093.0,"Mexico, MO Urban Cluster (2010)",56548
2231.0,"Meyersdale, PA Urban Cluster (2010)",56575
5948057.0,"Miami, FL Urbanized Area (2010)",56602
15790.0,"Miami, OK Urban Cluster (2010)",56629
65488.0,"Michigan City--La Porte, IN--MI Urbanized Area (2010)",56656
4186.0,"Middlebury, IN Urban Cluster (2010)",56710
5567.0,"Middlebury, VT Urban Cluster (2010)",56737
4732.0,"Middlefield, OH Urban Cluster (2010)",56764
7646.0,"Middleport, OH--WV Urban Cluster (2010)",56791
14327.0,"Middlesborough, KY--TN--VA Urban Cluster (2010)",56818
31662.0,"Middletown, DE Urban Cluster (2010)",56845
2656.0,"Middletown, IN Urban Cluster (2010)",56872
59059.0,"Middletown, NY Urbanized Area (2010)",56899
98213.0,"Middletown, OH Urbanized Area (2010)",56926
3277.0,"Middleville, MI Urban Cluster (2010)",56953
58067.0,"Midland, MI Urbanized Area (2010)",56980
132437.0,"Midland, TX Urbanized Area (2010)",57007
4537.0,"Mifflinburg, PA Urban Cluster (2010)",57061
4298.0,"Mifflintown, PA Urban Cluster (2010)",57069
2821.0,"Milaca, MN Urban Cluster (2010)",57079
7615.0,"Milan, MI Urban Cluster (2010)",57088
7806.0,"Milan, TN Urban Cluster (2010)",57115
3092.0,"Milbank, SD Urban Cluster (2010)",57142
9698.0,"Miles City, MT Urban Cluster (2010)",57169
19644.0,"Milford, DE Urban Cluster (2010)",57196
2834.0,"Milford, NJ--PA Urban Cluster (2010)",57206
30060.0,"Milledgeville, GA Urban Cluster (2010)",57223
2799.0,"Millen, GA Urban Cluster (2010)",57250
3064.0,"Millersburg, OH Urban Cluster (2010)",57277
4685.0,"Millersburg, PA Urban Cluster (2010)",57304
3847.0,"Millinocket, ME Urban Cluster (2010)",57331
9805.0,"Millsboro, DE Urban Cluster (2010)",57358
3473.0,"Millsboro, PA Urban Cluster (2010)",57368
3524.0,"Millstadt, IL Urban Cluster (2010)",57385
2718.0,"Milton, DE Urban Cluster (2010)",57395
8816.0,"Milton, VT Urban Cluster (2010)",57402
31387.0,"Milton--Lewisburg, PA Urban Cluster (2010)",57439
1390634.0,"Milwaukee, WI Urbanized Area (2010)",57466
12819.0,"Minden, LA Urban Cluster (2010)",57493
2873.0,"Minden, NE Urban Cluster (2010)",57520
5721.0,"Mineola, TX Urban Cluster (2010)",57547
14443.0,"Mineral Wells, TX Urban Cluster (2010)",57574
4251.0,"Minerva, OH Urban Cluster (2010)",57601
2796036.0,"Minneapolis--St. Paul, MN--WI Urbanized Area (2010)",57628
48739.0,"Minot, ND Urban Cluster (2010)",57655
5789.0,"Minot AFB, ND Urban Cluster (2010)",57682
608493.0,"Mission Viejo--Lake Forest--San Clemente, CA Urbanized Area (2010)",57709
86653.0,"Missoula, MT Urbanized Area (2010)",57736
2634.0,"Missouri Valley, IA Urban Cluster (2010)",57763
4129.0,"Mitchell, IN Urban Cluster (2010)",57790
15167.0,"Mitchell, SD Urban Cluster (2010)",57817
7303.0,"Moab, UT Urban Cluster (2010)",57844
5476.0,"Moapa Valley, NV Urban Cluster (2010)",57871
13723.0,"Moberly, MO Urban Cluster (2010)",57898
328541.0,"Mobile, AL Urbanized Area (2010)",57925
3384.0,"Mobridge, SD Urban Cluster (2010)",57952
5378.0,"Mocksville, NC Urban Cluster (2010)",57979
374865.0,"Modesto, CA Urbanized Area (2010)",58006
3425.0,"Mojave, CA Urban Cluster (2010)",58020
9652.0,"Molalla, OR Urban Cluster (2010)",58033
3245.0,"Momence, IL Urban Cluster (2010)",58060
8224.0,"Monahans, TX Urban Cluster (2010)",58087
62410.0,"Monessen--California, PA Urbanized Area (2010)",58168
8598.0,"Monett, MO Urban Cluster (2010)",58195
9332.0,"Monmouth, IL Urban Cluster (2010)",58222
19528.0,"Monmouth--Independence, OR Urban Cluster (2010)",58249
16102.0,"Monroe, GA Urban Cluster (2010)",58303
117503.0,"Monroe, LA Urbanized Area (2010)",58330
50051.0,"Monroe, MI Urbanized Area (2010)",58357
10713.0,"Monroe, WI Urban Cluster (2010)",58384
4592.0,"Monroeville, AL Urban Cluster (2010)",58411
2822.0,"Montauk, NY Urban Cluster (2010)",58420
3651.0,"Mont Belvieu, TX Urban Cluster (2010)",58428
3210.0,"Monterey, TN Urban Cluster (2010)",58438
8287.0,"Montesano--Elma, WA Urban Cluster (2010)",58469
5137.0,"Montevideo, MN Urban Cluster (2010)",58519
4233.0,"Monte Vista, CO Urban Cluster (2010)",58546
6382.0,"Montezuma, GA Urban Cluster (2010)",58573
255948.0,"Montgomery, AL Urbanized Area (2010)",58600
2720.0,"Montgomery, MN Urban Cluster (2010)",58627
2537.0,"Montgomery, PA Urban Cluster (2010)",58654
4771.0,"Montgomery, WV Urban Cluster (2010)",58664
2566.0,"Montgomery City, MO Urban Cluster (2010)",58675
9750.0,"Monticello, AR Urban Cluster (2010)",58708
2418.0,"Monticello, GA Urban Cluster (2010)",58721
5211.0,"Monticello, IL Urban Cluster (2010)",58735
8222.0,"Monticello, IN Urban Cluster (2010)",58762
3307.0,"Monticello, IA Urban Cluster (2010)",58789
6549.0,"Monticello, KY Urban Cluster (2010)",58816
7582.0,"Monticello, NY Urban Cluster (2010)",58843
26449.0,"Monticello--Big Lake, MN Urban Cluster (2010)",58870
3918.0,"Montpelier, OH Urban Cluster (2010)",58924
23013.0,"Montrose, CO Urban Cluster (2010)",58951
4932.0,"Montrose, MN Urban Cluster (2010)",58961
2346.0,"Moodus, CT Urban Cluster (2010)",58972
3190.0,"Moorefield, WV Urban Cluster (2010)",58992
4435.0,"Moore Haven, FL Urban Cluster (2010)",59005
2008.0,"Moorhead, MS Urban Cluster (2010)",59059
2979.0,"Moose Lake, MN Urban Cluster (2010)",59098
3351.0,"Mora, MN Urban Cluster (2010)",59113
7956.0,"Morehead, KY Urban Cluster (2010)",59167
46709.0,"Morehead City, NC Urban Cluster (2010)",59194
3910.0,"Morgan, UT Urban Cluster (2010)",59210
31966.0,"Morgan City, LA Urban Cluster (2010)",59221
5858.0,"Morganfield, KY Urban Cluster (2010)",59248
75028.0,"Morgantown, WV Urbanized Area (2010)",59275
5998.0,"Morrilton, AR Urban Cluster (2010)",59302
15850.0,"Morris, IL Urban Cluster (2010)",59329
4895.0,"Morris, MN Urban Cluster (2010)",59356
3723.0,"Morrison, IL Urban Cluster (2010)",59383
60275.0,"Morristown, TN Urbanized Area (2010)",59410
28561.0,"Morro Bay--Los Osos, CA Urban Cluster (2010)",59437
2641.0,"Morton, MS Urban Cluster (2010)",59464
25495.0,"Moscow, ID Urban Cluster (2010)",59491
2713.0,"Moscow, PA Urban Cluster (2010)",59501
34168.0,"Moses Lake, WA Urban Cluster (2010)",59518
2862.0,"Moulton, AL Urban Cluster (2010)",59545
18731.0,"Moultrie, GA Urban Cluster (2010)",59572
3053.0,"Moundville, AL Urban Cluster (2010)",59605
2381.0,"Mountain City, TN Urban Cluster (2010)",59626
4446.0,"Mountain Grove, MO Urban Cluster (2010)",59653
13589.0,"Mountain Home, AR Urban Cluster (2010)",59680
16420.0,"Mountain Home, ID Urban Cluster (2010)",59707
3070.0,"Mountain Home AFB, ID Urban Cluster (2010)",59734
13632.0,"Mountain House, CA Urban Cluster (2010)",59745
4425.0,"Mountain Lake Park, MD Urban Cluster (2010)",59761
18931.0,"Mount Airy, NC--VA Urban Cluster (2010)",59815
3677.0,"Mount Angel, OR Urban Cluster (2010)",59827
7071.0,"Mount Carmel, IL Urban Cluster (2010)",59842
3554.0,"Mount Gilead, OH Urban Cluster (2010)",59896
4442.0,"Mount Holly Springs, PA Urban Cluster (2010)",59910
3748.0,"Mount Hood Village, OR Urban Cluster (2010)",59923
7251.0,"Mount Horeb, WI Urban Cluster (2010)",59950
3323.0,"Mount Morris, IL Urban Cluster (2010)",59977
3253.0,"Mount Morris, NY Urban Cluster (2010)",60004
5293.0,"Mount Olive, NC Urban Cluster (2010)",60031
3222.0,"Mount Orab, OH Urban Cluster (2010)",60058
8454.0,"Mount Pleasant, IA Urban Cluster (2010)",60085
37488.0,"Mount Pleasant, MI Urban Cluster (2010)",60112
3965.0,"Mount Pleasant, TN Urban Cluster (2010)",60139
16658.0,"Mount Pleasant, TX Urban Cluster (2010)",60166
3248.0,"Mount Pleasant, UT Urban Cluster (2010)",60176
25097.0,"Mount Pocono--Emerald Lakes, PA Urban Cluster (2010)",60195
6969.0,"Mount Shasta--Weed, CA Urban Cluster (2010)",60223
3992.0,"Mount Sterling, IL Urban Cluster (2010)",60247
11481.0,"Mount Sterling, KY Urban Cluster (2010)",60274
4012.0,"Mount Union, PA Urban Cluster (2010)",60301
15442.0,"Mount Vernon, IL Urban Cluster (2010)",60328
6856.0,"Mount Vernon, IN Urban Cluster (2010)",60355
6553.0,"Mount Vernon, IA Urban Cluster (2010)",60382
2812.0,"Mount Vernon, KY Urban Cluster (2010)",60409
4499.0,"Mount Vernon, MO Urban Cluster (2010)",60436
21454.0,"Mount Vernon, OH Urban Cluster (2010)",60463
2285.0,"Mount Vernon, TX Urban Cluster (2010)",60473
66320.0,"Mount Vernon, WA Urbanized Area (2010)",60490
19971.0,"Mukwonago, WI Urban Cluster (2010)",60517
6019.0,"Muldrow--Roland, OK Urban Cluster (2010)",60546
5012.0,"Muleshoe, TX Urban Cluster (2010)",60571
5444.0,"Mullins, SC Urban Cluster (2010)",60598
89991.0,"Muncie, IN Urbanized Area (2010)",60625
9011.0,"Muncy, PA Urban Cluster (2010)",60652
2891.0,"Munising, MI Urban Cluster (2010)",60684
3210.0,"Murfreesboro, NC Urban Cluster (2010)",60706
151215.0,"Murfreesboro, TN Urbanized Area (2010)",60733
9511.0,"Murphysboro, IL Urban Cluster (2010)",60760
20137.0,"Murray, KY Urban Cluster (2010)",60787
496819.0,"Murrieta--Temecula--Menifee, CA Urbanized Area (2010)",60799
25864.0,"Muscatine, IA Urban Cluster (2010)",60814
162682.0,"Muskegon, MI Urbanized Area (2010)",60841
40481.0,"Muskogee, OK Urban Cluster (2010)",60868
250568.0,"Myrtle Beach--Socastee, SC--NC Urbanized Area (2010)",60895
22322.0,"Mystic Island, NJ Urban Cluster (2010)",60930
34379.0,"Nacogdoches, TX Urban Cluster (2010)",60949
164260.0,"Nampa, ID Urbanized Area (2010)",60976
8470.0,"Nantucket, MA Urban Cluster (2010)",61003
3842.0,"Nanty-Glo, PA Urban Cluster (2010)",61030
86098.0,"Napa, CA Urbanized Area (2010)",61057
8599.0,"Napoleon, OH Urban Cluster (2010)",61084
7172.0,"Nappanee, IN Urban Cluster (2010)",61111
3679.0,"Narrows, VA--WV Urban Cluster (2010)",61138
229490.0,"Nashua, NH--MA Urbanized Area (2010)",61165
4317.0,"Nashville, AR Urban Cluster (2010)",61192
4354.0,"Nashville, GA Urban Cluster (2010)",61219
3065.0,"Nashville, IL Urban Cluster (2010)",61246
1058818.0,"Nashville-Davidson, TN Urbanized Area (2010)",61273
5698.0,"Nassau Village-Ratliff, FL Urban Cluster (2010)",61300
26867.0,"Natchez, MS--LA Urban Cluster (2010)",61327
19767.0,"Natchitoches, LA Urban Cluster (2010)",61354
7283.0,"Navasota, TX Urban Cluster (2010)",61381
7003.0,"Nebraska City, NE Urban Cluster (2010)",61408
8885.0,"Needles, CA--AZ Urban Cluster (2010)",61435
2910.0,"Needville, TX Urban Cluster (2010)",61462
4058.0,"Nelson, GA Urban Cluster (2010)",61478
5972.0,"Nelsonville, OH Urban Cluster (2010)",61489
2182.0,"Neodesha, KS Urban Cluster (2010)",61516
11853.0,"Neosho, MO Urban Cluster (2010)",61543
5470.0,"Nephi, UT Urban Cluster (2010)",61570
6752.0,"Nevada, IA Urban Cluster (2010)",61597
8662.0,"Nevada, MO Urban Cluster (2010)",61624
7221.0,"New Albany, MS Urban Cluster (2010)",61651
13065.0,"Newark, NY Urban Cluster (2010)",61678
78101.0,"Newark, OH Urbanized Area (2010)",61705
3670.0,"Newaygo, MI Urban Cluster (2010)",61732
3544.0,"New Baden, IL Urban Cluster (2010)",61759
149566.0,"New Bedford, MA Urbanized Area (2010)",61786
27805.0,"Newberg, OR Urban Cluster (2010)",61813
50634.0,"New Bern, NC Urbanized Area (2010)",61840
3095.0,"Newberry, MI Urban Cluster (2010)",61867
12074.0,"Newberry, SC Urban Cluster (2010)",61894
4577.0,"New Boston, TX Urban Cluster (2010)",61921
7479.0,"New Bremen--Minster, OH Urban Cluster (2010)",61975
3787.0,"New Carlisle, IN Urban Cluster (2010)",62056
5420.0,"New Castle, CO Urban Cluster (2010)",62110
22442.0,"New Castle, IN Urban Cluster (2010)",62137
41450.0,"New Castle, PA Urban Cluster (2010)",62164
3310.0,"Newcastle, WY Urban Cluster (2010)",62191
4204.0,"Newcomerstown, OH Urban Cluster (2010)",62218
2951.0,"New Concord, OH Urban Cluster (2010)",62245
2832.0,"New Cordell, OK Urban Cluster (2010)",62272
5767.0,"Newfane, NY Urban Cluster (2010)",62326
14871.0,"New Freedom--Shrewsbury, PA--MD Urban Cluster (2010)",62353
3377.0,"New Hampton, IA Urban Cluster (2010)",62380
561932.0,"New Haven, CT Urbanized Area (2010)",62407
4207.0,"New Lebanon, OH Urban Cluster (2010)",62461
5140.0,"New Lexington, OH Urban Cluster (2010)",62488
3099.0,"New London, MN Urban Cluster (2010)",62505
7267.0,"New London, WI Urban Cluster (2010)",62515
3016.0,"New Madrid, MO Urban Cluster (2010)",62542
10857.0,"Newman, CA Urban Cluster (2010)",62569
5863.0,"New Martinsville, WV--OH Urban Cluster (2010)",62623
957680.0,"New Orleans, LA Urbanized Area (2010)",62677
47340.0,"New Philadelphia--Dover, OH Urban Cluster (2010)",62731
5347.0,"Newport, AR Urban Cluster (2010)",62758
3060.0,"Newport, NH Urban Cluster (2010)",62785
11522.0,"Newport, OR Urban Cluster (2010)",62839
2640.0,"Newport, PA Urban Cluster (2010)",62866
11320.0,"Newport, TN Urban Cluster (2010)",62893
3805.0,"Newport, VT Urban Cluster (2010)",62920
2679.0,"Newport, WA--ID Urban Cluster (2010)",62930
7983.0,"New Prague, MN Urban Cluster (2010)",62947
2521.0,"New Richmond, OH Urban Cluster (2010)",62964
8281.0,"New Richmond, WI Urban Cluster (2010)",62974
7304.0,"New Roads, LA Urban Cluster (2010)",63001
4467.0,"New Tazewell, TN Urban Cluster (2010)",63028
2882.0,"Newton, IL Urban Cluster (2010)",63055
15282.0,"Newton, IA Urban Cluster (2010)",63082
20799.0,"Newton, KS Urban Cluster (2010)",63109
2782.0,"Newton, MS Urban Cluster (2010)",63136
12004.0,"Newton, NJ Urban Cluster (2010)",63137
13125.0,"New Ulm, MN Urban Cluster (2010)",63163
2520.0,"New Wilmington, PA Urban Cluster (2010)",63190
18969794.0,"New York--Newark, NY--NJ--CT Urbanized Area (2010)",63217
29540.0,"Nicholasville, KY Urban Cluster (2010)",63244
4355.0,"Nine Mile Falls, WA Urban Cluster (2010)",63271
16193.0,"Nipomo, CA Urban Cluster (2010)",63282
2866.0,"Nocona, TX Urban Cluster (2010)",63298
30588.0,"Nogales, AZ Urban Cluster (2010)",63325
3251.0,"Nokomis, IL Urban Cluster (2010)",63352
3392.0,"Nome, AK Urban Cluster (2010)",63379
26721.0,"Norfolk, NE Urban Cluster (2010)",63406
111382.0,"Norman, OK Urbanized Area (2010)",63433
2728.0,"Norris, TN Urban Cluster (2010)",63447
17990.0,"North Adams, MA--VT Urban Cluster (2010)",63460
3374.0,"North Baltimore, OH Urban Cluster (2010)",63487
6439.0,"North Branch, MN Urban Cluster (2010)",63541
7061.0,"North Brookfield, MA Urban Cluster (2010)",63568
4568.0,"North Conway, NH Urban Cluster (2010)",63579
2580.0,"North Eagle Butte, SD Urban Cluster (2010)",63588
6532.0,"North East, PA Urban Cluster (2010)",63622
6161.0,"Northern Cambria, PA Urban Cluster (2010)",63649
21952.0,"Northfield, MN Urban Cluster (2010)",63676
3962.0,"Northfield, VT Urban Cluster (2010)",63703
5982.0,"North Manchester, IN Urban Cluster (2010)",63784
24444.0,"North Platte, NE Urban Cluster (2010)",63811
185872.0,"North Port--Port Charlotte, FL Urbanized Area (2010)",63838
3076.0,"North Shore, CA Urban Cluster (2010)",63851
10882.0,"North Vernon, IN Urban Cluster (2010)",63865
3852.0,"North Webster, IN Urban Cluster (2010)",63892
18024.0,"North Wilkesboro--Wilkesboro, NC Urban Cluster (2010)",63946
2813.0,"Norton, KS Urban Cluster (2010)",64000
10211.0,"Norton--Wise, VA Urban Cluster (2010)",64027
19961.0,"Norwalk, OH Urban Cluster (2010)",64054
8148.0,"Norwich, NY Urban Cluster (2010)",64108
205365.0,"Norwich--New London, CT--RI Urbanized Area (2010)",64135
3635.0,"Norwood Young America, MN Urban Cluster (2010)",64189
3593.0,"Nowata, OK Urban Cluster (2010)",64216
3384.0,"Nyssa, OR Urban Cluster (2010)",64243
7726.0,"Oakdale, LA Urban Cluster (2010)",64297
2611.0,"Oak Harbor, OH Urban Cluster (2010)",64351
34300.0,"Oak Harbor, WA Urban Cluster (2010)",64378
3198.0,"Oakhurst, CA Urban Cluster (2010)",64432
11867.0,"Oak Island, NC Urban Cluster (2010)",64459
7551.0,"Oakland, TN Urban Cluster (2010)",64475
2405.0,"Oakland City, IN Urban Cluster (2010)",64486
3262.0,"Oakridge, OR Urban Cluster (2010)",64513
8007.0,"Oberlin, OH Urban Cluster (2010)",64550
167213.0,"Ocala, FL Urbanized Area (2010)",64567
4587.0,"Ocala Estates, FL Urban Cluster (2010)",64577
1998.0,"Oceana, WV Urban Cluster (2010)",64594
3377.0,"Ocean Park, WA Urban Cluster (2010)",64648
34184.0,"Ocean Pines, MD--DE Urban Cluster (2010)",64660
5389.0,"Ocean Shores, WA Urban Cluster (2010)",64675
14528.0,"Ocean View, DE Urban Cluster (2010)",64702
3342.0,"Ocilla, GA Urban Cluster (2010)",64729
4070.0,"Oconto, WI Urban Cluster (2010)",64756
2571.0,"Oconto Falls, WI Urban Cluster (2010)",64783
2769.0,"Odem, TX Urban Cluster (2010)",64810
5120.0,"Odessa, MO Urban Cluster (2010)",64837
140810.0,"Odessa, TX Urbanized Area (2010)",64864
6750.0,"Oelwein, IA Urban Cluster (2010)",64891
4233.0,"Ogallala, NE Urban Cluster (2010)",64918
586672.0,"Ogden--Layton, UT Urbanized Area (2010)",64945
11117.0,"Ogdensburg, NY Urban Cluster (2010)",64972
15285.0,"Oil City, PA Urban Cluster (2010)",64999
25144.0,"Okeechobee--Taylor Creek, FL Urban Cluster (2010)",65026
3111.0,"Okemah, OK Urban Cluster (2010)",65053
923927.0,"Oklahoma City, OK Urbanized Area (2010)",65080
13766.0,"Okmulgee, OK Urban Cluster (2010)",65107
21394.0,"Olean, NY Urban Cluster (2010)",65161
9010.0,"Olney, IL Urban Cluster (2010)",65188
3019.0,"Olney, TX Urban Cluster (2010)",65215
188095.0,"Olympia--Lacey, WA Urbanized Area (2010)",65242
768925.0,"Omaha, NE--IA Urbanized Area (2010)",65269
8167.0,"Omak, WA Urban Cluster (2010)",65296
3308.0,"Omro, WI Urban Cluster (2010)",65323
4814.0,"Onalaska, TX Urban Cluster (2010)",65338
2553.0,"Onawa, IA Urban Cluster (2010)",65350
21360.0,"Oneida, NY Urban Cluster (2010)",65404
4328.0,"Oneida, TN Urban Cluster (2010)",65431
3538.0,"O'Neill, NE Urban Cluster (2010)",65458
5222.0,"Oneonta, AL Urban Cluster (2010)",65485
16917.0,"Oneonta, NY Urban Cluster (2010)",65512
25440.0,"Ontario, OR--ID Urban Cluster (2010)",65539
2869.0,"Oostburg, WI Urban Cluster (2010)",65566
23903.0,"Opelousas, LA Urban Cluster (2010)",65593
4404.0,"Opp, AL Urban Cluster (2010)",65620
4791.0,"Orange, VA Urban Cluster (2010)",65674
31343.0,"Orangeburg, SC Urban Cluster (2010)",65701
7020.0,"Orange City, IA Urban Cluster (2010)",65728
9935.0,"Orange Cove, CA Urban Cluster (2010)",65755
8162.0,"Orangetree, FL Urban Cluster (2010)",65767
3603.0,"Oregon, IL Urban Cluster (2010)",65782
11390.0,"Oregon, WI Urban Cluster (2010)",65809
8457.0,"Orland, CA Urban Cluster (2010)",65836
1675439.0,"Orlando, FL Urbanized Area (2010)",65863
3633.0,"Orofino, ID Urban Cluster (2010)",65890
15666.0,"Orosi, CA Urban Cluster (2010)",65917
37338.0,"Oroville, CA Urban Cluster (2010)",65944
8556.0,"Orrville, OH Urban Cluster (2010)",65971
5611.0,"Orwigsburg, PA Urban Cluster (2010)",66025
3569.0,"Osage, IA Urban Cluster (2010)",66052
4005.0,"Osage Beach, MO Urban Cluster (2010)",66060
2511.0,"Osage City, KS Urban Cluster (2010)",66068
4355.0,"Osawatomie, KS Urban Cluster (2010)",66079
2499.0,"Osburn, ID Urban Cluster (2010)",66093
7604.0,"Osceola, AR Urban Cluster (2010)",66106
4761.0,"Osceola, IA Urban Cluster (2010)",66133
3339.0,"Osceola, WI Urban Cluster (2010)",66134
74909.0,"Oshkosh, WI Urbanized Area (2010)",66160
12598.0,"Oskaloosa, IA Urban Cluster (2010)",66187
4253.0,"Ossian, IN Urban Cluster (2010)",66214
38389.0,"Oswego, NY Urban Cluster (2010)",66241
11695.0,"Othello, WA Urban Cluster (2010)",66268
4040.0,"Otisville, NY Urban Cluster (2010)",66276
12211.0,"Otsego--Plainwell, MI Urban Cluster (2010)",66285
20217.0,"Ottawa, IL Urban Cluster (2010)",66295
12262.0,"Ottawa, KS Urban Cluster (2010)",66322
5330.0,"Ottawa, OH Urban Cluster (2010)",66349
23861.0,"Ottumwa, IA Urban Cluster (2010)",66376
25420.0,"Owatonna, MN Urban Cluster (2010)",66430
4604.0,"Owego, NY Urban Cluster (2010)",66457
72687.0,"Owensboro, KY Urbanized Area (2010)",66484
2717.0,"Owensville, MO Urban Cluster (2010)",66511
21708.0,"Owosso, MI Urban Cluster (2010)",66538
28856.0,"Oxford, MS Urban Cluster (2010)",66565
9352.0,"Oxford, NC Urban Cluster (2010)",66592
22811.0,"Oxford, OH Urban Cluster (2010)",66619
379938.0,"Oxnard, CA Urbanized Area (2010)",66673
11107.0,"Ozark, AL Urban Cluster (2010)",66690
2943.0,"Ozark, AR Urban Cluster (2010)",66700
2738.0,"Ozona, TX Urban Cluster (2010)",66727
9936.0,"Pacific, MO Urban Cluster (2010)",66740
2931.0,"Paden City, WV Urban Cluster (2010)",66754
47950.0,"Paducah, KY--IL Urban Cluster (2010)",66781
7263.0,"Page, AZ Urban Cluster (2010)",66808
3956.0,"Pageland, SC Urban Cluster (2010)",66835
5140.0,"Pagosa Springs, CO Urban Cluster (2010)",66889
7731.0,"Pahokee, FL Urban Cluster (2010)",66916
27599.0,"Pahrump, NV Urban Cluster (2010)",66943
6092.0,"Paintsville, KY Urban Cluster (2010)",66997
4491.0,"Palacios, TX Urban Cluster (2010)",67024
24088.0,"Palatka, FL Urban Cluster (2010)",67051
18528.0,"Palestine, TX Urban Cluster (2010)",67078
473234.0,"Palm Bay--Melbourne, FL Urbanized Area (2010)",67105
366511.0,"Palm Coast--Daytona Beach--Port Orange, FL Urbanized Area (2010)",67134
3503.0,"Palmyra, MO Urban Cluster (2010)",67213
4568.0,"Palmyra, NY Urban Cluster (2010)",67223
9209.0,"Paloma Creek South--Paloma Creek, TX Urban Cluster (2010)",67231
18166.0,"Pampa, TX Urban Cluster (2010)",67240
5774.0,"Pana, IL Urban Cluster (2010)",67267
153162.0,"Panama City, FL Urbanized Area (2010)",67294
5502.0,"Panama City Northeast, FL Urban Cluster (2010)",67305
5420.0,"Paola, KS Urban Cluster (2010)",67321
3376.0,"Paoli, IN Urban Cluster (2010)",67348
35652.0,"Paradise, CA Urban Cluster (2010)",67375
26345.0,"Paragould, AR Urban Cluster (2010)",67402
3221.0,"Paris, AR Urban Cluster (2010)",67456
8412.0,"Paris, IL Urban Cluster (2010)",67483
11090.0,"Paris, KY Urban Cluster (2010)",67510
10056.0,"Paris, TN Urban Cluster (2010)",67537
25662.0,"Paris, TX Urban Cluster (2010)",67564
14027.0,"Park City, UT Urban Cluster (2010)",67618
5048.0,"Parker, AZ--CA Urban Cluster (2010)",67645
65589.0,"Parkersburg, WV--OH Urbanized Area (2010)",67672
3602.0,"Park Rapids, MN Urban Cluster (2010)",67726
14935.0,"Parlier, CA Urban Cluster (2010)",67753
2518.0,"Parowan, UT Urban Cluster (2010)",67765
9647.0,"Parsons, KS Urban Cluster (2010)",67780
48414.0,"Pascagoula, MS Urbanized Area (2010)",67807
21771.0,"Patterson, CA Urban Cluster (2010)",67861
2660.0,"Patton, PA Urban Cluster (2010)",67882
3475.0,"Paulding, OH Urban Cluster (2010)",67915
5962.0,"Pauls Valley, OK Urban Cluster (2010)",67942
3331.0,"Pawhuska, OK Urban Cluster (2010)",67969
13205.0,"Pawleys Island, SC Urban Cluster (2010)",67996
2712.0,"Pawnee, IL Urban Cluster (2010)",68050
8365.0,"Paw Paw, MI Urban Cluster (2010)",68077
11793.0,"Paw Paw Lake--Hartford, MI Urban Cluster (2010)",68106
4596.0,"Paxton, IL Urban Cluster (2010)",68131
13680.0,"Payson, AZ Urban Cluster (2010)",68158
3501.0,"Peaceful Valley, WA Urban Cluster (2010)",68171
2728.0,"Pearisburg, VA Urban Cluster (2010)",68196
10800.0,"Pearsall, TX Urban Cluster (2010)",68212
6203.0,"Pecan Acres, TX Urban Cluster (2010)",68228
6801.0,"Pecan Plantation, TX Urban Cluster (2010)",68239
10791.0,"Pecos, TX Urban Cluster (2010)",68266
3448.0,"Pelham, GA Urban Cluster (2010)",68320
9599.0,"Pella, IA Urban Cluster (2010)",68347
11504.0,"Pell City, AL Urban Cluster (2010)",68374
6618.0,"Pembroke, NC Urban Cluster (2010)",68401
16973.0,"Pendleton, OR Urban Cluster (2010)",68428
6259.0,"Penn Yan, NY Urban Cluster (2010)",68455
360423.0,"Pensacola, FL--AL Urbanized Area (2010)",68482
266693.0,"Peoria, IL Urbanized Area (2010)",68509
4186.0,"Peotone, IL Urban Cluster (2010)",68536
3229.0,"Perham, MN Urban Cluster (2010)",68572
6608.0,"Perry, FL Urban Cluster (2010)",68590
7714.0,"Perry, IA Urban Cluster (2010)",68644
4027.0,"Perry, MI Urban Cluster (2010)",68671
3707.0,"Perry, NY Urban Cluster (2010)",68698
4982.0,"Perry, OK Urban Cluster (2010)",68725
9341.0,"Perryton, TX Urban Cluster (2010)",68752
8505.0,"Perryville, MO Urban Cluster (2010)",68779
12834.0,"Peru, IN Urban Cluster (2010)",68806
30947.0,"Peru--LaSalle, IL Urban Cluster (2010)",68833
3189.0,"Peshtigo, WI Urban Cluster (2010)",68860
66812.0,"Petaluma, CA Urbanized Area (2010)",68887
3459.0,"Peterborough, NH Urban Cluster (2010)",68900
3032.0,"Petersburg, IL Urban Cluster (2010)",68941
2425.0,"Petersburg, WV Urban Cluster (2010)",68995
8595.0,"Petoskey, MI Urban Cluster (2010)",69022
