1931.0,1408.0,26.0,1382.0,1075.0,69.0,1277.0,255.0,126.0,25.0,0.0,28.0,495.0,"Alachua, FL Urban Cluster (2010)",00793
6662.0,4644.0,15.0,4629.0,2672.0,626.0,3792.0,1742.0,567.0,61.0,14.0,375.0,1643.0,"Albemarle, NC Urban Cluster (2010)",00982
2016.0,1043.0,0.0,1043.0,740.0,88.0,930.0,291.0,0.0,0.0,0.0,35.0,938.0,"Abbeville, SC Urban Cluster (2010)",00064
233051.0,179040.0,1422.0,177618.0,105523.0,14954.0,157741.0,66679.0,7981.0,1367.0,413.0,10076.0,43935.0,"Akron, OH Urbanized Area (2010)",00766
1525.0,1165.0,10.0,1155.0,714.0,233.0,873.0,407.0,62.0,13.0,8.0,32.0,328.0,"Abbotsford, WI Urban Cluster (2010)",00091
1691.0,1021.0,0.0,1021.0,557.0,224.0,702.0,361.0,137.0,80.0,0.0,47.0,623.0,"Aberdeen, MS Urban Cluster (2010)",00118
12071.0,8834.0,32.0,8802.0,5336.0,697.0,7719.0,3087.0,560.0,92.0,40.0,755.0,2482.0,"Aberdeen, SD Urban Cluster (2010)",00145
1361.0,858.0,23.0,835.0,503.0,204.0,509.0,302.0,67.0,10.0,20.0,29.0,474.0,"Ajo, AZ Urban Cluster (2010)",00712
11650.0,8775.0,40.0,8735.0,5707.0,1022.0,7336.0,2801.0,545.0,154.0,0.0,361.0,2514.0,"Aberdeen, WA Urban Cluster (2010)",00172
81176.0,69715.0,418.0,69297.0,42586.0,3552.0,64557.0,25596.0,2379.0,391.0,66.0,2223.0,9238.0,"Aberdeen--Bel Air South--Bel Air North, MD Urbanized Area (2010)",00199
1154.0,838.0,5.0,833.0,519.0,190.0,607.0,227.0,64.0,13.0,18.0,64.0,252.0,"Abernathy, TX Urban Cluster (2010)",00226
41602.0,29976.0,89.0,29887.0,20796.0,2304.0,26462.0,8162.0,1915.0,367.0,75.0,930.0,10696.0,"Abilene, TX Urbanized Area (2010)",00280
3961.0,2681.0,56.0,2625.0,1451.0,344.0,2096.0,1060.0,218.0,76.0,0.0,243.0,1037.0,"Alamosa, CO Urban Cluster (2010)",00847
1327.0,832.0,8.0,824.0,529.0,103.0,651.0,269.0,52.0,7.0,0.0,104.0,391.0,"Abingdon, IL Urban Cluster (2010)",00334
35483.0,25328.0,69.0,25259.0,17529.0,4388.0,19951.0,7032.0,1542.0,252.0,87.0,1464.0,8691.0,"Albany, GA Urbanized Area (2010)",00901
237274.0,194731.0,901.0,193830.0,112335.0,10856.0,180175.0,78469.0,4472.0,703.0,174.0,8572.0,33971.0,"Albany--Schenectady, NY Urbanized Area (2010)",00970
1748.0,1382.0,0.0,1382.0,829.0,197.0,1132.0,459.0,152.0,24.0,0.0,48.0,318.0,"Ada, OH Urban Cluster (2010)",00388
926.0,793.0,5.0,788.0,551.0,119.0,638.0,217.0,54.0,11.0,2.0,28.0,105.0,"Adams, NY Urban Cluster (2010)",00450
2506.0,1478.0,10.0,1468.0,679.0,318.0,1082.0,723.0,100.0,44.0,0.0,175.0,853.0,"Adel, GA Urban Cluster (2010)",00469
1431.0,1224.0,7.0,1217.0,853.0,106.0,1016.0,321.0,95.0,10.0,0.0,32.0,175.0,"Adel, IA Urban Cluster (2010)",00496
3591.0,1393.0,78.0,1315.0,928.0,486.0,687.0,250.0,130.0,125.0,0.0,42.0,2156.0,"Adjuntas, PR Urban Cluster (2010)",00550
100622.0,49877.0,1344.0,48533.0,26942.0,11932.0,31688.0,15484.0,7030.0,3172.0,237.0,4455.0,46290.0,"Aguadilla--Isabela--San Sebastián, PR Urbanized Area (2010)",00631
16234.0,12707.0,63.0,12644.0,7258.0,1130.0,11011.0,4923.0,778.0,236.0,18.0,740.0,2787.0,"Adrian, MI Urban Cluster (2010)",00577
1024.0,696.0,0.0,696.0,437.0,40.0,646.0,247.0,17.0,5.0,0.0,68.0,260.0,"Albany, MN Urban Cluster (2010)",00921
22687.0,18841.0,93.0,18748.0,12316.0,1616.0,16396.0,6079.0,1103.0,171.0,10.0,834.0,3012.0,"Albany, OR Urbanized Area (2010)",00955
306.0,306.0,0.0,306.0,131.0,40.0,261.0,169.0,5.0,0.0,0.0,0.0,0.0,"Air Force Academy, CO Urban Cluster (2010)",00676
13293.0,10100.0,70.0,10030.0,6412.0,812.0,8696.0,3242.0,686.0,189.0,22.0,490.0,2703.0,"Alamogordo, NM Urban Cluster (2010)",00820
1326.0,975.0,6.0,969.0,553.0,87.0,875.0,387.0,55.0,0.0,0.0,39.0,312.0,"Akron, NY Urban Cluster (2010)",00739
1595.0,1327.0,0.0,1327.0,769.0,198.0,942.0,466.0,260.0,74.0,0.0,14.0,254.0,"Auburn, IL Urban Cluster (2010)",04054
1281.0,984.0,9.0,975.0,484.0,87.0,864.0,471.0,32.0,12.0,4.0,56.0,241.0,"Attica, NY Urban Cluster (2010)",04006
1669.0,1487.0,0.0,1487.0,832.0,144.0,1201.0,502.0,169.0,84.0,30.0,59.0,123.0,"Aubrey, TX Urban Cluster (2010)",04021
31439.0,25138.0,72.0,25066.0,16089.0,1524.0,23103.0,8451.0,1431.0,147.0,0.0,1671.0,4630.0,"Auburn, AL Urbanized Area (2010)",04033
1399.0,938.0,24.0,914.0,499.0,58.0,845.0,412.0,22.0,0.0,0.0,109.0,352.0,"Auburn, NE Urban Cluster (2010)",04087
13826.0,11358.0,88.0,11270.0,7357.0,1305.0,9373.0,3429.0,1102.0,264.0,8.0,383.0,2085.0,"Auburn--North Auburn, CA Urban Cluster (2010)",04130
3507.0,2677.0,27.0,2650.0,1504.0,253.0,2330.0,1081.0,138.0,18.0,0.0,113.0,717.0,"Augusta, KS Urban Cluster (2010)",04168
10517.0,7855.0,57.0,7798.0,4014.0,357.0,7283.0,3645.0,201.0,77.0,8.0,321.0,2341.0,"Augusta, ME Urban Cluster (2010)",04195
146381.0,109577.0,762.0,108815.0,70436.0,12255.0,93704.0,35341.0,6118.0,778.0,79.0,5396.0,31408.0,"Augusta-Richmond County, GA--SC Urbanized Area (2010)",04222
3358.0,2462.0,18.0,2444.0,1362.0,369.0,1955.0,988.0,144.0,62.0,0.0,77.0,819.0,"Aurora, MO Urban Cluster (2010)",04276
1876.0,1478.0,24.0,1454.0,886.0,217.0,1151.0,474.0,148.0,21.0,0.0,55.0,343.0,"Aurora, NE Urban Cluster (2010)",04303
1291.0,692.0,72.0,620.0,377.0,78.0,522.0,243.0,21.0,0.0,0.0,213.0,386.0,"Ava, MO Urban Cluster (2010)",04411
2713.0,2146.0,41.0,2105.0,1189.0,173.0,1857.0,866.0,116.0,42.0,0.0,100.0,467.0,"Au Sable, MI Urban Cluster (2010)",04330
10005.0,7695.0,60.0,7635.0,4559.0,899.0,6334.0,2777.0,529.0,166.0,22.0,314.0,1996.0,"Austin, MN Urban Cluster (2010)",04357
580312.0,502048.0,1433.0,500615.0,350125.0,41341.0,445937.0,141370.0,23987.0,3487.0,845.0,19075.0,59189.0,"Austin, TX Urbanized Area (2010)",04384
1358.0,1080.0,0.0,1080.0,738.0,159.0,860.0,342.0,48.0,0.0,0.0,143.0,135.0,"Avalon, CA Urban Cluster (2010)",04438
2197.0,1293.0,27.0,1266.0,638.0,197.0,986.0,543.0,96.0,59.0,0.0,131.0,773.0,"Avenal, CA Urban Cluster (2010)",04465
2091.0,1713.0,44.0,1669.0,1089.0,97.0,1521.0,566.0,78.0,8.0,0.0,47.0,331.0,"Avon, NY Urban Cluster (2010)",04519
67920.0,58626.0,265.0,58361.0,38186.0,3954.0,49750.0,17121.0,9265.0,1611.0,163.0,2219.0,7075.0,"Avondale--Goodyear, AZ Urbanized Area (2010)",04549
1404.0,948.0,0.0,948.0,469.0,102.0,790.0,450.0,57.0,14.0,0.0,94.0,362.0,"Avra Valley, AZ Urban Cluster (2010)",04573
3277.0,2302.0,0.0,2302.0,1261.0,330.0,1773.0,847.0,250.0,122.0,11.0,174.0,801.0,"Aztec, NM Urban Cluster (2010)",04587
1400.0,973.0,24.0,949.0,500.0,102.0,825.0,429.0,25.0,20.0,0.0,93.0,334.0,"Bad Axe, MI Urban Cluster (2010)",04600
4497.0,2288.0,0.0,2288.0,1108.0,404.0,1534.0,897.0,338.0,283.0,0.0,80.0,2129.0,"Bainbridge, GA Urban Cluster (2010)",04627
4106.0,2857.0,32.0,2825.0,1626.0,355.0,2253.0,996.0,273.0,113.0,12.0,151.0,1098.0,"Baker City, OR Urban Cluster (2010)",04654
170743.0,133981.0,1056.0,132925.0,91388.0,17295.0,110130.0,37196.0,10479.0,1896.0,189.0,6569.0,30193.0,"Bakersfield, CA Urbanized Area (2010)",04681
967.0,535.0,0.0,535.0,439.0,186.0,327.0,82.0,20.0,7.0,7.0,40.0,392.0,"Bald Knob, AR Urban Cluster (2010)",04708
2482.0,1918.0,19.0,1899.0,1237.0,308.0,1496.0,623.0,92.0,3.0,0.0,113.0,451.0,"Baldwin, WI Urban Cluster (2010)",04762
1444.0,1190.0,0.0,1190.0,830.0,187.0,933.0,328.0,114.0,0.0,0.0,63.0,191.0,"Baldwin City, KS Urban Cluster (2010)",04789
1294.0,856.0,8.0,848.0,580.0,218.0,504.0,210.0,88.0,6.0,43.0,60.0,378.0,"Ballinger, TX Urban Cluster (2010)",04816
1353.0,973.0,0.0,973.0,607.0,89.0,868.0,343.0,43.0,8.0,0.0,41.0,339.0,"Baltimore, OH Urban Cluster (2010)",04870
1078.0,730.0,0.0,730.0,590.0,254.0,433.0,104.0,76.0,23.0,13.0,22.0,326.0,"Bamberg, SC Urban Cluster (2010)",04897
1425.0,1100.0,0.0,1100.0,459.0,63.0,948.0,605.0,30.0,0.0,0.0,63.0,262.0,"Bandon, OR Urban Cluster (2010)",04924
13472.0,9774.0,33.0,9741.0,5405.0,1007.0,8674.0,4091.0,276.0,10.0,0.0,666.0,3032.0,"Auburn, NY Urban Cluster (2010)",04114
1458.0,1267.0,0.0,1267.0,957.0,287.0,949.0,245.0,81.0,0.0,0.0,88.0,103.0,"Aumsville, OR Urban Cluster (2010)",04249
853456.0,699108.0,3910.0,695198.0,456844.0,52432.0,628724.0,224847.0,23184.0,4024.0,1462.0,28878.0,125470.0,"Baltimore, MD Urbanized Area (2010)",04843
9079.0,6815.0,62.0,6753.0,4630.0,946.0,5489.0,1989.0,506.0,41.0,17.0,355.0,1909.0,"Auburn, IN Urban Cluster (2010)",04060
24256.0,18876.0,216.0,18660.0,11948.0,1168.0,17154.0,6293.0,684.0,128.0,27.0,1205.0,4175.0,"Bangor, ME Urbanized Area (2010)",04951
1058.0,716.0,16.0,700.0,300.0,67.0,633.0,387.0,0.0,0.0,0.0,31.0,311.0,"Bar Harbor, ME Urban Cluster (2010)",05086
2201.0,1219.0,0.0,1219.0,607.0,177.0,1012.0,568.0,66.0,30.0,0.0,118.0,864.0,"Barbourville, KY Urban Cluster (2010)",05032
5944.0,4574.0,65.0,4509.0,2416.0,258.0,4100.0,1950.0,247.0,80.0,23.0,219.0,1151.0,"Baraboo, WI Urban Cluster (2010)",05005
7582.0,6057.0,67.0,5990.0,3888.0,329.0,5538.0,2034.0,256.0,21.0,0.0,221.0,1304.0,"Bardstown, KY Urban Cluster (2010)",05059
2014.0,1167.0,16.0,1151.0,563.0,131.0,961.0,543.0,125.0,31.0,0.0,102.0,745.0,"Barnesville, GA Urban Cluster (2010)",05113
1502.0,1089.0,0.0,1089.0,560.0,68.0,933.0,481.0,61.0,13.0,25.0,12.0,401.0,"Barnesville, OH Urban Cluster (2010)",05140
106828.0,90525.0,695.0,89830.0,53988.0,3892.0,84274.0,31585.0,5087.0,511.0,168.0,2829.0,13474.0,"Barnstable Town, MA Urbanized Area (2010)",05167
1289.0,763.0,0.0,763.0,507.0,141.0,610.0,235.0,15.0,5.0,0.0,89.0,437.0,"Barnwell, SC Urban Cluster (2010)",05194
9429.0,7241.0,45.0,7196.0,3526.0,722.0,6280.0,3487.0,228.0,71.0,8.0,416.0,1772.0,"Barre--Montpelier, VT Urban Cluster (2010)",05221
1187.0,890.0,17.0,873.0,531.0,102.0,757.0,342.0,31.0,0.0,0.0,80.0,217.0,"Barron, WI Urban Cluster (2010)",05248
1201.0,870.0,8.0,862.0,586.0,55.0,782.0,234.0,65.0,3.0,3.0,47.0,284.0,"Barrow, AK Urban Cluster (2010)",05275
5047.0,2456.0,59.0,2397.0,1069.0,326.0,1901.0,1102.0,225.0,50.0,0.0,169.0,2422.0,"Bastrop, LA Urban Cluster (2010)",05437
10575.0,7609.0,39.0,7570.0,4905.0,1246.0,6061.0,2414.0,473.0,86.0,5.0,390.0,2576.0,"Barstow, CA Urban Cluster (2010)",05302
15959.0,12073.0,92.0,11981.0,7137.0,1176.0,10373.0,4428.0,737.0,205.0,37.0,468.0,3418.0,"Bartlesville, OK Urban Cluster (2010)",05329
433.0,274.0,0.0,274.0,208.0,66.0,171.0,60.0,69.0,0.0,0.0,24.0,135.0,"Bartlett, TX Urban Cluster (2010)",05356
3309.0,2984.0,47.0,2937.0,1814.0,582.0,2169.0,980.0,194.0,123.0,0.0,85.0,240.0,"Basalt--El Jebel, CO Urban Cluster (2010)",05410
1499.0,1376.0,24.0,1352.0,996.0,87.0,1188.0,298.0,112.0,51.0,0.0,17.0,106.0,"Basehor, KS Urban Cluster (2010)",05423
4766.0,3860.0,28.0,3832.0,2384.0,437.0,3234.0,1261.0,212.0,85.0,17.0,153.0,753.0,"Bastrop, TX Urban Cluster (2010)",05464
6970.0,5059.0,27.0,5032.0,2671.0,252.0,4594.0,2230.0,238.0,49.0,0.0,229.0,1682.0,"Batavia, NY Urban Cluster (2010)",05491
1898.0,1101.0,0.0,1101.0,699.0,126.0,849.0,387.0,105.0,6.0,0.0,29.0,768.0,"Batesburg-Leesville, SC Urban Cluster (2010)",05518
4447.0,2937.0,22.0,2915.0,1793.0,309.0,2468.0,996.0,167.0,76.0,15.0,307.0,1203.0,"Batesville, AR Urban Cluster (2010)",05545
3021.0,2279.0,17.0,2262.0,1365.0,138.0,2017.0,769.0,123.0,19.0,20.0,186.0,556.0,"Batesville, IN Urban Cluster (2010)",05572
2548.0,1574.0,18.0,1556.0,857.0,235.0,1192.0,541.0,221.0,73.0,0.0,116.0,858.0,"Batesville, MS Urban Cluster (2010)",05599
3182.0,2065.0,19.0,2046.0,1104.0,112.0,1880.0,846.0,129.0,0.0,0.0,189.0,928.0,"Bath, NY Urban Cluster (2010)",05653
225999.0,176577.0,671.0,175906.0,114405.0,18695.0,151962.0,58190.0,8718.0,1361.0,351.0,9816.0,39606.0,"Baton Rouge, LA Urbanized Area (2010)",05680
31026.0,23083.0,215.0,22868.0,14215.0,3569.0,18470.0,7843.0,1409.0,375.0,45.0,779.0,7164.0,"Battle Creek, MI Urbanized Area (2010)",05707
2177.0,1828.0,4.0,1824.0,1112.0,215.0,1448.0,650.0,184.0,44.0,0.0,26.0,323.0,"Battlement Mesa, CO Urban Cluster (2010)",05734
1182.0,861.0,0.0,861.0,405.0,77.0,666.0,379.0,144.0,60.0,0.0,102.0,219.0,"Battle Mountain, NV Urban Cluster (2010)",05761
2016.0,1030.0,39.0,991.0,519.0,169.0,677.0,342.0,188.0,95.0,0.0,131.0,855.0,"Baxley, GA Urban Cluster (2010)",05788
1921.0,1224.0,29.0,1195.0,601.0,100.0,1039.0,499.0,62.0,37.0,11.0,30.0,667.0,"Baxter Springs, KS Urban Cluster (2010)",05815
1777.0,861.0,0.0,861.0,383.0,59.0,744.0,395.0,101.0,48.0,0.0,101.0,815.0,"Bayard, NM Urban Cluster (2010)",05842
29246.0,21920.0,210.0,21710.0,13422.0,2350.0,18716.0,7715.0,796.0,248.0,59.0,660.0,6666.0,"Bay City, MI Urbanized Area (2010)",05869
6589.0,4134.0,23.0,4111.0,2286.0,662.0,3145.0,1585.0,408.0,145.0,32.0,442.0,2013.0,"Bay City, TX Urban Cluster (2010)",05896
936.0,769.0,10.0,759.0,377.0,80.0,637.0,328.0,52.0,7.0,17.0,55.0,112.0,"Bayfield, CO Urban Cluster (2010)",05904
2460.0,1659.0,8.0,1651.0,1167.0,545.0,1049.0,412.0,106.0,29.0,16.0,104.0,697.0,"Bay Minette, AL Urban Cluster (2010)",05923
2281.0,1833.0,10.0,1823.0,1214.0,195.0,1585.0,598.0,31.0,11.0,0.0,177.0,271.0,"Bealeton, VA Urban Cluster (2010)",05958
2429.0,1595.0,44.0,1551.0,899.0,309.0,1155.0,587.0,103.0,55.0,0.0,84.0,750.0,"Beardstown, IL Urban Cluster (2010)",05977
1000.0,777.0,18.0,759.0,480.0,120.0,587.0,220.0,76.0,52.0,0.0,4.0,219.0,"Beaver, UT Urban Cluster (2010)",06076
5498.0,4010.0,82.0,3928.0,2050.0,398.0,3360.0,1737.0,250.0,94.0,0.0,167.0,1321.0,"Beatrice, NE Urban Cluster (2010)",06004
18301.0,14463.0,67.0,14396.0,8078.0,912.0,12973.0,5898.0,801.0,169.0,36.0,516.0,3322.0,"Beaufort--Port Royal, SC Urban Cluster (2010)",06031
57655.0,39626.0,223.0,39403.0,19125.0,5248.0,32770.0,18924.0,2290.0,372.0,317.0,1335.0,16694.0,"Beaumont, TX Urbanized Area (2010)",06058
2490.0,1477.0,10.0,1467.0,1039.0,189.0,1205.0,378.0,115.0,16.0,8.0,65.0,948.0,"Beaver Dam, KY Urban Cluster (2010)",06085
7445.0,5739.0,79.0,5660.0,3214.0,567.0,4798.0,2202.0,402.0,138.0,18.0,123.0,1583.0,"Beaver Dam, WI Urban Cluster (2010)",06112
867.0,855.0,0.0,855.0,650.0,11.0,835.0,184.0,21.0,0.0,9.0,12.0,0.0,"Bedford, NY Urban Cluster (2010)",06186
1459.0,1358.0,17.0,1341.0,797.0,107.0,1168.0,436.0,161.0,66.0,0.0,0.0,101.0,"Becker, MN Urban Cluster (2010)",06128
25376.0,18681.0,117.0,18564.0,11112.0,2092.0,15964.0,6820.0,1036.0,241.0,43.0,693.0,6002.0,"Beckley, WV Urbanized Area (2010)",06139
6058.0,4188.0,48.0,4140.0,2062.0,606.0,3303.0,1877.0,266.0,119.0,3.0,190.0,1680.0,"Bedford, IN Urban Cluster (2010)",06166
1942.0,1302.0,42.0,1260.0,730.0,138.0,1109.0,494.0,85.0,11.0,0.0,102.0,538.0,"Bedford, PA Urban Cluster (2010)",06193
2701.0,1606.0,0.0,1606.0,820.0,107.0,1294.0,505.0,259.0,157.0,48.0,114.0,981.0,"Bedford, VA Urban Cluster (2010)",06220
2644.0,2028.0,0.0,2028.0,1663.0,305.0,1503.0,324.0,233.0,16.0,12.0,52.0,564.0,"Beebe, AR Urban Cluster (2010)",06247
1577.0,1271.0,0.0,1271.0,760.0,0.0,1178.0,481.0,65.0,10.0,0.0,44.0,262.0,"Beecher, IL Urban Cluster (2010)",06261
5248.0,3498.0,28.0,3470.0,2170.0,676.0,2714.0,1159.0,194.0,62.0,7.0,164.0,1586.0,"Beeville, TX Urban Cluster (2010)",06274
2161.0,1672.0,5.0,1667.0,1044.0,228.0,1406.0,589.0,44.0,14.0,0.0,115.0,374.0,"Belding, MI Urban Cluster (2010)",06301
1168.0,892.0,0.0,892.0,379.0,16.0,771.0,361.0,166.0,91.0,0.0,45.0,231.0,"Belfair, WA Urban Cluster (2010)",06335
1520.0,1282.0,14.0,1268.0,739.0,107.0,1070.0,458.0,81.0,29.0,0.0,54.0,184.0,"Belfast, ME Urban Cluster (2010)",06355
5407.0,4508.0,33.0,4475.0,2797.0,291.0,4004.0,1620.0,283.0,58.0,0.0,103.0,796.0,"Belgrade, MT Urban Cluster (2010)",06382
5425.0,4209.0,9.0,4200.0,2896.0,486.0,3568.0,1181.0,188.0,37.0,0.0,338.0,878.0,"Bellefontaine, OH Urban Cluster (2010)",06436
5526.0,4565.0,65.0,4500.0,2627.0,462.0,3878.0,1825.0,147.0,39.0,9.0,117.0,844.0,"Bellefonte, PA Urban Cluster (2010)",06463
2264.0,1700.0,0.0,1700.0,895.0,65.0,1617.0,746.0,89.0,0.0,0.0,95.0,469.0,"Belle Fourche, SD Urban Cluster (2010)",06490
7518.0,3186.0,23.0,3163.0,2112.0,764.0,2245.0,953.0,237.0,51.0,6.0,108.0,4224.0,"Belle Glade, FL Urban Cluster (2010)",06517
48765.0,41971.0,250.0,41721.0,27805.0,2833.0,37748.0,13006.0,1700.0,371.0,43.0,1259.0,5535.0,"Bellingham, WA Urbanized Area (2010)",06652
2009.0,1789.0,0.0,1789.0,1241.0,109.0,1611.0,525.0,193.0,23.0,0.0,42.0,178.0,"Belle Plaine, MN Urban Cluster (2010)",06571
1141.0,858.0,10.0,848.0,474.0,44.0,777.0,365.0,28.0,5.0,0.0,30.0,253.0,"Bellevue, IA Urban Cluster (2010)",06598
3308.0,2504.0,53.0,2451.0,1433.0,238.0,2161.0,966.0,104.0,28.0,0.0,166.0,638.0,"Bellevue, OH Urban Cluster (2010)",06625
2344.0,1583.0,6.0,1577.0,715.0,70.0,1438.0,815.0,79.0,35.0,0.0,140.0,621.0,"Bellows Falls, VT--NH Urban Cluster (2010)",06679
1686.0,1031.0,4.0,1027.0,680.0,147.0,831.0,323.0,80.0,20.0,0.0,141.0,514.0,"Bells, TN Urban Cluster (2010)",06692
1771.0,1303.0,22.0,1281.0,870.0,235.0,901.0,309.0,212.0,55.0,9.0,19.0,449.0,"Bellville, TX Urban Cluster (2010)",06706
1537.0,1203.0,0.0,1203.0,735.0,148.0,1040.0,468.0,27.0,0.0,0.0,71.0,263.0,"Beloit, KS Urban Cluster (2010)",06733
24245.0,17590.0,116.0,17474.0,11225.0,1582.0,15229.0,5810.0,980.0,134.0,13.0,1668.0,4987.0,"Beloit, WI--IL Urbanized Area (2010)",06760
1576.0,1562.0,0.0,1562.0,1176.0,0.0,1519.0,386.0,78.0,0.0,0.0,14.0,0.0,"Belterra, TX Urban Cluster (2010)",06770
2489.0,1432.0,7.0,1425.0,766.0,245.0,1173.0,637.0,18.0,0.0,0.0,209.0,848.0,"Belton, SC Urban Cluster (2010)",06779
1691.0,1310.0,11.0,1299.0,582.0,45.0,1205.0,660.0,43.0,19.0,0.0,57.0,324.0,"Belvidere, NJ--PA Urban Cluster (2010)",06787
1704.0,865.0,0.0,865.0,602.0,156.0,659.0,191.0,90.0,13.0,14.0,85.0,754.0,"Belzoni, MS Urban Cluster (2010)",06814
6218.0,4738.0,33.0,4705.0,2362.0,433.0,4186.0,2303.0,95.0,16.0,19.0,248.0,1232.0,"Bemidji, MN Urban Cluster (2010)",06841
38075.0,32162.0,192.0,31970.0,22562.0,3914.0,26534.0,8379.0,1946.0,619.0,135.0,1622.0,4291.0,"Bend, OR Urbanized Area (2010)",06868
3834.0,2208.0,65.0,2143.0,1019.0,492.0,1542.0,1042.0,172.0,9.0,0.0,165.0,1461.0,"Bennettsville, SC Urban Cluster (2010)",06895
4767.0,3486.0,21.0,3465.0,1443.0,197.0,3220.0,1983.0,53.0,15.0,11.0,153.0,1128.0,"Bennington, VT Urban Cluster (2010)",06922
1829.0,1350.0,11.0,1339.0,664.0,173.0,994.0,584.0,167.0,43.0,12.0,78.0,401.0,"Benson, AZ Urban Cluster (2010)",06949
1469.0,986.0,13.0,973.0,389.0,60.0,887.0,540.0,49.0,21.0,0.0,73.0,410.0,"Benson, MN Urban Cluster (2010)",06976
2110.0,1399.0,49.0,1350.0,643.0,124.0,1097.0,600.0,218.0,44.0,25.0,224.0,487.0,"Benton, LA Urban Cluster (2010)",07084
1151.0,614.0,0.0,614.0,380.0,51.0,548.0,234.0,45.0,0.0,0.0,77.0,460.0,"Benson, NC Urban Cluster (2010)",07003
3219.0,2118.0,49.0,2069.0,1191.0,329.0,1606.0,816.0,161.0,54.0,0.0,81.0,1020.0,"Benton, IL Urban Cluster (2010)",07030
1947.0,1388.0,0.0,1388.0,907.0,116.0,1259.0,481.0,54.0,0.0,0.0,90.0,469.0,"Benton, KY Urban Cluster (2010)",07057
1567.0,1193.0,17.0,1176.0,649.0,94.0,1009.0,473.0,143.0,23.0,16.0,46.0,328.0,"Benton City, WA Urban Cluster (2010)",07111
25286.0,18204.0,160.0,18044.0,11498.0,1831.0,15251.0,5760.0,1271.0,362.0,113.0,1027.0,6055.0,"Benton Harbor--St. Joseph--Fair Plain, MI Urbanized Area (2010)",07138
5870.0,4574.0,7.0,4567.0,2983.0,593.0,3726.0,1349.0,251.0,141.0,27.0,218.0,1078.0,"Berea, KY Urban Cluster (2010)",07165
4637.0,3260.0,29.0,3231.0,1630.0,208.0,2926.0,1522.0,164.0,31.0,0.0,132.0,1245.0,"Berlin, NH Urban Cluster (2010)",07192
2058.0,1567.0,39.0,1528.0,736.0,166.0,1279.0,714.0,55.0,18.0,0.0,75.0,416.0,"Berlin, WI Urban Cluster (2010)",07219
2275.0,1522.0,60.0,1462.0,843.0,235.0,1162.0,567.0,88.0,34.0,4.0,136.0,617.0,"Berne, IN Urban Cluster (2010)",07246
2003.0,1643.0,26.0,1617.0,985.0,193.0,1365.0,558.0,180.0,32.0,13.0,110.0,250.0,"Berrien Springs, MI Urban Cluster (2010)",07273
1588.0,982.0,0.0,982.0,391.0,46.0,847.0,526.0,98.0,65.0,0.0,65.0,541.0,"Berryville, AR Urban Cluster (2010)",07300
1589.0,1141.0,0.0,1141.0,587.0,17.0,1056.0,554.0,69.0,0.0,0.0,65.0,383.0,"Berryville, VA Urban Cluster (2010)",07327
1224.0,906.0,0.0,906.0,607.0,71.0,811.0,290.0,32.0,0.0,9.0,84.0,234.0,"Beulah, ND Urban Cluster (2010)",07462
1115.0,838.0,0.0,838.0,571.0,162.0,571.0,195.0,130.0,40.0,9.0,50.0,227.0,"Bethany, MO Urban Cluster (2010)",07354
1445.0,1183.0,0.0,1183.0,938.0,307.0,847.0,245.0,26.0,0.0,0.0,20.0,242.0,"Bethel, AK Urban Cluster (2010)",07381
1249.0,966.0,4.0,962.0,545.0,160.0,768.0,400.0,71.0,13.0,0.0,34.0,249.0,"Bethel, OH Urban Cluster (2010)",07408
1313.0,854.0,2.0,852.0,379.0,58.0,760.0,455.0,26.0,18.0,0.0,40.0,419.0,"Bicknell, IN Urban Cluster (2010)",07489
6909.0,5868.0,18.0,5850.0,4273.0,1142.0,4487.0,1491.0,306.0,78.0,0.0,116.0,925.0,"Big Bear City, CA Urban Cluster (2010)",07508
974.0,637.0,0.0,637.0,395.0,18.0,555.0,180.0,119.0,29.0,0.0,22.0,315.0,"Big Lake, TX Urban Cluster (2010)",07543
3783.0,2915.0,9.0,2906.0,1692.0,176.0,2567.0,1091.0,199.0,43.0,51.0,390.0,478.0,"Big Pine Key, FL Urban Cluster (2010)",07597
4465.0,3399.0,55.0,3344.0,1607.0,223.0,3026.0,1699.0,60.0,9.0,21.0,309.0,757.0,"Big Rapids, MI Urban Cluster (2010)",07624
63320.0,49159.0,241.0,48918.0,26856.0,2875.0,45129.0,21005.0,1425.0,420.0,10.0,2179.0,11982.0,"Binghamton, NY--PA Urbanized Area (2010)",07732
8285.0,5642.0,57.0,5585.0,3360.0,693.0,4618.0,2105.0,423.0,61.0,7.0,273.0,2370.0,"Big Spring, TX Urban Cluster (2010)",07651
2859.0,1721.0,25.0,1696.0,938.0,144.0,1407.0,672.0,125.0,52.0,0.0,361.0,777.0,"Big Stone Gap, VA Urban Cluster (2010)",07678
49792.0,40400.0,372.0,40028.0,21289.0,2429.0,36380.0,17814.0,1727.0,333.0,71.0,2065.0,7327.0,"Billings, MT Urbanized Area (2010)",07705
5713.0,4928.0,31.0,4897.0,2958.0,368.0,4428.0,1788.0,207.0,67.0,0.0,173.0,612.0,"Birch Bay, WA Urban Cluster (2010)",07759
298934.0,228762.0,1115.0,227647.0,143271.0,20044.0,200848.0,77009.0,14105.0,1996.0,609.0,13079.0,57093.0,"Birmingham, AL Urbanized Area (2010)",07786
2551.0,1714.0,13.0,1701.0,939.0,101.0,1534.0,599.0,190.0,34.0,20.0,115.0,722.0,"Bisbee, AZ Urban Cluster (2010)",07813
1111.0,706.0,15.0,691.0,410.0,101.0,492.0,261.0,100.0,12.0,0.0,38.0,367.0,"Biscoe, NC Urban Cluster (2010)",07824
4519.0,3558.0,17.0,3541.0,2002.0,393.0,3072.0,1457.0,158.0,21.0,0.0,269.0,692.0,"Bishop, CA Urban Cluster (2010)",07840
1099.0,767.0,0.0,767.0,582.0,216.0,525.0,165.0,36.0,9.0,0.0,97.0,235.0,"Bishop, TX Urban Cluster (2010)",07867
1231.0,538.0,11.0,527.0,286.0,82.0,436.0,236.0,9.0,0.0,0.0,43.0,650.0,"Bishopville, SC Urban Cluster (2010)",07894
40397.0,31816.0,195.0,31621.0,19220.0,2512.0,28495.0,11753.0,1085.0,211.0,30.0,1929.0,6652.0,"Bismarck, ND Urbanized Area (2010)",07921
5487.0,4321.0,51.0,4270.0,2726.0,503.0,3364.0,1229.0,485.0,201.0,14.0,138.0,1028.0,"Blackfoot, ID Urban Cluster (2010)",07948
1963.0,1543.0,9.0,1534.0,894.0,184.0,1296.0,601.0,63.0,11.0,0.0,9.0,411.0,"Black River Falls, WI Urban Cluster (2010)",07975
2736.0,1617.0,12.0,1605.0,1060.0,239.0,1176.0,430.0,209.0,57.0,0.0,124.0,995.0,"Blackwell, OK Urban Cluster (2010)",08083
32744.0,27787.0,154.0,27633.0,18552.0,2713.0,23521.0,8124.0,1827.0,243.0,179.0,1147.0,3810.0,"Blacksburg, VA Urbanized Area (2010)",08002
1597.0,847.0,18.0,829.0,445.0,120.0,670.0,363.0,39.0,21.0,0.0,130.0,620.0,"Blackshear, GA Urban Cluster (2010)",08029
1079.0,694.0,0.0,694.0,499.0,56.0,572.0,185.0,186.0,10.0,0.0,10.0,375.0,"Blackstone, VA Urban Cluster (2010)",08056
3323.0,2533.0,53.0,2480.0,1526.0,291.0,2108.0,907.0,101.0,0.0,29.0,158.0,632.0,"Blair, NE Urban Cluster (2010)",08137
2670.0,1876.0,0.0,1876.0,1077.0,308.0,1488.0,768.0,88.0,24.0,0.0,96.0,698.0,"Blairsville, PA Urban Cluster (2010)",08164
1202.0,592.0,5.0,587.0,318.0,70.0,438.0,149.0,124.0,41.0,38.0,29.0,581.0,"Blakely, GA Urban Cluster (2010)",08191
1475.0,1131.0,19.0,1112.0,703.0,223.0,867.0,380.0,69.0,0.0,0.0,138.0,206.0,"Blissfield, MI Urban Cluster (2010)",08272
1625.0,1212.0,0.0,1212.0,874.0,199.0,869.0,244.0,197.0,63.0,0.0,50.0,363.0,"Blanchard, OK Urban Cluster (2010)",08209
1529.0,1165.0,0.0,1165.0,732.0,134.0,1012.0,414.0,43.0,19.0,0.0,69.0,295.0,"Blanchester, OH Urban Cluster (2010)",08218
930.0,623.0,0.0,623.0,411.0,58.0,527.0,175.0,68.0,14.0,6.0,36.0,271.0,"Blanding, UT Urban Cluster (2010)",08245
42836.0,34283.0,167.0,34116.0,23419.0,1838.0,31435.0,10099.0,1614.0,301.0,73.0,3262.0,5291.0,"Bloomington, IN Urbanized Area (2010)",08380
1515.0,1193.0,26.0,1167.0,712.0,64.0,1070.0,410.0,33.0,33.0,0.0,18.0,304.0,"Bloomer, WI Urban Cluster (2010)",08299
1087.0,668.0,24.0,644.0,291.0,41.0,587.0,309.0,35.0,16.0,0.0,27.0,392.0,"Bloomfield, IN Urban Cluster (2010)",08326
3089.0,1942.0,53.0,1889.0,1076.0,304.0,1412.0,602.0,311.0,117.0,0.0,229.0,918.0,"Bloomfield, NM Urban Cluster (2010)",08353
52154.0,41858.0,278.0,41580.0,23109.0,3360.0,37490.0,17769.0,1445.0,266.0,84.0,3248.0,7048.0,"Bloomington--Normal, IL Urbanized Area (2010)",08407
18327.0,12212.0,139.0,12073.0,7147.0,1301.0,10123.0,4488.0,857.0,210.0,66.0,815.0,5300.0,"Bluefield, WV--VA Urban Cluster (2010)",08515
21669.0,15968.0,144.0,15824.0,9280.0,1677.0,13452.0,6036.0,882.0,259.0,38.0,705.0,4996.0,"Bloomsburg--Berwick, PA Urbanized Area (2010)",08434
1081.0,456.0,5.0,451.0,239.0,125.0,319.0,152.0,38.0,0.0,0.0,51.0,574.0,"Blountstown, FL Urban Cluster (2010)",08461
1540.0,1027.0,0.0,1027.0,396.0,73.0,901.0,585.0,67.0,46.0,0.0,99.0,414.0,"Blue Earth, MN Urban Cluster (2010)",08488
4213.0,3022.0,26.0,2996.0,1730.0,257.0,2649.0,1154.0,187.0,39.0,8.0,288.0,903.0,"Bluffton, IN Urban Cluster (2010)",08542
1721.0,1404.0,18.0,1386.0,716.0,58.0,1247.0,586.0,77.0,46.0,26.0,36.0,281.0,"Bluffton, OH Urban Cluster (2010)",08569
4738.0,3087.0,19.0,3068.0,1806.0,699.0,2132.0,1019.0,377.0,147.0,16.0,126.0,1525.0,"Blythe, CA--AZ Urban Cluster (2010)",08623
6993.0,4524.0,22.0,4502.0,3036.0,608.0,3609.0,1153.0,633.0,125.0,11.0,622.0,1847.0,"Blytheville, AR Urban Cluster (2010)",08650
1167.0,789.0,17.0,772.0,603.0,188.0,492.0,137.0,92.0,5.0,0.0,72.0,306.0,"Boardman, OR Urban Cluster (2010)",08677
4668.0,3673.0,36.0,3637.0,2498.0,611.0,2909.0,1079.0,241.0,18.0,0.0,148.0,847.0,"Boerne, TX Urban Cluster (2010)",08704
4727.0,2454.0,41.0,2413.0,1624.0,497.0,1719.0,609.0,268.0,39.0,0.0,110.0,2163.0,"Bogalusa, LA Urban Cluster (2010)",08731
1819.0,1479.0,15.0,1464.0,665.0,67.0,1397.0,760.0,90.0,0.0,0.0,121.0,219.0,"Boiling Spring Lakes, NC Urban Cluster (2010)",08749
1200.0,908.0,0.0,908.0,517.0,58.0,828.0,391.0,113.0,0.0,0.0,57.0,235.0,"Boiling Springs, NC Urban Cluster (2010)",08758
149205.0,118721.0,1221.0,117500.0,74081.0,9091.0,102442.0,39330.0,10406.0,2066.0,406.0,6063.0,24421.0,"Boise City, ID Urbanized Area (2010)",08785
4043.0,2773.0,27.0,2746.0,1691.0,389.0,2221.0,908.0,168.0,60.0,0.0,386.0,884.0,"Bolivar, MO Urban Cluster (2010)",08812
